name,body,score,sub
tedvdb,de meeste plaatsen in nederland hebben geen treinstation daarnaast in mijn geval duurt de reis van nieuwegein naar utrecht met het ov 45 minuten en met de auto ongeveer 15 beide kun je niet echt een gehucht noemen ik denk dat ze het beter het woordje vaak door soms kunnen vervangen ,2,Netherlands
tedvdb,nee de reclame voor de site is misleiding ze zeggen daar dat de trein vaak sneller is dan je denkt blijkbaar dus niet ,-1,Netherlands
tedvdb,i have had the same issue with my vn750 the rear tire was way to old but had enough profile replaced the rear tire and handling improved greatly especially in the corners the rear tire was way to old but had enough profile ,1,motorcycles
tedvdb,i have got pin lock on my helmet my shoei has this standard i have never had fog on my visor even when riding in a lot of rain ,7,motorcycles
tedvdb, 500000km badge is earned after 312k miles ftfy ,3,Autos
tedvdb, 1 for aprilia i have recently bought a rst1000 futura awesome bike less racy than the rsv ,1,motorcycles
tedvdb, sigh http stream1 gifsoup com view3 1290449 picard facepalm o gif ,-5,nononono
tedvdb,and what exactly does this look like ,8,WTF
tedvdb, smith jones http www smith jones poolcentrum nl i would not go there today no airco very hot inside next to the stairway ,2,Utrecht
tedvdb, http www classes cs uchicago edu archive 2009 fall 15100 1 lab3 black dot gif ,2,firstworldanarchists
tedvdb,you could allow users to change the icon how to http www chainfire eu articles 133 tut supporting multiple icons in your app ,2,Android
tedvdb,sounds reasonable ,1,bikesgonewild
tedvdb,vroeger kon je bij steenweg nog wel onderhandelen ik weet niet hoe dat nu zit daar ,1,Utrecht
tedvdb,cool set as desktop background ,3,ProgrammerHumor
tedvdb,that made me feel bad ,39,funny
tedvdb,het wuiven http nieuws vtm be buitenland 45402 wuiven met de prinsesjes heeft ze ook al goed afgekeken van d r oma volgens mij wordt ze al flink gedrilled voor het koninginschap ,1,Netherlands
tedvdb,funny i noticed it too when i watched that trailer the first time maybe i like autos too much ,2,Autos
tedvdb,wow what a beauty ,2,bikesgonewild
tedvdb,wow giraffes without neck look really stupid ,1,AnimalsWithoutNecks
tedvdb,nice pics how is your bike i am thinking of buying a street triple because i have heard the speed triple has too much power what is your experience ,2,bikesgonewild
tedvdb,nice i have never seen one of these enjoy ,2,bikesgonewild
tedvdb,no you cannot blow that up ,-2,funny
tedvdb,how does that crane work the camera seems to hang pretty stable so the crane must correct all the vibrations and corners pretty fast ,2,Autos
tedvdb,euhm oeps daar wilde ik ook naar verwijzen ,0,nederlands
tedvdb, r nederlands heeft meer lezers ,0,nederlands
tedvdb,mee eens als ze niks doen en er wordt misbruik van de bug gemaakt zijn de gevolgen niet te overzien in de reacties op tweakers zie ik mensen die hier erg negatief op reageren wat volgens mij nergens op slaat ,2,nederlands
tedvdb,ww2 and the germans have weaponized dinosaurs ,11,gaming
tedvdb,hello to you too ,1,bikesgonewild
tedvdb,thanks my bike the vulcan is 23 years old but still rides perfectly ,1,bikesgonewild
tedvdb,the motorcycle driver takes the keys from the woman who drives and walks away probably to prevent the woman to try to kill him again ,30,WTF
tedvdb,ah you went to the netherlands and germany and a coffee shop http imgur com a brofm 24 nice pictures i really like the bmw k1200r ,9,motorcycles
tedvdb,they dont say that voorwaarden rijbewijs afgegeven buiten de eu conditions for license from outside the eu rijbewijs geldig moet zijn op het moment van de aanvraag licence must be valid ook moet u in het jaar van afgifte van het buitenlandse rijbewijs minimaal 185 dagen woonachtig zijn geweest in het land van afgift you had to live for 185 days in the country that provided the license ,0,Netherlands
tedvdb,it seems it is not too difficult hoe kan ik mijn rijbewijs omwisselen http www rdw nl nl particulier hetrijbewijs buitenlandsrijbewijsomwisselen pages hoekanikmijnbuitenlandsrijbewijsomwisselen aspx dutch you have to go to the town hall they will send your current licence to the rdw and you get a dutch driver licence in return probably after a week ,0,Netherlands
tedvdb, en portugal noorwegen,2,Netherlands
tedvdb,you sound like an american the rest of the world has no problem with these eggs ,16,funny
tedvdb, for the lazy on a desktop http www youtube com watch featuore plpp v yw2fuolkaww ,5,cableporn
tedvdb, murica ,1,WTF
tedvdb,wow that escalated quickly check r suicidewatch now ,20,AskReddit
tedvdb,my dad has this one http motoprofi com bikephoto 428 honda cb 450 s 1988 2 jpg in storage waiting for him to retire to be completely build up from the ground again he never had the courage to sell it ,5,motorcycles
tedvdb,1742 1 7 4 2 14 4 1 3 half life 3 confirmed ,12,funny
tedvdb,never heard the word k sefressern cheese eaters nice to know the germans have these kind of words for us too ,15,Netherlands
tedvdb,as i am dutch i cannot confirm he is belgian ,3,firstworldanarchists
tedvdb, dynabyte http www dynabyte nl notebook netbook html manufacturer 125 has dell computers other than dynabyte i do not know any stores who sell dell there is a dynabyte store in delft http www dynabyte nl basstock basstore storelocator pretty close to rotterdam ,2,Netherlands
tedvdb,i kind of like the first one the rest looks like you would expect from green bikes stupid ,1,bikesgonewild
tedvdb,ik hoorde het ook vanochtend ik weet niet zo goed wat ik er van moet denken ,1,Netherlands
tedvdb,yeah i used it this morning to record the trip to my work pretty cool ,1,Android
tedvdb,i cannot find it either on my s2 i am currently installing timelapse https play google com store apps details id com explorerdc timelapse to find out if it works ,1,Android
tedvdb, nope http i imgur com 9utgk gif ,1,WTF
tedvdb,your comment added to my laughter ,8,Jokes
tedvdb,this was the first thing i tought of ,0,funny
tedvdb,nice bike i am afraid i would kill myself if i bought something like that ,1,bikesgonewild
tedvdb,lol ik zit op dit moment in de toren die de dom op eet ,1,Utrecht
tedvdb,oh no i am a hacker myself ,1,offbeat
tedvdb,i have had it the other way around the bike i drive has a mph speedometer and i live in a kph country i was driving 80mph in an 80kph 50mph zone oops ,1,motorcycles
tedvdb,ik vermoed dat dat ook de reden was van de opkomst van pvv bij de vorige verkiezingen hoe het was beviel niet dus werd er voor verandering gestemd en dat beloofde de pvv ,1,Netherlands
tedvdb,is the fact that it is posted in r wtf not a warning itself ,20,WTF
tedvdb,bulshit ,27,funny
tedvdb,i am dutch and i drown my fries in it and i agree about the watermelon ,1,AskReddit
tedvdb,what about a gt those are a bit younger than your gtv i drive one and love the design ,1,pics
tedvdb,awesome have an upvote ,1,pics
tedvdb,maybe you should post in r toolate r toolate i watched it one month ago imdb release dates http www imdb com title tt1440129 releaseinfo ,1,movies
tedvdb,but that does not explain why the moon is red and how could you find the way back with all those wasps ,2,gaming
tedvdb,do not forget cmd or calc,4,AskReddit
tedvdb,it seems you filter is clogged and you need a new one ,193,AskReddit
tedvdb,you might need this how to install http www intowindows com how to change windows 7 logon screen easily without using hacks tools ,31,zombies
tedvdb,hey i drove past that last sunday ,1,Netherlands
tedvdb,wooh venz http www venz nl ,2,Netherlands
tedvdb, this http www smosh com sites default files bloguploads ancient aliens th 0 jpg ,-7,funny
tedvdb,i just realised he was a boondock saint when i was staring at the image ,1,zombies
tedvdb,fast five very inaccurate for example in the opening scene a bus hits the back of a car the bus is then propelled 10 meters into the air flies over the car lands and is ripped to shreds ,1,AskReddit
tedvdb,oh look an orangered oh wait sigh,2,bestof
tedvdb,always the same here sigh,1,bestof
tedvdb,ik werk bij een hostingpartij maar onze servers staan in dc2 bij xs4all vanaf daar hebben we helaas ook geen toegang naar tpb dus bij niet alle hostingpartijen zal dit werken ,1,Netherlands
tedvdb, redditor for 1 jaar leugenaar ,1,nederlands
tedvdb,ik vraag me af wat er gebeurt als je daar als voornaam robert drop table customers invult relevant http xkcd com 327 ,3,nederlands
tedvdb,i did too now what ,4,WTF
tedvdb,what is going on he ,1,WTF
tedvdb,i have seen 109 and i use icheckmovies http www icheckmovies com list top 250 tedvdb to track them ,12,movies
tedvdb,i would also run away if my owner was vegetarian ,2,pics
tedvdb,i always see it that way forever alone ,5,gaming
tedvdb,with a steel brush ,2,AskReddit
tedvdb,i think you should ask for rundvet some smaller supermarkets have it and so should some smaller butchershops ,2,Netherlands
tedvdb,also works with sisters and mothers ,0,funny
tedvdb,relevant human v1 1 http imgur com xzbva ,2,AskReddit
tedvdb, 3,1,explainlikeimfive
tedvdb,besides we have less teenage pregnancies and legalized drugs so just like holland america is not the greatest ,1,AskReddit
tedvdb,the second episode of alfred j kwak http en wikipedia org wiki alfred j kwak i watched it when i was 10 and still get tears in my eyes from that episode where his dad is being overrun ,3,AskReddit
tedvdb,zou er niet gewoon een directeur zwaar zijn zakken zitten te vullen dan en waarom een spaarrekening met 8 miljoen ,2,nederlands
tedvdb,so pretty much the same way car manufacturers name their cars ,2,explainlikeimfive
tedvdb,mee eens en maar 536 subscribers daarom maak ik ook reclame voor die subreddit ,4,Netherlands
tedvdb,zoiets is er al http www reddit com r nederlands r netherlands is ook voor niet nederlands sprekenden ,4,Netherlands
tedvdb,i was searching for the point of this post in my country it nothing special to order beer at the movies netherlands ,1,pics
tedvdb,they should invent a device that turns co2 into oxygen ,65,AskReddit
tedvdb,gmta,2,funny
tedvdb,ftfy http i imgur com icgx3 jpg,2,funny
tedvdb,ik vind het mooi om te zien dat niemand verbaast is over iemand die weinig herinnert van de nacht ervoor volgens mij gebeurt dat vaker ,0,Netherlands
tedvdb,cheeseburgler,2,funny
tedvdb,indeed it does http i imgur com kbzqf png,1,funny
tedvdb,here in holland we do not use 1 and 2 eurocent coins anymore our neighbouring countries still do and it annoying as hell ,1,pics
tedvdb,that is manneken pis http en wikipedia org wiki manneken pis you can see that image almost everywhere in brussels ,2,WTF
tedvdb,well i am dutch and have no special feelings regarding canadians wwii was a long time ago ,12,Netherlands
tedvdb,this completely ,1,movies
tedvdb,it is not a girl 0 o,3,pics
tedvdb,i double dare you motherfucker,4,reddit.com
tedvdb,i have seen that wall live at the cebit last year link http www youtube com watch v 8bvesdgphry ,4,geek
tedvdb,i do not see any dutch words there ,1,Android
tedvdb,that ,9,minecraftfaq
tedvdb,it could be ,14,minecraftfaq
tedvdb,wow impressive google image search http www google com search tbs sbi amhzzit 1sfsqj1vf4xudwio7e07b45qzplhtvzye6fpyzfs3ezjmztl3fxbknbjxycz54pz9ivawwcyzaoepehzs8v59ljf47i8j3pq0fmrkkfm97c7mud oq21gphjgbac4r4rhqrisfa0xnw nttqj2uk5bceprltgllkwbahyp 1q9kqa7eabjmr s7es4w2u1bcu1jia ua4siejb7ujdrdpln6cusdrmm3zi3qd5bxbzqkjlgyjkosbw8f5vxl 1tuswyxucr5mpqubdgupaq0bloktw3xh3swo 5p9u 1tkrrc25nayyi0ucn1s50ana8rcnd0vpelpkkk8uu1xnowgmprkycz5fhfmdwleqovjpbpta1dm1whgbfzn4fx7ami8xmcu8lph bcpcbchejy5nkt6sm4klvdyvsglb1axv blv 1ayohtm8wvj4o7ipgnvtmc54fblotzo3y9mhob2918twvfiyhtusl7 jvvutxmn7cikecspkef 1tqi1u2gtj5sv3pyfoqavh5vbzynj4fvoaaicr 1j1wx06f4v6iwbiqjoveb02jmxmifho 1v61ajxuu2jccubjgm588vihaubfk7wtip6fhqbjqpjhcmqn6faxiqc3vtgusu2jhwlkhxk0kncppop8hqjyv3ptoppytprcjynki 9okg4k 1fyvm6qhkrgep7zy0ofv3zciqrvw6emjhghokyjrwx2 g49ic5u fhi9rgwx1jxyuwxbeaozbvxlafyucvk7rfwq8a9u8ggjrvtq1t3au5wu440z6pgtxlhqqoz31ewg47sxum52u0fq8gde6gz5ezofskhte6g64xauxuv5hsw74rtecy48yk5rw8nir6psi 1ywxu1sv2k1sjs6iaevoqm7asgagjdel84gsgjntm47oilwnj33g2gceazx9vf0p41shklsfppm3x299xdswcco3g17azm4t7ae2wyosfaj3kllydmvziu99pxy 13qpta7nuestbcag6 1uhzlwamypoi8xrzzntecw90oprgxejluh9zl7z 1vmxn 12asxrh9l 1en 12e37 ethgsral0qvcgwszy9h8yk3qgg9ukpajchghr 1pp8l c 1sv2uo2 1cgirar1y 15e8qdfhzrhu55j wkrzk4ubrv7bklecvvn8apgbu7rk1ep3sqlqnwb1o8isa1ud5awcbnorimj6n edv5t7b49mhth7akubfa28zt6grrmayddnnri1osc 1alp0dbkprghhddzpiv76j4egyxyeyjixvunqaqxrdhjx2fukz8mwkhxmfu93timd aoczlamsttaw9r u9r9ghfq rykgbcc1iwfrpzicuyvt9sfcxisyjywa8g s58hefz58iqh4 hl en biw 1280 bih 905 gbv 2 site search sa x ei ht5mtpf7omps4qsf9z3pcg ved 0cdsq9q8 ,1,pics
tedvdb,eigenlijk ben ik het met alle punten die je aanbrengt wel eens ik denk dat de culturele verschillen niet zo n probleem zullen zijn daar hebben we nu ook al mee te maken als je bijvoorbeeld naar groningers en limburgers kijkt ,2,nederlands
tedvdb,still waiting ,6,funny
tedvdb,i felt an earthquake http 25 media tumblr com tumblr lqecfemixf1qhp1u6o1 400 jpg ,1,AskReddit
tedvdb,i am dutch and had some conversations with some germans when i spoke slowly they understood exactly what i said ,2,WTF
tedvdb, my submission http i imgur com pfa5s jpg ,11,offbeat
tedvdb,til what 501c 3 undue anguish and forest service equines mean i am not a native english speaker so thank you for explaining ,3,explainlikeimfive
tedvdb,1992 nissan sunny,1,AskReddit
tedvdb,it nice to see someone so enthusiastic about my country thanks for making me smile ,2,Netherlands
tedvdb, relevant http www reddit com r netherlands ,1,AskReddit
tedvdb,50 meter we have better hills than that vaalserberg http en wikipedia org wiki vaalserberg ,2,AskReddit
tedvdb,con owning and driving a car is expensive,3,AskReddit
tedvdb,it is exactly the same in the netherlands except we have 6 tax voor food and such ,1,reddit.com
tedvdb,it looks dutch licence plate and one way sign ,1,WTF
tedvdb,well you succeeded have an upvote ,5,funny
tedvdb, or that a colleague had sex with an anatomically correct inflatable sheep ,1,AskReddit
tedvdb,it always ends with sex statements like i have never payed for sex ,3,AskReddit
tedvdb,names of people i know ,2,AskReddit
tedvdb,duran duran a view to a kill,1,AskReddit
tedvdb,last week i had three chicks doing that to me at the same time ,2,AskReddit
tedvdb,til there is a place in texas with the same name as my country ,2,funny
tedvdb,je zit wel in de goede subreddit waar woon je nu ,1,nederlands
tedvdb, pdf version http egbg home xs4all nl english counters pdf ,1,comics
tedvdb, correct link http www youtube com watch v n abpav5e5m ,1,Utrecht
tedvdb,this kind of reminds me of war of the worlds pic http www voiceseducation org sites default files images war of the worlds by robert jpg ,2,pics
tedvdb,i can see my house from here ,2,pics
tedvdb,yes ,0,funny
tedvdb,i did the same only my mother calls it mozzarella http en wikipedia org wiki mozzarella ,135,AskReddit
tedvdb,nederlands of vlaams ,1,reddit.com
tedvdb,jazeker er zijn er genoeg jobtrack http www jobtrack nl jobtrack monsterboard http www monsterboard nl tip zoek naar vacatures succes ,4,nederlands
tedvdb,i did that once it appears i should have done that every time ,2,pics
tedvdb,it was a 92 audi coup ,1,pics
tedvdb,yup he only had a few bruises ,3,pics
tedvdb,masturbating ,1,AskReddit
tedvdb,boot in safemode run combofix http www combofix org awesome program against this fake antivirus thingy ,2,AskReddit
tedvdb,en amai ,1,pics
tedvdb,http www reddit com r nederlands comments h9a3q global reddit meetup day in amsterdam ,2,pics
tedvdb,dat mag je zelf bepalen wil je bij nederland horen ,0,pics
tedvdb,jammer reddit nl is al bezet ,1,pics
tedvdb,haha je bent teleurstellen ,3,pics
tedvdb,reminds me of that song of madonna sorry ik ben droevig means i am sad instead of i am sorry ,2,pics
tedvdb,noooo i want to play portal 2 co op ,7,PS3
tedvdb,do not know do not care ,3,pics
tedvdb,so did i is this picture taken in london ,3,funny
tedvdb,yes it is much faster en wil be more feature complete ,2,maemo
tedvdb,no no no he did dennis told me ,1,reddit.com
tedvdb,mark stabbed a guy ,6,reddit.com
tedvdb,it hard to overstate my satisfaction ,1,reddit.com
tedvdb,i want to ride my bicycle,33,funny
tedvdb,this woman has fake leggs or something like that i cannot remember exactly what is was but she had a valid reason edit ah here it is http gizmodo com 5602600 i am very sorry segway stroller lady,22,pics
tedvdb,my sarcasm detector fails it is the letter q,-16,pics
tedvdb,it worked ,1,geek
tedvdb,at least the weather improved ,0,pics
tedvdb,there is already an utrecht reddit http www reddit com r utrecht ,1,worldnews
tedvdb,i was about 15 now 25 and i am jealous at you i hate shaving ,1,AskReddit
tedvdb,true boring country right ,0,funny
tedvdb,it looks like utrecht google maps http maps google nl maps f q source s q hl nl geocode q utrecht aq sll 52 115782 5 2034 sspn 0 669578 1 234589 ie utf8 hq hnear utrecht t h layer c cbll 52 071156 5 09976 panoid hf6 3 zkrdvl 3mqigy93g cbp 12 253 98 1 6 71 ll 52 070881 5 100017 spn 0 010473 0 01929 z 16 ,1,funny
tedvdb,ctfl f snake,2,offbeat
tedvdb,boyfriend thinks you are ,1,reddit.com
tedvdb,done ,1,Netherlands
tedvdb,what a boring reply ,1,AskReddit
tedvdb,yes for c programming http expa project linhux nl leovm inzeemetc html and for computer systems http expa project linhux nl leovm cses html same author for both ,1,AskReddit
tedvdb,apt get install wine,-1,linux
tedvdb,he quik rown fo jups oer he la dog,1,AskReddit
tedvdb,i do not ,0,pics
tedvdb,what background o o,1,pics
tedvdb,yes because telling your kids not to have sex wo not work they will do it anyway it better if you tell them how to have sex safely ,3,reddit.com
tedvdb,the netherlands population is about 17 million and the graph is per 100 000 ,0,reddit.com
tedvdb,i came here to say this so have an upvote ,-2,funny
tedvdb, meanwhile in russia ,3,WTF
tedvdb,do not you mean rule 43 ,0,pics
tedvdb,i have had a customer who stored her files in the recycle bin ,2,geek
tedvdb, catfish hunter he a kling ot http imgur com ajkiz links 1 http en wikipedia org wiki catfish hunter 2 http en wikiquote org wiki star trek enterprise 3 http www flickr com photos 52541170 n08 5362987483 ,1,pics
tedvdb,i did the same support what os do you use me windows and linux support what version of windows me xp vista and 7,1,linux
tedvdb,it looks like outlook 2003 so you still have a lot of updates remaining ,7,WTF
tedvdb,this ,-10,reddit.com
tedvdb,run ,-3,AskReddit
tedvdb,what stingray ,26,pics
tedvdb,i came her to say this ,2,AskReddit
tedvdb,bioshock,50,gaming
tedvdb,thank you for the tl dr else i would not have read this ,2,geek
tedvdb,definitely 3,13,AskReddit
tedvdb,i had a sandwich in the train this morning ,1,AskReddit
tedvdb,why did i click on that ,1,funny
tedvdb,sun microsystems inc sunos 5 10 generic january 2005 proof http ec europa eu enterprise tris pisa cfcontent cfm vfile etc motd ,4,programming
tedvdb,a pancake recipe,1,AskReddit
tedvdb,kutkoekjes ,1,pics
tedvdb,i am in europe gues what noting here ,9,pics
tedvdb,hit the refresh button ,-1,AskReddit
tedvdb,we have those in the netherlands for years 2001 image http www stichtingtakecare nl images foto 27s afwerkplek jpg wikipedia http nl wikipedia org wiki afwerkplek ,2,WTF
tedvdb,she reminds me of jessica rabbit http image 7 verycd com ad188479d052b53c97acc43d8d974d6628491 large who framed roger rabbit 1 jpg ,0,pics
tedvdb,my evil genius http imgur com leir0 jpg cat,2,reddit.com
tedvdb, looks at username hmm i should not react to this ,1,AskReddit
tedvdb,t e d my first name ,1,gaming
tedvdb, this,0,AskReddit
tedvdb, relevant http latimesblogs latimes com babylonbeyond 2010 08 egypt van gogh painting missing from cairo museum html ,1,AskReddit
tedvdb,the sun everything revolves around it ,2,funny
tedvdb, at the same time ,3,pics
tedvdb,what he said ,1,AskReddit
tedvdb,what he said,1,AskReddit
tedvdb, my cat http twitpic com 266ye6 full does that ,12,AskReddit
tedvdb, relevant http downforeveryoneorjustme com imgur com ,1,reddit.com
tedvdb,me neither is it me ,1,pics
tedvdb,to soon,0,funny
tedvdb,yeah i do not think i am going to update yet ,1,PS3
tedvdb,i decided to update this morning but my internet connection was down ,-1,PS3
tedvdb,wrong mirror http www icanhasmirror com redir php o http 3a 2f 2ficanhasmirror com 2f m http 3a 2f 2fi imgur com 2f0ssgb png ,18,reddit.com
tedvdb,thanks for the ltdr,1,AskReddit
tedvdb,you are me but who am i ,0,AskReddit
tedvdb, ,-1,reddit.com
tedvdb,document,1,AskReddit
tedvdb,http theoatmeal com comics irony,2,AskReddit
tedvdb,goal ,0,pics
tedvdb,tung tung tadatungtung tadatungtung tadatungtungtungtung ,2,reddit.com
tedvdb,it is not supposed to be slimy 0 o,9,AskReddit
tedvdb,actually urinoir is a word we loanded from the french so there is not ,1,funny
tedvdb,same here ,3,AskReddit
tedvdb,what about the netherlands ,1,pics
tedvdb,raises hand oh wait it is sort of legal ,1,AskReddit
tedvdb, playstation 3 cable http www mymemory co uk images product shots 11808 1204114111 jpg ,-3,geek
tedvdb,i had exacly the same problem i have tried to flash is but could not get it to work the nokia repair centre could not get it fixed so i have called my phone insurance 6 5 weeks ago en still do not have it back ,2,n900
tedvdb,radio wo not even play my jam ,2,AskReddit
tedvdb,same here ,1,reddit.com
tedvdb,send him an reply with an trojan in the attachment ,16,reddit.com
tedvdb,i downvoted you to much upvotes ,3,AskReddit
tedvdb, less stable than symbian devices that i have had before sometimes it crashes and reboots i also own a n900 but mine has never crashed my previous n79 symbian did crash more often ,2,linux
tedvdb,how long is 50 miles in kilometers ,1,geek
tedvdb,upvoted for making me lol,1,geek
tedvdb,it was belgian flemish i am dutch and could not understand most of what he said ,2,reddit.com
tedvdb,i am dutch also but i do have a pocketknive and carry it with me allmost all the time ,1,AskReddit
tedvdb,disco ball,9,AskReddit
tedvdb,starfleet ships from star trek challenger voyager akira antares http www dan dare org freefun games cartoonsmoviestv startrekwallpaper31024 htm,0,AskReddit
tedvdb,army of two is amazing even split screen ,-1,PS3
tedvdb,ps4 controller http www coolest toys com wp content uploads 2008 09 ps4controller jpg,-5,gaming
tedvdb,where i work it wtf stupid ie 6 hack to fix idiotic alignment and borders and other stuff,-3,programming
tedvdb,now i do not know or is should upvote or downvote you,2,AskReddit
tedvdb,i agree i am still looking for decent photoshop and dreamweaver alternatives ,1,linux
tedvdb,not anymore http designercars nl biler mercedes benz model 0 jpg,1,reddit.com
tedvdb,you know what you doing ,8,gaming
tedvdb,http tinyurl com yjyusj6,3,reddit.com
tedvdb,some help http uk answers yahoo com question index qid 20090302045621aauufz2,2,technology
tedvdb,upvoted for making me laugh ,-2,AskReddit
tedvdb,http www dailymotion com video x235s bloodhound gang the roof is on fire extreme,22,reddit.com
tedvdb,brainfuck ,7,programming
tedvdb,my cat is too fat that wo not work ,4,comics
tedvdb,definitely i have been there and it quite interesting ,1,offbeat
tedvdb,red hat 5 1 after that gentoo now centos,1,linux
