name,body,score,sub
tedvdb,well you could try lineageos it certainly made my phone way more awesome ,6,Xiaomi
tedvdb,can confirm i have used it on plastic parts of my car that should have been black ,1,DIY
tedvdb,strak gedaan waar dient het voor ,7,cableporn
tedvdb,i just unlocked them yesterday i used titans and had 1 of the gems required to reincarnate do not remember what the requirement was ,1,realmgrinder
tedvdb,same here on my mi5s with lineageos i am not even rooted ,3,AndroidGaming
tedvdb,nice thanks ,1,Xiaomi
tedvdb,yes i want lineageos om natrium ,3,Xiaomi
tedvdb,no not anymore the bitcoin client is just as fast these days as the old way with the bootstrap torrent ,4,Bitcoin
tedvdb,well i do some work in the hosting branche if an php updates breaks a customer site guess who they blame they do not care that a few php bugs are fixed the care that their webshop is broken so a chrome like release would be a disaster for most hosters so they will still use older version of php ,59,linux
tedvdb,an info about natrium mi5s plus ,1,Xiaomi
tedvdb,yes it worked thanks a lot ,1,ClickieZoo
tedvdb,thanks i am having the same issue but with the 1 million mark thanks for this game ,1,ClickieZoo
tedvdb,but how i hatcher a dozen eggs only pokemon i already had none of the babies ,1,pokemongo
tedvdb, after saying we do not pick a side ,1,AskReddit
tedvdb, maybe now the cagers see you naah who am i kidding ,10,motorcycles
tedvdb,at least you have something that looks like a tracker ,-1,pokemongo
tedvdb, mick o connels i think you have the highest chance there ,7,Utrecht
tedvdb,3nd5tbc8nyad6rnj6hemfeq6rymk4cujyc,1,Bitcoin
tedvdb,so that in the future you do not need to install apps anymore because allmost everything can run in your browser battery percentage is just a small piece of this camera access is another besides that for example a website can disable animations if your battery level is below 25 to save a little bit of battery power ,-7,linux
tedvdb,zie het voorbeeld van u derliesl de betekenis van woorden veranderd dan ook zou maurice daar over nagedacht hebben daarbij wanneer houden we dan op heet maurice dan straks mouries want de ies klank schrijven als ice slaat natuurlijk ook nergens op ,2,thenetherlands
tedvdb,a decent touch screen interface i mean windows 10 has it ,1,linux
tedvdb,ja ik word wel heel nieuwsgierig van deze teaser ,2,motorcycles
tedvdb,ja verwaarloosbaar trager misschien maar leesbaardere en beter onderhoudbare code ,4,thenetherlands
tedvdb,hij bedoelt waarschijnlijk een for loop binnen het event ,10,thenetherlands
tedvdb,so what is on the wall ,3,bikebuilders
tedvdb,de staat neemt alleen zeggenschap over je lichaam als jij zelf te laks bent om een keuze te maken drie keer en zelfs daarna kun je nog je keuze of gebrek daaraan wijzigen ,4,thenetherlands
tedvdb,no in idle it allmost nothing but the up and down spinning of the hdd is now only necessary for media access so the hdd are a lot more idle ,1,linux
tedvdb,i use it for my home media server as root filesystem i use a usb stick as main boot device for power saving reasons with ext2 4 i had to replace my usb stick every 2 6 months on f2fs currently almost a year passed without problems and far better performance ,1,linux
tedvdb,yes hardcore henry was awesome ,6,movies
tedvdb,last night a single trip for me was 1 99 by tram from utrecht centraal to wijkersloot i am nieuwegein north so for daily trips i recommend a bicycle on saturday night there are night busses but te rest of the week the public transportation to nieuwegein stops around midnight ,3,Utrecht
tedvdb,you can check out funda http www funda nl huur nieuwegein for rental houses i do not have any other advice about an agent supermarkets are spread across nieuwegein most places you wo not have to walk more than 15 minutes to a supermarket the tram is a reasonable fast way to get to utrecht there are a lot of bus lines so if a tram stop is to far you can get the bus city plaza is the largest shopping center in nieuwegein with a few supermarkets and about everything you need probably easiest is to get a bike to travel to your work and across nieuwegein and find a place in the north part of nieuwegein there are not really bad neighborhoods in nieuwegein there are some streets you should avoid but usually those streets look kind of shabby so you know immediately the hospital is next to city plaza so that not going to be a problem nieuwegein is kind of boring but utrecht is very near and that an awesome city to hang around and discover ,4,Utrecht
tedvdb,maar als ik het goed begrijp is milieudefensie een clubje hippies die de staat aanklaagt omdat ze vinden automobilisten nog meer gepest moeten worden ,-10,thenetherlands
tedvdb, for example the meter and yard comparison is fine but the next common subdivision of the meter is the centimeter nope the next subdivision is the decimeter ,3,offbeat
tedvdb,ik had ongeveer hetzelfde uitzicht vanuit nieuwegein ,1,Utrecht
tedvdb,nieuwegein ,1,Utrecht
tedvdb,great i bought the oneplus x for my girlfriend a few hours too early for a refund ,1,Android
tedvdb,my mother calls her browser mozarella just that ,6,techsupportgore
tedvdb,looks fun i am installing it ,4,AndroidGaming
tedvdb,i am currently using face slim https f droid org repository browse fdid org indywidualni fblite a wrapper for the mobile web version with notifications includes facebook messenger functionality ,1,technology
tedvdb,my name is ted soo ten million dollars ,1,AskReddit
tedvdb,jeej we hebben gewonnen oh nee wacht ,1,thenetherlands
tedvdb, not available in your country aah come on ,2,AndroidGaming
tedvdb,i know how you feel and i found her last month i hope you find yours too ,1,AskReddit
tedvdb,mooie wegen ik zat vorig jaar in vercors en afgelopen jaar in de vogezen dat zijn allebei ook aanraders ,2,motorcycles
tedvdb,ok als ik het goed begrijp zijn nu dus een heleboel mensen druk geweest om een wet te introduceren zodat twee mensen hun werk niet meer kunnen doen had dat niet iets effici nter gekund ,4,thenetherlands
tedvdb,me either oh wait look at this oneplus two i have here usb c is awesome is not it ,7,AskReddit
tedvdb,cat ,5,CatsStandingUp
tedvdb, misschien omdat ik woon er misschien omdat ik er woon sorry ik kon het niet laten ,5,AskReddit
tedvdb,because this is one of the few that actually did research if helmets actually make cycling safer ,3,thenetherlands
tedvdb,because head injuries are very rare by cycling it discourages the use of the bicycle and promotes unsafe behavior dutch source http www fietsersbond nl de feiten verkeer en veiligheid fietshelmen vhb3url1hqa ,2,thenetherlands
tedvdb,ooh console time is also nice ,5,webdev
tedvdb,i do not agree with you passing empty sets just introduces other problems and makes debugging harder i rather have my program crash on a nullpointer exception than spend time wondering why my code does not get executed ,2,ProgrammerHumor
tedvdb,netherlands here zeroth floors everywhere ,2,funny
tedvdb,it is about the same in the netherlands only instead of 2 3 it is about 50 and yearly taxed above 21k ,1,pics
tedvdb,where is that picture from ,1,oneplus
tedvdb,soo why exactly are you sleeping at his house ,7,funny
tedvdb,would not a no thank you be a more reasonable reaction ,5,Whatcouldgowrong
tedvdb,thanks funny clip but still a strange reaction from the woman in red ,6,Whatcouldgowrong
tedvdb,about that song that is maroon 5 https www youtube com watch v t59kb3hq3yg ,1,thenetherlands
tedvdb,er heeft zojuist iemand een foto gemaakt van het rood van dichtbij ,2,thenetherlands
tedvdb,hij is net terug gekomen voor de tweede keer en heeft hetgeen hij geprobeerd te schrijven heeft iets roder gemaakt ,3,thenetherlands
tedvdb,4 04 iemand stapte uit een zwarte bmw en kladderde wat roods op de rotonde,1,thenetherlands
tedvdb,yes that is what the rest of the world is doing but apparently american software cannot do math ,5,gaming
tedvdb,i know you are looking for a while back and forth between the two of the galaxy met yelmar en peter van der jagt de auto naar huis te gaan met de auto naar huis te gaan met de auto naar huis te gaan met de auto ,1,AskReddit
tedvdb,nice photo a while ago i made a short recording driving towards wijk bij duurstede https youtu be 83afxwclolm,1,motorcycles
tedvdb,hey ik heb een vermoeden dat het frits lambrechts is die het heeft ingezongen ,1,nederlands
tedvdb,funny last week i had the same hp with the same customer statement only there was so much dust in the fan that it would not turn cleaned it out and it was working perfectly again ,1,techsupportgore
tedvdb,try just enabling it that helped on my phone ,1,Nexus5
tedvdb,sport tour version checking in ,2,bikesgonewild
tedvdb,bring out the pitchf oh wait nevermind ,3,ImageStabilization
tedvdb,there is a speaker icon in the bottom left if you click on it you can adjust your volume ,41,nottheonion
tedvdb,i dont know,98,nottheonion
tedvdb,i have ordered a lot of parts from eet europarts and they ship to to the netherlands source i live in the netherlands and ordered parts there ,3,techsupportgore
tedvdb,mentioned somewhere in the thread split screen issue is also in stock so likely not fixed soon and set your video format on 1080p instead of 4k ,1,oneplus
tedvdb,well he only mentions the stuff they did wrong i am guessing that part is working like it should it would not surprise me if the token was the same as last login attempt increased by one ,1,programming
tedvdb,well if the code is changed every time you try to log in and sent to you by sms it is 2fa ,1,programming
tedvdb, geen grap nou ik vind wel wat heftig om die arme eilandjes zo keihard als landverraders te bestempelen ,3,thenetherlands
tedvdb,correct hannibal ,2,WTF
tedvdb,well you can run php a service so you do not have the overhead of starting a new process every request in that case disabling garbage collection for web pages may be not the best idea ,1,programming
tedvdb,exactly they even used the original actors for the german voices that why their german sounds so dutch ,8,techsupportgore
tedvdb,new kids it is a dutch serie and resulted in two movies the movies where also translated to german ,13,techsupportgore
tedvdb,it looks or looked awesome ,1,bikesgonewild
tedvdb,i was late for work had a meeting with a customer ah well that is the risk of running an unstable rom ,1,oneplus
tedvdb,same here but 10 1 patch fixed that,1,oneplus
tedvdb,cool thanks ,1,Autos
tedvdb,same here but i finished frontiers before i flashed lollipop so origins was just in time ,2,AndroidGaming
tedvdb,there is a dutch cars coffee o,1,Autos
tedvdb,not expensive either for such a nice bike ,1,motorcycles
tedvdb,i had no problems on 4 4 4 only when using art did you switch runtime i think frontiers has an issue with art ,2,AndroidGaming
tedvdb,ctrl f joffrey upvote ,2,AskReddit
tedvdb,toepasselijke username ,8,thenetherlands
tedvdb,for me it is right side up,1,motorcycles
tedvdb,is not that a nexus 9 upside down ,192,Android
tedvdb,nice ,1,firstworldanarchists
tedvdb,a tooth from a sperm whale i think i got that from my grandfather after he died ,2,AskReddit
tedvdb,i upvoted you for explaining why you upvoted him ,-4,explainlikeimfive
tedvdb,this works fine except for video recording ,1,oneplus
tedvdb,i have seen cardcast but have not played it yet linkme cardcast ,2,AndroidGaming
tedvdb,i really like cloud saving and the achievements so for me google integration is a pre and please make the back button work so many games just ignore the back button ,3,AndroidGaming
tedvdb,no need to yell but it looks like a fun bike ,6,MotorcyclePorn
tedvdb,i agree and for git and svn ,1,ProgrammerHumor
tedvdb,last weekend i was on a holiday in istanbul in a bar i asked for the wifi password but it was a turkish word so i handed my opo over to the bartender he looks at my phone calls his colleagues and now there where four turkish guys studying my phone we got a free round of shots even funnier no one even looked at a friends iphone 6 sitting right next to me ,1,oneplus
tedvdb,yes i need one just kidding but i would would appreciate it ,1,InboxInvites
tedvdb,it certainly looks broken ,5,aww
tedvdb,franco kernel fixes this it is a bug in the gps driver probably fixed in the next ota ,2,oneplus
tedvdb,it looks awesome btw trading in your multistrada ,1,bikesgonewild
tedvdb,i think that an garage insurance licence plate here in the netherlands you these are used for testdriving so a garage does not need to have a bike or car insured while it is in the showroom you are not allowed to park anywhere with these plates in this case it is bended around the official licence plate ,2,bikesgonewild
tedvdb,why is is that expensive i want one ,6,Autos
tedvdb,beetje vreemde titel voor deze post ,1,nederlands
tedvdb,how is this bike for taller persons do you need to be a tiny italian guy to comfortably ride one ,4,bikesgonewild
tedvdb,that bike is on the top of my wishlist awesome bike ,4,bikesgonewild
tedvdb,hey dat is geen nederlands ,2,pics
tedvdb,i think you tried to link somewhere else ,1,nononono
tedvdb,i really like his timezone problem explanation https www youtube com watch v 5wpm gesoy list tl7cmukm2pemuzqui z9cp29yv2dho2y3x ,14,programming
tedvdb,so did i maybe we are fast learners ,8,thenetherlands
tedvdb,in ios7 this was still the case ,1,webdev
tedvdb,i do not think it is possible to stabilize this one ,2,ImageStabilization
tedvdb, hier http www reddit com wiki styling staat wel wat informatie maar kennis van css html is wel een vereiste ik heb nog nooit zoiets in reddit gedaan maar wil je hier eventueel wel mee helpen ,1,Utrecht
tedvdb,suatmm ,1,oneplus
tedvdb,mine is 2t7c7 3vtrv 2cffb 2jhdd qcb because dutch ,2,AskReddit
tedvdb,this is definitely utrecht source i am drunk there a lot ,3,Whatcouldgowrong
tedvdb,i think he finished there is a link at the bottom to show the remaining pictures ,7,DIY
tedvdb, just90skidsthings,3,thenetherlands
tedvdb,on my oneplus the menu button works just like before ,1,Android
tedvdb,i got one from an ex coworker nice guy ,1,oneplus
tedvdb,yes he she knows screenshot http imgur com 5d5zvu1 the three have purchased one invite is claimed but has not made a purchase yet ,2,oneplus
tedvdb,so much want,6,bikesgonewild
tedvdb,what are you both doing here and why are not you both outdoors riding ,3,bikesgonewild
tedvdb,wow an original bajaj avenger 220 i have never heard of it before ,3,bikesgonewild
tedvdb,mee eens ook erg lekker alleen vond ik de burger bij meneer smakers iets beter ,0,Utrecht
tedvdb,ik heb inmiddels al vaak bij dx spullen besteld altijd aangekomen en maar 1x door de douane tegengehouden 20 euro over gemaakt en toen kwam het alsnog ,2,nederlands
tedvdb,ik vond meneer smakers ook erg lekker goede burgerbar ,6,Utrecht
tedvdb,ik krijg ze vaak juist als ik ineens meer fruit eet dan normaal ,2,thenetherlands
tedvdb,all italian bikes suck ,18,motorcycles
tedvdb,ik heb het dan ook voornamelijk over salarissen net boven jan modaal die gewoon hun zaakjes netjes op orde hebben maar aan alle kanten steeds meer moeten gaan betalen want ja ze verdienen nog steeds meer dan anderen en dat mag blijkbaar niet ,1,thenetherlands
tedvdb,het idee iedereen betaald mijn zorgkosten zodat ik dat niet hoef ook het gaat mij er om dat er een balans gevonden moet worden en nog meer geld halen bij de hardwerkende nederlander helpt die balans niet ,3,thenetherlands
tedvdb,bij de meeste mensen is er een verband te ontdekken tussen hard veel werken en het salaris wat ze daarvoor krijgen uiteraard zijn er uitzonderingen ,3,thenetherlands
tedvdb,nee dan beter op een ipad want apple is wel veilig r thefappening al gezien ,2,thenetherlands
tedvdb,momenteel zijn epd absoluut niet geschikt voor tablets maar dat is aan te passen zet een paar ux experts aan het werk en die komen dan wel met een goed werkbare oplossing 7 tablets passen nog net in de meeste verpleegkundigen kleding dus die hoeven niet zomaar rond te slingeren ,1,thenetherlands
tedvdb,maar die trolley pc ook een nexus 7 haal je in bulk waarschijnlijk voor nog geen 100 euro per stuk ,1,thenetherlands
tedvdb,klopt maar als ik straks geen financieel voordeel meer heb van hard veel werken en dus meer belasting betaal waarom zou ik het dan nog doen laat mij maar lekker simpel werk zonder verantwoordelijkheden doen voor hetzelfde netto salaris ,2,thenetherlands
tedvdb,nee het principe dat de hardwerkende nederlander altijd financieel gestraft moet worden ,2,thenetherlands
tedvdb,waarom zijn verpleegkundigen niet uitgerust met een kleine tablet 7 waar ze het epd op kunnen raadplegen en bijwerken ik hoor van familie van me die in een ziekenhuis werken dat ze tegenwoordig een trolley hebben waar een complete pc op staat weer ze mee over de afdeling moeten lopen dat moet toch beter kunnen in deze tijd ,1,thenetherlands
tedvdb,ik helemaal niet de hogere inkomens worden aan alle kanten al zwaarder belast waarom dan bij de zorgkosten ook nog eens ik word tegenwoordig steeds meer gemotiveerd om zo veel mogelijk zwart te werken zodat ik niet meer dan de helft weg hoef te geven daarnaast maak ik nooit gebruik van de zorg dus betaal ik elke maand genoeg voor iets waar ik niks aan heb ik snap zelf ook wel dat ik nu hier wel erg kort door de bocht ga maar het gaat mij vooral om het principe ,3,thenetherlands
tedvdb,ik heb een paar van mijn vrienden erg positief horen praten over penoza maar ik ben er zelf nog niet aan toe gekomen om te kijken ,2,thenetherlands
tedvdb,so they have found a new reason to play with powerful lasers ,10,offbeat
tedvdb,we hugged it to death ,2,pics
tedvdb, link for the lazy http www jodieotte com ,12,pics
tedvdb,it looks awesome two people crammed in a light shell full of fuel and two huge jet engines ,3,funny
tedvdb,the air pollution in utrecht is pretty good some hot days there can be some smog but it has been a while since i noticed it i work in utrecht and live in nieuwegein just south of utrecht and have never noticed it smelled like old car fumes outside ,4,Utrecht
tedvdb,understandable the fight scenes where incredible ,1,Ijustwatched
tedvdb,i have watched it yesterday evening i agree with you but not on the plot part you make ik sound like the story is slowing the movie down but it did not feel that way to me by the way did you see the deleted gang war scene http vimeo com 90092972 ,3,Ijustwatched
tedvdb, indeed it is http www reddit com r imagestabilization comments 21d2gx request rolling ship ,13,ImageStabilization
tedvdb,i think they nailed it ,-1,funny
tedvdb,oh idd goed punt had ik overheen gelezen ,1,thenetherlands
tedvdb,ergens vind ik het een beetje vreemd dat de nederlandse staat nu gedeeltelijk verantwoordelijk is voor de moorden begaan door het servische leger of zie ik het nou zo fout ,15,thenetherlands
tedvdb, johnny quid 15 07 14 08 49 link 80 reacties volgens mij is dat gisteren ,0,thenetherlands
tedvdb,nice lekdijk ,1,bikesgonewild
tedvdb,een computer beeldscherm je weet wel zo n ouderwetse beeldbuis toen hadden we nog geen flatscreens goede oude tijd ,2,thenetherlands
tedvdb,masturbating so i can throw everyone in jail without even having to explain myself oh wait ,1,AskReddit
tedvdb,nou bedankt allemaal voor jullie nl alerts s,2,thenetherlands
tedvdb,yup 4 maal dat vond ik dan wel weer een beetje overdreven ,12,thenetherlands
tedvdb,instructions unclear dick stuck in battery ,2,Justrolledintotheshop
tedvdb,ah i see makes sense thanks ,2,Whatcouldgowrong
tedvdb,so if i am understanding correctly if he had not touched the front brake he had not been thrown off ,2,Whatcouldgowrong
tedvdb,yes the dashboard is very cool http youtu be syvmt95gknc,2,bikesgonewild
tedvdb,all words are made up ,22,nononono
tedvdb,good point what about a narwal spike helmet ,5,WTF
tedvdb,i think this is indeed a more appropriate question please u wokcity respond ,7,WTF
tedvdb,why do you have a pink helmet ,2,bikesgonewild
tedvdb,thanks i agree it is not cableporn but it is indeed interesting ,6,cableporn
tedvdb, rekt het niet scheurt het wel dutch for if it does not stretch it tears ,1,AskReddit
tedvdb,ingevuld ,2,nederlands
tedvdb,ik wel en het is inderdaad net zoiets als de zwarte markt in beverwijk maar dan een stukkie kleiner overigens is de video geupload in 2007 dus niet geheel representatief meer ,2,Utrecht
tedvdb,it probably in russia it always is ,14,Whatcouldgowrong
tedvdb,house at 1m43 ,2,trailers
tedvdb,only 1hp ,5,motorcycles
tedvdb,mee eens er zijn nog veel meer van ons te vinden in r calvinball dus als iemand interesse heeft ,1,thenetherlands
tedvdb,maar dat hangt wel af van in welke van de doelen het laatst gescoord is en of de speler links of rechtshandig is ,6,thenetherlands
tedvdb, source https www youtube com watch v qk2x f2jeza ,38,nononono
tedvdb,yes it is dutch ,1,technology
tedvdb,hmm let add some more access points that will stop them from complaining ,210,techsupportgore
tedvdb,two dick dude ,2,funny
tedvdb,ja sorry kon het niet laten ,3,thenetherlands
tedvdb,ik juni ruim ,26,thenetherlands
tedvdb,in dutch we call them handschoenen ,3,funny
tedvdb, arranged by penis http www thewebsiteisdown com ,1,funny
tedvdb,yes you warned me but still nicely done by the way ,1,webdev
tedvdb,wow movies guessed 10 score 8 and i have seen some movies ,1,webdev
tedvdb,they might be illegal in belgium in the netherlands they are pretty strict on led strips ,1,motorcycles
tedvdb,i agree and just by doing stuff yourself oil changes and that kind of stuff ,1,motorcycles
tedvdb,could somebody explain what i am looking at ,2,Justrolledintotheshop
tedvdb, oh grapje zeggen terwijl je oeps mijn fout bedoeld is inderdaad niet heel grappig ,3,Netherlands
tedvdb,i laughed so hard when they were in the farmer house and yelled heil hitler spoiler ,1,Ijustwatched
tedvdb,i think you forgot to mention visual basic 6 ,1,webdev
tedvdb,i am currently running on doriman kernel http forum xda developers com showthread php t 2614400 it is available for most all variants of the g2 ,1,lgg2
tedvdb,i am having exactly the same issue firefox 27 ,1,Android
tedvdb, alot http 4 bp blogspot com d z d2tzi14 s8trio4br3i aaaaaaaacv4 zh7 gcmlrko s400 alot png ,3,funny
tedvdb,you could install betterbatterstats https play google com store apps details id com asksven betterbatterystats it told me that google keep was causing wakelocks so i removed it ,4,lgg2
tedvdb,nee dat je op apparaten waar je mogelijk mp3 bestanden op kan zetten een paar euro downloadheffing betaald betekend niet dat je dan ook echt mag downloaden ,1,Netherlands
tedvdb, woah http www quickmeme com img cb cb209761100d71d2d2297bb9ad8d97e94067e1f0e6d2df76e458ff1f718e5be4 jpg ,6,PS3
tedvdb,so what does that mean ,136,science
tedvdb, r firstworldanarchists ,8,bikesgonewild
tedvdb, since this mt 09 is my stunt bike the 2 radial calipers have been added and are connected to my hand brake that i only use one finger to control its better to have enough power to stop the bike at any given time rather to make it harder for myself source facebook https www facebook com photo php fbid 447197248742091 set a 247346135393871 58035 243975882397563 type 1 theater ,25,motorcycles
tedvdb,haha cool 1 stackoverflow com 2 docs moodle org 3 moodle org 4 forum xda developers com 5 github com ,1,ProgrammerHumor
tedvdb,hoezo misdraagt wat heb ik gemist ,3,Netherlands
tedvdb,ziet er interresant uit ik kom misschien ook nog wel even binnen wippen ,2,Utrecht
tedvdb,i will take that bet 1btc ,1,WTF
tedvdb,do not you cannot trust anyone on the internets i did not take it personally ,2,WTF
tedvdb, for the lazy https blockchain info address 16cjkygqur5tgdi6nhsxs6dadvmabsrzel ,84,WTF
tedvdb,ach we kunnen spelling toch ook gewoon negenen ,4,Netherlands
tedvdb,hopefully not because some people do not like fireworks nobody should be allowed to light fireworks that not how a democracy works or should work ,3,Netherlands
tedvdb,het eerste commentaar op die post is dat het leiden is en niet amsterdam ,2,Netherlands
tedvdb, neen hier neem een upvote,1,Netherlands
tedvdb,die fout vind ik veel erger dan het hele feil dat selfie woord van het jaar is edit facepalm vindt vind blijft ook lastig ,33,Netherlands
tedvdb,what about wasps ,1,AskReddit
tedvdb, i think there should be a sign before the username http www reddit com r bitcointip comments 13iykn bitcointip documentation ,2,Bitcoin
tedvdb,i have one of those at home i believe that the power supply states that it can deliver 2 5amps but i do not believe it it cannot handle more than 3 bitcoin mining sticks should be around 500ma stick ,1,shutupandtakemymoney
tedvdb,i have got no problems downloading it maybe a virusscanner or firewall issue i have uploaded the windows 3 8 2 version it to a mirror https mega co nz 2j8iuy6i nsvslmfyrieuns9xulkasgmihxve4tytb51k7ewr t0 you could try that ,2,BitcoinMining
tedvdb,rtfm read the fucking manual ,2,AskReddit
tedvdb,of rechts klikken op de afbeelding en opslaan als ,3,Netherlands
tedvdb,because a blowjob is a nice to get ,0,AskReddit
tedvdb,why has not anyone mentioned f e a r ,2,PS3
tedvdb,about 459 ,41,Android
tedvdb,awesome including the mentions of your mistakes this way others do not have to make the same mistakes ,2,Autos
tedvdb,what about santa elves they are probably offensive to small people ,2,Netherlands
tedvdb,living on the edge ,4,ProgrammerHumor
tedvdb,but what did you use to make the photos ,-10,techsupportgore
tedvdb,this was beautiful i completely understand why you sold her ,3,motorcycles
tedvdb,for the lazy r yesshesquats r yesshesquats ,18,pics
tedvdb,jammer dat mensen soms zo kortzichtig kunnen zijn ,3,Netherlands
tedvdb, so the statement is technically correct the best kind of correct ,5,funny
