name,body,score,sub
EagleKL44,make it a fourth ,-2,sports
EagleKL44,aw man you hurt my feelings i just got down voted twice how will i ever sleep at night ,-40,sports
EagleKL44,are you implying this redditors gender gasp stupid wanker,-113,sports
EagleKL44,my thought process exactly r leikale i wished we could have had romney or a more promising young and upcoming candidate that we could have relied on but we did not i said to my parents at the beginning of the primaries that all trump had to do was borderline outrageous things that everyone thinks but no one says honestly he really was a breath of fresh air into politics normally it two candidates who say the politically correct thing even when their party opposes the topic here comes trump saying nah fuck that it sucks you and i both know it sucks if you think it does not suck you are wrong and i am gonna prove you wrong once i fix it we have not seen anything like him in the modern presidential era really i think if anyone else went up against hillary she would have won but trump ran a beautiful campaign you really do have to admire it statistically speaking he identified hillary weaknesses exploited them let the polls convince everyone he was a long shot and then swooped in for the win i do not like trump i voted for him and still i support him because he is my president and i really could not stand bernie or hillary ,2,AskReddit
EagleKL44,maybe your dad made a bad call and that batter intentionally fouled the ball so it would hit your dad ,-152,sports
EagleKL44, hold my beer ,2,AskReddit
EagleKL44,good and lets keep it that way ,1,politics
EagleKL44,bodybuilder checking in girlfriend and i just saw a ball game now on the train ride home doing well and thanks for asking maga ,1,The_Donald
EagleKL44,some tiny little undiscovered poison frog during an amazon rain forest tour oh look at this cute little lime green yellow and black frog aw he so cute look he barely fits in the palm of my hand dead ,4,AskReddit
EagleKL44,not really considering he also stated that he angered a lot of agents by not following their recommendations throughout the years especially on the clinton case since it was such a high profile case nonetheless those agents did not hate him they were just disappointed their boss didnt trust their suggestion i had a former boss who i hated as my boss but we played im the same mens bball league we would grab beers together on weekends and after work but within walls of the office i was so frustrated because id recommend options for clients and he woukd always find something wrong or go with a lesser options because he thought of it first i picture the fbi agents and comey relationship similar ,0,politics
EagleKL44,thank you for the advice im onnthe east coast too and so far ive seen the best place to fly out of is either jfk or philly both are easy to get to for me i would absolutely look into flyong to paris someone else suggested flying to london and spending 1 day night then take the express train to paris and spend 3 nights in paris or the surrounding area and then take a train to germany based on where we decide to go for the remaining 2 or 3 nights then i was guessing i would findnthe cheapest flight frankfurt might be an option as i know its a major transportation hub sorry for spelling errors im on mobile ,1,travel
EagleKL44,my parents and sister have both been there and said its a beautiful country town city i was just thinking of tooling around there during the day theres a castle and church there to tour also black forrest is about an hours drive from there i obviously dont have a full grasp of the timeline of things yet but i need to start puttong the pieces together of whats possible then figure out a timeline ,1,travel
EagleKL44,well i do not hate my job i actually in fact love it in 4 minutes it our northeast core and small group markets sales reports after each sales rep aka me gives our updated rep readout ie sales numbers i believe the vp of our nyc group office will be discussing the new new york paid family leave law that will go effective 1 1 2018 you are all more than welcome to join but you have to have a company e mail and log in through skype business see you all there ,1,AskReddit
EagleKL44,honestly i watched and enjoyed bill nye new netflix show 100 agree there should not be a censorship towards any of the material now while i do not always agree with the politics of the show i really cant deny the scientific evidence i mean global warming is a problem y all ,0,The_Donald
EagleKL44,hazing and to be clear im talking about high school sports college fraternity and not to be confused with bullying growing up all throughout my high school collegiate sports career if you were freshman you were hazed forced to do extra push ups and extra suicide runs forced to carry equipment and the seniors bags usually perform 1 or 2 embarrassing public acts like wear tu tus over your jeans 1 day to school it was stupid and fun i did not mind it at all joining a college fraternity the hazing was definitely more hardcore but it was still all mental 1 mile jogs at 3am forced to sleep in the basement with your pledge brothers w nothing to actually sleep on aka you are getting zero sleep had to wear dress shirt and tie to class on mondays and fridays now none of that shit flys my fraternity just got put on notice because last semester some libtard social justice warrior reported that during her lunch everyday she would see the same kid bring another kid lunch and carry his backpack one of the seniors would go to work and then make a pledge bring him his class materials and a sandwich before class that 1 incident put the whole chapter on probation so stupid ,2,AskReddit
EagleKL44,i know you have heard a 1000 chicken recipe responses so far honestly just play around and see what works best for you i typically will lightly cover my chicken in olive oil then season it with a combination of lemon herbs garlic powder old bay cayenne pepper crushed red pepper and or a parsley basil thyme rosemary medley i know the old bay is high in sodium but normally i smother 1 chicken breast in it let me live a little i always wrap the breast up in parchment paper grandmother taught me this and i cook it at a lower temperature depending on how many breasts are in the oven something like 400 degrees for 20 mins for 6 7 chicken breasts idk my oven is weird i think its messed up but that works for me and it almost comes out perfectly tender and moist if it needs more time i just put it back in for a few extra then i normally just pair with roasted veggies i found a sweet link online that i screenshotted on my phone it a 1 pan roasted veggies recipe it has sweet potatoes with a dash of cinnamon brussels sprouts asparagus broccoli carrots and red onions some weeks i switch things up i will remove the asparagus or sprouts and steam green beans instead or i will stir fry snow pea along with white onions and bell peppers honestly never gets old for me in the winter i will usually had a 1 4 to 1 2 cup of brown rice spring and summer its just chicken and veggies i get my carbs elsewhere ,1,Fitness
EagleKL44,i am not quite sure but i know it stated using his knowledge of the company and position and industry for a competitor client or any distributor is a no go ,1,legaladvice
EagleKL44,yes he did 26 weeks pay and a small bonus ,1,legaladvice
EagleKL44,he was a senior product distribution manager that was as general as i can pu it without getting to personal i believe he stated that the non compete said it limited him from signing with competitors clients aka distributors or using company knowledge to advise a different company also cannot go into product distribution within the industry as a whole ,3,legaladvice
EagleKL44,sign this or lose your job that not forced but it a lose lose situation he cannot use his 30 years of knowledge towards finding a new job in the industry and if he does not sign it he risks losing his job of over 30 years no one forced him to sign anything but he was boxed into a corner and told to jump off the ledge left or right ,12,legaladvice
EagleKL44,yes he was forced to i addressed this in a few posts above but yes he was forced to sign or be let go so he signed ultimately knowing it was the writing in the wall anyways ,4,legaladvice
EagleKL44,i doubt it he spoke briefly in the car and it seems more geared towards consolidating positions i do think he was targeted specifically because he older earning a healthy salary but he would have brought up that they targeted ages seems like he was a by product of an attempt to shed salaries and save money in the long run ,85,legaladvice
EagleKL44,do not know i am back at work now i had to pick him up as he had a company car and company phone he called and asked me to pick him up as they were taking both ,9,legaladvice
EagleKL44,exactly i was told by a friend at work that non competes in most cases are generally not enforceable because companies often deploy them right before a firing essentially a sign this or you are fired ultimatum which they generally fire you anyways it a lose lose situation he just told me he signed the no compete on or around the 6th of april a series of firings happened the next week and 2 weeks later aka today 4 21 he was let go ,73,legaladvice
EagleKL44,they did offer half year severance he 62 and it not likely he will go to a different industry to learn the tricks and trade i was more asking towards the non compete if its enforceable or not any work arounds ,22,legaladvice
EagleKL44,sorry yes he did there was about 30 50 employees this is a large corporation with nearly 50k employees that were asked aka told to sign the non compete they had 24 48 hours to sign and return to their boss my dad was pretty high up the chain of command so he was shocked and knew it was weird timing after all these years he tried to band together with several other members in a similar role than him strength in numbers but a few caved and then the rest all signed and followed suit last week they fired about a dozen and then today he told me they fired even more himself being one of them i do not know the specifics but i do know the non compete said no competitors or distributors within the industry and he also cannot deal with product distribution which is what division he was in i know nj and pa are liberal and pro employee for the most part but non competes are still like the mark of death during a hiring process ,71,legaladvice
EagleKL44,will do thanks for the advice ,1,AskReddit
EagleKL44,i just finally realized something grrm has totally performed the d e n n i s system on us shudders ,5,asoiaf
EagleKL44,honestly this is my 2nd play through and the first time i was so afraid of dying or getting ambushed that i reverted to a stealth archer now mid way through my second play through and i am a 50 50 mix of dual wielding war axes and 2 handed battleaxe i got full leroooy jenkins into every cave even when i cannot remember if i had ever been there during the first play through pretty fun just running into battle with a poisoned blade and thu um freezing anything that moves ,6,skyrim
EagleKL44,i have superhuman strength but i am so strong i often accidentally break the things i touch rip iphone ,4,AskReddit
EagleKL44,there are plenty of full length you tube videos available out there she was clearly not some peaceful protester throwing rocks and fireworks or whatever they had into the crowd she was clearly looking for a fight otherwise she would not have been in that part of the crowd with that being said they are both wrong simply because they are there looking for violence he wrong for hitting her shes wrong for inciting violence and participating in a fight not at him but in general guess what people they can both be wrong i do find it hilarious though that she just got clobbered like that 1 hitter quitter ,2,news
EagleKL44,i almost got expelled for paraphrasing a couple sentences in one of my senior level 300 classes and forgetting to cite them as a reference i know that sounds like a cop out but it was towards the end of the 1st semester senior year in college and i was working 30 hours a week between 2 jobs addiitionally i was an officer on student government vice president of the intra fraternity council and held a pretty significant chair position within my fraternity i also participated as a campus ambassador giving tours to potential new students all in all i was fairly well known by university staff and several faculty members i had some bullshit paper for an economics class due and no time to do it we had to interview someone with a job and i cannot remember exactly but the assignment had something to do with how it related to some topic we were talking about in class so i interview my buddy ryan who was a manager student of some sort at the campus rec center he has been there since freshman year and basically set the schedules and ran the intramural program well we conducted the interview and at the end he gave me the new employee handbook for reference in case i needed it few days later i work in the morning at job 1 then go to my two classes 2 3 3 4 then worked 5pm 11pm at job 2 as a bar back waiter get home and i am exhausted knowing i have to write this paper long story short i was up until close to 3 4am writing this paper and i have a 9am i turn in the paper and 3 days later received a voicemail from my professor requesting i come to office hours after the next class i go to class she wo not even make eye contact with me which was unusual as i sat relatively close to the front every time and generally participated she would not even call on me if i raised my hand after class i go to her office and she starts fuming how i tried to pull 1 over on her she explained she had highlighted 3 sentences throughout the course of my paper that were eerily identical to what was listed in the campus rec center new employee handbook truth be told i do not even remember if i referenced the handbook or just went off my notes from how my buddy answered the questions i explained to her my situation work tired notes from the interview forgot to cite the handbook but she would not budge next she informed me she was filing a plagiarism report so it can be formally documented i had to sit with the professor and department chair then again alone with the department chair who then made the ruling and sided with the teacher i was allowed to appeal to the assistant dean of the college of business public affairs who upheld the ruling i personally knew the dean of the college of b pa and asked for a special meeting which he granted as a favor he recommended that i request a ruling from a board of my peers as it would be inappropriate of him to overturn his assistants ruling good news is if the peer board ruled in my favor i could expect a ruling anything from the charges dropped and rewrite the paper or receive a 0 on that assignment but remain academically eligible bad news is they could also uphold the ruling to expel me on the grounds of plagiarism by the grace of god i walked into the room that day and saw that i knew 1 of the peer students on the board he had been on student government the prior year and sat to my right during the meetings he knew the type of person i was and i believe convinced the other 4 board members to rule in my favor as the teacher refused to let me back into her classroom the board ruled i receive an incomplete for the class does not affect my gpa but does show up on my transcript i remained academically eligible took the class again that winter with a professor that loved me and heard about my situation he let me submit all assignments i completed under the previous teacher for full credit minus that goofed up paper that started all this and even let me improve them first to bring up the grade if i wished finished that winter course with a 97 and then went on to graduate in the spring funny thing is that bitch professor i kept seeing all over campus that spring i would walk past her head held high and her eyes would being pointed right at that floor i may have mumbled and called her a bitch during a few passing she was on the stage when i walked across and got my diploma and i skipped shaking her hand even though she did extend it so i did not officially get expelled but i was down to my last lifeline ,2,AskReddit
EagleKL44,that one opinion yours i have different opinions which is allowed in this country nonetheless i respect your right to say i am wrong while i have the right to say you are wrong for saying i am wrong neither of us are wrong even if one thinks the opposing person is wrong ,2,politics
EagleKL44,well i do disagree with the title so i was sarcastically pushing button call it trolling if you want no skin off my back ill still sleep fine tonight if you rationalize it that way lol i genuinely am sorry that you are a miserable person sorry for being sorry ,-8,politics
EagleKL44,you say complain i say greater emphasis shit does not happen overnight you build a plan and execute not all plans will work and you are gonna have to pivot and compromise along the way 3 years from now we can judgement it been only about 100 days so far ,1,politics
EagleKL44,tbh i popped on here shortly during lunch and love pushing people button i did vote for trump and while i do not agree with everything decision or action i agree with an overall majority i am happy he nominated a conservative scotus im happy he putting a greater emphasis on illegal immigration and the threat of terrorism i am happy he at least trying to look to change the aca in some way rather than lie to us that everything is fine and the ship is not sinking it was by the way the aca would going to implode with or without trump souce i work in insurance i am happy man sorry you are not peace and love ,-14,politics
EagleKL44,you spelled winning wrong ,-19,politics
EagleKL44,i heard up to 7 from my local morning news phl no idea if civilian or non civilian i am sure either way they will be reported as civilian by those who oppose the strike ,1,The_Donald
EagleKL44, hey russia yeah hey it president trump so yeah syria fucked up and we are gonna punish them for it um yup we know you are friends with them so that why i am calling we are dropping a shit ton of bombs just the friendly heads up to clear out any ground troops and make sure you clear the airways whats that no you cannot change my fucking mind this is just a courtesy call bitch click my interpretation of the trump putin conversation maga ,-1,politics
EagleKL44,pony express ,3,thewalkingdead
EagleKL44,and a good majority thinks they have idiotic ideals so whats the point here the whole blowing themselves up in the name of whatever and causing death and destruction just to rape and murder is idiotic not the whole religion itself even though it is based on violence rape sexual abuse and terror sounds like a great way to live ,3,politics
EagleKL44,hey mr fbi agent look over here ,7,worldnews
EagleKL44,triggeredddddddddd,1,politics
EagleKL44,do not care about muh internet points care more that other options are blocked out because they are a different thought process ,-3,politics
EagleKL44,so when the dems perform a filibuster that the gop fault ,-10,politics
EagleKL44,triggered,-2,politics
EagleKL44,triggered,-11,politics
EagleKL44,co worker pointed this out to me the other day and i am purposely being short to condense amount of words i have to type trump tries to pass an agenda item dems filibuster or block or somehow disrupt those efforts trump announces he will move on to the next agenda item dems media then proclaim trumps giving up trump does indeed move on to next agenda item which is blocked or shut down again now this cycle is very well documented in the media many times proclaiming victory over fascist trump but my co worker brings up a great point the dems are setting themselves up for a republican knockout punch come senate house voting time they are providing him all the ammo for him to lay out several examples where he trying to get something done and they block it simply because of who he is or his party affiliation he can then claim which he done all along that washington is broken and whether he right or wrong he has the proof in the pudding he tried on several occasions to pass legislation and his opposition only threw all their efforts against him to undermine him some will applaud that effort others on the fence may read more into the washington is broken idea idk food for thought that was his opinion whether you think he right or wrong i really do not care but definitely something to think about edit and naturally being down voted since people do not like difference of opinions on this sub not even my own thoughts but thoughts of a coworker whom i spoke to regarding the topic of this administration not getting anything done ,-27,politics
EagleKL44, whoosh right over your head ,1,news
EagleKL44,does not sound muslim at all ,14,news
EagleKL44,sasha does not but her role does basically there was a female comic character with a different name but plays a near identical role as sasha ,0,thewalkingdead
EagleKL44,thank you for those kind words i take pride in my dickish abilities ,1,thewalkingdead
EagleKL44,both characters play major roles in the upcoming future of the show that all i am going to say without getting into spoilers i found last night pretty informative into showing how rosita got where she is today with without abraham how about this do not watch the next episode then come back and i will let you know when guns start blazin again so you do not have to watch an entire episode full of inconsequential even though they are about to play big roles in the near and long future characters you get to see the blood and guns you long for ,3,thewalkingdead
EagleKL44,you do know this entire thing is based off of a comic book right similar to got but different in their own story telling ways the show is following the comic in a fairly accurate way got has maybe 10 episodes in a season so they condense everything down to fit into the time they have as a reader of the ice fire series i am often shocked how much material and background they leave out just to fit their time restraints i really wish they would have set up the entire series better with more in depth look at each character walking dead has almost twice the episodes and genuinely does make a fair attempt to give each character some form of background character development because well they have the time you seem like the type of show watcher that clicks through their phone until boom action happens and deaths occur walking dead is a story about life after the apocalypse it not all slashing walkers and shooting other groups most of the time is finding out how to find supplies find shelter then fortify and defend it and how to come together as a group of mutual interests yeah killing rogue groups killing walkers that are a threat or avoiding herds are also major parts but without the background as to why they are doing what they are doing or why a character ticks the way they do you literally just have a low budget shitty netflix action flick on your hands ,2,thewalkingdead
EagleKL44,technically yes if i felt offended and wanted to report it it was in a playful manner with me so i did not mind ,3,AskReddit
EagleKL44,yes they did then they came across rick motorhome and she machine gunned them down the last wolf was the one morgan was trying to save and later shot dead by carol ,4,thewalkingdead
EagleKL44,i am a bodybuilder and i have had similar experiences at my last workplace and my current one both times it a older woman and joking context i really did not mind at the time i think if they continued to do it i would see it as a problem i even told my gf and she laughed ,206,AskReddit
EagleKL44,considering many of the live steaming services we use today did not exist or were not available in 2009 i would have to say you are wrong last night i personally had it on the tv but needed to shower so i walked out of the room and brought it up on my phone on twitter plugged it into the bathroom speaker i have and listened to it there that shit was not available in 2009,50,television
EagleKL44,on top of that i bet the person who wrote this article the person agreeing with this article and the ones commenting on here acting like its a big deal are all likely wearing clothing that was made in a different country fruit of the loom boxers vietnam china not usa this is pathetic france and italy are known for their fashion and their artists make some of the best dresses known saying you should buy american simply to buy american is stupid if someone makes a product better you there is no shame is purchasing it from them but when you can make a product better but someone else is making it simply because they can get paid less that is when the buy american sentiment comes into play ,1,politics
EagleKL44,i was just out in colorado early january 4 straight days in this order keystone vail breckenridge vail unfortunately moving is not an option i have no wife or kids but my parents and all my best friends are here would be too difficult to leave them ,2,skiing
EagleKL44, we hate you every pa skier right now including myself ,27,skiing
EagleKL44,urchin alert ,4,skiing
EagleKL44,yeah you should probably join the train too ,-9,politics
EagleKL44,go back and watch addresses from former presidents clinton bush obama the vice president for each will always be seen nodding and approving and depending on who the speaker of the house they would be too for obama is not was different as biden would sit there and constantly nod while paul ryan would only show approval on certain specific bipartisan topics if he agreed for trump it just so happens the speaker is a republican and a very influential one at that ,1,politics
