name,body,score,sub
EagleKL44, second there no excuse for being so set on exercises that you cannot adjust on busy days if the squat rack is crowded and you want to do military presses then grab some dumbbells or go find the machine that replicates the movement or grab a bar and start the exercise off the ground each time regardless of how you do it the rest of the gym should not have to wait because you really like this exercise more than that one soooo in conclusion everyone else at the gym has to get out of your way and tailor their workout because you need this rack machine weight at that specific time lol dude you just sounded like the biggest hypocrite why cannot you adjust your routine no instead you are suggesting someone working hard has to stop their routine and tailor around you because you are pouting and want to use something when you want it for the record yes i am that guy that sits in the squat rack for 35 45 minutes because i am doing 12 sets of squats and maxing out at 405lbs people in your gym actually trying to work hard probably hate you for sitting there bitching about them under your breath if you really want to use a rack when someone else is using it ask nicely to work in with them most people will say yes but if you do not take that stick out of your ass i am sure they wont help out ,5,Fitness
EagleKL44, gym etiquette ,8,Fitness
EagleKL44, if you strip that bar and start a completely new exercise without offering it to the people waiting first why what if i am working on shoulder and i need to do 6 sets of shrugs and then 5 sets of standing military press just because you are standing there looking unhappy you have to wait does not mean i should stop after the first exercise and give you the rack in fact maybe because it crowded i had to originally wait 10 minutes to get this rack why would i walk away when i already have it only to return and have to wait again i know it sucks but from my experience if someone has the rack and they are using it purposefully no curls in the fucking squat rack and working hard then let it sucks but just wait until it your turn now if they are fucking around then approach them and tell them you are waiting and you do not appreciate them fucking around because it affecting you ,6,Fitness
EagleKL44,heating pad works well for me after i go heavy deadlifting or squatting and end up with a sore back alternatively icy hot and advil ,1,Fitness
EagleKL44,did you just jump straight into the squat rack i would suggest warming up first especially if you have not been in the gym for an extended period of time try doing a few sets of lunges body squats calve raises hamstring curls get your lower half warmed up and stretched out as for the knee i could only suggest you did not have the correct form and there was pressure on your knee give it a few days then try to go back and see how it feels ,1,Fitness
EagleKL44,frustrating to see people i know bragging about x fit then 9 months later i ask them how they are doing and they seem to have some injury related to their experience there i honestly do knock the professionals and i will actually watch the national competitions when they are on espn i admire their endurance but for me that all crossfit really is the endurance to perform many strenuous exercises x many times or in combination with each other rapidly i know it works for some people who have the right foundation and like all things you know there great crossfit coaches out there but i just see too many negatives outweighing the positives ,0,Fitness
EagleKL44,well stefani unfortunately most regulars in the gym wo not realize the power racks are for more besides just squatting i personally do not use it for benching but i wo not look down on someone who is its curling in the power rack that frustrating hopefully 1 macho bro has not ruining the gym for you i know a good 50 of the guys at my gym been there over 4 years now and i know we all appreciate a woman working as hard as we are ,3,Fitness
EagleKL44,honestly i mean no clue i did show up with her when she went to clean out her locker at the crossfit gym and we came face to face again but it was fairly civil i am pretty sure he also had a huge crush on her and wanted to bang her i pretty much told him to his face he was a poor mans napoleon ,0,Fitness
EagleKL44,without getting into the technical jargon kipping pullups put alot of stress on your shoulder alignment over time the ligaments and muscles become strain and can even tear this is mainly due to the individuals overall lack of strength not being able to perform normal pull ups kipping just puts an incredible amount of torque on your shoulder and most peoples shoulders cannot handle it leading to injuries regular wide grip close grip and chin up pull ups should not cause shoulder issues to the best of my knowledge i am not a professional nor a medical doctor everyone body is different ,1,Fitness
EagleKL44,here the follow up i wrote to someone else as well and it like a cult i showed up to support her at some of her competitions i once saw her do a challenge that roughly was squat x many times then run 1000 meters then do x amount of snatch and cleans by like her 10th squat rep i was like not her real name sammy you are rounding your back keep your back straight keep it straight and bend at the hips her x fit coach came over to me and told me to stop yelling at her when i proceeded to say i was her younger brother and shes performing the exercise wrong he told me i did not know what i was talking about like dude she has a round back shes gonna pop a disc that way anyways she continued on and when she got to the snatch and clean it was more like a deadlift and clean once again her back was slightly rounded the barbell would then bounce off her thighs and she would clean but her shoulders were flaired out i tried to correct her again and the same coach got in my face and told me to stop telling his athletes what to do clear napoleon complex as he was a foot shorter than me i am 6 5 246lbs well on her last clean she failed and the weight came crashing down on her i told the coach to go fuck himself and stepped over the spectator line to help her up as he was too busy yelling at another athlete that was about to fail as well ,1,Fitness
EagleKL44,so you are doing body squats like no weights just squatting normally with your natural body weight still the form and technique remain the same warm up and stretch out the calves look up youtube videos if you do not know a proper calve stretch ,1,Fitness
EagleKL44,and it like a cult i showed up to support her at some of her competitions i once saw her do a challenge that roughly was squat x many times then run 1000 meters then do x amount of snatch and cleans by like her 10th squat rep i was like not her real name sammy you are rounding your back keep your back straight keep it straight and bend at the hips her x fit coach came over to me and told me to stop yelling at her when i proceeded to say i was her younger brother and shes performing the exercise wrong he told me i did not know what i was talking about like dude she has a round back shes gonna pop a disc that way anyways she continued on and when she got to the snatch and clean it was more like a deadlift and clean once again her back was slightly rounded the barbell would then bounce off her thighs and she would clean but her shoulders were flaired out i tried to correct her again and the same coach got in my face and told me to stop telling his athletes what to do clear napoleon complex as he was a foot shorter than me i am 6 5 246lbs well on her last clean she failed and the weight came crashing down on her i told the coach to go fuck himself and stepped over the spectator line to help her up as he was too busy yelling at another athlete that was about to fail as well ,0,Fitness
EagleKL44,so you mean planet fitness employees must be all that pizza they order ,2,Fitness
EagleKL44,walk on a treadmill steep incline to warm up the calves then just stop being a pussy and stretch them out over time they will become more flexible ,1,Fitness
EagleKL44,i hate everything about crossfit i sincerely hope this draws out all the closet cross fitters to tell me how many reps of 135lb cleans they do with horrific form yeah buddy keep doing your kipping pullups while you slowly tear your rotator cuffs so bad you will never be able to lift a 20lb object above your head trust me it happened to my sister after 2 straight years of warning her and offering for her to come train with me instead she enjoyed the comraderie and the challenging daily workouts she finally tore both rotator cuffs received 2 concussions from trying to rep as many as possible during competitions leading to a bar or weight slipping or her failing and dropping on her head and has issues with her right knee probably from being coached to perform bad form on some leg exercise s after all her injuries she finally denounced crossfit began working out with me but she can barely get through a consistent week because one or both of her shoulder flair up when i helped her move to alexandria last month i literally had to carry anything over 30lbs because the strain on her shoulders were too much she gonna need surgery on both before long ,6,Fitness
EagleKL44,well when my neck does pinch i give it 1 rest day then go to see the chiropractor he identifies the inflamed area tells me what hes going to do and why then he performed the maneuver shit pops and i can feel things shifting but i immediately feel better i know there are crazy ones out there but if you find yourself a good one who knows his shit i suggest giving it a try i have never felt better ,3,Fitness
EagleKL44,sorry but my routine is 10 sets of back squats and i finish with 2 sets of front squats honestly if i do anything less i seriously do not feel it that night or the next day some people are just different i know a few guys who can do 4 sets of 225 and they are burned out and ready to move on personally i do 2 sets 135 2 sets 225 1 set 315 1 set 365 or a higher max weight drop down and do 2 sets 315 again drop down 1 set 225 drop down an rep until failure 135 then i do 2 sets of front squats 135 to blast out my quads and yes this roughly takes me 35 45 mins to complete sorry not sorry ,1,Fitness
EagleKL44,i had an influx at my gym in brooklyn as well it been reaching the low 60 every couple of days or so i would say all the people who joined and gave on on their ny resolution feel the warm weather and are reminded they are gonna look like cows come their memorial day beach trip they will be gone in another week once they are too sore to workout ,2,Fitness
EagleKL44,i am with ya i have hit the 405 mark my best was 425 for 1 i found that every time i would go for 4 plates the next week i was barely able to pull 3 for 10 normally i can rep 10 easy so i began to switch my approach i left my ego at the door and i do more sets of 225 275 and 315 and go for higher reps versus trying 405 for 3 4 do what you gotta do i just eventually found it was not worth trying to pull that heavy anymore i would rather rep weight i can control but do you man and good luck ,1,Fitness
EagleKL44,dwight goodman status ,1,Fitness
EagleKL44,eat more pizza ,7,Fitness
EagleKL44,shhh do not teach him the art of picking up hot girls ,5,Fitness
EagleKL44,i literally posted a all caps rant about some dude in the squat rack like 15 minutes ago it happens way way too often i hate when they say they have 4 sets left bro i normally will go off and do some lunges to stay warm and just wait it out once i got so frustrated as i was waiting then turned around to find him setting up i counted the amount of weight he has on the bar which was around 70lbs walked over grabbed the fixed barbell 70lber came back to the squat rack and told him he could use the fixed barbell instead of the squat rack barbell he was not happy but that the perk of being 6 5 245 with a beard people tend to listen ,12,Fitness
EagleKL44,do you have a spotter also have you tried any methods to increasing the explosive power from your glutes hips and quads ,1,Fitness
EagleKL44,it ok i do not actually hate you i might i was stuck waiting but alas i was not keep working at it ,3,Fitness
EagleKL44,i know everyone hates them but i began seeing a chiropractor around 2011 i began correcting my posture around fall 2012 and he does wonders for my neck and lower back if i have a knot in my back or neck he almost always is able to work it out if he cannot he suggests i get a deep tissue massage from a trained massage person sounds like it dumb but they do a hell of a job but yeah man take it easy for a few days maybe go get that knot massaged out then when you return work hard to keep you neck in a neutral aligned position ,2,Fitness
EagleKL44,how is that even possible the bar weights 45 you would of had to put 2 5lb weights on each side if this is the case i utterly hate your existence ,-3,Fitness
EagleKL44,i mean i know the ez curl hits it differently but the kid had plenty of options my gym has fixed straight barbells that go up in 5 lbs increments and they also have fixed ez curved barbells then they have the ez curved bar that you can put whatever platted weights on but no every week there 1 dude in a squat rack curling 55lbs ,1,Fitness
EagleKL44,gym trainers are the worst at the retro fitness i belong to i have seen roughly 4 5 young 19 20 21yr olds go from gym bros to trainers because they figured out they could get a free membership and get paid to train people there about 10 total and i only know two 1 male 1 female that actually have a 4 year college degree sad thing is this one kid used to work out with his buddies he was by far the strongest of them all but was not overcoming his plateaus so one day he asked my buddy and i to spot him we gave him some pointers after 3 weeks we invited him to workout with us kid made some good progress then decided to become a retro fitness trainer goes through the joke of a thing they call certification and over the course of a year starts acting like more knowledgeable then us i stopped talking to him because whenever i do he critiques my form when he can or tells me about some new routine he was just certified in oh most of his routines with his clients go like this 1 girl pushups 2 donkey kicks 3 sit ups 4 tricep dips w way to much weight assitance 5 planks 6 rowing with bad form 7 more planks 8 lat pull down 10 planks on planks on planks i have not seen a single client gain meaningful results,5,Fitness
EagleKL44,they could easily use one of the fixed barbells my gym has ones that increase by 5lbs so 50 55 60 65 etc or use a easy curl bar and put as much weight on it as they wish but no i have to stand at the squat rack with a displeased look as some skinny 20yr old has 3 sets left bro curling 65lbs in the squat rack ,1,Fitness
EagleKL44,preach ,1,Fitness
EagleKL44,where in your back does it pull do you have a diagnosed condition or do you just feel your muscle pull randomly from time to time i had a similar with the right side of my neck my nerve would pinch when i was doing pull ups shrugs shoulder presses etc eventually one day a guy in the gym came up to me and said he was a sports injury therapist and he could not help but notice my posture was off apparently i guess i was sticking my neck forward when pressing and shrugging i would tilt my chin down to my chest this was causing the nerve in my neck to exposed pressure i worked hard to correct it and i barely have issues any more ,4,Fitness
EagleKL44,if you are going to curl in the squat rack at least put some f king weight on it i am tired of watching people curl 65lbs with the barbell in the squat rack ,4,Fitness
EagleKL44,hell yeah man currently sitting at work and i hated loved watching this makes me wanna get out there right this second looked like you guys were really enjoying that pow pow loved the little side comments you were telling yourself the whole way down i feel like i do the same thing always like talking to myself figuring out which way i want to go ,2,skiing
EagleKL44,this was me last friday night doing the warpriest challenge i was grinding out ib and after i killed the six pack i got that night long trail sick day ipa as well as a few whiskey on the rocks i got bored and figured ah what the hell i will find a group and run the hm challenge luckily found a group w the checkpoint got in and immediately proclaimed i will take right platform well the first glyph sequence goes by and i forgot to hide behind the totem boom dead said sorry guys i was not paying attention i got distracted by my dog i do not have a dog next time we go around we get to the second sequence warpriest has a sliver of health i had the brand and lost it because i could not lock onto a thrall did barely any damage and then a team member died third time around i end up dying from the yellow bar knight trying to be a hero luckily it was on the 2nd time around again and the rest of the group was able to finish off the warpriest without me needless to say i was basically carried and i found it completely hilarious sorry to the random group members who picked me up ,1,DestinyTheGame
EagleKL44,idk what orm is but yes drop set would be for example say your dumbbell shoulder press max is 80lb dumbbells for 1 5 reps lets also say a standard comfortable weight for you in 60lb dumbbells for 10 12 reps sets 1 to 3 do as many reps with the max weight as possible lets say you get 3 then immediately drop to the 60s and do as many as you can lets say 10 12reps now on the 4th set take the 60s and do as many as possible amap then drop to a lighter weight of 45 50lbs for amap then drop again to 30lbs amap then finish with 15 20lbs amap your shoulders will be on fire you will have completely fatigued the muscle ripping the muscle fibers which leads to muscle growth and strength ,1,Fitness
EagleKL44,i would have to disagree i do a routine somewhat similar to the op without going too in depth monday back day 6 7 exercises 60 pull ups bent over rows deadlifts t bar rows low row lat pulldowns 1 arm rows hyperextensions then i finish with 3 bicep exercises dumbell preacher curls hammer curls spider concentration curls and do some abs tuesday chest day w 4 tricep exercises to finish chest flat bench incline bench incline dumbbells chest buster overhead stretches cable flys triceps close grip skullcrusher cable rope cable reverse wednesday legs 10 mins stairstepper warm up 10 sets back squats 2 front squats 5 stiff leg deadlifts 3 4 sets leg press 3 sets calf raises on leg press 3 sets of 20 lunges or 10 each leg then seated calve raises thursday shoulder pull ups to warm up 5 sets standing military press superset with shrugs on the trap bar rear delt cables face pulls side delt dumbbell raises front delt dumbbell raises finish with arnolds although recently i have also finished with more rear delts to really kill them friday arms i personally go 1 bicep exercise then 1 tricep back and forth my own preference biceps chin ups dumbbell curls then superset 3 barbell curls 100 wide grip 80 normal 60 close it brutal do 10 reps drop the 100 do 10 reps drop the 80 repeat for the 60 wait 30 seconds then go back 60 80 100 then i finish with concentration or preacher curls triceps dips close grip bp skullcrushers 1 arm overhead presses cable pushdowns reverse grip pushdowns agree or disagree this has gotten me crazy results in the last couple months along with a good diet i have put on about 4 7lbs since thanksgiving ,0,Fitness
EagleKL44,so i am concluding that your overall goal is you want to slim down get a little more tone and get some strength back also your wrist hurts doing pushups but what about if you bench press shoulder press or use a barbell for curling overhead presses also i personally do not agree the low intensity weight high reps thing you can do drop sets which will let you go heavy and gain strength then drop to a lighter weight so you can really fatigue the muscle which is gonna raise your heart rate good thing build your muscle strength and endurance and help you get more tone with some more size ,1,Fitness
EagleKL44,was there 5 weeks ago after they got 14 inches of snow absolutely beautiful place make sure you hit the summit of mt nine nine 90 you can then hike up the ridge to the top straight ahead off the lift you should see people climbing a path its about a 5 min hike straight up kind of taxing but the views are breathtaking have fun ,2,skiing
EagleKL44,as everyone else has already suggested wear them around the house while cooking doing laundry or just stand in them skiers stance while watching tv if you have tried to break them in and let says after 3 4 times on the mountain the problem does not get better then i would suggest returning to the place you bought them and see if they can heat mold your boots very common practice and most boots can have this done nowadays they will heat the inside liner first then you place your foot in and the liner will mold to your foot if they find out its the outter shell that is the problem most times they can expand that as well so the inside liner has more room to spread out very common for people with wide feet ,3,skiing
EagleKL44,these were the exact pair of boots i got last year this is my second season using them and i feel i can probably get a solid 2 3 more years out of them solomon x pro 100 http www buckmans com ski ski boots mens ski boots salomon x pro 100 boots mens sal 378152 o4i 27464 aspx s 291 i cannot remember what i paid exactly for them i would guestimate between 300 400 ,1,skiing
EagleKL44,i am near the lehigh valley philly area as well i will say this buckman is always going to be slightly higher price wise but you are mainly paying for the service which theres is top notch second to none i got my boots at the beginning of last year during their fall pre season sale this is usually september or early october they discount all of the new models 15 20 the best thing about buckmans is the sales staff is experienced and they know exactly how to fit you for the right boot i got a nice pair of solomon and they are the most comfortable things in the world i can ski all day without an issue i advised my buddy to do the same as me which i am also advising you he went they fitted him for a boot then he tried to go cheap and buy the same boots online from a website distributor well when they came in he could not figure out why they felt so much different then in the store because in the store they were heat molding the boots to his foot the ones online were just not heated he had to take them in to buckmans explain he got them online instead and they gladly helped him out but charged him for the heat molding fee all in all i think he paid the same amount or more than just getting them from the store as far as end of the season it really hit or miss because it whatever is left over i am a bigger guy so i tend to find things like 2xl jackets and pants 2xl base layers now on the clearance rack but if you are a large xl or like a size 10 11 foot size i could see finding your size being an issue as those are more common for reference i used buckmans in whitehall pa my friend went to buckmans kop ,1,skiing
EagleKL44,god oh god why do i have to live on the east coast i was there about 4 5 weeks ago hope you enjoyed it the mountain is so much fun ,1,skiing
EagleKL44,awesome job man honestly that a great idea for a tattoo was that your goal ,3,skiing
EagleKL44,yeah this is my first semester into it pretty challenging i honestly have not noticed too much of a change during the week minus going to the gym later due to work then class but my weekends are now pretty much dedicated to reading books outlining notes and studying my ps4 feels neglected haha i did not want to get too in depth in the first post but if you ever want my exact routine just ask and i can draft it up and send it over to ya ,2,Fitness
EagleKL44,honestly i had this issue with my left right for biceps triceps and shoulder presses my right side always seemed to bear the weight of the whole bar i began to focus on individual preacher curls while i always did more forces reps with my left side i did individual dumbbell skull crushes and dumbbell shoulder presses on top of two armed exercises as well like wide grip bicep curls close grip bench and over the course of 6 10 months i began to notice i did not need the additional reps now i can curl 50lb dumbbells each arm for the same amount of reps without worry i am no professional but that was my method to overcome the left arm deficiencies ,1,Fitness
EagleKL44,are you constantly doing biceps with the curl bar or dumbbells if you are using a curl bar with both arms at the same time your right side seems to be the dominant side and therefore carrying more of the load unconsciously best bet is to use dumbbells and really focus on using the left arm by itself and yes do more reps per set and maybe an overall extra set for that arm that being said your dominant side will always feel stronger and could be slightly bigger,1,Fitness
