name,body,score,sub
EagleKL44,just curious have you ever read the news articles back from 97 98 at which time the business relationship between trump and machado was going on it public record that the miss universe executives wanted to fire her and promote the runner up trump and nbc owned 50 50 shares in the company and instead of firing her he convinces nbc to follow his idea to allow her to remain in her position under the contingency that she begins to control her weight she has publicly stated once again his is actual printed news papers back in 1997 98 that she has eating disorders and was so rail thin and fragile at the time of the competition due to lack of eating in order to appear thin on stage now she is coming out in the media stating that she never said those things and that it was all a fabricated lie by the miss u company while everyone is shaming trump for inviting reporters to watch a workout of machado did you ever see the video where he and a trainer are standing next to her in the gym and when the reporters ask alicia about her weight trump responds by jesting that the reporters should maybe hit the gym for once because they along with himself are much more overweight than she could ever be considered just curious if you have also see the video of her having anal sex for money or how about the child she had with a well known mexican drug cartel and how at that childs baptism she was showered in gifts from the cartel members now she in the mainstream media as a newly anointed us citizen very odd that she becomes a us citizen at the same time hillary just happens to find her and broadcast her story all over mainstream media i also find it rather odd that if trump treated the miss u women so poorly than why is it that several miss u contestants have come out and shown support for him through their twitter accounts facebook pages and when the mainstream media will report it through their websites as well see washington post if anything hillary should have done a better background check on this woman i am betting she same a quick opportunity to get in a quick jab during a debate and hoped to leave it at that but miss machado is a gold digger and now doing every interview for cash that she possibly can looks like a sure backfire to me ,-10,politics
EagleKL44,lol bro she did a porno trust me if you just type in google her name followed by porno there are a dozen adult sites that host the video yes shes also done several topless photo shoots and had sex on camera for the money ,-6,politics
EagleKL44,ok so it does not actually do anything other than be a prop you can push around ,1,DestinyTheGame
EagleKL44,wait honest question what box is he talking about ,1,DestinyTheGame
EagleKL44,idk what you were watching,3,The_Donald
EagleKL44,right back at ya my dear dear friend i sincerely apologize if i offended you in any such way i would not want you to feel uncomfortable or offended in any way good in this election and hopefully some day you will find some hot girl to share your political agenda with or maybe not after all your name is comicsfan616,3,politics
EagleKL44, trumps bad well why do you say that because he bad that some sound logic right there bud ,7,politics
EagleKL44,hey my sister is one of the latter she hates trump for her own misinformed reasons the points she tries to make sounds like it straight off biased cnn but disliked hillary as well and therefore has stated she is not voting my parents and i even asked why does not she look into the green part or libertarian she said it does not matter because no vote for trump is just as good as a vote for hillary just think about the thousands of people that are out there thinking this same thing dislike trump and do not favor hillary therefore wo not vote or will vote but for a non factor party meanwhile i see trump support in the form of signs stickers and ads 5x more than hillary ads it a movement ,3,politics
EagleKL44,feelings not hurt we hope you have a wonderful day as well when trump embarrasses she who will not be named tonight please make sure you create a safe space for yourself to enjoy a nice bowl of ice cream and have plenty of kleenex for your tears and sniffles hugs and kisses trump supporter ,7,politics
EagleKL44,eastern pa here checking in roughly 30 mins outside of philadelphia i have got to say between my area and my girlfriend area about an hour north of philly i would say i am not surprised every neighborhood i drive through i see trump signs or bumper stickers easily 5 1 over hillary signs a bunch of co workers were just talking in our break room and it was heavily pro trump only 1 person spoke up in favor of hillary and another just said she not really into politics but does not prefer him i realize pa has usually leaned dem but i gotta say people i see more pro trump than pro hillary i realize you can spin that however you wish but i can honestly say the feeling from what i am seeing is trump supporters happily and energetically supporting trump meanwhile hillary supporters appear to be in hiding and embarrassed to state their affiliation ,7,politics
EagleKL44,hilldawg is also supported by the saudi and other middle eastern factions difference is trump has denounces any white power organizations and has publicly stated he does not want their support hillary on the other hand welcomes her donations and was a huge advocate along with mr obama for the loosened sanctions on iran and constantly trying to hide gov t files that show the saudi helped fund the 9 11 attacks you want someone with track record of putting foreign sovereignty ahead of your own people vote hillary you want an improved economy vote trump ,4,politics
EagleKL44,i am from the suburbs of philly and the lawn sign game is easily 5 1 trump over crooked not even joking in my neighborhood alone there are 10 trump signs and i only know of 1 hillary sign which is my lesbian neighbors down the street nice ladies though they just wanna see a woman prez cannot win em all my girlfriends parents live further away from philly and there area is nothing but trump i saw a hillary sign torn to shreds the other day driving around their area literally looked like a lawn mower ran over it ,10,The_Donald
EagleKL44, sauce https ucr fbi gov crime in the america 2013 crime in the america 2013 offenses known to law enforcement expanded homicide expanded homicide data table 6 murder race and sex of vicitm by race and sex of offender 2013 xls ,28,The_Donald
EagleKL44,kylejames44 334 335 hunter,1,Fireteams
EagleKL44,i have no mic but i have my nighthawk on invite me to party kylejames44,1,Fireteams
EagleKL44,kylejames44 334 335 hunter ,1,Fireteams
EagleKL44,kylejames44 335 hunter,1,Fireteams
EagleKL44,i have 2 psn kylejames44,1,Fireteams
EagleKL44,kylejames44 335 hunter,1,Fireteams
EagleKL44,im average kylejames44 335 hunter ,1,Fireteams
EagleKL44,kylejames44 335 hunter i am 100 experienced ,1,Fireteams
EagleKL44,ehh i am more saying like if you are tailgating and standing in line for the john and a few eagles fan heckle ya for wearing an opposing jersey just smile and be like ha ha yeah man i know i am behind enemy lines right now gonna be a good game though i mean i am a season ticket holder and the issues i normally see are when a few of my fellow fans say something to an opposing fan lets use the ravens because they travel well for eagle ravens games and that ravens fan takes it personal and starts calling the philly fans pussies and their team sucks because no superbowls etc etc that where i hear about a fight or food thrown at that ravens fan ruining his brand new 150 white forsett jersey you do not gotta bend over and take it but i find more often than not that we as philly fans gotta give you the right of passage and give ya some shit for being on our turf if you play along with the joke usually you get left alone because we are like ok cool he here with a couple buddies from baltimore all good once again if you are ever at a philly sporting event and some philly fan harasses you beyond a couple jokes or japes do not hesitate to reach out to the police or other by standing eagles fans i once personally walked over to a group of 5 21 year old or so drunk ass kids as they were flinging shit at this one group of dolphins fans who were doing nothing wrong i believe they even went to spit at the one girls feet but actually got it all over her leg instead my group heard saw it and walked across the parking lot lane and promptly told them to knock it the fuck off or my buddy who was a cop was gonna call his buddies on duty patrolling the area ,1,pics
EagleKL44,idc what the statistics say last iron banner and most of the damn time i land on a scout map it midas all day er day ,1,DestinyTheGame
EagleKL44,good you piece of scum jk jk yeah we eagles fans are passionate as hell and there are some bad apples that give us a bad rap i have heard horror stories as well as great experiences from opposing fans my best suggestion is to go along with whatever japes are thrown your way unless racist over the top offensive etc like if a eagles fan yells that the giants suck and your team happens to be 1 3 at the time just be like hey yeah we do most of the time i see my fellow fans fire be fueled because they know they are trolling some giants or cowboys fan also rolling with a few eagles fans to a game can also help take the heat off ya they know likely you live in the area and while we disagree with teams you having eagles fans around let us know you are there to enjoy the game with a few pals ,0,pics
EagleKL44,considering how often mida is used in crucible by the vast majority the knucklehead would not be the preferred helmet to use as both the mida and knucklehead have the aim down sight radar perk i love the knucklehead in iron banner when i use my hawkmoon but when using the mida once again as 98 of crucible strictly uses you would be better off equipping another helmet exotic ,2,DestinyTheGame
EagleKL44,kylejames44 335 nightstalker,1,Fireteams
EagleKL44,kylejames44 335 hunter,1,Fireteams
EagleKL44,i would love to be able to help ya but unfortunately i am average at best my suggestion would be to post over the crucible sherpa thread and ask for an experienced team to carry you my first time at the light house i posted there met 2 dudes who set up and specific date time for us to make a run we went 9 1 the boon cancelled out the 1 loss and made it to the lighthouse trust me if you have some patience and post there stating your case that you have never been there will definitely be some group looking to help lighthouse deprived guardians good luck,1,Fireteams
EagleKL44,haha sorry my man but i hope you know i just went on and locked and equipped it just for you ,1,DestinyTheGame
EagleKL44,i will give it a go kylejames44 334 hunter,1,Fireteams
EagleKL44,if you need help let me know kylejames44 lvl 334 hunter,1,Fireteams
EagleKL44,334 nightstalker kylejames44,1,Fireteams
EagleKL44,i have 2 for coe kylejames44,1,Fireteams
EagleKL44,i still need 2 lol message me ,1,Fireteams
EagleKL44,i am down but disclosure i have never done coe before i have completed poe back in house of wolves need to get a full card done for the y2 moments kylejames44 334 nstalker,1,Fireteams
EagleKL44,kylejames44,1,Fireteams
EagleKL44,kylejames44 334 hunter,1,Fireteams
EagleKL44,334 hunter i have tom spindle whatever is needed kylejames44,1,Fireteams
EagleKL44,dave matthews band ,1,AskReddit
EagleKL44,to be fair he was carrying a weapon sneaking around or away from their position he definitely was someone who would have killed them if the opportunity arose war is hell im not saying i know from experience l but i have plenty of buddies whom tell me horrific stories about iraq plenty of times a us soldier would be injured and thenrest of the group pinned down by fire and unabke to reach the wounded in time the insurgents would not have given them first aid so i dont understand why everyone gets all outraged when the us does not name of the game is to kill your enemies not shoot them then patch them up ,2,Documentaries
EagleKL44,we may be the exact same person wake up work gym for 1 2 hours ps4 for 30 60mins bed monday thursday ,1,Fitness
EagleKL44,we may be the exact same person wake up work gym for 1 2 hours ps4 for 30 60mins bed monday thursday ,17,Fitness
EagleKL44,kylejames44 lvl 333 hunter,1,Fireteams
EagleKL44,kylejames44 lvl 333 hunter chill fam ,1,Fireteams
EagleKL44,kylejames44 333 hunter,1,Fireteams
EagleKL44,you have a group ,1,Fireteams
EagleKL44,kylejames44 lvl 333 hunter ,1,Fireteams
EagleKL44,i am down lvl 332 hunter psn kylejames44,1,DestinySherpa
EagleKL44,ya see what i mean lol and no worries ,1,DestinyTheGame
EagleKL44,great now i cannot find the real xur megathread this is fucking stupid bring back the rules or give us an option to view the non stupid shitposting thread as usual ,-1,DestinyTheGame
EagleKL44,yes exactly this perfectly describes the type of ticket i am going to be buying off of her i feel much more confident now that you described it just like that ,1,MoonriseMusicFestival
EagleKL44,yeah this person is a local she lives 25mins away and she sent me pictures and from what i can see the word comp is on it ,1,MoonriseMusicFestival
EagleKL44,are you doing oryx challenge psn kylejames44,1,Fireteams
EagleKL44,kylejames44 lvl 333 hunter ,1,Fireteams
EagleKL44,oryx challenge ,1,Fireteams
EagleKL44,do you have a team ,1,Fireteams
EagleKL44,auto correct on my mobile does not work and i was on public transportation still should have proofread ,1,pokemongo
EagleKL44,first off rip to my title on my mobile and my auto correct doesnt work right just caught this gloom i already had 2 glooms both around 500 cp when this guy showed up should i keep this new one as the one to evebtually evolve into the vileplume somehow oddish arent extremely common around me so if i commit to one i want to commit to the right one anyone help me with his iv diagnosis ,1,pokemongo
EagleKL44,not trying to sound spoiled rural player here i know and feel the struggle of nonstop pidgeys weedles and spearows yesterday while just randonly driving on a back road in between 2 farms this guy spawned and i nearly shit bricks my gf had my phone and was checking so when she said this big dinosaur guy just appeared i literally threw on my flashers pulled over and spent 3 great balls catching him i have no idea how or why it spawned in the middle of nowhere pa but maybe this is hope for all us rural players out there ,1,pokemongo
EagleKL44,not sure where you live i live in between a fairly large town in pa and the sticks mountains i noticed the other day if i was sitting at home and dropped an incense or lure there a park down the street from me i only ever got the same as you today i was driving through town on my way home and decided to stop and get gas i checked my tracker and saw a ton of more uncommon pokemon so i dropped the incense there parked my car and took a walk around the block literally got nothing but weedles and pidgeys then with 45 seconds left this guy popped up i thought i was seeing shit just keep grinding man its hard life for rural players ,2,pokemongo
EagleKL44,you still have 2x the amount that show up on my screen sigh ,1,pokemongo
EagleKL44,in land locked usa yes very rare not sure for people around large bodies of water though ,1,pokemongo
EagleKL44,i would say for every incense i roughly get 1 maybe on a rare occasion 2 eevees that show up and almost always they are under 100cp so not worth evolving typically when i droo an incense i get 1 2 caterpie weedles 2 pidgeys or maybe a spearow and usually 1 eevee sometimes add in 1 of the following drowzee ghastly rarely clefairy or nidoran ,1,pokemongo
EagleKL44,nope i would say my breakdown is like 60 2km 30 5km and 10 10km i hatched 1 10km that was a level 400 eevee which i evolved and powered up to my lvl 1087 jolten and currently aboit 1 mile from hatching my 2nd 10km egg keep grinding ,1,pokemongo
EagleKL44,waait wait would you think teamviewer is trackable from a corporate standpoint like i know my website usage is monitors twitter facebook daily fabtasy sports websites all blocked w a stern warning but if i use yeam viewer do you think that woukd apply ,1,pokemongo
EagleKL44,clear space first my best advice is keep only roughly 15 20 revives and same with berries as they are common at pokestops ,2,pokemongo
EagleKL44,i hate you and yes i speak for everyone ,1,pokemongo
EagleKL44,meanwhile this morning at work in a smaller metro type area in pa someone in my office building dropped a lure on the stop outside so i decided to double up and drop a lure then said the hell with it i will triple up and drop an incense results 4 weedles up to lvl 110 3 pidgeys up to lvl 97 1 caterpie lvl 40 1 spearow lvl 239 1 drowzee lvl 65 1 eevee lvl 80 that ran away after 1 pokeball and a magikarp lvl 20 actually pleasently surprised about the magikarp as i had yet to see one appear even though i live between a large pond and a modeeately sized river tl dr i have shit luck ,1,pokemongo
EagleKL44,i always leave 1 2 or more open spots in every category emblems shaders boots heavy etc etc no matter what and even if it went to the kiosk i would of had a green indicator so no i just think the dead orbit rng god hates me ,1,DestinyTheGame
EagleKL44,when i saw that update i thought sweet i will get some do shaders now nope every other piece of the game is like oprah you get a shader and you get a shader then i head over to do and i receive a 318 handgun boots and the motes strange coins either that or i get another damn ship ,1,DestinyTheGame
EagleKL44,while im within driving range of the charmander nest on the east coast im not sure whats worse driving out of my way for pogo or actually being forced to go to norristown pa ,10,pokemongo
EagleKL44,its already been proven the api for the game supposed to indicate the distance of a pokemon from your location is not accurately working thats a eli5 wording but there was a post yesterday about it on the front page ,7,pokemongo
EagleKL44,so the entire east coast has like 3 nests and the west coast has 726168188800754 million ,12,pokemongo
EagleKL44,love it someone give this man some gold ,-4,pokemongo
EagleKL44,not even kidding if i walk out the front doors of my building i could spit on the statue commemorating some past govenor of pa from the front doors i walk roughly 20 feet turn right towards my section and maybe another 20 30 feet is my cubicle so youre telling me if im 15 20 yards away im not close enough increase the proximity so i dont need to stand on too of things theres one of those circukar intersections near my work and a huge ww2 commemorative statue in the middle no benches no sidewalks people arent supposed to cross the 2 lane circle to get to it yet there is a gym there and the only way to get to it is to illegally cross a busy intersection and then stand on the edge of the street and fight ive seen numerous teenagers sprinting across the lanes to get to it also heard a cop parked around the corner the other day and yelled at anyone trying to make their way out to it like thats not fun for anyone increase the proximity so someone can safely access the gym from across the street ,1,pokemongo
EagleKL44,the yellow brick road leading to a legendary pokemon follow it ,2,pokemongo
EagleKL44,proximity is a huge issue for me half the stops are random momuments that you need to cross a busy 2 3 lane highway to get to when walking driving from stop to stop is technically an option bit then the whole legal issue with driving and playing also experienced a gym the other at this restaurant on my way home from my real life gym i park in the parking lot gym is not activated i get out of my car and walk to the door gym is still too far away now this particular restaurant closes after lunch on sundays i walked around to the front of the building still not close enough like how much more on top of this place do i need to be increase the proximity so when im within a stones throwing distance i say 50 yards the stops and gyms activate its ridiculous theres a stop out front of my workplace honestly 5 feet outside the front doors if im sitting at my desk i cannot collect if there were no walls i could literally spit on that fucking thing how is the proximity so shitty note gps is generally accurately showing where i am ,2,pokemongo
EagleKL44,honestly i see all these screen shots of people near lures with 3 4 pokemon showing up heck yesterday i saw a screenshot of someone in between 2 lured spots with a drowzee bellsprout multiple pidgeys weedles and a ghastly last night i was walking my dog in my town near the only spot that has 2 stops next to one another my town has 5 total but the 2 next to each other are a post office mason temple society and i met this young kids roughly 14 just sitting on the temple steps we both realized we were out searching so he dropped a lure and i drooped a lure for the next half hour i had roughly 2 pidgeys 1 2 weedles caterpies and a lvl 210 meowth that escaped after the first great ball i threw broke i believe the kid had same results but he did catch a horsea for the first time and i think a low level ghastly idk how i see all these screenshots of people near lures with dratinis squirtles staryus jigglypuffs haunters etc etc lures only ever bring me the basic polemon mentioned above ,1,pokemongo
EagleKL44,trump supporters and clinton supporters just gonna say we wont have to worry about hipsters and feminists anymore ,-1,AskReddit
EagleKL44,yeah this weekend i was walking around philadelphia and had no problems going to each landmark but normally its a huge pain because you just cant get close enough to some places when living in the suburbs ,1,pokemongo
EagleKL44,lol remove any walls and i could easily throw a rock baseball football 40 50 yards ,2,pokemongo
EagleKL44,working in a financial investment office it is a very professional atmosphere probably frowned upon is what im getting usually i grab the stop on my way in and out of work and also when i leave for lunch but nonetheless you are suggesting to not increase some user satisfaction based on a proximity issue im not saying someone should be able to look at the map and grab any gym stop that shows up but if i can throw a stone and hit the location of the stop then i should be able to interact with it as well ,2,pokemongo
EagleKL44,i completely agree with your agree lol living in the burbs is annoying the landmarks are like fountains in the middle of a circle intersection like you cannot physically walk up to it unless you jaywalk thru traffic and stand in front of it in the middle of a road that makes no sense let me grab the stop from 30 yards away safely across the street ,2,pokemongo
EagleKL44,i work in a city but i live in the boonies slang for wooded farmland secluded area when in driving or anywhere near work i find tons of pokemon but when im out near my house i barely find any occasionally if im walking my dog 1 or 2 weedles will pop up but majority of the time the tracker lists 5 9 pokemon and they are all 3 steps away and never appear ,1,pokemongo
EagleKL44,my issue is in my work complex theres a statue in the front of the building if im in my office no more then 50 yards away it doesnt work hell when im at the front door of the building it says im too far away i literally need to stand in front of the stop which is slightly embarrasing to do in front of 1000 other people who work at your company to do also probably frowned upon by management imo this game would be alot more enjoyable if i could grab the stop or gym without having to sit on the landmark itself literally need to be on top of everything for it to work maybe you libe somewhere where the stops are easier to get to but in eastern pa most of the stops are random places that you cannot actually stop at hell i saw a billboard the other day as a gym you cant stop there unless you pull over the side of the road ,6,pokemongo
EagleKL44,well show houses and book houses are significantly different example there is a willas tyrell in the books who was the yoinger brother of loras but he i believe was some sort of cripple but very capable of producing an heir as in the books the queen of thornes attenpted to marry sansa and willas if the books follow the show he would now be the rightful heir but going off the show i woukd also add these houses may not be the biggest houses but they played importabt roles rickard karstark house karstark beheaded by robb roose bolton house bolton killed by ramsay greatjon house umber killed at red wedding lady mormont house mormont killed at red wedding ,2,asoiaf
EagleKL44,well to be fair to my response you are asking why a certain something happened in the show version they have less time and therefore need somethings to be implied lord walder kept asking for black walder and lothar arya says they are here and then reveals the pie the show is then implying that at some point she crossed paths with the 2 sons killed them and cooked them for lord walder my best judgement would tell me that she stalked them and scouted them then likely put on a face and killed them who knows where she got the oven and materials to cook the actual pie but thats where your imagination needed to kick in thats my personal viewpoint of it but i can get where you would want more hard evidence ,3,asoiaf
EagleKL44,yes however if you look through the reactions and discussion threads this was largely overlooked i kept hearing the but why would they said to mereen and not just wait for dany to get to westeros question this post was to answer that ,1,asoiaf
