name,body,score,sub
EagleKL44,the difference is obama policy stopped the new application process one that was clearly flawed hence the stoppage that obama imposed any issued green card or visas were not affected keep in mind this is the visa process that allowed the san bernadino shooters to leave the us arrive in the middle east and return which they later and commit acts of terror just for example ya know trumps policy stops the new application process as well as all issued green cards and visas as i mentioned obama administration originally identified the application process as being flawed therefore someone dangerous could have been issued a green hard or visa into the country trumps policy is looking into these flaws reviewing past applications and prevents any current issues with refugees while i truly do feel sympathetic towards any refugees who have family in the us and simply want to create a safer legitimate lifestyle i also strongly feel they need to do so in a safe and proper way the stoppage on immigration and refugees is simply piece of gum on a leak in a dam it not a one all fix all but it is a pause that is going to let officials review and hopefully fix what is wrong and allow for a safer vetting process in the future http heavy com news 2017 01 barack obama ban refugees did iraq iraqi muslim trump jimmy carter iran iranian immigration ,0,pics
EagleKL44, mr obama in 2011 imposed a six month pause on iraqi refugees after the fbi concluded that terrorists had managed to exploit the program one person was admitted even though his fingerprints were found on an improvised explosive device in iraq problems persisted even after that two men who entered as refugees from iraq including one who d most recently lived in syria were charged with terrorism related crimes a year ago www washingtonpost com amphtml news fact checker wp 2017 01 29 trumps facile claim that his refugee policy is similar to obama in 2011 ,3,pics
EagleKL44,ding ding ding and we have a winner the ban is not a ban on people of islamic or muslim religions it a bad on particular hotspots across the world which have a tendency to breed terrorism it very similar to the ban obama put in place for roughly 6 months back in 2011 ,-20,pics
EagleKL44,or go with obama plan and just ignore it ,-13,news
EagleKL44,ahh typical libtard instead of retorting with factual evidence or logical thinking instead sink down to name calling and degrading stay classy ,1,politics
EagleKL44,yeah but those corporations do not want to have to move and reinvest in other countries they will if they have to but it easier for them to lobby in favor of the easier solution which is mexico cooperating with us ,0,politics
EagleKL44,exactly and that hurts mexico which they cannot afford why do you think trump is doing this he a business man he knows the us companies operating in mexico wo not like this it puts pressure on them which they can either put pressure on the mexican government to comply or figure out other business opportunities which puts pressure on mexico to work out a deal he has the leverage hurt your opponents wallet and that will get them to start thinking differently ,1,politics
EagleKL44,i understand your points but sometimes things do not come as easy as they should i agree right now mexico has no reason to submit it like a seige almost they will hold out until it no longer makes sense for them to do so loss in jobs value of the peso etc etc will push them in the cooperating direction i also think while trump makes promises such as mexico will cooperate and we start the wall in a couple of months i really do not think it going to matter if they cave sooner or later so far he been remarkably consistent with his campaign promises even cnn ran a article about it ,1,politics
EagleKL44,oh definitely i fully expect they are like ehh fuck it we will figure it out international trade is not simple though like i said they can contact russia china japan australia etc etc but how are they going to replace the 80 of their exports going to us alone i remember reading about due to the open trade barriers with the us our corn production essentially wiped mexico off the map and now they import our corn i realize this is a small example pretty insignificant really but how many further examples are there like that one out there their entire agriculture system was seriously hurt from nafta because small farmers could no longer compete with the decline in food costs when it was first put in place most those workers moved to manufacturer jobs which came from the us it a huge cycle loss of manufacturing jobs due to decline in demand mean layoffs or whole facilities shut down to go elsewhere now you have a huge unemployment number it just one domino after another sure they can stay strong but i think it wo not even get to case ,1,politics
EagleKL44,was a joke but really i have no answer i am guessing it never gets to that point us corporations getting screwed over will likely lobby mexico to comply and cooperate with the us and support stricter border barriers if that does not happen then the decline in demand for mexico products will force them to look to sell their goods elsewhere i can see some mild success there but not like how they had with the us trump is playing a chess match and holds more pieces mexico does not have many options other then to cooperate ,1,politics
EagleKL44,well they do not have free trade agreements with those other countries plus they would incur a cost of trading internationally with the other major players china russia australia you gotta ship the products there right now they just have to truck their goods across the border i am not saying it cannot happen but it likely wont they can say they will all they want but it does not make sense financially yall can stay on your sky is falling agenda i will remain on mine which is about securing the national border growing our economy fixing the inner cities which i am from and improving the national infrastructure ,1,politics
EagleKL44,overnight bruh didnt you know rome was built in a day ,1,politics
EagleKL44,oh yeah man they are gonna start growing them in wisconsin and north dakota so you are proposing we should not secure our borders because of avocados tomatoes can be farmed elsewhere hell my mom has a tomato plant in her inside garden year round i am clearly referring to us manufacturers the ones that moved down there at the beginning of nafta,0,politics
EagleKL44,first off if you are drinking beer from mexico it likely corona and that shit is pisswater anyways landshark all day mofo second i drink tea third while tequila is delicious it already more expensive to rock shots of that at a bar versus whiskey bourbon all day err day fourth i will miss avocados but it is a sacrifice i am willing to make since there always queso ,-16,politics
EagleKL44,at which point the us companies will likely lobby the mexican gov t to comply in some way or they could choose to leave to another country and mexico economy will stagnant and regress as they send 80 of their exports to the us trump knows this and is playing poker with mexico calling their bluff they cannot afford to not send their products here or face a depression of some sort you are right the tariff will not bring in any significant funds but the move of imposing a tariff is not to raise money it to bottleneck and suffocate the mexican economy so they have no other choice ,-7,politics
EagleKL44,let me ask how fucking stupid are you i clearly stated they would just more to another country as i noted someplace like panama or they could return to the us what is the argument you are making here if they move to another country then you will still get your cheaper consumer goods and any continuing products from mexico will come to us with a 20 tax increase if you are that hellbent on buying mexican products then do so and yeah pay for the wall mexico economy meanwhile will be stagnant and regress as they send nearly 80 of their exports to us cannot do that anymore when there is no demand for their product this whole thing is a fucking poker match mexico is bluffing and trump is calling their bluff no way mexico can afford to lose favorable relations with us ,-14,politics
EagleKL44,except when those companies begin to realize it is no longer profitable to remain in mexico they will begin to either pressure the mexican gov t to cooperate with us policies or will flat out leave and return to the us bringing those jobs with them they are not going to pay to make equally expensive items internationally if they are a us company they will move those jobs home or move them to a country that has a more favorable trade agreement with the us boom cheaper consumer goods are being produced again just now they are in panama for example or cost of living goes down as the economy is stimulated due to 500 k jobs returning to the us technically 800k manufacturing jobs moved to mexico due to nafta ,-53,politics
EagleKL44,except when those companies begin to realize it is no longer profitable to remain in mexico they will begin to either pressure the mexican gov t to cooperate with us policies or will flat out leave and return to the us bringing those jobs with them they are not going to pay to make equally expensive items internationally if they are a us company they will move those jobs home or move them to a country that has a more favorable trade agreement with the us boom cheaper consumer goods are being produced again just now they are in panama for example or cost of living goes down as the economy is stimulated due to 500 k jobs returning to the us ,1,worldnews
EagleKL44,unless they move to a different country with more favorable relations to us just want to point out they likely wo not move back home and that ok they will go to panama or canada or some country that has some fucking respect for our border and laws mexico is like that little brother that wants to play backyard football with the big boys but gets steamrolled on the first possession cries and acts like they are alright even when they are not ,8,The_Donald
EagleKL44,because there is no way mexico can lose us as a trade partner we import 80 of their exports free of tax mexico and trump are literally playing a poker game right now except mexico has a 2 pair and us has a full house they threaten to leave nafta or find other trade partners well hello 1 mexico needs us more than we need them and 2 go ahead and start trading with china it will cost more to ship them over there vs sending them to your next door neighbor us mexico is in a lose lose position but playing the part to look good politically,1,worldnews
EagleKL44,not exactly once companies mostly manufacturers see their profit margins get cut into they will either choose to move to a different company with more favorable trade agreements or move back to the us and avoid all taxes and regulations either way it will hurt mexico as they will lose jobs and money wo not be flowing in their economy i still gladly pay more for american products when able usually more reliable of a product ,1,worldnews
EagleKL44,thank you on another thread no one can comprehend this method we are literally only trading with mexico because of nafta which allows for the free trade aka no taxes on goods coming across the us border if you suddenly impose taxes on those goods then it neutralizes the difference in cost between mexican made goods and us mexico products will rise in cost at which point manufacturers will decide it not cost effective to have their plants there any longer they may move back to the us or they may move to another country with favorable trade agreements with the us either way this will hurt the mexican economy nearly 80 of their exports go to the us they need us way more than we need them 800k jobs moved from the us to mexico after nafta was signed and implemented due to cheaper labor down there the loss of those jobs and the lack of demand for their products is going to stagnant their economy trump can even take things a step further and impose a tax on all remittances being sent to the us 25 billion yes billion was sent from migrant workers in the us to their families in mexico you impose even a 10 tax on that amount and you get 250 million i hear alot of people say well then they will figure out another way to get the money there ok sure go underground find a way to hide it but that will cost them money too ,2,worldnews
EagleKL44,it gonna be great cannot wait http giphy com gifs 3owyoyjmvdijeccqtu ,1,news
EagleKL44,now go join r the donald,-1,pics
EagleKL44,you are looking at this like theres 1 rule to govern all it not that but i think it fairly simple if you are in southern nj you are closer to phl then ny i would expect you to then be an eagles fan meanwhile if you live in northern jersey you are much more likely to be a giants jets fan if you are somewhere in between then you have the eagles jet giants to choose from it all about how are you geographically related to the local markets of course we recognize fans that are fans due to their fathers and grandfathers i am not gonna knock a buddy of mine for being a vikings fan living in philly when his dad was born and raised in minnesota so what about someone living on the border of ohio and pa he close to pittsburgh but technically lives in the state of ohio what about someone from vermont are you a buffalo fan patriots fan or are you allowed to be a ny giants jets fan i ski up there every year and those 4 teams are the mix of what i see up there if you are a cowboys fan in philly because your father or grandfather was born and raised in texas as you are a fan by the product of your environment then while we will give you shit for it i think we as a fan base will be more understanding however if you are a cowboys fan while your dad is a fan of the eagles or another team then you have no allegiance to your local markets or your family we do not recognize your claim to be a true fan and furthermore we condemn your fuckery you are a fan simply because aikman or emmit smith dominated the early 90 when you were 8 years old then you are a fair weather fan and claiming you like winning teams as the reason for not liking the eagles or philles and you are a fan of the cowboys and yankees then you are just the worst type of person on this earth ,2,sports
EagleKL44,i hate to admit it but i think dak is a starting qb and a good one at that he has the legs and ability to extend plays or reach a first down on his own he cam newtownesque as they can let him take a qb draw up the middle and not worry about him being demolished his throws are mostly accurate and with good speed now note i said good i do not think he is great or will ever become top 5 qb brady mannings rodgers luck etc his throwing motion is a little longer not by much but a split second slower he obviously benefits from an extremely talented offense and players around him zeke is key here because the o line is so strong at run blocking they are able to open up holes and get the d on their heels so when dak drops back to pass he not only has time especially on a pa but his wr are talented and shifty see beasley enough to get separation when they run the ball effectively all dak needs to do is complete those 7 10 yard hitches curls and crossing routes usually getting the ball into the hands of dez on a 7yr hitch will lead to a 10 12 yard gain because of his talent this all leads up to a stat line along the lines of 18 26 245yds 1 2 tds 0 1 int and 15 30 rush yds meanwhile zeke scores 2td and they knock through a field goal or two and put up 27 30pts romo had has much more of a pure qb skill then dak the touch he had on the ball was what you saw of rodgers this past weekend he puts the ball in small spaces i have not seen dak do that on a consistent basis he had some helluva throws during the course of the year but even when i saw one of them i always felt like it was more him throwing it to a spot and the ball just made it through somehow or dez went up and got it for him i think hes going to be a good and consistent qb definitely the starter for years to come for dallas i am not ready to compare him to cam or russell i see him more like an alex smith with higher upside right now extended plays accurate wo not lose the game for you i think if you replaced 1 2 of those lineman and dez started to decline hypothetically speaking you would see a difference in his ultimate qb play ,1,eagles
EagleKL44,on behalf of everyone from philadelphia we would like to thank you for your service to humanity because of you guys every snake like cowboys fan started their slow transition from wearing cowboys gear to their yankees gear ,10,sports
EagleKL44,no by his logic if you grew up in a non nfl market you would theoretically be a free agent fan i am from philly as well but i know plenty of steelers fan in particular my best friend who i met in college is from harrisburg h burg is smack dab middle of the state between pittsburg and philly he ended up going with the steelers because his grandfather moved there in the 70 when the steelers were killing it and when we were growing up in the early 90 the eagles sucked and steelers did not if you are from mobile alabama you can root for whoever the hell you want the closest team is what the titans op is trying to say if you live in seattle and you are a cowboys fan then it because when seattle was struggling they gravitated towards the cowboys just because they were good aka you are a fair weather fan ,3,sports
EagleKL44,or their pull out methods were impeccable ,25,thewalkingdead
EagleKL44,i have not seen this mentioned yet but you could always start the daedra best friend quest which causes barbas the dog to follow you he annoying as hell and you cannot sneak around with him as he makes too much noise however he is literally a bullet sponge i typically will enter a boss room let him follow at which point he or the boss initiates contact and i stand back and do my thing while barbas takes the brunt of the damage ,1,skyrim
EagleKL44,at work and cannot view youtube can someone summarize the video ,1,The_Donald
EagleKL44,no suggestions but i will be there next week w a couple buddies from colorado best of luck and safe skiing ,1,skiing
EagleKL44,actually in case of a car accident on the highway like in front of op you are advised to leave a good amount of space between you and the car truck involved in the accident 2 reasons per my paramedic friend 1 you allow plenty of room for emergency medical services to get in and do their jobs 2 hopefully in the case of the tractor trailer behind op if you are rear ended then you at least wo not be sandwiched between two cars imagine op was hit from the rear and only a few feet away from the truck in front of him would have been crushed ,6,gifs
EagleKL44,yeah no sorry noah did not light her up they started out with a very positive discussion where they both held their ground until he began to highlight certain phrases from her commentary and spin them around to make a jab at her he unnecessarily brought up the race card which definitely threw her off because he spun her previous comment around and turned it into a race topic with that being said while i do not find trevor noah even remotely funny used to enjoy john daily colbert when he had the colbert report i thought it was a healthy discussion besides spinning her words into a race debate the host is always going to win these as they dictate and narrate the show and have planned to bring up certain topics that through the guest off their talking agenda i thought tomi stood her ground in the end and i would thoroughly enjoy noah going on tomi show one day for a rebuttal ,4,news
EagleKL44,for a very very long time easily 10 years ,1,Lyft
EagleKL44,ok so if i start the stormcloak version of the civil war quest and take the oath then the next time i go to solitude i wo not be attacked by the soldiers there as that is a their home base city basically ,3,skyrim
EagleKL44,but how can that be if the ride i requested was later cancelled by the driver because i was a no show since the app was not working i could not see if a driver was coming this was a completely different ride request ,2,Lyft
EagleKL44,your guess is as good as mine as to how the pick up location changed basically i originally entered i was at 123 abc street and going to 123 bca avenue i ordered the lyft at which time the screen went blank and i could not get the app to work and after 5 minutes i closed down the app and instead opened up uber which took us home the next morning i saw the notification that my ride was complete and under the detailed report it says my pickup location was 789 xyz street and the destination was set for atlantic city i have no idea how this ride was even generated let alone why the pick up location even different than the original pick up location and yes once lyft customer service reached out to me and i explained my story they said they would look into it and i received an e mail stating they are reversing the charge so i am assuming they were able to tell i clearly did not take this ride ,2,Lyft
EagleKL44,it appears the cancellation was for a different driver the details for the cancelled ride said the pickup location was for the correct place i requested it even though the app was not working for me after i hit request i am not sure how after the first ride was cancelled that the next ride the fraud one was even generated by the time the request was made i was already home safe and sound with my gf the request pick up location was set for roughly 1 5 miles away from my apartment and the destination was set for atlantic city nj while i had a few beers on nye i was fully aware of my surroundings and at no time did i even open the lyft app after i exited and stopped the app since it was not working no the drive or someone else did not use my credit card or the number to order a ride somehow the ride request was generated within the app as i have detailed report in my ride history that the driver picked me up at 12 54am and dropped me off at 2 18am in atlantic city so in other words it looks like a normal ride history report showing on the gps screenshot that i supposedly went from philly to ac so yes this driver apparently drove all the way there however i did not request this ride and i was never in this mans car ,3,Lyft
EagleKL44,hey man i just saw this reply message now there always going to be a few dickheads in the gym that act like they are too good to spot someone or scoff at someone who cannot lift as much as them they are assholes and just need to be told to grow the fuck up i have a separated ac joint in my right shoulder so my bench is always somewhat weaker than it should be for someone my size 6 4 230 on my own i can do 225 but anything above that i get weary about doing on my own my ego pushes me to go heavier though so if i know i want to go above 225 i will look for the closest gym acquaintance i know and i just ask to have them spot me so i do not hurt myself i just moved and joined my current gym about a year ago which at first it awkward asking someone you do not know for a spot but eventually they will ask you for a spot and you will have small talk chats with people who will become your go to spotters if you feel more comfortable tell them your bench is weaker and you are looking to build it up if i were there and i heard that i would gladly help you out at any time best of luck bro ,2,Fitness
EagleKL44,unfortuantely i hate to repeat what everyone else is saying but definitely just ask for a spot i have made a good amount of solid gym acquiescence this way listen you spot them they spot you the world goes round and round and everyones happy ,7,Fitness
EagleKL44,that the bible is just a compilation book that told stories of how people should live their life and praise an organization the church and donate fight on it behalf basically a book that fit their agenda at any given time also i think i would be able to survive an apocalyptic situation because i really only care about myself and my dog do not fuck with my dog ,1,AskReddit
EagleKL44,i have to carry around two cell phones one for work and one personal ,1,AskReddit
EagleKL44,smoking ,1,AskReddit
EagleKL44,well i am more of a console player i never really got into rpg or fps on the computer besides old school doom but yeah if you primarily play online i hear twitch is the way to go ,1,gaming
EagleKL44,yeah i am not a pre order type of person either but i fully realize a lot of people are which is why i brought up the hey you cannot get it the day of but you can select next day shipping i have been burned by way to many games to go off and pre order unless i know exactly what i am getting ie dark souls typically wait 1 3 weeks after launch to then jump into the game funny story 3 of my friends shelled out for no mans sky it was the best game everrrr for the first two weeks by week 3 my one friend already sold it for 80 of what he bought it brand new just one example of my patience paying off ,2,gaming
