name,body,score,sub
kbol, i do not know if they just want to move into their own streaming and are going to use that as a starter the direction may have changed since i worked there 2013 2014 but that was right around the time of the sling acquisition so i was in a few conversations about it the plan was only to use it to acquire people who would never sign up for their traditional service eg millennials they are aware that a majority of their user base is older people and have no plans to jump fully into streaming until they essentially die off ,1,technology
kbol,the echostar building is quite far from the dish corporate office there a small contingent of dish employees that work in a like back room of echostar mostly satellite ops but i would be surprised if any of those positions were it i am not sure what you were interviewing for but this sounds weird ,1,technology
kbol, twill http www gap com browse product do pid 522038012 cawelaid 120280880000196762 cagpspn pla caagid 39045364292 catci aud 57696679755 pla 302299297372 cvosrc cse google pla nonbrand cvo campaign 661500921 cvo adgroup 39045364292 cvo crid 138689418216 matchtype tid gppl000013 kwid 1 ap 7 catargetid 120280880000294565 cadevice c gclid cj0keqjwyn7jbrczn7lkgb3ki8kbeiqaalesqpegbzgstsnbpmf0yu 2uykugijswdtlpw6s6pw1mngaaihz8p8haq tencel http www gap com browse product do pid 524218002 cawelaid 120280880000255530 cagpspn pla caagid 39045364292 catci aud 57696679755 pla 302299297612 cvosrc cse google pla nonbrand cvo campaign 661500921 cvo adgroup 39045364292 cvo crid 138689418216 matchtype tid gppl000013 kwid 1 ap 7 catargetid 120280880000294568 cadevice c gclid cj0keqjwyn7jbrczn7lkgb3ki8kbeiqaalesqr2hzuwqnc5ouwoehojk7y5xczswgchcv0x24ykqkkmaatir8p8haq linen http www hm com us product 65592 article 65592 h etc joggers are not sweatpants https s media cache ak0 pinimg com originals c4 e2 fc c4e2fc2c7596c396dc09c0db2bc16d9c jpg here it is more a recent term used to denote a slouchy leg pant with an elastic waistband tapered legs and generally elastic ankle holes some sweatpants are joggers http athleta gap com browse product do pid 138467002 cawelaid 120299870000016853 but the reverse is not necessarily true ,15,femalefashionadvice
kbol,essentially chinos in a khaki color http oldnavy gap com browse product do pid 602566052 vid 1 locale en us kwid 1 sem false sdkw mid rise skinny khakis for women p602566 ,8,femalefashionadvice
kbol,this is such a cute version though ,3,weddingplanning
kbol,gotcha cool ,1,femalefashionadvice
kbol,oh huh i did not think that any non tech industries ascribed to the waterfall methodology specifically interesting ,2,femalefashionadvice
kbol, using largely agile methodology for software but within a company that uses largely waterfall can you clarify this for my own edification if your team is scrum what are your touchpoints with the waterfall portions of the company is your team developing stuff in an agile fashion to create artifacts for waterfall teams to use in their different project phases i am assuming that the overall company does some kind of consulting type work and your team dev supports their endeavors with clients ,4,femalefashionadvice
kbol,this sounds like the interview process i went through for my current job they scheduled me to meet with 3 people a peer a director and our hr managing director the company is only 60 people the peer interview was to get a sense of what i would be doing day to day the director was to see how i fit in the overall business strategy and the hr director was about cultural fit with the company we also require people to take a coding aptitude test we work in software but it not specific to any one language that is sometimes delayed until they do their onsite so i wonder if the break is in between your personal interviews and something to that effect at a previous job as a ba they had us take the wonderlic test i still never figured out why ,1,femalefashionadvice
kbol,i am doing a 30 day challenge at my yoga studio and it day 6 and i am always so sore and it eats up so much time but i can totally see new musculature and poses are getting easier so it paying off and my wedding dress is supposed to come in this week so i am excited to see it on a in my size and b with my newly toned arms ,3,femalefashionadvice
kbol,i sent in an overflowing bag of like ann taylor banana republic loft etc and made about 40 on it and another 40 for a rebecca minkoff purse that was in there the roi is terrible but i felt a bit better about it than dumping it at goodwill like i usually do and i am too lazy to do poshmark ,8,femalefashionadvice
kbol,what about running or swimming ymmv but running feels like active meditation for me ,4,femalefashionadvice
kbol,social frats i was an me with a graduating class of 75 and i would say 20 25 of that maybe more were people in traditional fraternities sororities ,1,LifeProTips
kbol,companies can provide college credit for students in lieu of payment of course ymmv on the college accepting it and the company offering it ,2,LifeProTips
kbol,you can get a surprisingly good suit at h m for like 100 or less ,1,LifeProTips
kbol,because a suit is a specific signifier that says i understand social cues whatever your take on those cues themselves may be someone who is able to signify that they understand the actions and motives of an in group while trying to join that in group will always be looked upon more favorably than those that do not ,2,LifeProTips
kbol,my university had 50 of students participate in greek life and we did not have undergrad business majors so actually a surprising amount of frat guys were in engineering ,0,LifeProTips
kbol,the evie dress in blue is perfect for cocktail attire i would ignore any of the other factors cape cod outdoors etc in lieu of the stated dress code and i do not think that lulu dress or a similar approximation is formal enough for cocktail attire ,2,femalefashionadvice
kbol,speaking for us utilities they have to present any new software rate etc to a regulatory board and prove that it wo not make them too much profit or else it will be rejected this varies state to state and whether the utility is municipally owned investor owned or some mix of the two but speaking in generalities anyway they likely cannot mark it as a cogs if the regulatory board did not approve it or will not even send it for approval since they want to save their bargaining chips for more important things like rate cases almost everything they put on a bill is highly scrutinized they rarely just throw things on there willy nilly for fun ,4,AdviceAnimals
kbol,utility software breaks a lot it just not a really mature market and the industry is resistant to change so there not much incentive for third parties to give anything better anyway so a lot of manpower time is spent stabilizing systems etc it is actually more cost effective generally for them to remain on paper billing but they are trying to adapt to the new online everything world that every other industry has caught up to ,2,AdviceAnimals
kbol,could not you go to a library and print out the pdf email version of your statement ,19,AdviceAnimals
kbol,yes cushion thank you ,1,weddingplanning
kbol,thank you i am obsessed with it ,1,weddingplanning
kbol, oops i need to get my nails done http imgur com f4qovvi ,12,weddingplanning
kbol,i ordered mine in january and was given an eta of 6 8 months and it out for shipment right now eek i cannot wait ,2,weddingplanning
kbol,kind of related but the day our photographer sent back our engagement pictures to us maybe an hour later if that we were at a bar and a random girl approached us and said you look familiar did you get pictures done with xxx i guess she good friends with our photographer and he had posted one of our pictures as a sneak preview on his ig small world ,11,weddingplanning
kbol,that sounds like a shitty band name lol,2,femalefashionadvice
kbol,the emp museum 4 suuuuure,2,femalefashionadvice
kbol,oh man i have never really thought i needed a tattoo but hot damn are his good,3,femalefashionadvice
kbol,i recently got a job offer that was a bit below what i was expecting and i was soclose to just accepting it but i instead responded saying i understood why they valued me at x but to accommodate leaving my current job missing out on likely bonuses i would need a signing bonus of y to jump ship and they gave it to me no problem especially satisfying afterward i told my fiance and he said wow i am always too nervous to do something like that women 1 men 0,22,femalefashionadvice
kbol,i got a new job i put in my two weeks at my current one and it was not weird at all i love living in austin i get to bring my dog down to live with me again once i transition to the new job my fiance and i are going to vietnam for our honeymoon next year we are going to singapore in september and booked possibly the world cutest hotel http wanderlusthotel com i am in such a great mood these days ,19,femalefashionadvice
kbol,the salmon sounds fine but i agree on it smelling fishy and being just kind of a boring option for pescatarians similar to a lot of vegetarian options being basically eat this side of assorted veggies it is appreciated that you are catering to your guests needs but if you have the option to make it fun may as well as a pescatarian myself i would personally vote for the mahi mahi but the sea bass sounds like a great option as well except the pancetta which another user already pointed out ,3,weddingplanning
kbol,we are doing vienna by billy joel from a little inside joke between the two of us ,2,weddingplanning
kbol,tentatively how long will i love you https www youtube com watch v an4ysolsumy by ellie goulding it short and sweet without being overdone i really wanted to do ends of the earth by lord huron we are both really big into travel etc but the ending kinda ruins it as a romantic song so my fiance suggested 22 a million because it would sound cool in our venue and no one will know what he saying anyway i am thinking i will walk down the aisle to cat power version of sea of love https www youtube com watch v cbmeaotpjzm but i think it would be a beautiful first dance song as well ,2,weddingplanning
kbol,yes one time mine had just fallen fully off and the pedicurist stared at it for a second then painted the actual skin to make it look like a nail it stayed on surprisingly longer than expected ,2,femalefashionadvice
kbol, do you think these kind of clothes ever go out of fashion yes because everything does even if you find the world most perfect white button up now the subtle nuances of how it fits where torso length arm length is it oversized or tight or somewhere in between etc will vary based on the current trends of the time well fitting jeans and well fitting blazers are rarely ever out in the way that ruffles may be in a few years i just want to caution you against thinking that you can hold onto the same piece for perpetuity and still expect to be seen as current since the definition of well fitting varies ,7,femalefashionadvice
kbol,my toenails are so jacked up from falling off all the time my second toes are longer than the firsts so they usually get the brunt of it but i think all of my toes have lost their nails at least once ,3,femalefashionadvice
kbol,i was just scrolling through before bed and must have missed the other one which is why i only commented on this one i do not think that trashy is a useful qualifier in any fashion context ,5,femalefashionadvice
kbol,please do not conflate value judgements with fashion styles you do not like ,83,femalefashionadvice
kbol, i do not know how much crotch coverage there would be if it cut that high in the back crotch coverage is the same as any other bathing suit just like thong underwear etc ,7,femalefashionadvice
kbol,we went to italy recently and i somehow lost weight even though i felt like i was eating a zillion carbs a day because we averaged like 10 miles of walking every day i was so sore but so happy that i could eat all the pasta and pizza i wanted ,2,weddingplanning
kbol,we just signed lola to be my hmua i am so glad you liked their work they came v highly recommended from my planner but hearing it from an actual bride is so comforting where are those bridesmaid pj sets from so cute ,5,weddingplanning
kbol,we did the same our full service planner and designer was about 4k and we lucked out that she was the cheapest in our area because she is incredible our venue has only been open a little over a year and she already done 15 20 weddings there so she knows it like the back of her hand is best friends with the venue owners etc and she so plugged in to the local vendors but was also super appreciative that we introduced her to a new photographer she had not met yet and now they are doing styled shoots together she is so good about keeping us at or under budget being frank about where we can skimp vs where splurges really add an extra oomph coordinating contract change after contract change etc we are both consultants so having her on the ground is so clutch when we might find out at a moment notice that we have to be at a client site the day before a vendor meeting and i have already used her as a scapegoat to my family more than once which is already worth the money in and of itself i love her i would marry her myself if she were not already married ,1,weddingplanning
kbol,i have a bathing suit like that from aa last year and it white aka it nips and i wear it all the g d time people love it i am not someone for whom exuding sexiness comes naturally so i think my fiance was surprised when i first bought it he likes it but it did not seem like me but it actually been kinda cool using it to explore that side of me i have not really delved into before ,3,femalefashionadvice
kbol, 450 for myself including trial and 175 per bridesmaid mob mog i probably could have found somewhere a bit cheaper but the group does really good work and all of my bms were okay with the price ,1,weddingplanning
kbol,yep i knew i wanted an flowy a line with organza and ended up with a dramatic silk trumpet that my moh pulled just to get it out of the way ,3,weddingplanning
kbol,i have a degree in mechanical engineering and have worked as a business analyst at a fortune 50 telecom company a software implementation consultant for utilities and am now interviewing successfully for product manager roles in the educational technology space aka my degree has never directly informed my career path but strategies i learned in college critical thinking problem solving does this answer make sense in context etc will always be applicable no matter what field you are in ,11,femalefashionadvice
kbol,only like half of the chacos styles have toe straps ,3,femalefashionadvice
kbol,when i studied abroad in chch and it started snowing in april may people would be all bundled up in jackets and warm pants and wearing jandals or barefoot i thought it was the funniest thing ,2,femalefashionadvice
kbol,almost every hairstylist i know uses instagram as their portfolio now so you could browse honestly just like hair search for famous stylists browse your current stylist s and see what they have done lately ,5,femalefashionadvice
kbol,have you tried tevas or chacos i have a pair of the latter that i wear with just about everything ,6,femalefashionadvice
kbol,we are going to vietnam flying in to ho chi minh city saigon and staying there for a day flying to phu quoc island https www phuquocislandguide com wp content uploads about phu quoc island vietnam jpg for 4 days flying to hanoi and going on a 2 day 1 night cruise to ha long bay https www gapyear com images advertiser files ha long bay jpg then staying another night in hanoi if the intra vn flights push you over your budget phu quoc alone would be a beautiful honeymoon ,2,weddingplanning
kbol,i have an app on my phone ios only called daily budget and i track every thing i buy it annoying and frustrating to see myself in the orange which is negative blue is positive and i get really woken up when i see that i wo not be back in the positive for a few days because of choices i made it also has graphs and stuff so you can see what areas you are spending the most in but if you are like me you know what the problem areas are clothes food but do not really recognize the frequency at which you are buying ymmv but i did it for the first few week or two where i did not try to course correct if i normally bought a coffee every morning i continued buying a coffee every morning the feeling of guilt i got at looking at my numbers after those few weeks was enough of a kick in the booty to be more cognizant about buying things at the time of purchase ,4,femalefashionadvice
kbol,aziz is a huuuuge foodie irl so i have to assume that this season was a passion project for him in more ways than one ,1,femalefashionadvice
kbol,ours is currently slated at 3 732 55 and broken down as bridal http imgur com a hzwzi 205 bridesmaids http imgur com a ycofr 65x4 260 ceremony installation https www instagram com p bsbnunvjuix taken by oneeleveneast 595 staircase installation https www instagram com p bruqnd gb4y taken by remiandgold no flowers 180 courtyard door installation https www instagram com p brn 11kgahb taken by remiandgold 225 reception tablescaping garlands candle votives etc 1 195 cake floral http imgur com a lgxbi 35 votives for cocktail tables 6x 15 90 welcome swag escort table arrangement guest book arrangement 155 the ig pics are our actual venue and or florist the imgur ones are just inspo pics she working from so just under 3k 2940 subtotal then tax setup strike fee etc we do not really have any other decorations besides flowers and this bomb ass banner i bought http 1z30b13mfvdj2ixk6z3i8rfx wpengine netdna cdn com wp content uploads kirbyanthonymarried 332 copy 600x399 jpg so i am happy to pay quite a bit for our vision ,1,weddingplanning
kbol,i love your koozies where did you get them from ,1,weddingplanning
kbol,ours took about 4 weeks to get back but luckily my photographer and i follow each other on ig so whenever he was editing our pictures he would put one or two up on his story and tag me in it so i knew he was at least working on them i do think not getting a response is a little unprofessional but hopefully it just a busy season and she will get back to you soon if you contacted her on monday i think reaching out sometime this weekend is valid hey xx just following up on our pictures do you have an eta for around when you will be able to get them back to us thanks ,2,weddingplanning
kbol,not quite safe driving but my favorite gta thing to do is to just create traffic roadblocks at intersections by parking a few cars perpendicular to the flow of traffic and watching how angry the ai people get my boyfriend does not understand this tendency at all but i get a ton of satisfaction out of it ,6,AskReddit
kbol,bartonandbeau becomingbarton pieceofmybarton boyandbarton hannellybarton sounds like finally barton to me but idk if that would come across very well,3,weddingplanning
kbol,newlyyoung iloveyoung wannagrowyoungwithyou instead of old youngandinlove yestoyoung,3,weddingplanning
kbol,briandmattrimony ,12,weddingplanning
kbol, takemy hannainmarriage tohannaandtohold bridehannagroom bride and a groom ihannaholdyourhand hannaniceday like havin a ,4,weddingplanning
kbol, do good http i amz mshcdn com ez h4ouud57ozfpd 6gmern3qw fit in 1200x9600 http 3a 2f 2fmashable com 2fwp content 2fuploads 2f2013 2f01 2fsuperman grammar gif ,20,CFB
kbol,that damn vest,5,CFB
kbol,i just got back from rome recently and i loved it i have not been to venice but rome was so so much fun ,3,femalefashionadvice
kbol,your waist is tiny ,75,weddingplanning
kbol, 4k before alterations i wanted to spend around 3500 but had some wiggle room and i love it and my fianc was not surprised haha ,2,weddingplanning
kbol,thank you when i take the bow thing off it makes my butt look really good too ,2,femalefashionadvice
kbol,thank you ,2,femalefashionadvice
kbol,i knew i wanted floaty a line http limorrosen com project skyler with tulle or organza and ended up with a dramatic trumpet https i reddituploads com 7f0d7688a5d44473a16058240130aaf0 fit max h 1536 w 1536 s 4b350f9348c03e182af23b6b56c6060a made of silk wedding dresses are weird ,24,femalefashionadvice
kbol,i know the response was more to the idea as a whole than you specifically probably should have specified that i meant the universal you not specific ,1,femalefashionadvice
kbol, sonically unpleasant yes i have a like visceral reaction to people pronouncing it that way,18,femalefashionadvice
kbol,i hate this video so much it jpeg not jpheg and all other such things i know you meant it tongue in cheek but it just such a silly reasoning because that is not how english acronyms work if you want to say it gif because it like gif t then fine but to expect an acronym to retain the phonetics of its constituent words is such a weird hill to die on ,13,femalefashionadvice
kbol,that picture specifically looks like a sock bun but an easy way to do one is to hold your hair at the nape of your neck and twist it all in a single direction eventually the twist will close upon itself and make a neat ish bun https i ytimg com vi ethwby5pkka maxresdefault jpg rather than a low messy bun https s media cache ak0 pinimg com 736x 3e b3 c1 3eb3c1175b94b3ee22c06bac09b68b07 jpg that you might get from pulling your hair halfway through a ponytail ,4,femalefashionadvice
kbol,depending on your hair texture i have found curling with a straightener to be much faster than with a curling iron idk why ,2,femalefashionadvice
kbol,steaming things is so satisfying ,4,femalefashionadvice
kbol,when my fiance proposed my initial response was are you sure even though we would been together for 4 years ,2,AskReddit
kbol,are you sure you are not looking at elopement packages i have never seen a 1500 engagement shoot ours was included in our wedding package 3200 overall but i think it like 500 standalone ,10,weddingplanning
kbol,6 8 teams playing a single game is pretty big i agree ,10,CFB
kbol,it sounds like gifts are their love language and they have the means and desire to match it not a waste if you remember the fact that people are much happier with experiences than things and your wedding sounds like it will be the experience of a lifetime ,2,weddingplanning
kbol,haha oh gosh that on the other hand i agree with you,1,weddingplanning
kbol,i think you unbutton them ,2,weddingplanning
kbol,i am so tired of interviewing but i am also so tired of my job just get me out of both situations and give me an offer please someone i have like 18 irons in the fire but it is a juggling act that i am quickly tiring of juggling in addition to my full time job i am actually getting paid for,11,femalefashionadvice
kbol,yeah i did a free trial of linkedin premium and i think a lot maybe all of their insights were bs like they will put you in the top 10 of a posting if you have a lot of skills on your profile that match other candidates profiles skills but that does not mean those skills are what the job is looking for ,5,femalefashionadvice
kbol,i will pm you ours ,2,weddingplanning
kbol,my dad and i are dancing to vienna by billy joel which is just a song that always been really important to both of us and i am pretty sure i am going to lose it during our dance ,3,weddingplanning
kbol,rosentothealtar rosentotheoccasion twotrianas trianagetrosen trianagetmarried rosentrianagetwed like tryna get ,2,weddingplanning
kbol,irua i do ruaandme meandrua you and me me and you rightfullyrua youlook ruatifultonight beautiful tonight ,2,weddingplanning
kbol,ifedun like i do getting marriedfedun getting married soon feduningandaahing oohing and aahing i like tyingthemacknoton ,1,weddingplanning
kbol,loveyoumorales love you more marryingmorales moralesinlove mrandmorales moralesthemerrier,1,weddingplanning
kbol,idoudy idudy meandudy udybest,1,weddingplanning
kbol,almostaustin awwstin s adiosarevalo hm i like fraustinthecake ,1,weddingplanning
kbol,or maybe just olyvayou i love a you ,1,weddingplanning
kbol,fuschia ,5,femalefashionadvice
kbol,like this https dtpmhvbsmffsz cloudfront net posts 2014 04 01 533aeca9e6ce2820ae2534f5 m 533aecb894c7de3a6326ca8a jpg peplum,3,femalefashionadvice
kbol,asos has a huge selection and i like my american apparel one piece if they have any inventory left ,6,femalefashionadvice
kbol, then god is an ego maniac that will only redeem those who praise him despite an overwhelming lack of proof yes that pretty much exactly what i said ,2,AskReddit
kbol, so why not perform a more substantive irrefutable and long lasting miracle that does not rely on faith belief emphasis mine the whole point of faith is believing in something without inconvertible proof of its existence god only wants to redeem those who want to be redeemed so you have to actively choose to have faith offering substantiative proof allows everyone to be saved by default which defeats the purpose the biblical interpretation of god is very into testing people often more than once should you choose to believe in him and want to go to heaven after you die you can either pass all of his draconian tests not wearing mixed cloths eating shellfish et al or accept the fact that jesus has done all of those things on your behalf and literally the only thing you have to do is to believe in his power if you believe god exists believing in jesus should not be that much of a stretch and trusting in his divine ability is the comparatively easy path to salvation ,0,AskReddit
