name,body,score,sub
kbol,i will offer an alternate side that i have 3 weeks 15 days of paid vacation right now and that is more than enough for me any vacation longer than like 7 or 8 days just makes me really antsy to get back home no matter how much fun i am having but i am a live to work kind of person so i feel more recharged and sustained when i have something for my brain to chew on different strokes ,5,femalefashionadvice
kbol,i love theodore it always reminds me of teddy from little women ,3,femalefashionadvice
kbol,one thing that my mom specifically did when we went shopping is she asked for my opinion on the dresses first then tailored her answer once i would given mine when she explained it beforehand it felt like she was babying me and not saying what she really felt but it was more that it was not worth her saying oh i love this dress if i have already 100 eliminated it in my mind i am paying for my own dress and have a stubborn streak a mile wide though so she probably knew it would be futile anyway ,2,weddingplanning
kbol,seconding shinola i made an off handed comment to my fiance that i would get him an engagement watch once i got my engagement ring and he held me to the deal so he ended up with the cream chrono face https www shinola com mens watches all therunwell47 chrono s021115 html light tan band https www shinola com watch straps 24mm natural cordovan top stitch html for 820 although his hardware is black not silver there not many but if you are near a flagship store https www shinola com store locator they have a mix and match table that allows you to try on the combination you like before you buy it which he found really helpful since a lot of their men faces are surprisingly small and he has pretty thin wrists to begin with ,1,weddingplanning
kbol,one nice thing about nail polish on skin is that once it dries you can kinda pick it off and pretend like it was a clean edge the whole time ,28,femalefashionadvice
kbol,one funny thing i have noticed in my city atlanta is there are now markets which are cool and trendy in contrast to malls which are distinctly out but like look at this market http www poncecitymarket com it a two level structure comprised of stores and a food court it just in a historic building and the stores are more heritage leaning so it feels like you are not shopping at a mall but you are i think the convenience of having multiple stores together in one place will be tough to be fully replaced by online shopping even if the stores in them change or what we call them is different ,2,femalefashionadvice
kbol,one of my best friends has a gender neutral first name and has been dating a guy for the past 3 years whose last name is her first name so her name will be essentially smith smith and i cannot wait for it haha she much too traditional to keep her maiden name etc ,6,weddingplanning
kbol,i think i know where that fira deck and acropolis view are if you have time the inclination we did a 5 hour sunset cruise from oia we were staying in fira but they pick you up wherever and it was the best part of our trip i wish i knew the name of ours we just booked it through our apartment front desk but they are all probably pretty great eta ooh also santo wine is the big winery on the island and i thought it was good but then we went to the pelican restaurant in fira and they have an underground cellar and that sommelier was so so good ,1,femalefashionadvice
kbol, i do not think i have ever met a single person in my entire life that has said i do not like pizza or even pizza is okay i am one of those people i am very indifferent to pizza i will eat it if it there but i never want it outright especially weird that i love cheese and bread i am just meh on the execution somehow ,15,weddingplanning
kbol, here mine http imgur com dljpimi 1 1 karat cushion cut on a size 5 finger i dropped plenty of hints about what i did and did not want and he did really well ,2,weddingplanning
kbol,there are checks and balances in the form of a republican controlled dominated congress and a supreme court with up to 3 seats that could be potentially appointed by the peotus not super balanced imo eta do i think he politically savvy enough to pull off all of the doomsday scenarios maybe maybe not could he though not out of the realm of possibility sadly ,3,femalefashionadvice
kbol,our venue is pretty bare bones it only the space so we have to rent things like tables chairs flatware etc but venue rentals is 25 of our budget catering is just over 20 live band is 13 floral is 8 and photography is 8 remaining 26 is things like apparel stationery getaway car rental license officiant etc these are all based on the estimated budget provided by our planner we have not yet booked anything speaking of if you do end up wanting a planner they recommend around 10 of your budget for full service offerings ,1,weddingplanning
kbol,zanzibar i think my fiance and i enjoy traveling to unusual places and we want somewhere that offers that and a relaxing beach since we always do go go go vacations we both travel a lot for work so we have a lot of airline miles racked up and are going to maximize points on our credit cards for hotels etc ,1,weddingplanning
kbol,just an fyi but my fiance and i went to santorini in november it was beautiful highly recommend but august is very much their high season gets verrrry hot so it may be quite crowded if that a factor for you eta but i agree that athens while cool to see all of the history really only needs about a day ,1,weddingplanning
kbol, gettingknighted,6,weddingplanning
kbol, 35 40k my parents are contributing 20k i am the second of three daughters so i knew they had some money put aside for our weddings just was not sure how much and my fiance and i will cover the balance the budget does not include our rehearsal which his parents will cover nor my dress which i am paying out of pocket for but it does include our planner 4k she already so worth it he and i both have good jobs so we are flexible on the upper range and we wo not be crushed if it goes a bit over 40 but we did not want to blow our savings for it either he and i make roughly the same so we are splitting our contributions 50 50 from a joint bank account that will become our main bank account post wedding ,1,weddingplanning
kbol,what my process has been so far scroll through yourcity weddingphotographer on instagram and find pictures that i liked go to their ig page website blog etc and look at their portfolio does it match the style that i like does everything look well lit well composed well edited email or check investment tab on the website for their price stating when and where our wedding is and if they could please provide me with their package information pretty much every professional will have some kind of pdf dossier that explains the package s they offer or their a la carte prices or both in the initial email to them i say something about not having my budget set in stone yet even though i do because it a nice way to triangulate if the style i like matches the budget i have set ymmv on this though if they are way over my budget eliminate them if under consider them if reasonably above i see if there anything included in their packages that i can live without 8 hours instead of 10 or no bridal session or whatever and ask about that modified package with something like i see that package 2 is x if i remove the bridal portraits and second shooter would you do it for y and they can accept the counter or not from that process i have probably emailed 20 photographers and have it narrowed down to 2 one guy whose only package was exactly my budget and exactly all of the things i was looking for full day coverage second shooter engagement session included print release and the girl is 50 over budget for the same points but that with knocking 150 off for removing a bridal session from her top tier package my next steps are going to be to meet with both of them and seeing who we vibe with more then booking that person ,2,weddingplanning
kbol,i never really saw pjs as in like sleepwear http target scene7 com is image target 51258046 wid 450 hei 450 fmt pjpeg although i have heard of it happening at other schools that i did not attend but sweatpants https s media cache ak0 pinimg com 736x e2 9e 71 e29e711eb4895798a881d95692941c27 jpg are not uncommon and outfits like these http 1 bp blogspot com irkutyckzzc tnxlqhi9cki aaaaaaaaadw mrcr8yhujny s1600 img00009 20101111 1504 jpg are normal i would not call those shorts tiny but they are definitely athletic ,7,femalefashionadvice
kbol,my fiance name is matt so we are doing karaandmattrimony simple easy to remember and only slightly punny ,3,weddingplanning
kbol,not really an investment pair but i have had zara court shoes basically these http www zara com us en collection ss 17 woman shoes leather high heel shoes c358009p4284508 html without the detail on the back for the past 6 months of working as a consultant read i travel a lot in them and find them very comfortable and get a lot of compliments on them ,0,femalefashionadvice
kbol,despite other people claims to the contrary my legs never feel warmer when i am wearing tights vs without in addition to all of their other issues lack of durability not being in etc etc so it seems pointless to me also to paint with a wider brush i think generationally as we get more casual things that denote formality start to lose their appeal since i do not need to signify the formality that tights confer repeated across enough people becomes i do not see people wearing tights ever which then becomes a cycle until they fall out of favor with enough people that it not really done anymore see also the fall of white tie for formal events it still exists in some places but people mostly just do black tie now if they want to be fancy ,29,femalefashionadvice
kbol, i am just saying that making a size small bigger is not solving problems it creating new ones but is it creating new ones or just renaming old ones i am 25 so this is a sincerely curious question since the current state is pretty much what i grew up with anyway was it that much easier for smaller women to find clothes in stores when they were marked s rather than xxs or have the purchasing choices remained static eg 40 of stock is m 20 is s 30 l or whatever while the sizes measurements have changed if the latter then i could see the issue but if it just a matter of getting used to a new number i see that as more of a quirk of the industry than a real problem ,1,femalefashionadvice
kbol,i have not ordered from them but have heard good things i am getting married next year and looking for bridesmaid dresses and a lot of people have been using lulus recently since they are not too expensive but are pretty nice quality ,2,femalefashionadvice
kbol,i used to love the ankle fit on the bdg twigs from urban outfitters but i have heard that recent iterations are not nearly as good as when i bought mine a year or two ago so ymmv ,2,femalefashionadvice
kbol, i am a jcrew small t shirt even though my boobs are bigger now than they were when i was a true small i think this hits on the crux of my rebuttal against vanity sizing what does true small mean maybe a small in the 90s was not a small in the 50s does that make it not true is there some platonic ideal of what sizes should be that retailers are intentionally deviating away from in order to make more profit i am thin but not sized out of places so i will recognize my inherent privilege in that but i do not see how reverting back to the way things were fixes the crux of the issue that is smaller women being unable to find appropriately sized clothes if a 0 in the 90s or a 000 in the 2010s she still is on the very end of the bell curve and it just not financially responsible for companies to cater to her needs as much as it sucks on a personal level ,3,femalefashionadvice
kbol,finally copped the a p c half moon bag http usonline apc fr women bags half moon bag pxadm f61048 black 16 cannot wait for it to arrive ,2,femalefashionadvice
kbol,ha i quote kroll show and publizity in particular also somehow a medically inadvisable amount of tuna allll the time kindred spirit ,2,weddingplanning
kbol,yes me as well i think partially because i met my fiance right before dating apps were a thing so i have never really had to work the muscles of generating spark through them ,7,femalefashionadvice
kbol, 3 taking time to consider what sort of companies i want to give my money to i know this will be a big change for me so i intend to kind of do it one step at a time but i am sick of buying low quality clothes from companies that do not pay livable wages so i am excited to make the change i thought this blog post https elizabethsuzann com blogs stories money talk was fascinating i knew a lot of the things she mentioned even no ethical consumption under capitalism but i liked the breakdown of costs for an item and she is very thoughtful about intersectionality and ableism w r t ethical consumption ,4,femalefashionadvice
kbol,thank you ,2,weddingplanning
kbol,a friend recently introduced me to this cleansing technique https fiftyshadesofsnail com 2015 03 28 how to shrink pores temporarily plus 3 pore myths and it is very fun to me to physically feel the grits coming out of my face and i just feel pampered whenever i remember to go above and beyond my normal skincare routine anyway ,6,femalefashionadvice
kbol, also do not sell yourself short on the salary thing if someone were to be making that amount for the job do not let them hire you for it for less agreed if you think you can successfully do the job that would pay someone 50k i would request 50k when you ask to take it on it still cheaper to them than hiring someone new if you are currently making 30 paying you the extra 20 is still cheaper than continuing to pay your 30 hiring a new 50 and they get the security of having someone they know will be good at the job which can make up for any differential in someone doing it ft vs you doing it pt in addition to your other stuff ,10,femalefashionadvice
kbol,i think there a ups store or two in austin they would probably be able to help somehow my mom sent me a lot of care packages when i was in college of weird stuff she would just bring it to the ups store and let them decide what kind of box how to ship etc poshmark automatically sends you a mailing label for things that you sell so you should probably be proactive in telling your buyer that it coming via a different service if you do end up going that route i would be a little surprised if i ordered something via usps that showed up via ups fedex may not even know to look for it my leasing office puts usps packages in our mail room but holds other packages stuff like that ,5,femalefashionadvice
kbol, ameeeezing https www youtube com watch v g109xi9mbp4 ,4,weddingplanning
kbol,wow that is gorgeous who the designer style number ,3,weddingplanning
kbol,i think i want to do a really beautifully tailored jumpsuit like this https www pinterest com pin azkpemyjhjlbz7rjptjtxnombyun0 gsriormp1x1yeecyi8rbn1 ia or this https www pinterest com pin 447052700489617474 so i can channel solange https s media cache ak0 pinimg com originals 4d 45 aa 4d45aadae969d296c939b1d11520fa79 jpg ,2,weddingplanning
kbol,can you imagine that body in a bathing suit ,3,funny
kbol,my fiance and i are going to palm springs ca and going to this weird thing http www acehotel com calendar palmsprings nye 2017 utm campaign psp nye 2016 utm medium shortlink utm source utm content www acehotel com 2fpspnye and i am really excited ,6,femalefashionadvice
kbol,no 15k is not really high the average cost of a wedding in the us is 30 35k and these are nice but definitely not over the top or anything it is possible to spend less but tough 50k would be high end in most markets outside of nyc la sf but not all that unheard of ,4,AskReddit
kbol, linglebells or lingleweddingbells would be super cute if you want to use your name ,2,weddingplanning
kbol,i do not think newpriestontheblock is too long newlyordainedpriest or something to that effect could be pretty funny priestcharming priestandprincess ,2,weddingplanning
kbol, maxsononmyman like macking ,0,weddingplanning
kbol,i am having the same issue i went with my mom sisters and fmil while we were all in the same city for christmas and it was fun but i felt like i would not allow myself to fall in love with anything because i am afraid my tastes will change or something i am going to wait until february or march to start looking again ,3,weddingplanning
kbol,i really only know about it because i am trying to plan my own wedding but check out r weddingphotography they may have some good tips on how to get yourself hired as a second shooter ,2,videos
kbol,if you think you would be interested in the industry you could try second shooting for wedding photography your saturdays would be really busy but it would be one way to build up a portfolio plenty of wedding photogs also do portraiture families and or boudoir shots if that avenue seems too restrictive ,3,videos
kbol,agreed i love my family but i would not host my favorite aunt for a week and a half when i am not doing anything much less have an impending wedding hosting people is exhausting ,5,weddingplanning
kbol,if i am understanding u constructorofthings correctly he saying the motivation for ignoring the fbi warnings was not malice or greed but rather apathy not i am ignoring this because i can profit from it but more this will not affect enough people to bother wasting my time over ,5,AskReddit
kbol,if it this year sxsw my fiance and i are moving to atx in march and were looking into airbnbs to stay at the night before we move in lol such poor timing on our current lease ending date and they were not entirely unreasonable unlike the 1000 courtyard downtown this one https www airbnb com rooms 13658906 checkin 03 2f13 2f2017 checkout 03 2f24 2f2017 guests 7 adults 6 children 1 s nl48pfda is 170 night on the southern side of the city this one https www airbnb com rooms 5285796 checkin 03 2f13 2f2017 checkout 03 2f24 2f2017 guests 7 adults 6 children 1 s nl48pfda is 181 night on the north end eta i had been looking 3 13 3 24 for 3 24 4 3 this place https www airbnb com rooms 16174829 checkin 03 2f24 2f2017 checkout 04 2f03 2f2017 guests 7 adults 6 children 1 s mdh4jilz in cherrywood is only 104 night ,8,weddingplanning
kbol,i thought the names were cute ,1,weddingplanning
kbol,i have no affiliation with the company at all i was just browsing around pinterest for dress ideas yesterday and came across it 45 per dress for at home try on and each dress is custom made for your measurements and offers specific customizations i am really into j capulet http floravere com collections gowns products j capulet a hall http floravere com collections gowns products a hall h golightly http floravere com collections gowns products h golightly with a slight preference to the juliette since i have been envisioning myself in a floatier skirt eta judging from their instagram it looks like they started in november so i doubt they have had too many brides yet so i guess this is more of a sharing post than a questions post ,5,weddingplanning
kbol,oh oops i missed the movie part of your post it one of my favorites ,1,LiveFromNewYork
kbol,i am 99 sure that that how it was phrased in love actually carol singers which would make me think that it a british phraseology ,3,LiveFromNewYork
kbol,it depends on the airline and their normal routes but op ups are very very unlikely for most major carriers i would not bank on one happening in a given trip ,9,IAmA
kbol,ooh a children book is a good idea i will try and find something she could use in her classroom ,3,femalefashionadvice
kbol,what a cool gift ,1,femalefashionadvice
kbol, one year i got my mom what i thought was the perfect gift i put so much thought into it and was so excited and she never used it once ugh my mom is the one who really instilled gifts as an ll in me and i am really nervous that my non physical gift for her this year donation in her name to an early childhood education charity she a first grade teacher might not be well received because she likes actually being able to open the thing i am crossing my fingers but nervous ,6,femalefashionadvice
kbol,it a wonderful life is my 2 all time christmas movie only second to a christmas story watching either makes me feel cozy and christmassy ,1,femalefashionadvice
kbol,i love giving gifts but i hate giving gifts on people lists it seems too easy i am so good at intuiting what people really want instead of what they need she says to herself i just figured out fiance gift yesterday because he is a terribly hard to shop for b does not have too many hobbies outside music and coffee and i have relied on those for years and c very bad at concealing his distaste for a bad gift gah i am proud of what i found now but i was stressin for quite awhile ,5,femalefashionadvice
kbol, today is the day http imgur com a ahuil ,35,femalefashionadvice
kbol,sorry to dash your dreams ,1,femalefashionadvice
kbol,oh huh good to know i was considering buying one with my christmas bonus this year so i will definitely keep that in mind ,5,femalefashionadvice
kbol, are you sure you cannot afford it already http imgur com a cxgp3 p,6,femalefashionadvice
kbol,pretty overdone but an lv neverfull i travel a lot so having a big bag that does not get scratched up going through tsa but still looks nice is the goal and they last forever fit everything you could ever need ,9,femalefashionadvice
kbol, youlemonyoulearn p lemonontheedge lemonlaughlove lemononaprayer,8,weddingplanning
kbol, buckmasterwild like buckwild buckmasterandbride buckmasterandmrs thebuckmasterstartshere like the buck stops here but opposite this is harder than i was expecting ,1,weddingplanning
kbol,this shop and this pattern are beautiful i ended up buying the tis the season and terrarium ones i may switch projects to finish the holiday one before christmas then go back to my skbs thanks for sharing ,1,femalefashionadvice
kbol,i normally have a 1 insta per day rule but i was like i think the denizens of the internet will understand,6,femalefashionadvice
kbol,yes i am so pleased once i catch up i think i will do another subscription ,1,femalefashionadvice
kbol,i did a 3 month subscription back in october so i am working on the pine trees moon one it very pretty and i put it on this soft blue fabric that looks very nice with it ,3,femalefashionadvice
kbol,i just started one of my skb patterns last week and i love it it so much easier than cross stitching and i like the outcome much more ,2,femalefashionadvice
kbol, for the most part i will never get off my parent phone plan bc unlimited data my older sister is married and just had her first child and she still on my family plan i do pay my parents for my share but it saving us all money so i feel not one lick of guilt about it ,3,femalefashionadvice
kbol,i was heavily instagramming the earlier portion of our date while we were on our way to the spot where my fiance proposed he was rolling his eyes but he does not do social media so i thought he was just ribbing me ,5,femalefashionadvice
kbol,or tiny feet short i am 5 5 but have size 5 5 feet which makes buying any tall boot a pain because they hit in just the worst places imaginable ,1,femalefashionadvice
kbol,athens is just kind of dirty it interesting seeing the historical stuff but most websites said that you do not really need to give it more than a day and i would agree with that ,2,weddingplanning
kbol,he picks her eventually ,3,AskWomen
kbol,i feel like i as a cowboys fan jinxed dak since i am pretty sure the only times i have started luck over him were the two times we played the giants ,1,fantasyfootballWDIS
kbol,dak nyg or luck v hou first round of playoffs 12 team standard close matchup leaning luck but still not 100 yet ,1,fantasyfootball
kbol,we have considered it i think my fiance is hoping to do some of the more inaccessible places while we are younger but everyone i know who been to belize loves it so we might have to look into it further ,1,weddingplanning
kbol,i have had a lob for about a year but growing up i was definitely the girl with the long hair even through most of college it was down to my belly button when i straightened it i like the utility of a lob a lot it long enough to style but short enough to not get cumbersome but i am debating what to do next since i am getting married in early 2018 and have always envisioned myself with longish curls that would not be feasible with my hair as is right now but i do not think this blunt of a cut would work on longer lengths ,3,femalefashionadvice
kbol,i love this banana bread http allrecipes com recipe 20144 banana banana bread recipe and i usually break up pieces of dove dark chocolate in it to make it even more delicious ,2,femalefashionadvice
kbol,this could also be a cause of liking your outfit in still looking at a mirror likely not moving much vs seeing it in motion walking past a store window or something the reverse is seen a lot in waywt people like their outfit but it does not convey well without movement so might be something to consider ,3,femalefashionadvice
kbol,i was in joann fabric yesterday and saw a few different kinds of fashion tape i am sure the ladies there will know what works best with your dress fabric ,1,weddingplanning
