name,body,score,sub
kbol, i am a huge window seat fan but seem to be in the minority about the sunglasses i do not think it wrong just weird ,0,femalefashionadvice
kbol,my boyfriend and i just bought ours today we are going to be the jamaican bobsled team https www amazon com jamaican bobsled team costume adult large dp b00fgdag8w ref sr 1 1 ie utf8 qid 1474396208 sr 8 1 keywords jamaican bobsled costume i would love to do something more intricate but he not a huge costume person so i take what i can get we went as suzy and sam from moonrise kingdom last year which was a huge hit probably my most favorite costume to date ,7,femalefashionadvice
kbol,i really should use my lounge membership more often they are so convenient i am just too lazy to get to the airport early enough to make it worth going p,0,femalefashionadvice
kbol,ymmv but i have never put my liquids in a ziploc baggie like they request and not had any problems i fly on average every other week i do not have anything super big and i do not travel with shampoo conditioner but i have never had issues with like my full size of toothpaste i will caveat and say that i have pre check but not every airport has pc so i do go into regular security every now and then with the same results ,2,femalefashionadvice
kbol,it does do not fret i am not sure how often they get deep cleaned but a cleaning crew does a 5 10 minute sweep as part of the turnaround from off boarding to on boarding i know they have at least one or two replacement seats on most flights for messes that cannot easily be cleaned pee vomit period etc ,7,femalefashionadvice
kbol,haha i think it was along that vein actually i have given in to goading my coworker and meant to say apollo 13 and said armageddon instead iirc ,2,femalefashionadvice
kbol,ugh yes especially since i live in atlanta and have delta status people think that because everyone is going because lol at the upgrade lists out of atlanta that it just a free for all but it not i dealt with a lot to get my status and i would like to bask in it but no chance ,5,femalefashionadvice
kbol,sure it basically this http allrecipes com recipe 20144 banana banana bread one then i buy dove dark chocolate pieces and break them into smaller chunks before folding them in to the batter it basically to taste but i think i generally do 5 7 of the individually wrapped pieces they melt really nicely while the bread bakes ,3,femalefashionadvice
kbol,i have never seen the x files nor the matrix nor armageddon nor apollo 13 nor anything terminator etc etc i love to bug one of my colleagues with these tidbits every so often ,7,femalefashionadvice
kbol,i have odd opinions about flying since i travel for work so much do not line up at the gate until it time for your zone zone 3 people clogging up premium boarding just makes the whole thing take longer and makes everyone grumpier do not wear sunglasses i realize that planes are modes of transport and i am fine with people wearing sunglasses in cars buses etc but planes feel distinctly inside to me and i think it weird that people continue to do this do not lean your seat as far back as it can go i know that i am weird in that i do not like to recline my seat but it really annoying even as a relatively small person when you fully encroach on my space because you need to be at a 180 degree angle for a 1 5 hour flight stay in your own seat this includes equitable division of armrests legroom and tray tables it not fair to have more than the two allotted bags onboard what i mean is people who have their carry ons and a purse and a shopping bag from the airport newsstand and a chili to go bag and duty free items not fair and not nice i do not mind bare feet or odd seating positions since i do both hehe though eta i do not put my bare feet on anything i just take my shoes off and put my feet under the seat in front of me ,18,femalefashionadvice
kbol, release ,19,femalefashionadvice
kbol,i have my banana bread recipe down pat dove dark chocolate pieces sooo yummy and every fall i resolve that i am going to find a pumpkin bread one i like equally as much but my boyfriend is not super into pumpkin flavor so i have not yet buckled down on it that and the perfect coffee cake are just eluding me ,2,femalefashionadvice
kbol,i will be at the gt vandy game right down the road was hoping to win some tickets to band of horses late night show at smith olde bar but no dice have fun ,1,femalefashionadvice
kbol,i do not think so i flew with my dog cross country and there were not any restrictions on which flights i could could not pick since you generally add your pet on after purchase ,1,femalefashionadvice
kbol,probably have you switch seats with another passenger once you board i guess ,3,femalefashionadvice
kbol,i am not really an la nyc person but i would move there in a heartbeat just for ucb they are sooo funny ,3,femalefashionadvice
kbol,the house teams are the ones that consistently perform at a given theater the auditions are held by the theater and its members are considered part of the theater cast troupe whatever you want to call it this is in contrast to making up your own team sometimes called indie teams which usually entails going from theater to theater to perform based on who has room in their schedule a house team almost always performs in their given slot different theaters run things differently but for mine you have to complete their in house training program levels 1 5 before you may audition for their house teams new graduates get put on the sunday house team then from there you can get promoted to the thursday night cast from there mainstage fridays saturdays ,7,femalefashionadvice
kbol,i do not necessarily agree with her but she might be worried on your behalf about the whole you only get one wedding hopefully thing and just making sure that you are not settling especially if they can afford either option which it sounds like they can do not go crazy with her money but to me it seems like she just wants y all to have the night you want to have without having to worry about the cost differences etc that you mentioned if you really do prefer the bbq you will probably just have to hammer that home a few times for her i think she has your best interests at heart ,21,femalefashionadvice
kbol,i have actually been doing improv for going on 3 years now i just keep moving around so i have not ever been able to actually graduate from a program yet haha now that i have i am allowed to try out for my theater house teams whenever their next auditions are ,7,femalefashionadvice
kbol,my improv graduation show was yesterday and it went so well that i am considering legally changing my name to harold no but actually i am very funny and still riding the high of other people thinking the same thing today is a good day ,41,femalefashionadvice
kbol,one of my old coworkers is locally instagram famous he has about 80k followers he quit our company to pursue an internet based reality tv show with his brother which is apparently now going to be on our local cw network but he ended up working at one of our competitors so i am assuming that living off his fame alone has not been successful yet he probably posts 4 5 times a day and is the only person i follow who consistently uses instagram stories i have no clue why he is so popular i asked him once how he got so many followers and he said put it on private it keeps them guessing keeps who guessing how are they finding you if you are on private ,3,AskWomen
kbol, mr f,25,femalefashionadvice
kbol,sometimes what i am angry about is stupid and not worth fighting over i am cranky and he left the toilet seat up on accident for example so i say i am fine because i care more about our relationship than a stupid toilet seat sometimes what i am angry about is not what he specifically did but the fact that he did it and did not acknowledge what it meant to me he missed an important event and gave a bad or no apology i do not care that he missed my improv show there will be others but i do care that he did not acknowledge that it something that important to me so i am fine because he is generally good about these kinds of things so it worth looking past but it still hurts in the moment sometimes i really am fine but he keeps pestering me about looking upset so i get defensive because i do not know how else to get the point across that nothing is wrong and yeah sometimes i do it to get his attention if nothing else has worked but i would say that about 1 of the time ,7,AskMen
kbol,to look at people linkedin profiles without them knowing i looked ,1,AskReddit
kbol,ugh same i was always perfectly fine with drugstore makeup except i splurge on dipbrow since the pots last forever but i got a sample of they are real a few months ago and now i cannot look back it so but i love it,4,femalefashionadvice
kbol,i have been really enjoying a lot of gap stuff recently especially their t shirts and tanks i wear one or the other almost ever day they are sooo comfy,3,femalefashionadvice
kbol,i got mine at loft ,2,femalefashionadvice
kbol,the larger the band the more likely the shirt is to stay in place i have seen some where it just an elasticized seam lacking a better term here and those annoyed me even just in the dressing room but i have one that a couple of inches thick similar to your picture and i have worn it to brunch breweries and out shopping with no problem about falling up ,6,femalefashionadvice
kbol,donald glover has amassed a pretty big fanbase from his work on youtube 30 rock community and as childish gambino all pretty disparate types of people i would say and he has yet to have a miss so i think people were curious about his next project since because the internet came out awhile ago and the relative mystery of the ads forced them to actually tune in to see what it was about also i cannot think of a currently prestige show that airs on tuesdays which might have helped as well ,9,Atlanta
kbol,madewell surprisingly great poshmark purchase ,5,femalefashionadvice
kbol,awesome thank you ,1,femalefashionadvice
kbol, that thing where u like ur fit but do not have a full length mirror at home so u use a good enough storefront window instead http imgur com 95x6svx ,48,femalefashionadvice
kbol,oh i really like the look of that borough bag maybe a silly question but does it come in multiple sizes or just the one i need to fit a 13 laptop a notepad and my wallet ,1,femalefashionadvice
kbol,not fish chips but there is a cafe kia ora in midtown that owned by a kiwi from wellington iirc and has some stuff that i remember eating when i studied abroad in chch ,1,Atlanta
kbol,our offense in general is not great red zone play is just a symptom of that ,2,CFB
kbol,my dad is a tall thin brunette nerd who is really into music and my boyfriend is a tall thin brunette nerd who is really into music i try not to think about it too much ,9,femalefashionadvice
kbol,i have never really dated current bf started out as a fwb thing and most of my relationships before that were just straight hook ups but i unknowingly picked out carbon copy types of dudes to hang out with my roommates found it hilarious i think i may have felt different if they were dates but for just hanging out i allow ed myself to be as picky as i want since it did not does not really mean anything ,8,femalefashionadvice
kbol,this is a perfectly acceptable feeling to have there will always be someone who is richer or smater or more whatever than you and sometimes it really sucks to have to deal with that emotion and feel like you are being left behind because of it i was just pushing back on your question of how do they do it because it pretty simple they use money whether it theirs or their parents or loans or credit cards the how is disingenuous and missing the forest for the trees you do not care how they have the money you care what that means socially money better clothes better status in life if i am reading correctly even if we could answer that how sufficiently it does not change anything for you we can however help out with more concrete questions like i love x silhouette how do i replicate that on y budget or i have z event coming up what is an acceptable outfit based on my budget location etc ,14,femalefashionadvice
kbol, for reference i agree with you and even if there are parents giving their kids allowances cars whatever carte blanche without the kid having to lift a finger so what their being able to do that is their prerogative and does not change your own station in life it one thing to phrase it as those people are privileged and sometimes it sucks that i am not everyone feels that way i get that but to phrase it as how do they do it just seems intentionally opaque to me empathy is not only reserved for those in a lower station of life than you ,7,femalefashionadvice
kbol,just because your relationship with your parents is strained it does not mean everyone is i am not trying to downplay your accomplishments learning to budget when still in school is a huge boost later but you seem to have issues with stepping outside of your personal experiences since you have repeated this same sentiment multiple times throughout the thread your experiences are what have shaped you into who you are and defined your value set but if you continue to resent people for having a different station in life you might miss out on some valuable experiences having the agency to spend multiple hundreds of dollars on a single item does not make someone bad or frivolous or whatever they just have different priorities and opportunities than you ,32,femalefashionadvice
kbol, r fringefashion maybe depending on what specifically you are looking for ,3,femalefashionadvice
kbol,you never paid me that five bucks ,1,AskWomen
kbol,we came for the jiggy juggas but stayed for the wiggy wuggas ,4,AskWomen
kbol,i dooo what iiiii am told,1,AskWomen
kbol,email email every time i hope it from a feeemale,3,AskWomen
kbol,i see you jockin me tryna play like u no me,3,AskWomen
kbol,i am american but have not heard pip either i am guessing performance improvement plan ,2,femalefashionadvice
kbol,i never knew living off howell mill would be beneficial to my cfb fandom but here we are,3,CFB
kbol,tbh i sometimes shave my baby hairs if i cannot deal with them although my hairstylist was horrified when she found out,2,femalefashionadvice
kbol,buy what you can afford which is generally a piece at a time but consider the item in context with your current wardrobe and or future goals for it is this piece versatile what do i have or am planning to get that it can be mixed and matched with etc basically one piece at a time to keep within your budget but consider your wardrobe holistically when doing so to keep within your goals ,5,femalefashionadvice
kbol,i hope the people at postmates do not data mine me bc they would probably be worried for my health from how much chipotle i order,2,femalefashionadvice
kbol,mine will just continue without me and pretend like he did not ,1,femalefashionadvice
kbol,she has some poppier stuff but brandi carlile too she opened for an ocms show i saw recently and just absolutely destroyed it i did not know her beforehand and ended up going through her whole discography the next day ,1,Music
kbol,this is me irl with weddings and watching other people wedding videos boyfriend does noooot get it but they are just so in love and everything is beautiful and i love love y all,6,femalefashionadvice
kbol,exact same for us my lease ended before his so i moved there and he confessed a few separate times that it was really hard for him to consider the place ours and not his place that i happen to have all my clothes at now that we have moved and picked a place together he has not had that kind of mental block anymore it definitively ours ,1,femalefashionadvice
kbol, ,5,femalefashionadvice
kbol,i will be right under 60 hours for work this week and i am just exhausted i got upgraded on our flights to from chicago but i am convinced i am going to waste it on just napping haha eta i just won kanye floor tickets from one of the managing partners here so week no longer sucks bye,10,femalefashionadvice
kbol,lol yes when i was in chicago for work i met u beyonce and get v heart eyes she a good friend date highly recommend and i wanted to hang out again the next day but i did not want to interrupt her already established life there just being some poor peasant traveler so i did not mention it luckily she texted me and we got dinner again and it was again the best,17,femalefashionadvice
kbol,i would watch the shit out of this,7,femalefashionadvice
kbol,i have been wearing my office blanket like a cape recently,2,femalefashionadvice
kbol,i grew up in tx and all of my friends from there are incessantly posting that tomi lahren girl videos i try to watch them and understand why people vibe with them but it just a skinny white girl saying platitudes loudly ,2,AskWomen
kbol,they definitely had the recipe in one edition of nick mag back in the day but i cannot ever find it now ,1,todayilearned
kbol,get an antenna if your sporting event of choice is shown on local channels i got one for like 25 on amazon and can watch full hd football games as long as they are on cbs abc nbc and a smattering of really stupidly funny local channels to boot ,9,AskReddit
kbol,when i lived in denver and worked in englewood a guy i worked with commuted from boulder every day i could not believe it ,1,femalefashionadvice
kbol,coming from the us i was told we had a client in a fun cool city everyone loves toronto then came to find out it was in mississauga it was awful ,2,femalefashionadvice
kbol,my boyfriend does not flush his overnight pees bc he thinks it will wake me up knowing full well that i sleep like a rock 100 of the time it is so gross,6,femalefashionadvice
kbol,pretty much or refuse to give the tenant a south facing view or a lot of other insidious things to where it probably really not worth fighting but you would have the law on your side if you did ,2,AdviceAnimals
kbol,oh yep forgot those two caveats it been a few years since i was there ,2,AdviceAnimals
kbol,no i know i am not defending their practices in any way i just wanted to get the word out in case any redditors were super attached to their dishes for whatever reason i know the csrs were supposed to mention it as part of the moving script but i am not sure how much it was enforced ,6,AdviceAnimals
kbol,it fcc rules i cannot remember the exact clause but mentioned in this la times article http articles latimes com 2006 feb 12 realestate re rental12 landlords can make it very very difficult but you have a federal right to choose your cable service provider ,3,AdviceAnimals
kbol,i used to work for dish corporate call routing it illegal for a landlord to not allow dishes the only way is to have a tech confirm no los ,6,AdviceAnimals
kbol,oh yeah showing skin i am waaay less adamant about that a very situational question time of year time of day venue your region stated dress code the general leniency of the bride groom themselves etc white is just an always never for me ,15,femalefashionadvice
kbol,i just finished my provisional year and i would say my experience is about the same a lot of the social events they put on seem super daunting if you do not know anyone and or targeted to a different age range than i am in my small group members were nice but we did not have too too much in common besides our ages plus our group leader forgot to schedule events for us so we really only met once or twice i will say that the group is more diverse than i originally expected and that they do truly care about important issues like generational poverty and human trafficking in contrast to my friends in some other jls where their community focus is like art education or something in terms of volunteer work there a lot to do internally and externally it just not the salve i was hoping it would be for my lack of close female friendships here ,1,Atlanta
kbol,drivers are starting to get penalized if they reject too many pool rides so it might be worth giving it another shot ,2,Atlanta
kbol,yeah that olive green one was one of the ones i tried plus a navy blue printed one that i could not find online womp womp ,2,femalefashionadvice
kbol,in shopping at banana republic this weekend i saw that they had quite a few of a similar style flutter sleeves wraparound tie but were generally in midi not maxi length if that helps ,3,femalefashionadvice
kbol,double rec on the bdg i like the twigs specifically but i know a lot of people like the seamed high rise as well ,3,femalefashionadvice
kbol,maybe low heeled mules https cdnd lystit com photos 404b 2016 01 04 urban outfitters white low heel mule product 3 024910135 normal jpeg still sandal y while providing a bit more foot coverage something like these flat http honestlywtf com wp content uploads 2016 01 babouche2 jpg or heeled babouches https s media cache ak0 pinimg com 564x 4f de 1a 4fde1afc898b0e398135cbb51d313f8f jpg would also be quite lovely if you are feeling uber trendy ,4,femalefashionadvice
kbol,as one of the ffaers who would have trashed the dresses it up to the bride to decide what she does and does not care about some brides care about cakes some brides care about flowers and some care about none of it the difference in wearing white is that you are removing agency on behalf of the bride she gets to pick out all of the other details of her wedding but she cannot control what you wear unless you specifically ask and she specifically ok it basically if some brides would be fine with it but others would not i will not do that thing it common courtesy and i am presumably at the wedding because i like and or respect that person ,49,femalefashionadvice
kbol,you can also just use an old sock to make one cut off the toe and roll it til it big enough calf height socks give you a bit more leeway if you want more volume but i have done it with good results from ankle socks too ,14,femalefashionadvice
kbol,oh wow i do not really need another rain jacket but that one is p great ,2,femalefashionadvice
kbol,it might be l l bean but barbour also has a similar version ,2,femalefashionadvice
kbol,cool yeah i think it would be difficult for me to afford doing full time but i think i could handle the part time courseload stressful 10 weeks for sure but worth it ,1,femalefashionadvice
kbol,that awesome i work in software implementation so tech lite but i love the idea of ux ui and have been toying around with the idea of going to something like ga or similar to pivot my career a bit i will be curious to hear what you think of it are you doing it full time ,2,femalefashionadvice
kbol,any local paperies in seattle there a good one in atlanta called the merchant but idk if they sell online or not ,4,femalefashionadvice
kbol, here https www youtube com watch v dv 7cvglxk0 list pldfl1s gh lcpxz6pwuurtyzlwtsdvtk index 4 a form video might explain what i mean a bit better ,5,femalefashionadvice
kbol,exactly it crazy how i can piece together a lot of seemingly at the time random things into a specific order now like i rushed for a sorority in college but ended up dropping for a few reasons i ended up joining a social engineering fraternity instead that i would not have had time for if i were in a sorority and met my now boyfriend of 4 years there i was crushed at the time but it led me to a lot of good places i would not have gotten otherwise ,-1,femalefashionadvice
kbol,i am trying to think of how to best convey it via text but basically your head to your butt should remain entirely still your core shoulders etc will be passively engaged by virtue of trying to maintain good posture but i would not focus on them the things that should be moving are your arms and legs i am a member of a track club and they sometimes post form videos let me see if i can find one for you to show what i mean if you have a knot you should be fine to run on it as long as it not actively painful like it may hurt in the normal knotty way but if it radiating pain i would try to ice it for a day or two first otherwise run as usual and just work out the knot either with your an so a friend hands or using something like a lacrosse ball against the wall ,5,femalefashionadvice
kbol,i get a really similar issue with education in that i am statistically smarter than about 95 of the population i do not know how else to put it i am smart went to a top 15 school and was in the top 10 of my class there so i feel that i should be going to grad school because i know so many people who are going to med school law school one guy had the agonizing decision between duke yale harvard and penn law one girl is taking a gap year at a top 5 med school to do a masters of biomedical engineering at stanford just like incredible incredible things and i know i am of a similar intelligence as those people and i sometimes feel like i am wasting that ability by working in a job that i am good at but surrounded by less smart people or even not grad school but just something that sounds important but i enjoy my job it has great benefits it more challenging mentally than i would expect i get to travel i get paid well i am appreciated for my work it just really hard to shake that i am just doing this and not changing the world honestly i have not found a way to combat it yet but it sucks it does not come around super often but sometimes i just get the mean reds about the roads not taken in my life i feel you ,1,femalefashionadvice
