name,body,score,sub
kbol,the second dress in that album is the limor rosen clover http limorrosen com project clover from their birds of paradise collection ,1,weddingplanning
kbol,the black tux is partnering with select nordstrom stores to allow in store try ons i forget all of the cities they are doing it in 6 7 iirc but might be worth looking into ,3,weddingplanning
kbol,depending on the job there might not be stuff to have i am a remote employee for my company but when i visit the office all i really need is a station with an external monitor which they all do before i was remote i had stuff at my desk but it was like knick knacks ,1,femalefashionadvice
kbol,tohaveandtogoldman,3,weddingplanning
kbol,use it for your bachelorette pictures ,6,weddingplanning
kbol, starting with expressing from the beginning that i was only interested in a relationship that intended to lead into marriage yes i would do basically quarterly check ins with my now fiance saying literally i want to get married do you want to get married i want to marry you do you want to marry me i want to have kids do you want to have kids i want to have kids with you do you want to have kids with me it felt so painfully awkward the first few times to be so direct but these always have been and will continue to be important things that i want to experience in my life as much as i love him it was not worth sticking around for lack of better phrasing with someone who had different priorities ,8,weddingplanning
kbol,you are allowed to apply for a new passport due to a name change from marriage for free if it less than a year after a new or renewed passport that is if you renew your passport in january 2018 and you legally change your name and apply for a new passport due to that name change on or before january 2019 it free otherwise the cost is the same as any standard passport application fee 130 iirc ,2,weddingplanning
kbol,i did class of 2009 small reddit world oh cool like aerial silks i have always wanted to try that ,1,femalefashionadvice
kbol,omg yes i am how nuts i love it so far i moved here from atlanta and the uptick in walk and or bike ability everywhere that i have wanted to go so far we are in east austin has been so wonderful how long have you lived here ,1,femalefashionadvice
kbol,it is actually could be the same place and i just moved to austin o r u me,2,femalefashionadvice
kbol,my hometown in dfw had a huge mormon population too i do not know if that a thing or a weird coincidence our lds church was literally like a block away from the high school luckily the ones i knew were very respectful of other people beliefs i am sorry your experiences were so painful ,3,femalefashionadvice
kbol,welcome i just moved here but it wonderful ,2,femalefashionadvice
kbol,i think paying her back would be the right thing to do if you can afford it maybe once you offer she will tell you to apply that amount to your new dress she probably wanted to make sure you got the dress of your dreams but it worth giving her the heads up ,3,weddingplanning
kbol, if something making your legs look shorter and your ankles wider is not unflattering what is this outfit https s media cache ak0 pinimg com 736x 78 38 ea 7838ea63a5cb244955ec07ecdb897161 jpg intentionally makes her legs look shorter but i still think she looks good ,10,femalefashionadvice
kbol,vienna by billy joel my dad gave me the stranger album which vienna is on for my 17th birthday because i kept listening to vienna over and over again after hearing it in 13 going on 30 lol but it also describes our relationship really well it what i was thinking anyway but he specifically requested it ,2,weddingplanning
kbol,agreed i could save up for a wedding and a down payment or i can save up for the house after the wedding especially since people move all the time but you hopefully only get married once ,8,weddingplanning
kbol, her is this a joke basically my feeling about this whole article ,14,weddingplanning
kbol,good point floravere https floravere com collections gowns is an online only bridal retailer they send you the sample dress es you have picked with some clips and a cute bridal box champagne gummy bears some enamel pins for you to try on at home i tried them and really liked the choices they had ,2,weddingplanning
kbol,ooh i had not thought about getting long lengths i am 5 5 so that might work out perfectly ty ,1,femalefashionadvice
kbol,i think u textrovert is more speaking to the fact of ascribing to a patriarchal norm is at best benign and more likely is still feeding into that defined norm feminism brought us to where i have the choice to take his name or not but my choosing the easier side easier as in more socially accepted of that is not feminist it is not advancing the ideals of feminism nor am i taking on the emotional social sometimes legal labor of going outside of patriarchal constructs similarly women can be caregivers if they want to be or secretaries or what have you but they are not changing the fabric of society by doing so the idea is often conflated that if i as a self identified feminist do a thing that thing is feminist that all she pushing back on feminists can do patriarchal things some often times it is not wrong or bad or anything like that to do so but it is not feminist ,9,weddingplanning
kbol,i think the idea is that the ebates incentivises people to shop at that specific store and nordstrom probably decided that the payouts they were making were not worth the increased traffic or that the traffic increase was not enough they thought they could sustain similar levels without paying for it etc ,1,femalefashionadvice
kbol,i went to a school in tn that attracted a lot of northerners and so many people especially from the ne looooved to wear shorts when it was like 0 degrees out just to prove that they were hardier and better at winter than southerners eyeroll ,0,femalefashionadvice
kbol,we are planning a black tie optional wedding right now because we both have always wanted to go to one but never get the chance my fiance will look so good in a tux swoon ,2,femalefashionadvice
kbol,austin tx ,2,femalefashionadvice
kbol,i like my br sloans a lot if you are ok with a cropped ankle length and b low rise waist they are as comfy as any ponte pants i have owned but look a bit more formal but i have also worn them with stan smiths i do wish the rise were higher though ,3,femalefashionadvice
kbol,if it helps it very very very common to not end up with the dress you had originally imagined there was a recent post in here of about 200 brides showing off what they thought they would get vs what they got and i think i only saw maybe 3 people whose were fairly similar i thought i was going to get something like this https static1 squarespace com static 546e5582e4b01a45cc85c69e t 56cf92bf859fd01d9956a0eb 1456444106164 nashville bridal shop and ended up with this https i reddituploads com 7f0d7688a5d44473a16058240130aaf0 fit max h 1536 w 1536 s 4b350f9348c03e182af23b6b56c6060a wedding dresses are just a different ball lol game that being said i agree with the other advice here to try one more appointment worth of dresses with maybe 2 3 that are not a dropped waist ballgown or shaped like that stella york dress just to confirm that there is not another silhouette you might like even more at the end of that appointment reassess how you are feeling and see if your gut is pulling you in any specific direction i think that sy dress is absolutely perfect on you and for a nye wedding as an aside but do not let our opinions sway yours ,2,weddingplanning
kbol,i love both of those options you could also do something like jonesgetsmarreed or just gettingmarreed ,5,weddingplanning
kbol,assuming you are taking his last name beaulieuforsoup lol becomingbeaulieu beaulieuandbride goingbeauling you beaulieudmeover like bowled me over if you are fine with shortening it to beau you have a lot of options brideandbeau newbeau meandmybeau etc ,3,weddingplanning
kbol,this one made me legitimately laugh aloud ,3,weddingplanning
kbol,i got engaged in october and one of my male coworkers did not know until two weeks ago he felt terrible but i just found it funny that he would somehow missed all of the hullabaloo and my wearing the ring and my discussing our respective wedding plans with another engaged coworker ,3,weddingplanning
kbol,yeah i think that the difference it definitely a different mindset to get used to eg this is an amalfi coast trip not this is an italy trip but it a lot nicer to feel like we have the opportunity to go back and see milan or venice or whatever at a later date instead of we have done italy if that makes sense ,1,femalefashionadvice
kbol,we generally do not move around a ton during our trips so that might be the difference like for our italy trip in may this year we are going for 7 days including travel but flying into naples and spending about 4 days on the amalfi coast then taking the train up to rome for a day before we fly out similarly when we went to greece we had a long layover in paris so we went into the city but otherwise flew into athens were there for a day then went to santorini for 4 both times the island coast was the intent of the trip it just hard to get there directly our 10 days in south africa was barely enough and even though we were able to do overnight at a safari and johannesburg and cape town i would have preferred more time 12 days might have been perfect in that scenario or we should have just stuck with our mo of only going to one destination p long answer long but i think 7 10 days is sufficient for having one main destination but probably would not be great for visiting multiple cities countries at a time ,2,femalefashionadvice
kbol,my fiance and i are like really into dogs whenever we are apart for too long work or something and we have run out of things to say we send each other puppy gifs and the other person has to acknowledge receiving each picture by captioning them because these gifs are usually cute dogs doing funny things we originally called them funny puppies but that somehow morphed into fuh puh if we are joke mad at the other we say ok you get none puh which is a pretty serious threat our dream is to have one corgi and one shiba in the future the corgi will be named porkchop and the shiba applesauce so now every corgi is referred to as a chop and shibas are sauces similar to the above we do not ever say the word corgi corgis became corgums became gums and we like their tums and their bums so that one sticks but sometimes they are called lumpkins or lumps for short which are an especially rare breed of gums because lumps have to be harvested from the ground in the manner of a beet root we just moved cities and have been discussing what we think that means for lump harvest season this year we can very easily have a full on conversation in our personal gibberish language but it makes perfect sense to us ,6,weddingplanning
kbol,we have a stuffed corgi who lives a very full and interesting life he knows how to play dead and flip and tuck himself into bed and drive and yeah you are not alone ,2,weddingplanning
kbol,thank you it is almost literally exactly the opposite of what i thought i would get but i am obsessed with it ,1,weddingplanning
kbol,bumble lets you set an age range to look for in your area i think it initially set as 5 years of your age but you can adjust it to whatever i am 25 so it was showing me women from 20 30 but i think i would have more in common with 30 year olds than those still in college so i changed mine to be 22 30 ,5,femalefashionadvice
kbol,generally 7 10 days my fiance and i are just both lucky in that we can work from home really easily so we wfh around the holidays haha we also try to generally fly out on fridays and back on sundays when we can unless it prohibitively more expensive so we do not waste pto on travel days ,4,femalefashionadvice
kbol,i have a huge sweet tooth and i have loved having blueberries around when i get snacky it almost always satisfies my cravings and they are delicious at lot of different ways by themselves frozen in yogurt etc eta also not on the sweet side but sweet potato chips so yummy and way less salt than regular chips ,2,femalefashionadvice
kbol, i have yet to discern the difference haha yeah we get 15 days of pto and one floating holiday and it like why not just 16 days of pto ,6,femalefashionadvice
kbol,i get 15 days and i think i would be happiest with 20 i would never use more than that but being able to take 2 1 1 5 week vacations still have some time left over for the holidays would work perfectly for me eta 15 vacation days i do not know how many sick days i get in addition to that since i just work from home if i am feeling under the weather ,10,femalefashionadvice
kbol,i think since the dating side of bumble requires the girl to make the first move in m f pairings it might have the same restriction on the bff side plus i think it just less of a thing that guys i know would use so it might be that there only ladies on it not sure ,6,femalefashionadvice
kbol,i was browsing r weddingplanning the other day and my fiance moved my laptop for something and i guess i had a dress post up so he just got the guiltiest look on his face when i finally got him to fess up he goes i i think i saw your dress so it took me a few minutes to reassure him that it was not me i guess we had similar hair but also to not poke around my post history because i do have pictures of me in it i did not realize he was so into the idea of not seeing it ,6,weddingplanning
kbol, we are having an all well mostly all vinyl dj for our reception and my fiance is a huge music nut so this is particularly exciting for him we were originally thinking of doing a band but we both listen to like bon iver so none of our tastes aligned with something that would be good for our guests so we figured this would be a good way to make sure that we are meeting our guests needs well known music to dance to while still making the event feel very us we are likely having a plated farm to table dinner for about 30 head catering tastings this weekend but both are farm to table he probably the most excited for the one whose menu has pecan crusted quail as one of our entrees i am the one who cares about photography style specifically but my fh is obsessed with our photographer as a person trying to figure out to befriend him bump into him places etc haha,22,weddingplanning
kbol,if you wanted to keep it with a similar thing do a d for dan theme then announce you are done dating ,4,weddingplanning
kbol, 3200 for 9 hours second shooter engagement session and an online gallery with printing rights we are low key okay high key obsessed with our photographer and we have not even had our engagement session yet he exactly our style and exactly what we had budgeted to spend on what was my 1 priority ,1,weddingplanning
kbol,do any austin brides have alterations recs i still have quite a bit of time but my planning in a lull right now so i might as well see what the normal lead time is for the coveted shops ,1,weddingplanning
kbol,i got my hotel blocks in downtown austin for my late march 2018 wedding a few weeks ago and they were already starting to book up my planner took care of ours so i cannot help with logistics but especially if you are wanting something on the budget side and or convenient to your hotel the earlier the better ,1,weddingplanning
kbol, u kbol and i have practically identical wardrobes like it scary y all i met myself irl although it did confirm my suspicion that i would want to be friends with me if i were not me p,11,femalefashionadvice
kbol,sareh nouri mine the naomi ,2,weddingplanning
kbol, there are so many rules about what people can and cannot wear to weddings most of them are regionalisms black mourning the union red harlot trying to upstage the bride lol but pretty much everyone in western cultures knows about the no white to a wedding rule it not something new i just find it hard to believe that out of all of the dresses in the world there is not a single nonwhite option that suits you have every right to not care as a bride but to frame it as there being too many rules to follow is a little misguided imo ,18,weddingplanning
kbol,go to kelly closet i am moving away from atl tomorrow actually but i bought my dress there anyway on a just browsing trip with my moh the ladies there are the sweetest ,1,weddingplanning
kbol,thank u,1,femalefashionadvice
kbol,aaaaalso anthro has a bridal line called bhldn that is apparently beholden but i have just always called it b h l d n,7,femalefashionadvice
kbol,some people and i were discussing how to pronounce dagne dover the other day and i was surprised at the range of answers i am preeeetty sure it dag knee but i do not know that i have ever heard the brand pronounced aloud by someone in the know to confirm that suspicion ,10,femalefashionadvice
kbol,y all are seriously missing out on r weddingplanning my friends do not bother linking me stuff from there anymore because they know i have already seen read and thoroughly analyzed it great popcorn ,9,femalefashionadvice
kbol,i was going to say this too ,2,weddingplanning
kbol,probably about 10 12 dresses across 3 different appointments i felt like i had just gotten started but i think that about average ,2,weddingplanning
kbol,if she ok with one shoulder asos http us asos com asos asos one shoulder foam scuba dip back midi skater dress prd 7327269 iid 7327269 ,2,weddingplanning
kbol, s he spelled out will you marry me with the app icons ,4,weddingplanning
kbol,that super reasonable my block is 189 night for a much cheaper col area ,1,weddingplanning
kbol,we went to santorini in early november last year and it was incredible 70 degree days and we basically had the island to ourselves athens was chillier than we expected so make sure to pack for both ,2,weddingplanning
kbol,i have always wanted to be married when i grow up i appreciate the legal and social ramifications of being married and it just something i have always felt in my heart separately from that my fiance is my most favorite person to hang out with and i really want to do that for the rest of my life ,1,weddingplanning
kbol,gap has been my go to recently ,1,femalefashionadvice
kbol,i am planning a wedding too and currently really drawn to these https www macys com shop product nanette by nanette lepore ruby two piece block heel sandals only at macys id 4431962 ,2,femalefashionadvice
kbol,thank you ,1,AskWomen
kbol,i wanted to wear it we could have sent it in the same day to get it resized i just did not want to let it go ,2,AskWomen
kbol,reductress is a satire site like the onion for jezebel ,28,femalefashionadvice
kbol,i do not think she saying to hold onto it indefinitely but just that there is often little thought given to what happens to the thing after you discard of it which seems a little tone deaf for a movement that often pushes for ethical consumption should not ethical disposal be equally as important ,13,femalefashionadvice
kbol,my fiance had previously bought me a ring at my request and i told him that i have very thin fingers 4 75 but he still went with the jeweler suggestion of their standard size 6 5 so i had to walk around with my hand basically in a fist for the week i wore it before i sent it to get resized my nails were only done because i get gel nails done every month and they usually last 3 4 weeks i did not specifically get them done for or around the engagement but i know that pretty common ,2,AskWomen
kbol,yes i love it very much http imgur com oni4nnp this is from before i got it resized do not worry ,14,AskWomen
kbol,3 24 18 we have a planner venue my dress hotel blocks and photographer and will be having our caterer tastings next week and engagement shoot in april our planner is looking into vinyl dj options and we think we have the ceremony musicians we want to use but no contract yet i am not sure what comes up next after dj caterer kinda just following my planner lead but she and i are having a design discussion next week as well so i think we will start getting into decor soon after ,1,weddingplanning
kbol,cbb is the easiest to get into there no continuity between the episodes unlike hh where i would recommend starting at the beginning because they get super inside joke y really fast this http www earwolf com episode farts and procreation is my favorite cbb episode to get people into it i think i cried laughing the first time i listened to it i agree though i like all of the people that earwolf has but just the amount of content they produce overwhelms me and i do not really try any of them besides cbb and hh lol ,1,femalefashionadvice
kbol,if you listen to pistol shrimps i assume you already listen to other earwolf stuff cbb hollywood handbook with special guest lauren lapkus etc etc my fiance and i have also gotten really into pod save america recently and i am debating checking out their other pods too pod save america with friends like these although none of them have a huge backlog since they started like december 2016 eta it no longer running since grantland is defunct but they had a podcast called the right reasons that was so good and i did not watch a single one of the shows they discussed although i am a reality show lover just not avid follower ,2,femalefashionadvice
kbol,what specifically about the sleeve is important to you that will restrict your search by a lot i am a consultant and just wrap my tote handles around my rollaboard handles and that works fine for me eta i am trying to remember the name of it but i have a tory burch double zip tote that pebbled leather on the t but fabric on the outsides which is perfect for travel because it still looks nice stands on its own etc but i do not have to worry about leather scuffing when going through security my 14 laptop only fits in the main compartment though not either of the zippered sections eta2 found it this https www toryburch com ella canvas leather tote 41159500 html is my bag ,5,femalefashionadvice
kbol,credit karma is now offering a tax filing service and claims that it free but i am not sure if it subject to the same free claims as turbotax eg only the most basic of filings are free ,2,AskReddit
kbol, chittychittyringring omg i am dying over this one,15,weddingplanning
kbol,i am trying to eat mostly pescatarian these days so i have had to tell fiance a few times that a frosted flakes dinner is very much in line with that diet ,9,weddingplanning
kbol,yep first one is the christos penny i tried it on and loved it surprisingly lightweight for such a full skirt ,2,weddingplanning
kbol,thank you i am obsessed with it ,2,weddingplanning
kbol,yep my fiance and i use an app called splitwise to keep track of running expenses all of the incidentals for a given vacation etc which is integrated with venmo which we use to settle up with we like it a lot ,2,weddingplanning
kbol,same journey i felt pretty in the flowy stuff but i felt beautiful and sexy and bridal in the fitted one that i only tried to get it out of the way ha ,11,weddingplanning
kbol, what i wanted https static1 squarespace com static 546e5582e4b01a45cc85c69e t 56cf92bf859fd01d9956a0eb 1456444106164 nashville bridal shop spaghetti straps tight bodice organza or tulle a line or ballgown skirt very floaty and dreamy what i got https s media cache ak0 pinimg com originals 07 bb ce 07bbce652aa06fdcd7c2442915e2dc62 jpg satin clean lines fitted in the hips i hate that my mom ended up being right p ,20,weddingplanning
kbol,in general i am with you but i just feel like if you are a picky person be prepared to be disappointed regarding food options rubs me the wrong way it not my fault that lasagna literally makes me gag so if i showed up to a wedding and they were like our theme is lasagna i would feel pretty put out that i was not even given the option to mitigate the situation at all i do agree however that it not your burden to bear as long as you have properly communicated that tacos will be the food option people who do not like tacos can figure out how to take care of themselves ,1,weddingplanning
kbol,similarly i told my fiance that it was really important to me that he ask my dad before he proposed to me but i try to avoid mentioning that on here because i do not want to explain to people that i do not see myself as property etc etc it just something that matters to me ,30,weddingplanning
kbol,vanessa style leans closer to my own preferences although i do find it odd that not one of her portfolio shots comes from any actual ceremonies or receptions they are all portraits but somehow her portraits seem less stiff than any of the ceremony shots that i saw from ivy i think she has a better eye for both composition and editing but it does not seem like you are super thrilled with either do you have the time desire to keep looking as someone for whom photography is super important i would not really want to settle on a good enough photog but your priorities may be different ,2,weddingplanning
kbol,you could try the special moments wedding chapel http www specialmoments info gallery gallery in lewisville ,1,weddingplanning
kbol,i personally think the essence dress looks more decidedly bridal than the db one does you look great in both but something about that original dress feels a little more like a really nice prom dress or a nice evening gown i like the contrast between the white and the moscato on the essence and i just instantly see bride when i look at that one i also think the horsehair trim makes it look more flowy and romantic wood nymph y like you are floating ,3,weddingplanning
kbol,perfect thank you ,1,femalefashionadvice
