name,body,score,sub
Schneider21,i have issues connecting sometimes when i first load the game up if it was not fully closed ie shut down for the night booted back up and loaded the game right away i typically just quit the game fully from the dashboard before launching it each time you have to put up with the opening splash screens and everything each time but it does not seem to have a problem connecting then ,3,EliteOne
Schneider21, the paladin consortium http inara cz wing 286 is always looking to fill its ranks with cmdrs who recognize the importance of protecting those who cannot defend themselves if you like the idea of helping new players learn the ins and outs of the games while taking care of griefers and ne er do wells check us out we originated on the pc but our xbox fleet is growing rapidly and with the impending release of horizons we are going to need plenty more paladins to carry the banner see you in the black cmdr o7,1,EliteOne
Schneider21,upgrading your thrusters will allow your ship to have a larger mass attain a higher top end speed and increase your maneuvering speed turning and yawing ,2,EliteOne
Schneider21,this was my suggestion basically a full page of flying cobras ,1,EliteOne
Schneider21,1 in the galaxy map when you have a system highlighted press right on the d pad and choose the plot route button looks like the line with dots on it this will calculate a route for you and auto select the nav targets when you jump if you select a system that multiple jumps away you will see the lines on the map here solid for ones you can make and dotted if you would need more fuel 2 answered in part 1 above 3 i recommend against buying a docking computer for several reasons for one maneuvering your ship is an essential skill you will want to fine tune and practicing docking is a great way to do that second a docking computer would take up a module slot and with the early ships you are limited enough in that regard better to use that slot for something that can help you defend yourself or earn greater income as far as why they would not show up in your list though i am not really sure i will get back to you after i investigate 4 it depends if you are just going in for repairs or to sell some salvaged goods you just want to find the closest port that has the appropriate services available but if you are trying to turn a profit on some purchases or looking for appropriate missions to take on or looking to do missions for a specific faction it can be worth making the trip to the more outlying stations and sometimes you will have to go there for a delivery too so there that 5 unidentified signal sources uss weak signal sources wss strong signal sources sss distress beacons salvageable wreckage all those sorts of things are randomly occurring events that spawn they appear in your navigation panel i think when you are near them but once you are a certain distance away they will disappear they also do not appear on your system map do not worry though if you miss one just keep flying and you will see plenty more pop up 6 as long as your fuel scoop is powered it is by default it will activate automatically when you fly in the corona of an appropriate star only stars of type f o g k b a and m can be fuel scooped remember fog kbam or kgb foam if you prefer make sure you do not get too close or you will cook and start taking damage ,5,EliteOne
Schneider21,for courier missions you are fine doing whichever ones feel like you would want to do them ones with decent pay and not too far a jump range for example i would not worry about who offering the missions or anything just yet no way to tell what missions a station has until you land all stations offer different missions and they refresh regularly cobra mkiii costs 350k cr if i remember correctly general rule of thumb i have heard is to have at least twice the initial cost up front to be able to combat fit it and be able to afford the rebuy the best advantage i can think of for playing open is just being a part of the community open and solo do use the same universe and ships and everything so yes you can switch between the two as you like you are not at all as likely to be randomly ganked as a lot of people suspect there just something magical to me about flying into some random port and seeing an actual player undocking at the same time but do whatever makes you the most comfortable if you are looking for good people to play with hit up our discord channel https discordapp com invite 0z0jfyxdnyxl5h71 there always people looking to wing up and cmdrs of all experience levels are welcome lhs 3447 is the system most everyone players start at that system and the surrounding including eravate are generally considered the starting area it actually not a terrible idea to leave that area altogether as the few griefers there are sometimes like to poach in the area they know they will find clueless new players near the starting area is the kremainn system which is recently seeing an increased presence by the paladin consortium the paladins are dedicated to protecting and guiding new players so if you want to try open and like the idea of a bunch of strangers watching your back you could try heading there disclaimer i am a member of the paladins you can approach any of the targets you find by selecting them and lowering your speed as you get close then pressing y to disengage supercruise it takes some getting used to and you will more likely than not zip right on past targets quite a few times but you will get the hang of it generally adjust your throttle to keep the eta timer as low as possible without going below 6 seconds there are tutorials out there that can give you more specific instructions than that to stop at one of these points of interest you aim at it and press a your hud in the lower left will show you what it is your distance and speed same as waking to stations keep that timer above 6s and press y to disengage early on i would avoid most of those notices you see flying by as you progress and feel more comfortable in potentially dangerous situations start checking them out unidentified signal sources and weak signal sources tend to be easier engagements while strong signal sources are higher you can salvage wreckage if you like but the cargo you pick up is illicit and must be snuck into a port with a black market and sold there it way more profitable and easier to just run courier missions good luck cmdr see you on open play and possibly our discord channel soon i hope o7,4,EliteOne
Schneider21,when you accept a mission go to your left panel x left and view your transactions tab select the mission and choose galaxy map this opens the target destination in the galmap choose the icon that looks like the points with lines that will plot a course to your destination close the map if you disable flight assist before you make your first jump y rb when you jump to a star you will come to a dead stop otherwise you will be moving forward when you arrive and have to steer your ship away and or hit the brakes to avoid burning up if you do disable fa you will have to re enable it when you go back to normal space like if you get interdicted or low wake into a port or outpost with a course plotted the next system will automatically be targeted when you make a jump so just realign your ship with the yellow reticle on your hud or use the blue dot left and above your radar wait for your fsd to cool down and then jump again if you accidentally or intentionally changed targets like to scan a ship or stellar body you can open your navigation panel and find the system with the plotted lines icon next to it and select it there if you do get sucked into a star gravity well and start cooking do not panic quickly point your ship in the opposite direction of the star use the head look and your radar to figure this out throw all your power pips into eng and thrust to full if your target destination is in fact on the opposite side of the star and cannot be jumped to you may not be able to enter supercruise even open your nav panel and select any other target then try again once you get out of the well find the correct system and jump to avoid being scanned as you enter a port you have a few options one is to try silent running y lb using this shuts the exhaust ports of your ship lowering your heat signature but significantly increasing the internal temp of your ship i stopped trying to do this early on because all i seemed to do was wreck my internals i have never installed heat sink modules what i do is one of two things depending on where i come out of sc in relation to the port if i am near the entrance already and lined up nicely i get myself into position aimed at the mail slot from as far back as possible then i hit the gas and get through the slot before they can scan me if you see a message scan detected it means the scan has begun but you are not screwed yet it takes about 10 seconds to complete a scan so if you can break line of sight by getting inside you will be fine if i am on the side or back of the station i just crawl my way towards the front and keep a look out for sentry ships when you spot them or their trails they leave slow down or stop to avoid getting in front of them after they have passed move in quick and get inside just like you they can only scan what is in front of them so doing this is pretty fool proof smuggling is super fun once you have figured it out if you really like it it worth upgrading to an adder and putting a few upgrades on it to allow you to haul more at a time in my opinion good luck cmdr o7,6,EliteOne
Schneider21,came here to say pretty much exactly this to be honest i was playing the game for quite some time before i really felt like i was starting to understand it hell powerplay still confuses the crap out of me just stick with it and google or ask here when you run into things you do not get and you will be an ace in no time fly safe cmdr o7,3,EliteOne
Schneider21,are you deploying your hardpoints are your lasers and limpet launchers assigned to a fire group do you have enough power to run everything ,2,EliteOne
Schneider21,maybe a silly question but were you at the same location in the game even if you wing up with a friend you still have to physically go to the other location the exception would be once you are together you can nav lock and travel together easier ,1,EliteOne
Schneider21,welcome helping new players is an admirable role to take on since as you know the game has a fairly steep learning curve if you would like to participate in a more organized effort to assist your fellow cmdrs you should look into joining the paladin consortium http inara cz wing 286 we are a wing dedicated to guiding the lost and protecting the weak and it sounds like you would be a great fit for our organization additionally if you have not already you should check out our discord channel https discordapp com invite 0z0jfyxdnyxl5h71 where you will find plenty of cmdrs rookie and veteran looking to join forces and wing up fly safe cmdr see you in the black o7,2,EliteOne
Schneider21,my understanding is that fdev are in fact working on an api i am sure there will be some good companion apps coming out after that i will probably take a crack at making a companion actually ,2,EliteOne
Schneider21,you just reminded me that i am going on vacation on the 2nd ,3,EliteOne
Schneider21,fair point easier to sticky the mod posted one though to control edits and such have faith in your fellow phoenix ,2,EliteOne
Schneider21,in the interest of keeping the front page a bit cleaner all discussions on the release date and pricing of horizons 1 6 should take place in the stickied thread here https www reddit com r eliteone comments 4k4144 horizons16 release date revealed thanks for understanding ,1,EliteOne
Schneider21,let keep things tidy around here and keep all news discussion of the xbox one horizons and 1 6 release to this thread thanks everyone ,1,EliteOne
Schneider21,in the words of our shadow president our society can only become stronger by lifting those at the bottom not pushing them deeper to that end we must ensure the empire does not take control of the neits system lest their span of galactic oppression grow even wider ,5,EliteOne
Schneider21,i believe it only for nav targets no not other ships ,3,EliteOne
Schneider21,the sidewinder may be the exception to this rule the maximum capacity cargo rack that will fit in a slot depends on that slot class the sidewinder does not have any slots above class 2 and the largest size class 2 cargo racks are 4t you can drop your shield generator and discovery scanner to bring that total up to 8t but you do so at your own risk ,1,EliteOne
Schneider21,i had no idea you were an aussie as i have had no problem understanding you this whole time ,1,EliteOne
Schneider21,the most embarrassing mistake i have made so far is not realizing ships come with cargo modules lower than their maximum potential i was getting by with 16t cargo space in my cobra when i could have been moving 32t the whole time live and learn ,3,EliteOne
Schneider21,as long as you are only going after the metal rings it can be worth it the standard resource site materials are not ,1,EliteOne
Schneider21,you could always sell the ship back and buy a sidewinder to mine you will need mining lasers and a refinery at the least find a planet with metallic rings drop in somewhere and start chipping away i would recommend selling off your weapons and anything else unnecessary and going for the best refinery you can afford otherwise you will be spending a lot of time purging when you could be packing that stuff up to sell ,2,EliteOne
Schneider21,nice definitely my favorite https i imgur com hubietj jpg ,3,EliteOne
Schneider21,except the audible tink of the cmdr helmet off your canopy i imagine ,2,EliteOne
Schneider21,i was trying to pick up a bounty last night so i was supercruising around looking for baddies found an npc chasing another npc around and i got on his tail when the hunter finally interdicted his prey i moved in to drop into his wake by the time i had gotten there though there was only one ship the hunter i tried to avenge the destroyed vessel but i proved to be not up to the task and had to flee glad your story ended happier than mine and you know included real people ,2,EliteOne
Schneider21,welcome check out our discord channel https discordapp com invite 0z0jfyxdnyxl5h71 lots of xbox cmdrs there looking to wing up fly safe cmdr o7,2,EliteOne
Schneider21,haha i was gonna say those if you have them uploaded to a single imgur album you can just post the album link i think that will display them in a nice little carousel as well ,1,EliteOne
Schneider21,they do look fantastic i will give them that ,1,EliteOne
Schneider21,you are reading an awful lot between the lines i did not suggest you were claiming your shots were perfect you originally called his picture terrible then showed him your shots to show what he should be going for that what i was commenting on i did not say you should stop or be silent you just demonstrated that you are an ass and i was letting you know that is all if throwing harsh words at others who are sharing their work and then editing those words later to cover your tracks helps you get through the day then well good luck with that but when you are a shitposter realize that there a watchful eye on you so when you do break the community rules it wo not go unnoticed ,2,EliteOne
Schneider21,is the common belief that they are useless or that the cost damage ratio does not compare to simply using multicannons and such ,5,EliteOne
Schneider21,i had a limited amount of time to play saturday so i was feeling a bit rushed took forever to find him followed him around until he went up to the attic and i had to take the long way around since i was dressed as a bodyguard and the chaps at the stairs would have made me by the time i got up there he was just leaving without going into too much detail things got messy i made it out and successfully completed the mission but my rating was very amateur lesson learned take your time ,3,HiTMAN
Schneider21,i think if you had said purrfect you would have been a shoe in ,2,EliteOne
Schneider21,most people are sticking close to the bubble you do not want to be out in the black without an srv and unable to enjoy the new surfaces i would think you would also want to start saving up some cash ,6,EliteOne
Schneider21,good tip i have just been screaming ramming speed and throwing the throttle to full when a chaff cloud goes off zip on past them lose sight plink plink plink shields offline rebuy ,6,EliteOne
Schneider21,it great to give tips and advice but why is your tone so condescending your shots are fine sure but there nothing spectacular about them that makes you some kind of genius photographer and even if there were criticizing someone else work does not make you seem any more impressive the ships in this game are also gorgeous and i for one love seeing shots with them in it it could be more exciting to offset the angle a bit maybe but this is far from what i would call terrible ,3,EliteOne
Schneider21,just celebrate with us damn you but yeah it will probably go away by the end of the day ,5,EliteOne
Schneider21,what you do not have a frameshift wake predictor on your ship p i have seen a few of these posted on r elitedangerous too i am sure it been reported as a bug but would not hurt to add another to the list https forums frontier co uk forumdisplay php f 105 to drive the point home ,1,EliteOne
Schneider21,the mkiv will be arriving with the horizons expansion and will likely be quite a bit more expensive than the mkiii one of the reasons the cobra mkiii is so popular is the package for the price so you should definitely pick it up earlier on to reap some of that benefit ,1,EliteOne
Schneider21,agreed coming from a unary star system myself i am fascinated by the idea of two or more suns in a planet sky when horizons lands i am sure i will be taking lots of pictures of dual sunsets and such have more pictures to share ,5,EliteOne
Schneider21,huh ,3,EliteOne
Schneider21,excited to be a part of the elite xbox one community and all its craziness thanks everyone ,1,EliteOne
Schneider21,the cobra is a nice early game multirole ship the cost may seem high at this stage but with some smuggling runs in your adder you should be able to build up the cash in no time just do not forget to save up enough to add the necessary improvements and be able to cover the rebuy cost too good luck cmdr o7,2,EliteOne
Schneider21,haha no i did not we did a bit of an outpost waltz before i opened the comms i was unaware bumping was sort of a standard greeting ,2,EliteOne
Schneider21,you can join in our discord channel by clicking the link in the message above or click here https discordapp com invite 0z0jfyxdnyxl5h71 if you prefer if you already have a discord account you can join our channel by clicking the on the left sidebar clicking join and pasting our channel link in the text field there ,1,EliteOne
Schneider21,copy the link i posted above in your discord app open the sidebar and tap the icon on the left side choose join then paste the link there ,1,EliteOne
Schneider21,not at all i am saying it someone looking to pvp that does not want to be a griefer i have no problem with people rping a role that puts them in conflict with other players i am merely stating they chose that position simply to pvp and recommending responding to their actions with appropriate reactions ,3,EliteOne
Schneider21,agreed also worth stating that it is worth going through the in game tutorials if you want to be a competent cmdr if when you want to wing up with your fellow xboners check out our discord channel https discordapp com invite 0z0jfyxdnyxl5h71 to see who available and looking to partner up fly safe cmdr o7,3,EliteOne
Schneider21,it seems to me there are always players justifying going against community goals just for the sake of it often justified with some in character reason but in reality it just an excuse to pvp without being labeled an obvious griefer i would recommend bringing a few friends and showing them that the community will prevail best of luck cmdr o7,2,EliteOne
Schneider21,the game is brutal just because missions are available for you to pick up does not necessarily mean they are actually you know achievable i would recommend sticking to simple delivery missions not the same as sourcing the goods yourself and light trading until you really get the hang of things upgrade your ship a bit try taking on wanted npcs near nav beacons if they seem low level enough check out the links in the sidebar here for some good tutorials on different career paths and be sure to join our discord channel https discordapp com invite 0z0jfyxdnyxl5h71 if you want to wing up with your fellow cmdrs fly safe cmdr o7,1,EliteOne
Schneider21,it always exciting when a game community starts to boom one of the ways elite is distinctly different from other multiplayer games is that new players are pretty much incapable of ruining the experience for the long time veterans for example in a co op shooter a la cod an inexperienced player on your team has the potential to wreck your ability to score points and win the match no such correlation exists with ed while it certainly possible to cause a bit of mayhem with a sidewinder experienced players are able to whip them into shape very easily with this power of course comes great responsibility if a new player is harassed constantly and blown up any time they leave port they will grow up to become harassers themselves if on the other hand they are coached into being great additions to the community yes even as noble pirates the galaxy will be all that much better off that why i joined the paladin consortium whose mission is to guide the lost and protect the weak just this weekend i had my first practical assist an adder spinning aimlessly around lawson orbital bumped into me as i was undocking i sent a comms invite to him and discovered he was playing with a friend for a bit and went out on his own only to get lost he was trying to get back to trevithick but had no clue how i winged up with him and guided him back explaining the core game concepts on the way he was very appreciative and seemed to already enjoy the game more now that he understood it better it really is a rewarding feeling when you help someone like this and with the sale and upcoming expansions there will be plenty of people to help soon enough fly kindly cmdrs o7,10,EliteOne
Schneider21,welcome check out the eliteone discord channel https discordapp com invite 0z0jfyxdnyxl5h71 lots of cmdrs there looking for a wingman fly safe cmdr o7,1,EliteOne
Schneider21,it sounds like a bug when you have an assassination contract active there a chance for the target to spawn any time you low wake into a destination may be increased chance for certain types like uss etc no fire zones are probably intended more as protection from being pvp would so your target action of firing on you likely was not recognized by the game as being in violation of the rule it may be worth it to report the bug to frontier https forums frontier co uk forumdisplay php f 105 and see if they respond with a better answer ,1,EliteOne
Schneider21,welcome check out the eliteone discord channel https discordapp com invite 0z0jfyxdnyxl5h71 lots of cmdrs there looking for a wingman fly safe cmdr o7,1,EliteOne
Schneider21,there a lot of other cmdrs looking to wing up check out the eliteone discord channel link in sidebar and above first post and introduce yourself there you will be flying with a wingman in no time,3,EliteOne
Schneider21,goodness i could not tell you a fellow going by digitarry on discord made the video under big pappa direction he would be able to enlighten you if you tracked him down ,1,EliteOne
Schneider21,fixed i i think ,2,EliteOne
Schneider21,great response although i like to recommend trading or even light smuggling when starting out i am willing to wager the pirate who attacked you was an npc player cmdrs who are pirating you are a bit more patient and prompt a response while player seal clubbers would have just ganked you without saying anything these type of players are thankfully few and far between ,1,EliteOne
Schneider21,welcome those are quite the questions and unfortunately i am just heading out the door take a gander through some of the links on the sidebar here to get started and i will report back in a bit with specific answers to your questions when i get a chance fly safe cmdr o7,1,EliteOne
Schneider21,not sure what happened to the original clip video http xboxdvr com gamer schneider21 video 17467629 ,2,EliteOne
Schneider21,i have only just joined them really getting my elite on in the last few days but the reason i did was because of what they stand for much like the respectable fuel rats the paladins are very focused on making the game fun for new cmdrs so many mmo style games die off because of a toxic minority that ruin the experience for many ensuring new players have a great initial experience is the only way to ensure the community continues to grow which only benefits the rest of us as well thanks for the words of support ,3,EliteOne
Schneider21,i am only a hobbyist game developer so this is more of an educated guess than anything the landing computer pretty much just turns your ship into an npc ship using the same path finding and behavioral instructions they use when docking the scene geometry has collider that the ai finds routes around through and trigger areas that would notify the ship to deploy landing gear descend vertically etc as in anything with development it only insanely complex at a high level when you break it down into individual tasks it much simpler ,1,EliteOne
