name,body,score,sub
Schneider21,i feel like people are nitpicking your phrasing i think the real question here is what did early peoples of the area now known as norway refer to the area as which i am also interested to know i am additionally interested in what the entire peninsula was called especially by the time of the viking age as the way i understand it scandinavia was not a term that came about until much later ,3,Norse
Schneider21,if only you had a few extra tethers set out near you ,2,Astroneer
Schneider21,from what i have seen it actually items connected to the front or back they pop off when the blue ghost cable appears showing you can connect your rover for power i am sure it a bug and will be addressed but it is quite annoying i have to be sure to park far away from my base for now ,3,Astroneer
Schneider21,this is my favorite astroneer video yet ,9,Astroneer
Schneider21,day 1 and we are already getting some quality shitposts this bodes well ,15,Astroneer
Schneider21,the ways i have discovered you can die getting hit by a rock during a storm falling too far asphyxiation gas clouds from scary plants all of those have a pretty clear indicator they are about to happen one thing i have noticed is sometimes i assume i am tethered to the base but the game lost one of the tethers up the line and i am not actually connected and receiving oxygen this is obvious because there no line joining you to the tethers but sometimes i am just not paying attention ,2,Astroneer
Schneider21,did you jump off then or keep going up until you ran out of air ,1,Astroneer
Schneider21,i do not recall the devs ever saying you could build a tower to another planet ,2,Astroneer
Schneider21,awesome adding this to my todo list ,1,Astroneer
Schneider21, is the on board printer the thing in your inventory where you can craft stuff like batteries and solar panels yes exactly what does the full size printer do it allows you to craft larger items that would not fit in your backpack like vehicle parts big solar panels etc i believe you will have to find all the appropriate research items first though ,1,Astroneer
Schneider21,nice i can confidently say that the coolest space mower i have ever seen does it auto collect the organics ,1,Astroneer
Schneider21, how do you make the little tethers that let you keep oxygen while exploring at a long distance if you have some compound in your pack you can craft the tethers using your on board printer then press t on pc down on xbox to pull out a tether and click right trigger to place the tether is the only way to get new blueprints to research those weird balls cubes you find yes at least currently those are more abundant than you might think though look around and investigate everything what are the little things on the side of the machinery for for example if i wanted to build a printer it takes 2 copper but it also has slots on the side of the tech base that you can put any material on those are slots they can be used to attach resource nuggets for storage attach components like solar panels generators etc or in certain cases be the output of the platform device as is the case with the smelter do things like solar or wind power have any affect of your suit or just your base for example i made a solar power thing and then attached it to a piece of my suit so that it was next to the wind speed reader but it did not seem to change anything about how much power my suit was gaining yes they work on your suit too obviously you have to be in sunlight for the solar panels to work and in wind for the wind generator to work ,1,Astroneer
Schneider21,adam mentioned in a dev stream that enabling the debug console was actually a flag they set when building the game so it quite possible there will be no way to access it in any release version which for me is good because i am weak and like to cheat and end up cheapening the experience for myself and abandoning the game ,2,Astroneer
Schneider21,well nuts i guess just dig a hole beneath the shuttle as deep as you can and bury it doing your best to forget about all the time and resources you spent building it ,1,Astroneer
Schneider21,no worries i do agree that using the camera is the least enjoyable part of the experience so far we will just have to tough it out and keep providing constructive feedback eventually we will either be given everything on a silver platter or have gotten used to the wonkiness ps welcome to reddit watch your step p,2,Astroneer
Schneider21,maybe a silly question but does the shuttle have fuel in it ,1,Astroneer
Schneider21,what issue are you having specifically brendan already mentioned here https www reddit com r astroneer comments 5ik6q1 i know this is prealpha but the control options that they are working on fixing the camera in the next content update so if you voice specific problems you are having they will be able to address them better ,2,Astroneer
Schneider21,your mission should you choose to accept it is to travel to the planet s and save its mostly plant residents from certain doom ,1,Astroneer
Schneider21,gave me a chuckle ,1,Astroneer
Schneider21,it is a cute little base though and you have everything you need to get going get that rover going so you can gather all the research and build yourself a base 2 0 ,1,Astroneer
Schneider21,it does not currently have local multiplayer it something the devs are looking into ,2,Astroneer
Schneider21,besides watching intentionally always sunny is my put show on set volume almost off turn away from tv and fall asleep show it just comforting knowing that it on even not being able to hear it the show is immensely entertaining just watching the actor expressions there some minute shrug or smirk or eyebrow twitch i catch each time i watch that i had not noticed before favorite show of all time ,1,AskReddit
Schneider21,throwing my hat into the inverted mix here have not had a chance to play yet but i know exactly the issue you are describing from dealing with it in other games hopefully a fix comes along before my brain rewires itself to deal with the inverted mess ,3,Astroneer
Schneider21,there no reason to believe this will cause ownership issues when changing your region back to us is there ,1,Astroneer
Schneider21, 25 aud is actually 18 40 usd so that a bit of a discount even ,1,Astroneer
Schneider21,thanks for posting xbox info the controls were are my biggest worry and i am sure they will take some getting used to i believe ms is expected to provide mouse and keyboard support on the xbox sometime soon so if i cannot wrap my head around it there always hope for that p also interesting that view distance is a control binding and not a menu option i imagine that will change somewhere along the line ,2,Astroneer
Schneider21,cute p,3,Astroneer
Schneider21,the only partials i have seen actually on the backpack are from partially consumed nuggets like power tethers etc because as far as i know you wo not get a nugget from the vacuum until it fully packed so to speak what i am referring to specifically is if you are vacuuming up for example resin and have half a nugget worth still in the vacuum then you go off and collect a nugget or two of something else and come back to the resin does it pick up with where you were before or do you have to start with an empty nugget again ,1,Astroneer
Schneider21,love the candid and transparent communication from this team keep that up and i am betting you would be hard pressed to find anyone able to level a legitimate complaint against the game ,7,Astroneer
Schneider21,thanks adam to be clear i do not care if you never add anything beyond what i have seen in your dev streams so far your twitch streams in particular and the obvious passion you and the team have for the game is what sold me on it cannot say enough how excited i am to play astroneers and how inspired i am by the game aesthetic ,1,Astroneer
Schneider21,sub for this ,5,gifs
Schneider21,or could be that it a joke since nobody fishes everyone is the best fisherman would not put it past that british humour ,5,The_Trail_Game
Schneider21,time spent doing science is never wasted ,1,The_Trail_Game
Schneider21,from modernature community rep on the official forums hello it is an online game in the fact that you can chat with other players in a town saloon and you can compete against each other via the town competition however when you are out on the trail you are interacting with npc versions of real players those appear based on where the person last logged off for example if you logged out in turkey prairie right now and i walked over there i might run into you but it an npc version of you not actually you ,1,The_Trail_Game
Schneider21,yes trying to stock up on pine logs and not finding any pine trees in the early areas edit appears to be a few trees on the walk up to eden falls at least ,1,The_Trail_Game
Schneider21,bought the starting settler pack today and feel like it was a great choice i used the included favors to purchase a banker hat and between the extra stamina hooks and pockets i now feel like i can focus on crafting more advanced items and upgrading my town rather than worrying if my pants are going to fall apart every time i stand up be warned you will quickly be prompted with another limited time purchase also 7 99 with a different set of equipment favors etc but going a good bit out from eden falls i have not needed to even carefully manage my stamina yet ,1,The_Trail_Game
Schneider21,whoops sorry i do not get notifications or anything from my reddit inbox maybe tomorrow sometime ,1,The_Trail_Game
Schneider21,sounds like a fun experiment i will participate if you can arrange it during standard business hours ,1,The_Trail_Game
Schneider21,ah steam probably only has the year logged in their database and when writing the date to the view assumes an empty month to be january and an empty day to be the 1st typical lazy developers p,1,HiTMAN
Schneider21,sorry this is not accurate hitman codename 47 na 19 november 2000 eu 1 december 2000 hitman 2 silent assassin microsoft windows playstation 2 xbox na 1 october 2002 eu 4 october 2002 gamecube na 17 june 2003 eu 27 june 2003 hitman contracts na 20 april 2004 eu 30 april 2004 hitman blood money eu 26 may 2006 na 30 may 2006 hitman absolution microsoft windows playstation 3 xbox 360 ww 20 november 2012 os x ww 15 may 2014 hitman 2016 episode 1 ww 11 march 2016 episode 2 ww 26 april 2016 episode 3 ww 31 may 2016 episode 4 ww 16 august 2016 episode 5 ww 27 september 2016 episode 6 ww 31 october 2016 retail version ww 31 january 2017 so it would be more accurate to say that not a single hitman game has been released on january 1st edit formatting,1,HiTMAN
Schneider21,i love that you have the marquee and bottom artwork in there great work on this ,1,RetroPie
Schneider21,news to me thanks for the tip ,1,Unity3D
Schneider21,has to be ported bookmarking this so i can take a peek at it when i am not on mobile i would be happy to help port it if you are going to open source it ,5,Unity3D
Schneider21,how is this not an hbo series already this sounds delightful ,5,CrusaderKings
Schneider21,that how they do it in the got mod more or less ,1,CrusaderKings
Schneider21,rip its were our beer stand ins over there had a cooler on top of the stryker loaded up and the gratitude i would receive for passing an ice cold atomic pom or power was almost enough to offset the remorse i would feel when i had to inform the driver we only had sugar free citrus left ,1,worldnews
Schneider21,i believe shutting the gates lowers the chances of disease spreading into your court it also restricts your diplomatic actions like council members being unavailable to dispatch and certain intrigue events are unable to be initiated if you are sequestered away ,3,CrusaderKings
Schneider21,many years later patrick the longpotato king of ire supervised the wedding of his eldest daughter who would succeed him to the throne as husband for his daughter longpotato had chosen the son of his rival the king of lombardy it was widely whispered that for the prince to conceive longpotato would have to do the honors himself that may have been what he had in mind all along ,5,CrusaderKings
Schneider21,you cannot changing hud color on pc is actually a hack that messes with your other in game colors so it not an official feature anywhere even ,4,EliteOne
Schneider21,well clearly their mods do not share the love for bob ross we have here on r eliteone ,2,EliteOne
Schneider21,you will be banned for posting about bob ross in this sub unless you also link to your favorite episode or say happy little somewhere in your post so you are good i think ,3,EliteOne
Schneider21, remindme in 24h to check out this amazing ama of u the main moon,4,AskReddit
Schneider21,buh la kay the way you said it sounds different ,1,funny
Schneider21,looks totally fine to me ship it ,2,Unity3D
Schneider21,i have seen st09 a few dozen times now fx has been playing it for a few weeks and never paid attention to whose beagle it was that scotty lost thanks ,1,startrek
Schneider21,no it did not i got the joke which is why i laughed the hidden social commentary was in regards to our inclination to just do what everyone else is doing despite not having a personal desire or need to do so but thank you for your input ,1,AskReddit
Schneider21,this is actually totally expected i cannot recall a single time my infantry unit ever trained without our rifles even empty you are still training on where to point your weapon and how to not flag friendlies so the fact they are just running in head first totally unarmed suggests these are people who never expect to actually see combat ,0,Unexpected
Schneider21,there was a russian guy in my national guard unit who most of us could barely understand during a drill weekend a small group of us had our names called to fill out some form or other he sees us standing in line and just nonchalantly strolls over and gets in line behind us one guy says igor what are you doing to which he responds i dunno what are you doing you mean you just got into line for something just because igor says hey man in russia when you see a line you do not ask questions you just get in it i mean i laughed my ass off but i am sure there a poignant social commentary in there somewhere ,7,AskReddit
Schneider21,on this sub your flair is enough to get you downvoted and apparently there somebody who will report posts where someone mentions using private groups ridiculous ,2,EliteOne
Schneider21,interesting but only anecdotally related ,1,EliteOne
Schneider21,what languages does having extra slashes break the comment ,1,Jokes
Schneider21, so am i ,57,Jokes
Schneider21,that happened to me in basic training when a drill sergeant overheard me doing an impression of the company first sergeant took me over to where the other drill sergeants were all congregating and was sure i was about to get destroyed only to be instructed to do the routine again cracking them all up that when i knew my experience in the army was going to be very different from the movies ,13,dadjokes
Schneider21,work safe work smart your future depends on it ,3,gaming
Schneider21,on one hand i am sorry to see you go man it always sad to part ways with people you may only know in this strange digital way of ours but on the other it sounds like you are at an exciting point in your life and i wish you all the best with your new home take care of yourself o7,2,EliteOne
Schneider21,there is when are you available to receive ,1,EliteOne
Schneider21,we will be in touch cmdr o7,1,EliteOne
Schneider21,agreed looking forward to working with you ,1,EliteOne
Schneider21,i love it especially the pinging off the back wall ,1,EliteOne
Schneider21,you can help other players by hanging around the starting systems and looking for people in need players struggling to dock zipping past their waypoints getting pounded on by harmless eagles that sort of thing send an offer to chat and see if there any information you can provide or assistance you can lend in combat if you are interested in helping the paladin consortium faction we can always use a hand specific missions are only issued to members so sign up through our inara http inara cz wing 286 page to get started and we will have you running assignments in no time ,2,EliteOne
Schneider21,we are in a boom right now with new xbox players if you want to start the process of joining sign up on our inara page if you would just like to fly with a few of us for a bit to get a feel for how we are let me know and i will set something up ,1,EliteOne
Schneider21,welcome there so much advice to give but it sounds like you are doing a pretty good job figuring things out on your own one thing i would say is to not be afraid to try refitting your ship for different roles selling a module back or just replacing it with a new one gives you the exact amount back you paid for it so you wo not lose money switching from being a miner to a bounty hunter to a trader the starting sidewinder is free to replace when you die not counting the cost of any modules you installed but still cheap with those so also do not be afraid to take risks practice your combat at nav beacons accept high risk high reward jobs when you get the feel for which kind of activities you really enjoy then you know what direction you should start leaning to buy and customize a specialized ship once you have the funds to outfit a new ship expect to spend as much on upgrades as you did for the ship itself d rated modules are a great place to start since they are much lighter than e and c modules most of all just have fun fly safe cmdr o7,3,EliteOne
Schneider21,oh my god that worse than i imagined you just hear the horrible sounds and then switch back to see the message telling you what you already knew and feared and for added effect the fact you just sit there and do not move really demonstrates the shock you are probably feeling let us know how the contact with fdev goes ,1,EliteOne
Schneider21,yeah we kinda need to see that p as deathtrapminer said you should send the clip to fdev they are really good about refunding players for losses caused by bugs glad you guys had a sense of humor about it though ,1,EliteOne
Schneider21,pictures for those of us without imp vessels please ,2,EliteOne
Schneider21,does your ship computer indicating it malfunctioning or do things shut down when you extend hardpoints if it the second thing you may have power management issues ensure your power requirements are not exceeding 100 and if they are set up priority groups to ensure vital systems stay operational if it the first one we will probably need more information to get to the root of the problem ,1,EliteOne
Schneider21,looks nice to me you might not have it set up this way in game but i definitely recommend splitting up your power priorities a bit more the way it is now if your power plant becomes damaged everything is going offline having more priority groups will make sure the important things keep running ,2,EliteOne
Schneider21,well done sir perhaps you can get a head start and rendezvous at the first rally point in any case best of luck with your upcoming adventure ,3,EliteOne
Schneider21,that quite literally a horizon to anyone ,5,EliteOne
Schneider21,i doubt they respond to every ticket the potential for overpowered npcs is a know issue and will be addressed in a yet to be determined patch ,1,EliteOne
Schneider21,it under miscellaneous enable context menu unfortunate bug oversight to have it disabled by default now ,3,EliteOne
Schneider21,did you sign out and sign back in did you get destroyed or were you just falling forever ,1,EliteOne
Schneider21,horizons currently does not work with game sharing only the person that purchased the game dlc has access to horizons content frontier developments has indicated they plan to fix this in the future but has not elaborated further than that ,2,EliteOne
Schneider21,lol,1,EliteOne
Schneider21,i am assuming it for balancing reasons if you could create a single ship type that could do all things well there would not be much need to diversify your fleet ,8,Stellaris
Schneider21,the blue semi circle means you can land the bar graph actually supposed to be buildings means there are settlements or bases on the surface ,1,EliteOne
Schneider21,lol,-2,Stellaris
Schneider21,i have seen people do it at the beginning but i think it usually at the end of a long block of text for those times when someone starts reading gets bored and scrolls past but then catches the tldr and decides to catch the gist anyway it also works nicely as a recap of what you covered for those who did read everything but are forgetful ,1,EliteOne
Schneider21,some people are pressed enough for time that every second matters p,1,EliteOne
Schneider21,engineers is update 2 1 which is included in the horizons season expansion tl dr yes ,3,EliteOne
Schneider21,glad to hear it looking forward to seeing you out there cmdr o7,1,EliteOne
Schneider21,all are welcome check out my other comment for the link if you have not already do not forget to tell em schneider21 sent ya p,1,EliteOne
Schneider21,yeah it a weird little oversight on the dev part i think you do not need cargo space for the mission delivery but your reward contains cargo and you need room to accept it ,1,EliteOne
Schneider21,yeah it a weird little oversight on the dev part i think you do not need cargo space for the mission delivery but your reward contains cargo and you need room to accept it ,1,EliteOne
Schneider21,totes i never got involved in cgs at first but once i recognized their value i have not missed one since disclaimer i have missed several ,1,EliteOne
Schneider21,i believe if the mission has a reward that contains cargo as missions can now do as of 1 6 you cannot turn in the mission without having the necessary cargo space available ,1,EliteOne
Schneider21,awesome check out our inara page http inara cz wing 286 and click join at the bottom you should receive a response from one of our officers shortly looking forward to seeing you out there cmdr o7,1,EliteOne
Schneider21,player groups organize through inara inara cz there are a good number of xbox specific factions as well as cross platform ones i can only speak for my own faction here so i encourage others to speak out on their own here the paladin consortium is dedicated to assisting new players with learning the game and protecting them from gankers and griefers i have only played with the xbox fleet and they are a pretty relaxed group of guys several help themselves to quite a number of alcoholic beverages during their play time so they are not super serious i suppose i generally only have a few hours a night to play so i also cannot get into things as hardcore as i may like i think you would feel comfortable with us if supporting our mission statement sounds like something you would be interested in ,1,EliteOne
Schneider21,you were not called anything you were acting as if purchasing during the gpp entitled you to something more than what new purchasers were receiving with the current promotion i commented on that but did no name calling please refrain from further name calling and hostile remarks thanks ,5,EliteOne
Schneider21,my lord such entitlement good luck with that ,7,EliteOne
Schneider21,it not bs game prices typically go down over time and it not uncommon for late comers to get slightly sweeter deals to encourage them to purchase you might as well complain that i could buy a 2014 model vehicle at a lower price than what you paid for it new ,6,EliteOne
Schneider21,as a software developer and hobbyist game dev i absolutely agree ,2,EliteOne
Schneider21,which is why i said they support it to a degree ,0,EliteOne
Schneider21,as someone who has to buy all my own games i do not disagree with your opinion people getting stuff for free do not have much right to complain in my opinion microsoft does seem to allow and even support to a degree people sharing in this way so i am not really fully against it i do wish people would just google or at least read and comment in one of the dozens of existing threads on the subject rather than post their own saying the same thing but i guess if everyone followed reddiquette exactly there would be no need for mods p,-6,EliteOne
Schneider21,definitely your best bet fdev is unlikely to allow you to teleport but nothing wrong with opening a new account plus you would get to experience the new tutorial missions this way ,1,EliteOne
Schneider21,i think it perfectly acceptable and common to go with a dbs or even a scout over an explorer i think the reasons people go with the explorer are the same reasons people buy expensive cars irl they have the money and they want it all you can still be a perfectly efficient and successful explorer in a lower cost ship though ,1,EliteOne
Schneider21,nice i did not know this ,2,EliteOne
Schneider21,thanks for pointing to the technical explanation as a programmer myself i am very sympathetic to the devs on this one with an application as complex as ed it to be expected that issues like this rear their head now and then coding the original app is complicated enough let alone when you are modifying and expanding on that code continuously ,1,EliteOne
Schneider21,certain elements are like removing engineer upgrades from npcs what changes like the railgun with beam laser rate of fire are code changes that need to be made in a patch ,1,EliteOne
Schneider21,it does not sound like they are holding back on xbox or anything just that they cannot say exactly when the xbox patch will roll out because of microsoft certification process ,8,EliteOne
Schneider21,nice finisher love the sound effects of those missiles ,2,EliteOne
Schneider21,ah i think this is what happened to me last night thanks for the explanation ,1,EliteOne
