name,body,score,sub
Schneider21,this looks adorable and it seems crazy complicated to learn how to control but equally rewarding when you figure it out what is the release looking like on this one edit nvm found the trailer indicating march 28th release yet another item added to my wish list ,9,NintendoSwitch
Schneider21,a him album sighting in the wild neat ,2,NintendoSwitch
Schneider21,makes sense that you would argue against zelda score considering your username ,2,NintendoSwitch
Schneider21,haha my wife was great about me getting the system she never told me i could not get something but i do feel guilty that i buy things like xboxes and macbooks and when she spends money it stuff for the house or our kid she used to play games back in the snes days she loved donkey kong country and kirby avalanche so my dream is that she will get back into it with the switch then instead of sitting around watching netflix at night we can occasionally play a game together a man can dream good luck with your marriage post snipperclips ,1,NintendoSwitch
Schneider21,this works out great for me seeing as i do not have any friends ,1,NintendoSwitch
Schneider21,this works out great for me since i do not have any friends ,3,NintendoSwitch
Schneider21,yeah this is perplexing ,2,NintendoSwitch
Schneider21,the poem was awarded a rare perfect score but that not enough let times it by four 40 40 40 40 ,3,NintendoSwitch
Schneider21,snipperclips instantly caught my attention and was a guaranteed buy for me since the only other game i am getting for now is zelda sc will be my first multiplayer game that i will be using to try and win over my wife approval of the system i was stoked to learn it will be a launch title ,14,NintendoSwitch
Schneider21,i think what u sanjisasuke was referring to was that the battery life limits can be overcome with an external battery to handle sessions longer than 3 hours no modern handheld device smart phones tablets gaming handheld is capable of heavy operation for over 7 hours anyway so criticizing it beyond that is not relevant if you anticipate frequent occurrences where you will want to be playing for hours on end without access to your dock you will want to invest in a spare charger car charger external battery etc yes it an additional cost but it to cover what is beyond the normal use case i think ,1,NintendoSwitch
Schneider21,i think the way you are describing it is the logical normal human way of looking at things maybe it a phenomenon specific to video games or maybe it pervades through the tech industry as a whole but i think there a tendency to be critical of free things as a means of assessing its true value since your wallet did not decide that for you in this case similarly if you did pay for it you may feel compelled even subconsciously to defend the product shortcomings as a way of justifying and feeling good about your purchase i have nothing to back this up just thinking it may be the case for some ,1,NintendoSwitch
Schneider21,i was freaking out all day wondering why mine had not shipped yet even went as far as making backup plans for friday night with my brother and nephew if it had not arrived in time did a little googling and discovered there are 4 amazon distribution and fulfillment centers within 30 minutes of me so i imagine you are absolutely right and it will ship out noonish tomorrow arriving sometime late afternoon friday ,1,NintendoSwitch
Schneider21,something i definitely failed to consider were wii u owners who are not smitten with the idea of console gaming on the go your thought process is logical sensible and understandable ,1,NintendoSwitch
Schneider21,agreed i would much rather buy one of these awesome new games over buying mario64 for a fourth time p,1,NintendoSwitch
Schneider21,ah technically correct the best kind of correct d i remember getting into arguments with my playstation owning friends in school over which system was better and at the time we seemed more concerned with which games were available for which system while i had goldeneye mario and oot they were more interested in resident evil metal gear and final fantasy since i usually lost the arguments i guess i convinced myself the system was the weaker of the two but i still enjoyed it plenty ,2,NintendoSwitch
Schneider21,thanks i am glad i have worked so hard to get where i am at too i did not mean any offense with my statement but i honestly do not see how the power comparison makes any sense still if you can only afford one game system you can pick up an xbox one or a ps4 for less than the cost of a switch so if graphical power is an important factor for you then you are probably better off going with one of those other systems right likewise if you do not care about having console like experiences on the go you are better off with a different system i do not recall a time when nintendo ever had the most powerful system on the market and it never needed to in my opinion ,1,NintendoSwitch
Schneider21,ah so it a problem for people with big houses but not us peasants eh i actually considered picking up a 25 hdmi cable to connect the dock to the tv while being able to keep it on my nightstand this way i can easily pop it in and out as needed or change cartridges without getting up and should not have connectivity issues either unfortunately it was an impossible sell to my wife what with having that cable run across the floor and all ,2,NintendoSwitch
Schneider21,well in this case all available research is sort of just other people opinions p,1,NintendoSwitch
Schneider21,i totally was as a kid nes gameboy n64 gamecube but have been an xbox guy for the last 3 generations now picked up a wii late in its cycle but barely even used it this system has me all kinds of excited to becoming a nintendo fanboy again ,2,NintendoSwitch
Schneider21,while i do not agree with the way you phrased it or the claim of being best on the market that right in line with what i was trying to say people who want maximum graphics capabilities with their games are probably already playing them on xbox ps4 or pc the switch as nintendo products often do offers something different that has a value alongside those other systems and does not necessarily directly compete with them ,1,NintendoSwitch
Schneider21,totally nintendo more than any other console lives and dies by its first party support that said i found the nindie announcements yesterday extremely encouraging and am inspired to continue work on a game i started on a while ago with the intent of porting it to switch i can easily see this as being a system where a lot of smaller teams create fantastic games that play to the switch unique strengths ,2,NintendoSwitch
Schneider21,i love that they are launching with one killer game and a slew of smaller titles with great releases slated regularly over the coming year it enough to keep me excited for a good while ,6,NintendoSwitch
Schneider21,agreed i cannot help but imagine a boardroom at nintendo hq where execs are nervously refreshing review sites to see their verdicts anticipating their success or failure over the next few years ,2,NintendoSwitch
Schneider21,also very true launch titles especially those being simultaneously released on the previous gen system tend to not be as impressive as those later in the console life cycle so it may yet be true that switch titles a year or two from now would be graphically impossible on the wii u ,1,NintendoSwitch
Schneider21,i like switchening more than switchmas and will be using that from now on thanks ,5,NintendoSwitch
Schneider21,fair point it sometimes easy for me to forget that not everyone is as rabid with their news gathering as us core people ,13,NintendoSwitch
Schneider21,i hear you i guess for me not being a wii u owner it logical to buy the new system i would also probably make the argument though that it not the cpu gpu boost that the main selling point but getting that full console experience anywhere you go that the big feature here if that sounds awesome to you it does to me it seems like a valuable feature if you do not see yourself using it outside the house much though i can see where it would not be ,2,NintendoSwitch
Schneider21,the full opening to link awakening from the intense intro of the storm raging to the quiet waves of the beach and that suspense building before transitioning to the original theme brilliant i also have a special place for the loz and aol title songs too though with that said i sometimes randomly find myself humming the oot lost woods song unable to get it out of my head ,1,zelda
Schneider21,the tiem 4 talk haz passd u schnider is now a ded hooman and will maek a gud snak this aminashun is now scored 10000 0000 1000 1000000000 and the convirsashun is ovar ,4,NintendoSwitch
Schneider21,u haev are demans 50 000 kilograns of fish and berds by midnite on march therd or ur frend hear gets a new set of aqualungs til he pooshes up cattales 1 edet n the scoar is now 100 100 100 1000 to ,6,NintendoSwitch
Schneider21,guys please do what the croc says i do not think he fucking around i have a wife and kid for god sake 80 80 80 80 ,6,NintendoSwitch
Schneider21,achievement unlocked sweet air up there you took the high road and still managed to shove it in your opponent face ,5,NintendoSwitch
Schneider21,cute and unexpected enjoyable 40 40 40 40,8,NintendoSwitch
Schneider21,needs more human incompetence to be by cnet how how do i i will just flip this catastrophic crash ,9,NintendoSwitch
Schneider21,take my upvote and get out of here ,2,NintendoSwitch
Schneider21,take my upvote and get out of here ,2,NintendoSwitch
Schneider21,could be or alternatively a way to keep the price down so that those who wo not use the wired connection can pay for just the base unit and those who want more functionality can expand it at cost matter of interpretation i guess like you said the option is there whether it a fair priced option well ,2,NintendoSwitch
Schneider21,that looks like a nightmare to dust clean your room ben ,2,NintendoSwitch
Schneider21, i think the girl in this pic is really cute that why she in the picture p,17,NintendoSwitch
Schneider21,i am surprised there are as many wired responses as there are 63 at the moment the device itself is wireless so if you intend to play on the crapper lying in bed or otherwise un docked you would probably want a nice wireless network going in your house anyway right so why mess with additional network setup by having the dock maintain one connection while the actual console has another would not this have the side effect of dropping your connection when switching between the two networks as you dock undock it just so much cleaner and easier to go wireless from the start in my opinion ,3,NintendoSwitch
Schneider21,i am a firm believer in the idea that even moronic people are entitled to their opinions that said you need to understand that your opinion is yours alone and when your opinion is that different from the brainwashed sleeping sheep it just as likely that you are the crackpot outlier instead of the only one that knows what is actually going on presenting your opinion as the only acceptable truth is a great way to convince people of exactly that you are really clueless games are not overpriced they are luxury goods and the market determines their value as a game developer i would think you would be absolutely in favor for their increased valuation unless of course you have never actually published a game and attempted to sell it in any case neither i or u asperatology said anything about purchasing a switch its peripherals or nintendo marketing philosophy that started your rant the video referenced in this thread is about transferring knowledge between generations of game designers both old to new and new to old and nothing more really but since you brought it up i am getting a switch i do think the price is fair and i am very excited for nintendo its future and the games coming to its new system and i suspect they will be just fine without you purchasing their products i hope you have a great day and work through these issues that are bothering you ,10,gamedev
Schneider21,it reminds me of those training videos you have to watch that teach you about food safety or acceptable office environment behavior ,5,NintendoSwitch
Schneider21,i actually like the fact that nintendo assumes we all own smart phones by now and do not need netflix and chrome on our gaming device i have seen criticism that there no cell connectivity in the system either but i see it as if i really want to connect online while on the go i can tether it to my phone i know that everyone does not feel the same and some do not own phones and thus do not have the option but i feel that nintendo made smart compromises to find the comfortable sweet spot ,2,NintendoSwitch
Schneider21,whoopsie thanks for the explanation ,1,NintendoSwitch
Schneider21,where does he say nintendo miyamoto aonuma invented game design he just talking about their different design philosophy and their training program lighten up man ,11,gamedev
Schneider21, here my pro tip every time you fail just tell your so i really feel like we just need to communicate a little more this is true about every aspect in a relationship not just games p,2,NintendoSwitch
Schneider21,is that child link butt cheek i see peeking out from under his tunic ,24,zelda
Schneider21, link looks reggie sorry could not help myself ,5,zelda
Schneider21,absolutely and i appreciate you sharing your thoughts in starting the thread i think i had started addressing the point but quit writing before i rambled on too long in the long run you will be a winner in any case my daughter is the absolute best thing to ever happen to me she can be adorably sweet and affectionate or hilariously moody and obstinate and she equally amazing in either case as she grows and develops as a person she may have an interest in games or she may not but i will always have a second controller available for her whether she shares my interests or finds all her own the opportunity is there and that about all we can ask for enjoy your journey with your wife and future family ,2,NintendoSwitch
Schneider21,i was born in 84 my younger brother and i grew up on video games my dad was not interested in games he worked long hours and was involved in a lot of community organizations when he did have some spare time his interest in model trains was the only thing i can recall him ever distracting himself with although he never actually called it that my brother and i would make jokes about him telling us to turn off that pretendo and go play outside as a way of making it clear how distanced he was from the whole scene many years later my brother and him lived together in an apartment dad was a pirates fan and my brother liked the phillies so occasionally my bro would often play mlb the show with a matchup between the two as dad would watch while you may think he would be impressed with how realistic it looked compared to the old days he was more likely to point out duplicate fans in the stands or how a player arm clipped through some geometry in the dugout or something he just never found the awe and joy in games that his sons did my dad died in 2011 fucking cancer sometimes i wish i had spent less time playing games and more time doing things he was interested in like tinkering with the trains i did try at times but i think he knew i was not really into it and only tried to make him feel better my daughter was born in june of 2015 i fully expected my life to change to the point where i would not have time or interest in video games anymore not counting the first 9 months which sucked she was not a great sleeper things have not changed all that much after all i have less time overall but still get a few hours a night usually which is plenty the biggest thing that has changed is how i look at the games themselves my daughter is a bit over 20 months now and i cannot wait until she old enough to play games with her old man one time she woke from her nap while i was playing the witcher and she was very interested in how it worked http i imgur com qgkgflp gifv the idea that she may be as nerdy and into games as i was as a kid thrills me but i realize she may have other interests and may even take after her mother and want to play outside of all things the switch excites me because unlike my xbox i can see myself playing games on it with my daughter whether it sitting on the floor of the family room with blankets and popcorn on a friday night or in the back of the car on our way to the beach some summer while microsoft and sony are really pushing hardware to have games impress in a technical sense i do feel that nintendo is the only one keeping the focus on the things that have formed the fondest memories for me sitting next to a person you really care about and playing together that what i am most looking forward to with this system and what i hope will be a source of beautiful memories for my daughter when she has kids of her own someday ,2,NintendoSwitch
Schneider21,should have gotten one with them kissing ,29,zelda
Schneider21,came here for this comment thanks ,1,holdmycosmo
Schneider21,when i was in iraq we did not see too many people that seemed to play video games probably had a lot to do with their unreliable power grid and the fact that their country was ravaged by war on base we did have little shops that were run by i think syrians that sold pirated movies and games some of which were fairly recent i have no idea if locals had any interest in the games or if they were sold exclusively to us americans though ,1,NintendoSwitch
Schneider21,cannot help but wonder if the actual tattoo is backwards just so it looks good when you take mirror selfies ,1,zelda
Schneider21,i like to think that internally link is a thoughtful and elegant craftsman with words the shakespeare of hyrule even unfortunately he has tremendous social anxiety and can barely speak to other people often appearing nearly mute this causes him endless frustration which tends to manifest itself with outbursts of aggression on people gardens pottery collections and cucco flocks ,13,zelda
Schneider21,stay in character with it and write down descriptions as link would experience them hyrule field south of waterfall shrine about 500 paces turn left at bokoblin camp and travel east 200 paces metallic boulder blocking cave opening if only i had some way of moving it ,11,zelda
Schneider21,considering botw was strongly influenced by the original i would say play at least through the first dungeon of that try to think of it the way us 30 somethings did when it first came out we were going on a grand adventure in a fantastic open world something we would never really seen before that said link awakening is my favorite 2d game in the series i remember being in 4th or 5th grade and talking about it with kids in school and giving each other tips and clues one kid was so into it he would draw maps of the dungeons and share them with me add to that the fact that having a full size zelda experience like that on the go was so unbelievable at the time that it was another huge milestone for the series add the two up and you have got an even better idea why some of us older guys are so stoked for friday ,1,zelda
Schneider21,i was watching two of their staff play astroneer before it came out and as much as i was starved for gameplay footage i could not get past the first 4 minutes they were painfully bad at even basic movement and seemed as if they would never played a game where the right analog moves the camera from watching demo gameplay videos i am not sure that difficult accurately describes the gameplay but it definitely more intelligent it seems you can no longer get away with mashing the attack button to fell an enemy and the solution to puzzles requires you to actually think rather than just find the highlighted solution around the corner this can only be a good thing for the series and for the industry as a whole i hope other developers publishers take notice and inspiration ,3,NintendoSwitch
Schneider21,i wondered this today as well my best guess is that a review is an evaluation based on a set of objective and subjective criteria the end result being a quantifiable score assigned to the product by contrast a preview is looser impressions more general statements that do not try to score the product categorically the difference may seem trivial but with how impactful review scores seem to be in the industry i imagine publishers really care about the where when and how details ,6,NintendoSwitch
Schneider21, ur ftfy ,13,trashy
Schneider21,i like to think that things like this happen to reward people who have a shit time in their normal life looking through your history it seems you deserve a break enjoy your early gaming what game is beneath zelda there ,97,NintendoSwitch
Schneider21,that called ocd ,3,Showerthoughts
Schneider21,you called him captain like the joke character captain obvious ,21,mildlyinteresting
Schneider21,if you wanna rip it off i charge 20 ,1,news
Schneider21,this gave me a good chuckle thanks for sharing ,1,Unity3D
Schneider21,no worries i did not interpret it as hostile i think my brain messes with me in situations like this i know i am looking at some of the most advanced technology known to man so i see a simple squeeze bottle and think it must be some high tech device lubricant or something instead of saline for food simply because granular salt would be too messy in zero g seems i actually have the same speakers they are using hooked up to my cpu i can relate i have the same mustard in my fridge ,1,space
Schneider21,hmm you are right it does seem to be mostly foodstuffs hazard a guess as to the clear and black bottles that look like contact solution with the barcodes ,1,space
Schneider21,gods would i love to see this picture annotated with what all these miscellaneous items and their contents are ,16,space
Schneider21,check out game design zen https itunes apple com us podcast game design zen id1028932466 mt 2 by curtiss murphy the series starts out a bit ponderous until he finds his sense of style but it loaded with fantastic information ,1,gamedev
Schneider21,you would think so the hypotenuse of the messed up triangle area is about 2 feet i would estimate so not a big area at all might just be the toes of people shoes dragging across that are causing the disruption ,3,DesirePath
Schneider21,well one of those things is definitely easier than the other plus i would not have had to get my shoes all mulchy ,10,DesirePath
Schneider21,it was a dark and stormy night or rather a fairly bright and dry albeit somewhat cold morning ,8,DesirePath
Schneider21,four paragraphs qualifies as an intricate story my forum posts must read like dickens then maybe i missed my calling ,11,DesirePath
Schneider21,i can totally see why you would think that given that it just mulch being messed up not that you have any reason to believe me the stranger on the internet but the short story of why i snapped the picture this morning this is the building i work in the keypad nfc reader used to be right next to the door but was recently moved next to the newly installed handicap access button that opens the doors automatically so while employees were used to just swiping their badges right next to the door we now have to step just out of our way to swipe then round the tiny corner seen here to enter the door behind me a day or two after the modification i noticed a footprint in the mulch by the next week it was noticeably pressed down with bits of mulch on the pavement nearby today i saw the big mess and found it funny is all you can also see in the top right of the image where the other corner gets rounded enough to pack the mulch down there probably a joke in there somewhere about the company cutting corners but i am too lazy to find it ,36,DesirePath
Schneider21,really this is like the 14th sub you have posted this video to and it has nothing to do with star wars ,1,StarWars
Schneider21, consumers with commercial or government insurance will be able to obtain auvi q at no charge the company said it will also make the product available for free to patients with no insurance and a household income of less than 100 000 auvi q will be sold at a cash price of 360 for those who do not qualify for the emergency treatment at no charge the richmond virginia based company said however the starting price from which health insurance companies will negotiate discounts or rebates will be 4 500 it remains to be seen how payers will respond to the strategy ,1,news
Schneider21,jason robison has been killed not clear if it was by police self inflicted or what source http 6abc com news police suspect dead in pa state trooper fatal shooting 1680198 i lived in huntingdon for 14 years and i went to school with jason briefly i do not recall any contact with him directly but i remember him being called to the principal office often and being associated with the rougher crowd i was not a friend of his i believe he would had a long criminal record i believe his actions yesterday were shameful and unforgivable but it fascinating and upsetting to me the way i see people reacting on his facebook page slandering the man criticizing his mother and threatening his young son such actions are contemptible and blur the line that separates us and people that do these kinds of things my thoughts and best wishes are with the families of both deceased in this terrible tragedy and my respect to the trooper slain in the line of duty may the situation encourage us all to be more civil towards each other and avoid occurrences like this in the future ,5,ProtectAndServe
