name,body,score,sub
Schneider21,haha okay man you got me have a good evening ,1,history
Schneider21,i did not express shock i said it was cringey i love how people go through comments and exaggerate reactions as a way of starting shit ,1,history
Schneider21,i think that a strong indicator of how pc language affects our societal viewpoint i am a socially liberal fiscally moderate democrat i am white male straight and middle class i am absolutely in favor of equal rights for everyone regardless of race gender sexual orientation etc but i feel that when we overuse the word racist and throw it at the slightest missteps in someone language it only serves to polarize and fracture us instead of allowing a productive conversation i am not sure what point i was going to get at so i want to point out that this general pronounced negro as nigro and that seems like the worse of the two ,40,history
Schneider21,yay source https www youtube com watch v 0bdrf0bd0aw for the interested ,1,Unexpected
Schneider21,that means two things ,69,Unexpected
Schneider21,my time in the army taught me that there not a lot of room for subtlety when it comes to soldiers you either make your point directly and bluntly or it gets lost entirely although i suppose at that point in history this would be more applicable to american men as a whole with the draft and all ,67,history
Schneider21, america has promised the nigro real citizenship and a fair chance to make the best of himself when the army needs americans to fight for the country it takes nigros along with whites everyone treated the same when it comes to dying cringe you do not get over a prejudice that easily there no use pretending we are different than what we are but we can try to live up to our american promises i would go further and say we cannot do less and still feel ourselves patriots we have promised to respect each other all of us that one of the reasons that makes our world worth fighting for well shit there we go that a message i can get behind ,187,history
Schneider21,of course that a thing why would not that be a thing ,425,Unexpected
Schneider21,same happened to me i also had my progress it tracked one day which would have broken my 100 day streak if i had not had a freeze equipped was not a big deal when freezes were 10 lingots but with gems the purchase drained my savings i hate to join the critical bandwagon but i am not loving the recent changes ,1,duolingo
Schneider21,that bitch be trippin ,13,Unexpected
Schneider21,i would not have such a game development problem if it were not for my drinking hobby ,2,Unity3D
Schneider21,pretty standard am developer ,3,Unity3D
Schneider21,if i get caught drinking at work again they are going to really start looking into why i am spending so much time on reddit at work ,5,Unity3D
Schneider21,we are still friends you and i ,2,Unity3D
Schneider21,how is it misleading the title of the video is 9000 subscribers free assets for unity 5 blender ue4 the patreon link in the video description has links to download a ue4 asset bundle a unitypackage and the original blender files what is misleading here ,6,Unity3D
Schneider21,i own this and had no idea you were working on all these new features for it very excited to update to the latest version and try out all the prettiness before having to switch them off to work on mobile ,2,Unity3D
Schneider21,man i cannot wait for far cry 5 now ,0,news
Schneider21,cosmo kramer of course ,2,AskReddit
Schneider21,awesome that the first time i have watched a video like that where i actually got the sensation that i was on the thing spinning around as opposed to the sun rising and setting like we experience here thank you ,5,space
Schneider21,reduce did not you hear we have eliminated it altogether ,1,askscience
Schneider21,shit i think i was too but then i thought the iphone was never going to catch on who wants to hold something that big up to their head to talk so maybe i am not to be trusted ,5,worldnews
Schneider21,this does not bode well for cbs understanding of how people consume media these days ,1,startrek
Schneider21,i am a big fan of the witcher 3 but can admit its faults or rather the fact that it falls into some of the same traps many of our modern games do great observations and something i will be keeping in mind in my own projects thanks for sharing ,5,gamedesign
Schneider21,that so weird how do you address a common misconception and then continue to help propagate the inaccuracy i am currently making a viking game and there will be zero horned helmets in it ,1,Viking
Schneider21,except please teach your kids that vikings did not wear horned helmets to stop the ridiculousness ,2,Viking
Schneider21,nice try mr texas ranger i know it you you will never trick me into saying your real name three times in an attempt to summon you to roundhouse kick me in the face ,1,AskReddit
Schneider21,nice try mr norris i know it you you will never have any proof it was me ,5,AskReddit
Schneider21,you betcha ,8,mildlyinteresting
Schneider21,if i am being honest i do not even have a clue as to the definition of reticulate or any of its forms ordinarily i would just look it up but i think i like the mystery in this case ,274,mildlyinteresting
Schneider21,why is this not a thing ,1,AskReddit
Schneider21,i need more star trek bread puns please ,2,AskReddit
Schneider21,i hereby force you to open a bakery you have no choice ,1,AskReddit
Schneider21,reticulating splines ,2202,mildlyinteresting
Schneider21,haha i was wondering when that comment would show up stay suspicious reddit ,4,mildlyinteresting
Schneider21,this sounds like the genius pitch for the next controversial pepsi commercial pepsi max cleavage,3,mildlyinteresting
Schneider21,oh gods activating psychosomatic exacerbator ,3,mildlyinteresting
Schneider21, it for programming https en wikipedia org wiki rubber duck debugging ,9,mildlyinteresting
Schneider21,very cold but above freezing at least according to the fridge thermometer ,1,mildlyinteresting
Schneider21,this is one of the most beautifully crafted things i have ever seen thanks for shar wait where the fuck do you put the switch ,3,zelda
Schneider21,ah the best kind of correct ,4,gamedev
Schneider21,i believe you are thinking of romulans ,16,gamedev
Schneider21,brilliant the 18th century europe caribbean setting is such an obvious fit for the oregon trail gameplay and yet it never been done great job ,1,IndieGaming
Schneider21,i understand more than you will never know ,1,worldnews
Schneider21,fair enough i do hope that me fully admitting my mistake was clear enough that i did not want a source just to nitpick it i am genuinely interested in fixing my preconceptions and thank you for correcting me ,2,worldnews
Schneider21,honestly that fantastic news to me and i admit my statement was made based solely on my own limited experience with infantry units which may be vastly different from even the army as a whole much less the entire military do you have a source i can educate myself with to avoid making the same kinds of generalization mistakes in the future ,4,worldnews
Schneider21,not to denigrate the military but i believe the vast majority of our troops fall into the lower socio economic class less educated socially conservative gun loving republican category which aligns pretty much with trump support base as well i was discharged in 2011 though so i could not comment on the specific reasons current military personnel support him edit as pointed out by u naefux below this viewpoint is grossly mistaken when applied to the military as a whole and i apologize to any who may have been offended excluding grunts and jarheads of course ,2,worldnews
Schneider21,i think i am the only registered democrat to serve in the army if that any clue i think more than any president in recent history obama genuinely had the best interests of the american people in mind he is an incredibly thoughtful and empathetic man and as eloquently spoken as any world leader in history i have a tremendous amount of respect for the man and i miss him as my president already ,8,worldnews
Schneider21,no shit that more than i was ever taught on the situation glad you made it through that many attacks unscathed ,1,WTF
Schneider21,hear hear snopes article http www snopes com reasons admission insane asylum 1800s for those interested ,3,mildlyinteresting
Schneider21, r mildlyinfuriating,2,mildlyinteresting
Schneider21,ah yes i remember watching that on the extras dvd and thinking that i would not have wanted to see that movie it a spectacle light years ahead of its time star wars a billion years in the making and it coming to your galaxy this summer ,1,startrek
Schneider21, orson welles selling frozen peas frozen peas https www youtube com watch v v14pfddwxle for those interested ,1,startrek
Schneider21,the fact it being recorded suggests that the person behind the camera knew what was going to happen they probably used this video as training demonstration material and wanted to keep the attacker identity private ,247,WTF
Schneider21,my best wishes to you and your family i sincerely hope you get a chance to do exactly that ,12,worldnews
Schneider21,ah so that why shops and beedle never have arrows anymore i would not have skipped the cutscene so often if it was not the same video every time and there was a point where i was getting a blood moon every single night and then even in the mornings sounds like it could easily be fixed with a patch though right ,1,zelda
Schneider21,i thought that logo seemed familiar i have lived in the harrisburg area for a bit over 6 years now and still have not made it to a bears game one of these days though ,3,mildlyinteresting
Schneider21,the sentiment is absolutely understandable i know things were rough under saddam but it tough to find evidence to suggest anything is better now after us intervention what country are you living in now did the rest of your family make it out with you and is there any hope of going back home someday or are you pretty much set on making your futures in your new home ,12,worldnews
Schneider21,haha i think this every morning when i see that orangish brown horizon with the fade to yellow chalk white and blue on a side note do not take pictures while you are driving on the highway we care about you and want you to be safe ,24,Unity3D
Schneider21, mr peskov said mr putin was informed about mr voronenkov killing and voiced hope that ukrainian authorities would solve the crime he added mr voronenkov widow was welcome to return to russia yikes sorry about your loss mrs voronenkov hope they figure out who killed your husband come back to russia so we can take care of you ,113,news
Schneider21,i was in the army and went to iraq in 2009 well after the initial invasion so things were very different than the early days we did a lot of security escorts searches cordons etc a lot of time was spent with the iraqi army to help get them up to taking over the whole time it felt pretty obvious the situation would just collapse as soon as we left which made me very sad you could see the exhaustion on people faces but most people were nevertheless polite cooperative and even friendly especially the kids who i just loved i got in trouble from my platoon sergeant for kicking a ball around with a few boys once i just wanted to show them that i dunno we were not there just to kill people we had a number of guys injured in ied attacks and a guy in my squad was killed i was back at base for the day assigned to training a different unit on our vehicles so he had taken my spot in the patrol he was 20 years old too but i saw a lot more iraqis hurt or killed including one that i have never talked about before one night we were attached to some australian unit that was doing a series of raids searches we would follow them as they moved from town to town providing an extra presence i guess at one house shots were fired the story i heard was that the man who lived there had a weapon but all i could see were farm tools lying around the australians left us there with the body as night turned into morning the neighborhood started waking up and we still had no idea what to do it turned out that the man wife and kids were spending the night with family and they arrived home that morning to find us not letting them into their house our translator chose to lie to them and say we were questioning the woman husband inside we did not know he had said this until we were leaving when we were finally relieved by a different unit the translator told the woman her husband was dead and hopped in our vehicle the whole experience of that deployment left me feeling disconnected and ineffective i have been so much more interested in world history and other cultures since then and much more critical of my own nation and its government i know it not much value but please know that all americans even the soldiers are not the way we come off as a whole thank you for sharing your perspective and i am very sorry for your family and your country losses ,95,worldnews
Schneider21,fun fact my website was once hacked and the content was replaced with a page indicating i was identified as an enemy of the state of turkey i am not sure what i had done up to that point to upset them or any other nation but i have certainly got a thing or two to say about the turkish government now and just may have to put up a website dedicated to that content ,4,worldnews
Schneider21,this one been driving me nuts i only just recently found the shrine on satori mountain for some reason i had never gone up there so my plan was to do exactly what you ended up advising have not gotten a blood moon since that though as i spent all last night at hyrule castle finally finishing the story thanks for the post ,1,zelda
Schneider21,i like this i will be creeping on you for the next week to see if you get that guide shared ,2,Unity3D
Schneider21,this is my favorite also works as a post bar 3 00 am meal ,2,AskReddit
Schneider21,my first and currently only but another on the way child is a girl and she freakin awesome she loves to play in the dirt wrestle around with me and she fascinated by game controllers http i imgur com qgkgflp gifv i definitely thought i would need to have a boy to have a kid that shared my interests but every day i am realizing more and more that is not the case at all ,11,NintendoSwitch
Schneider21,congrats we have got another one due in september so if my current daughter does not end up enjoying playing games i will have another shot at it down the road p,2,NintendoSwitch
Schneider21,my daughter is a few months out from 2 still and she loves watching botw she got very upset when we were trying to put her down for bed a week or so ago so we brought her into our room and i booted the game up i just ran around in a field while she watched intently occasionally saying eee wunning he running or eee yunpeen he jumping and man her reaction when i got my horse was priceless i then walked around a stable and gave her close up views of the different animals and she knew what they all were just adorable i cannot wait for her to learn to play it someday ,33,NintendoSwitch
Schneider21,since i never thanked the mod team for all their hard work and dedication leading up to the switch release i will do that now this should in no way impact my chances of being selected to win p also us ,1,NintendoSwitch
Schneider21,no matter what i do i cannot fathom the sun a giant ball of constant nuclear fusion burning so brightly that it provides our rock 93 million miles away with the energy we need to exist nope not happening today either ,2,space
Schneider21,all romance languages follow this rule and in many other non english languages vowels have more consistent pronunciations most of which would indicate deckoo over deekoo but hey i am just a kid do not ask me ,1,zelda
Schneider21,ah that was the other one i was thinking of i pronounced it the same way you did do and i agree i like it better as kah karee ko ,2,zelda
Schneider21, new as in we are really just trying to see what we can get people to pay for ,3,mildlyinfuriating
Schneider21,oh these are ez poop undies i thought they were ez access for your man panties op how much searching for anal do you do in an average week p,5,mildlyinfuriating
Schneider21,this was the most perfect typed impression of robin williams i could imagine well done ,7,zelda
Schneider21,not only do i agree with you 100 i am a bit confused as to why so many people in this thread are whining complaining and arguing the point you are making i am in nearly the exact same boat as you turning 33 soon married another on the way full time job i own an xbox one and a few great tvs a number of months back i was talking with my brother 31 single no kids about how i feel like more of a casual gamer these days to which he expressed utter disgust what i meant i realized was exactly what you have described here it not that i do not enjoy playing games or difficult games or games that require a lot of time investment it that i need games that respect my time and schedule the xbox one blew me away with its ability to shut the system off while you are playing and when you boot it back up your game is right where you left it those few minutes i saved each play session not having to navigate menus and sit through loading screens meant a ton to me having the option to not only do that but continue while i am out and about is an amazing feature i am already making great use of ,10,NintendoSwitch
Schneider21,then you want an xbox one it good that you know what you are looking for and recognize when something is not that ,9,NintendoSwitch
Schneider21,i had a bit of trouble at first but i am very used to it already i think it actually works out better for zelda at least when holding the right joycon especially detached i rest the tip of my thumb about centered on the button diamond the pad of my thumb touches the top half of the analog stick and i really only bring my thumb down to fully rest on the hat when i want to click the stick down for the sheikah scope doing this the a button on the right side is much easier to access than the b button at the bottom i can get a nice action on that button by just bending my thumb slightly and rocking to the side a bit whereas with b it more like a full extension of the thumb which is a bit less comfortable as a repetitive gesture stick with it and soon you will be hitting the wrong button when you go to play something on your other systems ,1,NintendoSwitch
Schneider21,no it does not oh wait yes it does no maybe it does not okay yes it definitely does ,1,mildlyinteresting
Schneider21,yeah i agree with everything you said i am absolutely not opposed to it it just something i do not have a need for or personal interest in because of my particular situation is all i honestly do feel it only a matter of time before netflix naturally comes to the system relating back to the xbox i believe it app availability at launch was pretty sparse too and now has a ton of apps and games available so if we all are just patient i am sure the switch will be everyone dream machine before too long ,1,NintendoSwitch
Schneider21,no it looks a bit too much like the unity editor i think ,65,Unity2D
Schneider21,velvet ,10,gaming
Schneider21, disclaimer this comment is my own opinion and is not indicative of how i feel all switch owners should use their console i personally see no purpose for having media apps like youtube and netflix or even an mp3 music player or anything on the switch i got the switch to play games i have a few smart tvs an iphone ipad and a couple of laptops whoopty doo look at the rich guy right people are already complaining about the storage space on the device so i do not see why you would want to fill that up with apps you can use on your other device instead of reserving it for games that cannot run on those devices likewise if i can get 3 hours of zelda on a full charge i do not want to be cutting into that time by watching an episode of always sunny my phone can be responsible for that and since the switch does not have cell access a streaming service would really only be useful in certain situations where you have wifi anyway again this might just be me but i do not see the point in muddying things up and trying to be a full multimedia device i am fine with the switch as my console on the go that said i primarily watch netflix on my xbox one which is also a gaming console so maybe my opinion on it is influenced by the fact that i already have netflix access points on all my home tvs and i just do not need another one i guess that does not mean the switch should not be that console for someone else though ,0,NintendoSwitch
Schneider21,strongly agree my switch is my first usb c device so i am starting a new collection of chargers that will eventually phase out my collection of micro usbs although given apple obsession with thinness i doubt my phone will be using usb c anytime soon so i will have to keep those lightning cables around too ,2,NintendoSwitch
Schneider21,exactly what i was thinking i do not own any usb c devices is a fairly lame reason to complain about something using a new but standard port type ,7,NintendoSwitch
Schneider21,does shuttle mean bus because that way nicer than any bus i have seen in the us ,2,zelda
Schneider21,i doubt they would want to add new buttons ignoring the fact that there are plenty of buttons as it is two more than the xbox one controller has adding a new sku of joy con with additional buttons opens up a slew of problems and basically splits your console install base something console manufacturers desperately try to avoid i would say it possible these are keycodes programmed into the firmware that were used for debugging during the console development and were not intended to be used in the production release could have been quick access to profilers or consoles or something ,3,NintendoSwitch
Schneider21,judging from post history they are a fairly educated gamer this is likely to be a shitpost ,6,NintendoSwitch
Schneider21,okay i think i know what the a is but is v what i think that is and why would that need to be plugged ,6,WTF
Schneider21,i have been playing the hell out of mine since noon friday and have had no problems at all not trying to rub it in for the ones who have had problems just wanted to let on the fencers know they usually hear from the vocal minority in these cases ,1,NintendoSwitch
Schneider21,i have the base game so i am okay for myself but my brother was over last night and fell in love with the game and he now trying to put together the money to buy a switch this would be a great gift to give him as a cool surprise very awesome of you to do this by the way ,1,NintendoSwitch
Schneider21,i have nothing to give you but a bit of karma hang in there ,2,NintendoSwitch
Schneider21,my zelda has been shipping now for the last 4 hours with no update on the console yet do they have no concern for my mental well being ,2,NintendoSwitch
Schneider21,i absolutely agree as a developer i just do not want to be bothered with demos as making marketing and supporting the game are enough work as it is but as a consumer i love having demos i cannot recall a time when a demo has turned me off of a game i was planning on buying but i do know of occasions where a demo convinced me to buy a game i otherwise would not have unfortunately the two sides of me are ever at odds and cannot come to peace with this ,2,NintendoSwitch
Schneider21,you guys may be aware but the my subreddits dropdown is getting cut off by the header overflow hidden otherwise looks great love the banner ,6,NintendoSwitch
Schneider21,i would have said 10 minutes is not much notice but then i remembered everyone here refreshes at least every 3 minutes so it still guaranteed everyone would see the note looks good i miss the little animating switch logo but everything else is very clean and pleasing ,1,NintendoSwitch
Schneider21,maybe they thought people wanted more than an hour and a half of battery life ,1,NintendoSwitch
Schneider21,an excellent point of course one thing about botw that really excites me is the impact it may have on the rest of the industry if they can be challenging yet forgiving and treat the player like they are intelligent enough to figure things out themselves and the game is a massive hit then hopefully other teams take note and do the same ,3,NintendoSwitch
Schneider21,right and understandably too i imagine as a developer myself i do not like the idea of a forced demo because it creates extra work and my game may not lend itself well to being demo would if a timed demo forces a start from the beginning maybe i would rather the tutorial not be their demo impression for example unfortunate for consumers in this case but we may end up yet getting some good demos to satisfy our needs ,3,NintendoSwitch
Schneider21,it been posted a few dozen times now i am sure the mods are just doing everything they can to keep this place from being an ocean of duplicate posts ,1,NintendoSwitch
Schneider21,one of the things i loved on the 360 was arcade game demos they were required to be there so i got to try and occasionally buy games i would not have otherwise given a second look on the xbox one demos are optional and they are very rare sometimes big publishers release a version of the game that gives you full reign but limits your time which is great i came very close to purchasing watch dogs 2 because of this from my perspective having lots of demos suggests a confidence in the quality of the games with the idea being that trying it will encourage you to buy it lack of demos suggests the opposite that trying it may discourage you from purchasing i guess we will have to wait and see like always ,8,NintendoSwitch
