name,body,score,sub
scorpionma,first of all i should note the handwriting is from a child second while these are arabic letters i do not think it arabic maybe persian i did not understand what was said and every word is strange try wronglanguage pr,1,translator
scorpionma,cannot believe people did not know this how do you even google stuff ,1,LifeProTips
scorpionma,also women go to matures ealier than men so they have time to work on their motor skills while men get them late and in a point where they are already in a hard class where they do not have time to focus iv the handwriting,1,explainlikeimfive
scorpionma,implying prior in the draft would let me they would just dodge,1,paragon
scorpionma,in this thread,4,AskReddit
scorpionma,making the kids life to ready this might seen strange but i knew a neighbor who was really really rich and his kids would only buy the most expensive shit they did not do anything but had fun no job no chorus and relied on their maid too much suddenly dad goes broke and their life is destroyed he can feed them but not the most expensive shit no more maid no more having fun they have to do chorus now they could not do it noone of them were and to get a job they cannot live without money so tl dr even of you have money do not get your kid used to it let him learn the hard life to an extinct too ,1,AskReddit
scorpionma,thank you very much for answering i do not know why you got into answering my shit but i got curious thank you ,2,CasualConversation
scorpionma,sorry for do many questions if you too busy to answer i will understand but is not this againts a privacy law or something like hour can eula worka against a government law ,2,CasualConversation
scorpionma, 3 thanks,1,paragon
scorpionma,i did not say that they are not doing it i am confident that they do but saying they ask for permission so they must be doing it is false and people misunderstand how android permission works they do not know that an app must ask for permission if it wants to use something and they ask think asking for that permission listening to or conversations i an pretty sure they do listen to us but my point is this is not a valid proof of it i agree with all what you said though expect for the first part where you said legally please explain that i did not know they were allowed to do that,2,CasualConversation
scorpionma,when an app asks for permission to use a camera or a microphone that does not necessarily meme the app use that permission to listen to you of any app on android wanna use the camera for anything let say instagram they have to ask for permission if facebook had a voice feature then they need to ask for microphone permission tl dr an app asking for permission they are using it to listen to you but they can ,4,CasualConversation
scorpionma,apologizing wo not make you look weak or a child you will gain the respect of the guy you offended did something wrong to of you did something wrong apologise you will only gain good things from it,2,AskReddit
scorpionma,most annoying is r randomactsofgaming you will see a guy giving a 60 game with 2000 comments and only 60 upvotes he doing this shit free for you at least try to give the simplest things back,3,AskReddit
scorpionma,do you like when someone v say muslims are terrorists because you are basicly blaming arabs for this arab leaders are corrupt and is leading the arab countries to be the worst that of they are not atm we ask know they are corrupt and we cannot do anything about it syria tried doing something and look where they are i am not suggesting we should not try to fix this ,1,islam
scorpionma,you can put dogs in anything and they will stop be smiling i wish i was like that,3,aww
scorpionma,they all look like their laughing their asses off when you zoom they all look like their screaming ,1,pics
scorpionma,do not really know but is the app the screen shit is taken from is 9gag looks like it,0,im14andthisisdeep
scorpionma,how could it be seen as a dick move ,16,HumansBeingBros
scorpionma,wait why the fuck are you browsing 9gag ,48,im14andthisisdeep
scorpionma,good bot ,10,im14andthisisdeep
scorpionma,hello,1,CasualConversation
scorpionma,but the fillers in there are actully extremely awesome and interesting ,3,AskReddit
scorpionma,the mentalist amazing filler with amazing story,2,AskReddit
scorpionma, i somehow missed reading that totally my bad so sorry,1,paragon
scorpionma,i really hate the lack of moderation in this fun i have never seen a rules breaking post get removed,29,sadcringe
scorpionma,i was joking on the euro thing the default skin is already badass you want something a little better but cheap imo the default is worth more than 100 coins that why i said that,1,paragon
scorpionma,you ask seriously thought i was taking 100 i know you are being sarcastic but why the down votesm i clearly meant euro edit of you ate being serious in taking about in game coins,1,paragon
scorpionma,i do not think we should give new players pro decks that would just make no one learn to create decks and everyone will rely on default decks,1,paragon
scorpionma,i am not sure but i think of you hit enemies with full health your life steal will instead make a shield for 3 seconds,1,paragon
scorpionma,http i imgur com 9gsp948 gif noredirect,1,paragon
scorpionma,yes that it,2,paragon
scorpionma,the enemy team can see which minion he gets bonus from too you will see the same minion glow on your friendly minions,1,paragon
scorpionma,works with revenants obliterate to and maybe countess not sure,1,paragon
scorpionma,works with revenants obliterate to and maybe countess not sure,1,paragon
scorpionma,ok you know that one win out of 8 did you have great teammates in that add them and next time you okay post with them for example toy found a great player and you add hull you play a game and you found another great player add him i have a big ass list now and every time i wanna play i invite people and you will get people who join do it you will only play with pros like this,1,paragon
scorpionma,i have seen wukong destroying a full health tower in 5 second with only 3 minions with him at cxp 23 dunno how i feel about that,1,paragon
scorpionma,i had adsl before their service is awesome and i have never experienced bad things with them long is about 10 25 using speed test ,1,jordan
scorpionma,have you ever been on midlane with b4 of your teammates and you see them all engage so you engage after you cast your abilities you look back and you suddenly see your teammates fucking 2km away,5,paragon
scorpionma,that should be it i am at pc and it stays forever ,1,paragon
scorpionma,i was taking about the capped letters ,2,PeopleFuckingDying
scorpionma,beep beep lettuce,9,me_irl
scorpionma,what the fuck did not know there are such rude people in earth i think i have not seen a damn thing yet ,3,AskReddit
scorpionma,reposted every week too,1,sadcringe
scorpionma,w t f,2,hmmm
scorpionma,you would want a hero where he would focus on learning the game more than learning the hero if you give him a hard hero he will take a long time to learn his hero learn basics of the game,2,paragon
scorpionma,just because someone did something stupid did not mean he deserves to die ,3,nononono
scorpionma,imo we need shitty skins but they should be of low price a guy who just joined the game cannot get high tier skins so we should have shitty 100 skins or even led they will be shitty but at least new players can get happy over buying a skin,-1,paragon
scorpionma,did you make a while script just for r peoplefuckingdying that is fucking amazing great job ,5,PeopleFuckingDying
scorpionma, did she just remove her hijab in front of us in the 6th panel ,3,islam
scorpionma,if you are going to do something this stupid i would suggest wearing a fucking hazmat suit,1,Whatcouldgowrong
scorpionma,he did not die but he was seriously injured in his leg and head,10,OSHA
scorpionma,bone ankle queef ,0,BlackPeopleTwitter
scorpionma,hmmmm that very strange considering i only said that because that what artctic said in the stream thank for proving me wrong i good not know about that ,1,paragon
scorpionma,accursed farms he the creator of freeman mind ross game dungeon and civil protection if there was one word to describe his content it would be quality he may take a month to make a video but is absolutely worth it he is currently making freeman mind which is a show following the thoughts of goddamn freeman his other site ross game dungeon is reviewing and playing a game no one had heard off to keep it interesting so you do not great something you have heard before he brings his awesome perspective of the game and covers every bit of it,1,AskReddit
scorpionma,his hit does effects on proc not ults ,1,paragon
scorpionma,it all fine here changes always stays are you using ps or pc,1,paragon
scorpionma,yes shadow blink does dodge morigesh ult you have to time it right though its easy once you get the hang of it ,2,paragon
scorpionma,nope his clones do basic damage and are affected by only attack speed critic and damage stuns and slows not included,3,paragon
scorpionma,i personnaly hate the fact that some heroes can solo orb prime like khaimera or twinblast i think the way to make orb prime a team objective is to make decrease life steal you get from him or something,4,paragon
scorpionma,you are top 0 amazing ,40,paragon
scorpionma,i am now calling twinblast the double pistol dude fucking hilarious thanks for the laugh,3,paragon
scorpionma,he really squishy countess ult him he will be st 25 health and if she was able to land a dark tide he will be gone ,5,paragon
scorpionma,everyone time i post something people are against i usually get flamed and people start talking shit to me thank you very much for being nice that was really unexpected now i sound like a jerk because how angry i sounded i am very sorry man while i agree with you on dekker stun bug it is annoying and have no idea why it was not fixed it shouldnt reflect the whole epic not responding issue i think one example is not enough i am actully a dekker main now and this is absoluntly annoying and makes me wanna pull my hair edit here an possible explanation on why it is not working https www reddit com r paragon comments 62dlk9 will dekkers stun be fixed this year check the comment by u c galaxy and keep going down,7,paragon
scorpionma,he is just like tevevant in the swichyness countess can just ult him and dark tide him and hell be gone before he can even run he is door squishy that his weakness,1,paragon
scorpionma,i am actully not every time i see a problem come up here next update that problem is fixed if its not fixed you all probably not seeing something behind the scenes in which they will inform you of in community corner all i see is people complaining about too much prizes and too much reputation yes it is annoying but you are seriously trash talking a game because they are giving you free stuff i like critisim talking trash people trashing the game because bad match making they said they remade the whole mathmaking and added 5 thousand or something fucking lines also just because you want something added does not mean everybody want that added the cannot please everyone i am sorry if i sound angry here that was not my intention sorry,9,paragon
scorpionma,now we need a dre snoop album ,4,hiphopheads
scorpionma,this and snoops new album ,15,hiphopheads
scorpionma,you are taking like epic is not listening to shit y all are to greedy epic done nothing but please the community ,10,paragon
scorpionma,what the fuck r ofcoursethatexists,11,savedyouaclick
scorpionma,switched from orange to umniah last year orange starts you off with fantastic internet good soured good ping good everything it starts degrading after 2 months but it still usable wait a few more moths and you find yourself gone from 8mb to 0 5 and it keeps disconnecting complaining to orange will chat your internet going for a day then they will make you are internet shit again umniah you pay for 8mb you get 8mb that it the device is actully great everytime i have a problem they come in a day or 2 while orange took at least a week i once complained about having bad speeds they came the second day saw that i was getting the speed i played for then for me a 150 device for free and installed it the outside one 100 recommend umniah far better than orange i currently have the 4g subscription the speed from morning to asr prayer is between 40mb and 50mb and after that it gets to 20 40mb does not get any lower than that,2,jordan
scorpionma,i think he meant to say abs the week before that and but was cut off,3,meirl
scorpionma,comment cut half of the text i meant to say fuck yeah ,94,WTF
scorpionma,fuck ,125,WTF
scorpionma,i am pretty sure if you were there you would have done the same you ate probably on you are toilet thinking what would i do if that happend to me while he did not have time to think he was probably thinking how could i stop this elevator do not think he even had a thought about the elevator crashing ,2,WTF
scorpionma,when you join pack every mf er got your back,14,THE_PACK
scorpionma,is that matt parkman from heroes ,9,absolutelynotmeirl
scorpionma,no the second time you took the bullet from my head life is strange you never know if taking a bullet off someone head saves them,0,2meirl4meirl
scorpionma,i feel really sad for them imagine making an entire balanced game and nobody plays it paying thousands of dollars just so noone plays it they ought to try anything to fix that situation you cannot blame them for trying to fix it they know they are fucked,3,gaming
scorpionma,i would fucking kill for a new jay electronica and talib kweli collab maybe even put mos def in there just begun was fucking amazing,1,hiphopheads
scorpionma,before reading your story i was thinking if kidnapping a millionaire by drugging him to sleep then convincing him that he was in a coma and he want really a millionaire would with and holy shit you made it in to a sorry thank you very much great read,7,WritingPrompts
scorpionma,die live gets you alive though,-1,2meirl4meirl
scorpionma,i am having a hard time figuring out what body part is this is this a knee ,1,oddlysatisfying
scorpionma,i think he dies post them to his tumblr,106,KenM
scorpionma,would not that make it also 25 of dying like 50 chance you will live and 50 chance you will die twice would mean both would go 25 ,-2,2meirl4meirl
scorpionma,search for midnight hour by talib kweli see of you like that,1,Showerthoughts
scorpionma,yeah this one was easy to catch,1,Showerthoughts
scorpionma, r gifsthatstarttoosoon,1,gifs
scorpionma,double die double negative lives,11,me_irl
scorpionma,but children do go to heaven and they can not reject god because they are still children and do not think for themselves,1,islam
scorpionma,fuck yeah motherfucker you are the fucking man thank you so much ,9,megalinks
scorpionma,the only way i can imagine the peeked banana is by imagining it rotating like earth imagine a peyote banana circling it self and going right and left and rightl stay peeked,2,NoStupidQuestions
scorpionma,video suggestions porn on youtube hottest wwe girls nice try satan,3,MuslimNoFap
scorpionma,reply to express that i was about to say a similar thing,3,SUBREDDITNAME
scorpionma,that is still lot i do not even think we would reach a million if every one who pirates games open multiple findings we would not reach million think about it ,2,Piracy
scorpionma,normal soft taps,1,NoStupidQuestions
scorpionma,do not you think that is a but to much ,5,Piracy
scorpionma,this does belong thank you for posting,0,SlyGifs
scorpionma,i guess this is all because he sitting bored and wanna do something for fun and he creates this shitty live stream shit his look on his face during these streams are enough to tell you i am fucking bored and i need to have fun ,12,im14andthisisdeep
scorpionma,it ironic i think jacksfilms is always doing crazy shit,44,im14andthisisdeep
scorpionma,i had a friend like that he liked me so much in a friend way he thought everything i did was good and he wanted to be a better person i am pretty sure she likes you and thinks you are a really great personality,2,CasualConversation
scorpionma,would you believe this exist https youtu be rwwfx5ihbr0,152,im14andthisisdeep
scorpionma,that fucking funny though,2,facepalm
scorpionma,fixed period,2,paragon
scorpionma,what do you mean ,2,PatientDogs
scorpionma,beautiful dogs are at heart not appearance i have a dog that looks like shit every time i show her to someone but we had not shown me nothing but love and i fuxkin miss her although she dead she left me a daughter just like her loyal derpy and funny great joke teller ,5,PatientDogs
scorpionma,it all in good fun man d we are not mocking you we found tour writing funny hell i write 20 word a comment and get 25 mistakes do not worry about it man d,1,paragon
scorpionma, u yboc0 says he was trying to break the restaurant window i am only a reposter i am sorry original thread was found in r gifs just trying to keep this sub active,7,SlyGifs
scorpionma,beeb boop i am a bot that time travels here you are fucking reminds 85 days early,1,BlackPeopleTwitter
scorpionma,nas kendrick dr dre e 40 snoop dogg future ice cube will i am drake q tip school boy q anderson paak lil wayne scarface busts rhymes and king mez this is all without the underground rappers he got like the ones in my flag fucking amazing album,9,hiphopheads
scorpionma,i think it is one of the if not the best album of all time if anyone ask you about conscious rap this is definitely the album i am giving them amazing performance by both talib and now def i honestly do not know who better they both are amazing ,3,hiphopheads
scorpionma,https youtu be s3asxxnzelu 1 50 he says just what you said but i think it a good advice when an amazing movie get a shit sequel it makes you hate the original movie i think not squealing is to preserve the great position in history the album had making a bad sequel would ruin that but the game knew what he was doing and for it all right fucking amazing ,3,hiphopheads
scorpionma,obliterate do get stuck in the ult but once the ult is done they continue to attack the target they should not follow for that long,2,paragon
scorpionma,it was a joke just when i thought someone loved me sorry ,2,paragon
scorpionma,it free so stop complaining,1,paragon
scorpionma,and i love you,1,paragon
scorpionma,bro there are hundred thousands of verses about not killing and how bad killing is but these guys can just take any verse they want out of context i can right now quote you and twist your words and make you sound bad here you go his followers go around killing innocent people including children and women who were living their lives mohammad is killing his comrades see that what they are doing just twisting facts,18,islam
scorpionma, for example a law book says do not kill the innocent then these terrorists come and quote the law book by saying kill the innocent that how bad it is really quran has hundred of verses about not killing the innocent doing good deeds how killing a single person is like killing the entire mankind not damaging the environmentz etc ete then the terrorists come and take one ayah out of context and justify everything they did ,18,islam
scorpionma, that whoever kills a soul for a soul or for corruption done in the land it is as if he had killed mankind entirely and whoever saves one it is as if he had saved mankind entirely ,24,islam
scorpionma,my man captain d,9,nonononoyes
scorpionma,joined in 5 days ago fml,5,megalinks
scorpionma,it just that everyone i reset my router the one that connects to the isp my internet ip google what is my ip or using cmd changes to something else,1,megalinks
scorpionma, i have dynamic internet ip everytimr i reset my router i get a new one i can get you as many google account as you want,1,megalinks
scorpionma,no please do not day that i am sure one of you guys week find a solution you always do ,6,megalinks
scorpionma,they also fucking ruined years of me irl titles ,3,me_irl
scorpionma,no actully imagine kids in a middle easterner country no internet connection back then we never seen a black man too i see black as the special trait for cj ,2,gaming
scorpionma,that exactly what a multi is it luke ask the subreddits in that multi becomes on subreddit that toy can search and swipe from to to the subreddit of choice side bar and add subreddits you want to a new multi multi t ,1,baconreader
scorpionma, morducki ,9,paragon
scorpionma,i was sad that he was about to make a documentary 2 as dr dre words you do not sequel a classic he fucking did though and it is fixing awesome every sing in it is amazing and filled with features,8,hiphopheads
scorpionma,immortal technique dance with the devil i am not going to ruin the story for you go listen to it and tear up,0,AskReddit
scorpionma,was it a reference to the movie friday he says it just the way chris tucker says it https youtu be rlcxupagedq,99,gaming
scorpionma,also we should unify cards that has use from legacy and are the same now like cast and strike they make people even more confused on what to start with,3,paragon
scorpionma,almost 3 months of playing and i have never ever fell info a murdock trap but once where i was alone anyway it really was useless and rarely worked it extremely situational i was hoping they would fix it though not remove it it felt like it was part of who he is dot ,0,paragon
scorpionma,you cool to me ,16,SlyGifs
scorpionma,my mother told me the same thing thank you for reminding me mf er i do not want to disobey my parents,3,AskReddit
scorpionma,we also have a thousand fucking additions of the game best one was bab el hara edition,2,gaming
scorpionma,san andreas was called the black guy ,2,gaming
scorpionma,linking up cars to do one big ass jump spamming tab lining up shit ton of cars and destroy one of them to make a big ass explosion kiiiiiilll frenzy and playing race maps with friends it was fucking amazing and we still play it till this day it one of the greatest lan party games,2,gaming
scorpionma,overwatch wo not matter you shoot anywhere and it hits hitboxes are big and i am talking about games like csgo where every shot can change a whole match,-3,AskReddit
scorpionma,i was playing fallout new vegas there an area airfield something boomers up in the body west had about 2 bars of health and decided it was a good place to save and overwrite my previous save because why not nothing can happen just when the save finished i see a fucking middle directed at my face and i fucking die the save became me getting hit by a missle and my body fucking flying over 50 fucking hours of game time was gone deleted the game but kept the save because why not 2 months ago i decide to play it again and decide to check the save turns out there was a save editor for xbox and i was able to get to safety ,6,AskReddit
scorpionma,the weekly legacy was better thread,8,paragon
scorpionma,some fps games requires very high accuracy like csgo every pixel matters,72,AskReddit
scorpionma,wait you cannot so that with multi am i understanding the title wrong ,5,baconreader
scorpionma,i hope your mother stays well and healthy unill the end i hope she keeps being peoud of you same goes for your dad too he amazing,22,THE_PACK
scorpionma,so what did you find out ,1,commandandconquer
scorpionma,that is the best xd,-3,paragon
scorpionma,it does happens to me once and i once found a video of her too,5,paragon
scorpionma,nope its not about freezing any hit or any interaction from the enemy team cancels the recall countess ult does send you to the base with him khaimeras leap does send you too i guess there is a brief moment where you are still there but any action to you does not cancel the travel,3,paragon
scorpionma,google tanya from redalert if its her then its red alert 2 if its not then its the first red alert and can be dow loaded from r openra,1,commandandconquer
scorpionma,imo r openra is better than the normal one,4,commandandconquer
scorpionma,what a fucking asshole you are how are you do something like this fucking cheater i apologise i was trying to make a shitty joke about how i an mad with op doing really bad stuff to people the cinema then end it with an unexpected turn that it about the cheating part i looked like an asshole instead sorry man,-8,funny
scorpionma,but they are cute ,7,PeopleFuckingDying
scorpionma,oh i did not know we are going to visit them nude ,2,PeopleFuckingDying
scorpionma,6 8 cp behind is good for me but i always go 20 or 15 level behind at the end at landing phase i am good at 6 8 cp behind but after that when they start getting more kills and more farming i start being a lot more far behind ,1,paragon
scorpionma,i am sorry swear to good i did not mean to cause harm i was only interested in hearing the story i am sorry,13,PeopleFuckingDying
scorpionma,please elaborate on the last part,37,PeopleFuckingDying
scorpionma,you would 100 i am pretty sure this guy raised them while they where little he does have a great connection with them i am pretty sure if you did raise one you would trust then with your life,61,PeopleFuckingDying
scorpionma, r the pack every mf er got my back there ,27,AskReddit
scorpionma,when you are peeing and want to get that last bit out lift your balls and press under them it will trinckle out the last bits you may take time to find out the place i will find what its called medially,1,AskReddit
scorpionma,nope i live in jordan never went to a friends house as a kid but i used to play it we did not call it floor is lava but the rule was to not touch the ground which is pretty fun because it included jumping around and doing crazy jumps,5,Showerthoughts
scorpionma,now you have gone too far,2,jordan
scorpionma,http 500 ok,1,nononono
