name,body,score,sub
scorpionma,great gameplay to every hero phase seems op but we need time to really make sure and junglers are having a bad time junggling overall great update it made many heroes viable and more play able i would wait a little because everyone is picking phase to try her out and assassinate people instead of supporting this will die soon ,4,paragon
scorpionma,people do not like supporting people people like getting kills people think most kills best player that why revenant was so popular everyone thinks that she a caster or assassin and will choose her to kill instead of support this will die soon do not worry today i asked someone who picked her if he knew how to support he replied what is a support ,1,paragon
scorpionma,i main countess and i am sorry to say you cannot win against her if your squishy you can take her out but she does that way faster you will need someone to stun her before you move in she can take a revenant out with her ult dark tide her weakness is that she also squishy make your support stun her and then attack her at once she the kind to hit and run do not expect to do damage over timr and most importantly if she has her mana lower than 33 then attack she wo not be able to burst enough abilities to kill you ,3,paragon
scorpionma,thanks,1,paragon
scorpionma,i have to disagree on you on the fey imo she the best bot hero out there she really plays well,1,paragon
scorpionma,i saw this bug happening before my allies stopped seeing me i can only see them on person not on map and fog was confusing ,1,paragon
scorpionma,look at this from a few days ago https gfycat com decentblondfurseal,1,paragon
scorpionma,i am not sure but i heard in a community corner is that he will get one,3,paragon
scorpionma,i think people still need time to figure out his deck i think the new vamp cards are great on him,2,paragon
scorpionma,i go countess mid lane keep killing ranged minions with my q and every 3 points or a chance to back away while we are advanced in the posetoon i will retreat its kinda hard going for last hits because you will have to get close so take out ranged with q and tale some last hits with dark tide when you get your ult signal your jungler to tank her and you will get an easy kill ,1,paragon
scorpionma,is this what i think it is ,1,paragon
scorpionma,they should imitate the flashbang in csgo in terms of brightness they did it great there,1,paragon
scorpionma, you can do whatever you want in a not game just please do not bring shit into pvp test your decks play style in vs bots but leave pvp alone thanks,3,paragon
scorpionma,played 2 games today where this happened in the third game i asked in the draft i hope you know how to use her as support he replied what is a support fuck,0,paragon
scorpionma,read the title as tired of v4 and got mad but look how the turns table,1,paragon
scorpionma,not so much as countess ,3,paragon
scorpionma,as an offlane countess i only have 1 free slot to give for such thing and its late in the match too i am seeing where you are coming from but she needs a lot of countering not the normal hero counter like aurora,1,paragon
scorpionma,i am sorry but that just stupid to say we do not build a whole deck based on one hero i can build a whole deck dedicated to making any hero useless but that would make me terrible against other heroes her abilities are simply too op she heals more stuns more saves heroes better makes the enemy hero useless comparing that to other support she is the most powerful in evey aspect but team fighting ,-2,paragon
scorpionma,the range on her slow beam is way high let alone that youcant miss it ,4,paragon
scorpionma,i am not currently twlkig about how over powered she is but the skill needed epic is making new heroes way easy to use i kinda do not mind that but the fact that these heroes does the same things as old heroes but are still easier to play is where its unbalanced like dekker can stun you but there a huge chance she will miss while phase can not miss and can keep charging until it hits you and it stuns for longer i still not sure about how op or lp she is but the skill needed to play her is way lower than other supports which is not good imo,7,paragon
scorpionma,yes but what for other oflaners ,3,paragon
scorpionma,in 1 month and and 17 days to go,2,Showerthoughts
scorpionma,damn every draft in silver is choosing phase i am okay with that but they are all playing offensively and looking for kills and midlaning they do not get that its a support ffs 3 games all lost because they are pushing with phase,2,paragon
scorpionma,i can kinda understand that maybe the love for their child makes it seem like a good idea but to get a tatto of yourself is just plain stupid and there is a perfect word for this that i forgot hell i even get mad when people put a picture of themselfs as a background or even like their own posts but to put a permenant tatoo of yourself ,7,cringepics
scorpionma,they are probably acting like that because someone else is blocking their item,25,Showerthoughts
scorpionma,did they pay him back or gave him another ticket ,93,AntiJokes
scorpionma,it was a joke directed at myl laziness but i wrote it off in a wrong way i clearly saw what op meant and i did not mean to attack him sorry,2,facepalm
scorpionma,i am sorry i was trying to make q joke which was written in a stupid way sorry again,1,facepalm
scorpionma,i hate when people post a whole big ass picture full of texts and expects is to look for the face palm nothing shadings you op i am just lazy edit i am sorry i did not mean to bitch i was trying to make a joke which went awfully wrong i will downvote myself now i am sorry again,-10,facepalm
scorpionma,oh god i just realized my typo fuck,2,paragon
scorpionma,fuck my brain cannot handle this,1,NoStupidQuestions
scorpionma,is bot you are not thinking its that you are on autopilot ,1,NoStupidQuestions
scorpionma,i think it a paradox if he sent it it would not matter because people did not come anyway if he did not send it then that the reason noone came i hope you got my point because idk how to write,1,NoStupidQuestions
scorpionma,i pretend i have an another life i make scenarios where i am the hero snf shit its not i am not happy with my current life its just fun to picture things with your mind when you are free sometimes this actully helps me imo i once fell down the stairs with a pen on my mouth my quick thinking was protect my mouth from the pen more than lowering the damage of the fall and it worked if i did not do that i would have gotten fucked up and maybe choked the reason i knew what to do becayse i thought of this situation before,2,NoStupidQuestions
scorpionma,she still just a kid she doest really know how bad what she doing jm sure you invading her privacy is far less hurtful than what she doing she might be upset now but she will get it for sure she will understand what you did was for her safty,2,NoStupidQuestions
scorpionma,happened to me before found no solution and had to download that ,3,paragon
scorpionma,45 mb sex ,2,paragon
scorpionma, timezones ,2,paragon
scorpionma,repostseption,1,Serendipity
scorpionma,fuck i really need help on this one what 2009 memes and where were the memes making irony of them and what is this meme fuckidontnderstand,2,coaxedintoasnafu
scorpionma, ,18,BigCatGifs
scorpionma,what dies this flair mean anyone care to explain ,39,BigCatGifs
scorpionma,but what if i hold ,1,me_irl
scorpionma,i agree if he went on shouting some stupid stuff and actully did some stupid things he deserve it the article does not really say anything about that so i do not know i am agreed that he a dick and he doest deserve money if if he did a stupid and suspicious move intentionally like shout i have a bomb or something but if he did not i think that they should pay him a lot more than the ticket itself because of time wasted energy wasted and possibly missing an interview or something again i am all in on extra security and searching people but to not give them something back after they removed them from the flight is dickish,1,videos
scorpionma,can i ride you ,2,me_irl
scorpionma,i am okay with extra security i think its needed but the part i am worried about is that they knew he did not do anything wrong at least give him some money equivalent to his ticket or pay for the trouble you caused him,2,videos
scorpionma,imagine you get s hotel room for 1000 someone there suspects you of being a terrorist so the hotel kicks you out and fbi cones checks you out then it turns out you did nothing wrong and it was all a mistake but the hotel ai not paying back and fbi is not doing anything and you list your 100 for nothing at all fuck them all ,1,videos
scorpionma,wtf,3,Showerthoughts
scorpionma,that percentage is way exaggerated it like 10 or 15 ,6,WTF
scorpionma,sorry to let you down but the default deck is way less fun and is a lot of different from the meta deck try building a deck like the ones you find online like qunehshing scales honor the pure and purity sensor in some cases its way more fun to support,1,paragon
scorpionma,he might have made a stupid move but is not his fault they piled up like that you should always leave a stopping distance between the car infront of you,37,WTF
scorpionma,every one of my friends make it seem the best game they every played then again they did not play a lot of games,2,gaming
scorpionma,hmmmm i really dislike playing with the controller so i am sure i will only play console only games on it so the list wo not be that big i do not think i will get one but will rent one from my friends,1,gaming
scorpionma,everyone is saying that i still cannot run ps2 games on my pc ,0,gaming
scorpionma,he did issue an apology in 2015 not sure about that though,2,funny
scorpionma,you have some big ego man,1,funny
scorpionma,people think that every gag watermark shitty image while it 70 true they reposts a lot of front page from reddit and tumblr ,2,im14andthisisdeep
scorpionma,no i know electricity is really dangerous but people really make it sound a lot more dangerous a little 110v zap in one second does not kill someone that easily i have been zapped a lot of 220v zaps it hurts a little at first but it goes away 15 minutes after ,2,Whatcouldgowrong
scorpionma,the joke is so bad it made me laugh,2,Jokes
scorpionma,oh so that was the other user men with ps now i feel stupid ,2,gaming
scorpionma,yeah same here first hero and still not mastered i love counting how much squishy hero in the match i can take out before the match starts there are sine matches where you cant take shrine with out help and is really annoying,1,paragon
scorpionma,not sure about this but countess spell vamp would make her a lot more sustainable she already haha from killing minions and hero that spell vamp would make her heal a lot more,1,paragon
scorpionma,learning kallari now wo not hello you as she is getting rewirked tomorrow the big v4 you might wanna check the wiki on paragon reddit for tips ,1,paragon
scorpionma, i am all in of the story attracts me i think i am gonna put it on joke atm and gather a list of ps console only games and when the list is big enough i will get it ,2,gaming
scorpionma,going attack speed or critical or basic pen in countess it useless,2,paragon
scorpionma,i really think some more millimeters to her shadow slip range would make her perfect she kinda needs those,1,paragon
scorpionma,it serve a point so new players does not think the game is to hard or find it very difficult of they choose a really difficult hero we need it here b but i agree 8 days is to much the limit should still remain but it should be a lot less than that,1,paragon
scorpionma,i am actully not a main at all he is really easy to take down if your a burst of a caster like countess i am not talking about moving i am talking about his escape you all should not compared every hero with another just because done hero has lower fame he should not he had a big account of weaknesses you call that an escape he can make only a nearby hero target him which he is already following him an escape in level 5 that takes almost 2 minutes and dies not guarantee an escape at all comparing to other escapes it is a shitty 2 minutes escape that it also used is not always available to because you already used it some time ago while attacking someone,1,paragon
scorpionma,i cannot buy a ps atm if that is what you are referring to,-1,gaming
scorpionma,every fucking friend recommend it to me but i have a pc i honestly wish to buy a ps4 to play this game but i cannot ,21,gaming
scorpionma,this i feel like we should buff other supports a little instead of nerfing dekker different support method shittier support,1,paragon
scorpionma,last match when my carry got to 60 60 he did not care any more and started to give me kills and kept spamming attack raptor camp then givi g me the cxps his reasojong was that i helped him the entire match and he wanted to pay back a little that was a great fucking carry ,1,paragon
scorpionma,it it really hard for my brain to see this cannot imagine the perspective for done reason,3,me_irl
scorpionma,it felt cool doing it too unfortunately my m8s did not really see that ,2,paragon
scorpionma,thank you ,2,paragon
scorpionma,yes most posters want kills or want to be the best one in the match and they think most kills best player they ai not no birch to heal someone,7,paragon
scorpionma,https gfycat com impureableclumber another angle ,3,paragon
scorpionma,us is just like apple they want to be unique and different in the most stupidest ways ,11,me_irl
scorpionma,it all my fault i am extremely sorry and you did but have to go through they i am sorry i think the best way to do it is via this http paragonhelp epicgames com customer portal emails new,1,paragon
scorpionma,i like this solution,2,Eyebleach
scorpionma,boooo prior complaining about how powerful his ability but he moves like shit does not have an escape his health is really bad his ability wo not work near minions he has to reload above ask that he only has 2 abilities that does damage and if you go and take countess 2 of her abilities died the same damage as revenant,1,paragon
scorpionma,what is up ,1,paragon
scorpionma,came here to say this,1,AskReddit
scorpionma,support in paragon this gonna be great,1,AskReddit
scorpionma,she not that into dick,1,AskReddit
scorpionma,oh i thought he was the only one if that is the case then i apologize op i was being to harsh,2,paragon
scorpionma,oh shit i meant buff sorry,1,paragon
scorpionma,wait how is he holding the camera not this shit again,32,Eyebleach
scorpionma,nope i think it goes 40 fc barca 40 real madrid and 20 other clubs like chelsea and manchester i am not football fan but you would see arguments every now and then over both sides ,0,NoStupidQuestions
scorpionma,these are community coordinators or he he is not responsible for this type of thing unless he sees something that is obviously a mistake you just said you have been banned no username no explanation of the problem you just said you were banned and seeking attention wo not do it if you believe you were banned by mistake or an error just contact them explaining the problem you would get a lot more help there and privacy,2,paragon
scorpionma,what do you gain from telling us this telling the community about stuff that we do not even know about i am not trying to be rude but posting here wo not help you g to their main site and message them there there a small chance you would get help here,4,paragon
scorpionma,fully agree,2,hiphopheads
scorpionma,i do not really enjoy listening to eminem but the last time he did a great verse for me was in dr dre compton album in the song medicine man shit is fucking amazing,26,hiphopheads
scorpionma,have a great day then ,1,NoStupidQuestions
scorpionma,wait a couple of weeks and y all well get tour lucky patcher patch or your an exposed module to make it work,5,Piracy
scorpionma,not at all no the way i phrased my question was not good enough i am the one that should brr apologizing thanks for answering and i am sorry,1,NoStupidQuestions
scorpionma,no i meant the currency is it usd euro jod etc,1,NoStupidQuestions
scorpionma,10k usd or what ,1,NoStupidQuestions
scorpionma,he had about 6 upvotes here i have no idea how people can upvotes this shit oh god his comment history is shilling,2,wholesomebpt
scorpionma,really every study says men gets a lot more prison time and gets in jail a lot more than women those who goes are caught ,11,CrappyDesign
scorpionma,thank you for smalling down 2 frames 3,2,fite_me_irl
scorpionma,that is if you land it great ability but require a lot of aim and so much luck that why i think riktor needs a nerf buff every new hero is getting lock on and is very easy to play with while older hero relies on luck a lot and need aiming and hard working buff riktor,3,paragon
scorpionma,like the senator and angela in the office ,22,funny
scorpionma,sometimes the second message is not sent due to too many messages and it disturbs the posetining of teammates i think having an on my way is better,1,paragon
scorpionma, r bestof,2,gaming
scorpionma,keep solo quing every time you play with someone pro add him as a friend after a while you will have a shit ruin of pro friends to lobby with ,2,paragon
scorpionma,we need something to say on my way to ward op or something i sometimes say ward op and follow it with ok i am on it but the second one does not always go through so i ruin everything,1,paragon
scorpionma,he actully said on early interview that kendrick is gonna have an awesome carrier and he fucking did edit damn not early interview but he said he rolled with him https youtu be wy lr9ht4mi,71,hiphopheads
scorpionma,wtf last album fuck that man we need more of the game ,1,hiphopheads
scorpionma,you are talking like they are not humans he may have fucked up sometimes in his life but he fixed his situation for the best and felon is a strong word there just because someone got locked up does not mean they are not allowed to have kids he may only be locked up for stealing a chocolate bar it happens what you said is really harsh,15,wholesomebpt
scorpionma,you should go the subreddit sidebar and click exclude from r all i dont see why you wanna do that though ,2,wholesomememes
scorpionma,oh shit busted its not just spofity though,1,me_irl
scorpionma,i did try to do that first comment here is me crediting him but it didnt get to the top https www reddit com r wholesomememes comments 6azu76 take your time dhinndx,1,wholesomememes
scorpionma,what ,2,wholesomememes
scorpionma,we love you too just by reading this my face is already smiling thank you,2,wholesomememes
scorpionma,i am from jordan though which i am sure is much shittier than nj,1,wholesomememes
scorpionma,joe budden gas in the car,37,BlackPeopleTwitter
scorpionma,i have suggested before to just remove the cooldown if the damage did not apply but people said it made the enemy hero turn his head so its something while i kinda agree with that atleast fix the ult so it is more viable and can be relied on,1,paragon
scorpionma,let me guess your name is gatis kandis ,1,AntiJokes
scorpionma,http reddit com r wholesomememes comments 6azu76 take your time dhinndx he gave me permission ,3,wholesomememes
scorpionma,that sad ,9,Showerthoughts
scorpionma,every been ulting someone and countess would just move everywhere like going left and right and ip only for your ult to not do any damage ,1,paragon
scorpionma,minions fight everyday for a hero like you to come and just easily take that last hit support minion today,1,paragon
scorpionma,once me and my brother and our 2 friends was behind someone who his car stopped working at the first place in the light we all got out pushed his car to safety then drove our car to safety and fixed his car ,9,wholesomememes
scorpionma,1 am bored just flipping channels in tv when i find chris rock is talking about hair good hair it was entertaining educative and most of all really really funny ,1,AskReddit
scorpionma,good job microsoft ,2,worldnews
scorpionma,x posted from this fellow http reddit com r bikinibottomtwitter comments 6ayrjj u good i got all day u chambee 11 edit what a great wholesome guy he was okay with this http imgur com uk3cgrs,25,wholesomememes
scorpionma,no where in the qur an it says to kill non believers ,2,jordan
scorpionma,what is happening,10,bee_irl
scorpionma,that was actully impressive,10,nononono
scorpionma,how about yins ear destroying whips,1,paragon
scorpionma,it wo not be as bad as revenant though majority want more kills they hate being someone support trust me it wo not be as much add revenant,1,paragon
scorpionma,well he wasted a whole ult and then finally not get bonus that would make his ult kinda useless that is not the problem here the problem here is that it should be 1v1,10,paragon
scorpionma,i think victim is to easy right now and it should be nerfed 5 guys 10 invisible wards that covers a hide space is way easy imo imo toy should not be able to scan the while map that easily it should be harder,1,paragon
scorpionma,automatic mode for decks like the default deck one,4,paragon
scorpionma,orb prime should not be able to be taken by a 1 hero with life steal i think it should be disabled there or st leasy 50 lifeteal ,1,paragon
scorpionma,riktor pull needs fixing the skill there is too high the q for riktor takes too long to deploy ,1,paragon
scorpionma,1 you would find a lot people get pissed because someone choose a role that is not for a hero 2 not enough players to do this we are already experiencing high lobby time,1,paragon
scorpionma,i think he is not against dummy warding he against the discard thing,1,paragon
scorpionma,every little edit to the deck removes the cards order which is really annoying ,1,paragon
scorpionma,better friends thing 1 i should be able to add people when i watch their replay 2 i should find psn users by paragon name 3 a search feature to find friends 4 an option to watch the game my friend is currently playing i know you can go to the friends tab but having too kuh friends makes this a pain in the ass 5 be able to see profiles like kills deaths games played like general statists of friends 6 thank you for your great work ,2,paragon
scorpionma,not a lot of people know of this when you type you get a bunch of commands including mute maybe they could include it for voice there too,2,paragon
scorpionma, human freezes pupper to d ath,3,aww
scorpionma,this is great but i found this formatting a little bit better classic joke for our muslim friends today there were two white christian men john and mike whose plane crashed into a desert luckily they survived unharmed as they traveled through the hot desert looking for food and water they gave up and sat down thinking of what to do as the dust in the air settled they suddenly could view a mosque ahead they became very hopeful but then john said muslims are there they might help us if we say we are muslim then mike said no way i wo not say i am muslim i am gonna be honest so john and mike went to the mosque ahead and were greeted by an arab muslim who asked what their names were john thought of a muslim name and said my name is muhammad and mike said my name is mike the arab man said hello mike and told these other men to take mike and give him food and drink then he turned to john and said alaam muhammad ramadan mubarak hello muhammad happy ramadan ,3,islam
scorpionma,kinda of topic but i never learned how to make the dash go vertical like tha,5,paragon
scorpionma,that was a great move though,3,PeopleFuckingDying
scorpionma,not a mobile user but ,1,me_irl
scorpionma,in before lost city proof of aliens facebook posts and youtube videos,1,pics
scorpionma,what the fuck wow ,1,paragon
scorpionma,what does circlet is now global means i did bit understand that from the update same goes for mana,1,paragon
scorpionma,i think we were really greedy with epic there were lag and delay problem done months ago reddit was flooded with these so epic fixed it in 1 2 days then it all went quite morigesh too op they made a update bit only netting her but they merged her while maintaining it greatness and the most important is the orb prime and raptors we saw one o of those threads 5 times a day complaining his the game is trash but epic kept weekly updating with fixes until we ask quited down they listen to the community and they are doing great we as a community are bad for not recognizing their effort and thanking them all for their amazing work and community communication thank you epic for doing what you are doing,7,paragon
scorpionma,i very butch agree with the core it was way too easy to take down,1,paragon
scorpionma,freeman mind it kinda a youtube show but it extremely addictive and entertaining the kind that you can watch over and over again,1,AskReddit
scorpionma,who cares everyone forgot about dre,-1,Showerthoughts
scorpionma,is already one of the top posts iirc,1,ChildrenFallingOver
scorpionma,again sorry his title did not explain the situation i am sorry,0,videos
scorpionma,i am sorry i thought hood title did not explain the situation i added that myself to point it out,1,videos
scorpionma,his title did not explain the video well i had to add something to point it out ,1,videos
scorpionma,i also very much agree with that when playing countess i sometimes encounter 20 minutes with absolubty nothing from my team it like i am playing alone i am totally not saying they offlane should stay alone it really cannot be held alone for 5 minutes i am just saying let the jungler play some give him 4 5 minutes to jungle before you call him i would you are choosing oflane you need to be able to hold yourself ,1,paragon
