name,body,score,sub
scorpionma,did you know that a person who stutters while reading qur an gets twice the ajer here your hadith for that that does not mean you should not try better yourself though the fact that you are trying to fix your mistakes and your honest about it is enough you ofxourse do not get any sins for any of your mistakes but inshallah will get ajer for them what you are doing is beautiful and good luck ,2,islam
scorpionma,mono i am trying to copy files from my phone to pc its all done locally filezilla is only a client wic is free and does not have big limitations for what i am doing ,1,NoStupidQuestions
scorpionma,jacksfilms without a forehead joke,3,ofcoursethatsathing
scorpionma,came here to say this,31,me_irl
scorpionma,it should link to this too https youtu be 4hg g6x9fqi,5,ofcoursethatsathing
scorpionma,i eat a lot a lot but i burn a lot my metabolism is really high i guess i still do not know how that effects me though,5,islam
scorpionma,actully i always find myself gaining weight after ramadan no idea why,15,islam
scorpionma,what i would the target was sitting in the sky an ak was shot and it reached 0 velocity just when it touched his leg would that work is gravity wind able to stop it i am sure it would but how far would he be in the sky,41,NoStupidQuestions
scorpionma, r antijokes,2,Jokes
scorpionma,try playing with nvidia control panel settings try to remove the morin blue option see of that helps it or change the aa,3,paragon
scorpionma,came here to say this,49,me_irl
scorpionma, ,2,Piracy
scorpionma,i have a hard time fighting something 0 005 my body mass those spidies are scary ,10,AnimalTextGifs
scorpionma,reddit is one of the 50 or even 25 sites with most visited iv learnt that there is no one reddit community everyone is different here but we all make sure that positivity get over negativity and we all can be reason for it,2,bestof
scorpionma,thank you for commenting ,2,AfterTheLoop
scorpionma,thanks for answering ,3,AfterTheLoop
scorpionma,i do not beelieve it,6,bee_irl
scorpionma,what i type my face ,10,AskReddit
scorpionma, wronglanguage farsi,1,translator
scorpionma,this is only a suggestion from me because words are obscured noone of the word here is understood so in going to try this ,1,translator
scorpionma,as countess i always feel like i am useless in team fights because j can only target one guy and is hard to time it right i usually just go on attacking a lane fast enough to destroy an inhibitor and it always works late game she has an amazing lane clear what takes 1 second ,3,paragon
scorpionma,we love you u warowl,7,GlobalOffensive
scorpionma,thanks ,1,islam
scorpionma,thanks a lot for your kind words ,1,islam
scorpionma,this us amazing great job man may this be a sadaqah jaryeh for you,1,islam
scorpionma,this is not the sort of thing to ask us ask your doctor or your local mufti but if it effects you then the obvious answer is you can not fast if it effects tour health,1,islam
scorpionma,ramadan should not be the time to do things it would be the time to start things sorry for the stupid sentence but what i mean is what you wqnr to do this ramadan make sure it sticks to you for after ramdan do not stop fasting certain bad behaviors after ramadan,2,islam
scorpionma,try this http www reddit com r islam wiki ageofconsent,1,islam
scorpionma, lives are at stack then your fast becomes haram i think like if you knew fasting would result in someone deaths and fasted that would be haram please check up an emam on that i do not want to do iftaa on my own but that what our local emam said please ask someone who had knowledge and also for your 20 21 hours fasting did not muslim scientests made a statmenr that i would your country fasts for too long you xa follow a shorter country like in the north pole people follow mecca or something please look into this,1,islam
scorpionma,that 110 in the cinema,2,islam
scorpionma,nope our local mosque jordan does tawaraweeh in 30 minutes and people complain trust me is not about the physical pain nor about not understandimg people just do not have qushoo in their salah i guess ,2,islam
scorpionma, supaplex dos not that i am old or anything but where i live technology took a while to come everything was delayed ,1,AskReddit
scorpionma,i have recorded voice messages and i am using an app that would play the voice when i click on it i recorded my perfect voice of and different kind of pizza and noemall reponses makes calling a lot more fun and you do not feel pressure calling i mean me too thanks,1,2meirl4meirl
scorpionma,the birtney spears looks like a britney spears from a bart baker parody song,2,WTF
scorpionma,a law says you can kill people if it self defence an extremist comes and quotes the law by saying you can kill people and goes ahead and does what he wants how the hell is this the laws problem ,18,islam
scorpionma,ask him if you fast just that he does not need to be muslim to know if you need to consume food or not during the time he does not need to be muslim to know if you need to take some medicine or not,1,islam
scorpionma, r muslimnofap we are with you brother we know what you feel,6,islam
scorpionma,thread started fun with the candy and stripper then we got hit with this,434,AskReddit
scorpionma,nice try fbi,66,AskReddit
scorpionma,i love electricity programming computer science fixing electronics etc like when i saw the arduino my heart fell down from excitement and i am still doing stuff on it should i go mechatronics electrical engineering or computer science my first choice is electrical engineering i wanna hear opinions on it,1,AskReddit
scorpionma,can we generate infinite power from this ,3,gifs
scorpionma,you have made enough qualify videos to gain my respect this is fucking great well made man,2,paragon
scorpionma,imo the other reason she is picked a lot more is because she a lot easier to play with in front of dekker and narbash 3 of them does amazing supporting but phase can do amazing support is a lot easier to play i think epic is releasing the new heroes really easy to play with but the old ones re still hard to play with which makes it unbalanced in skill term,1,paragon
scorpionma,oh i did not notice that thanks a lot for informing and thank you for doing what you are doing best of luck,7,paragon
scorpionma,thanks a lot you made me smile you are awesome,7,islam
scorpionma,is it because that phase health regeneration bug ,3,paragon
scorpionma,thanks,1,Jokes
scorpionma,fucking turtled,7,PeopleFuckingDying
scorpionma,i feel you man i make a lot of mistakes ask a lot of english questions and always get shit in for it just know that you know 2 langauhes at the same time while they only know 1 and critzise you for it when someone is really butthurt about me not knowing a word i just shit on them for not knowing a word in my language good luck,34,todayilearned
scorpionma,yes i was thinking i would make some cement and put it in the hole then put the pond liner maybe will even put tiles in to make the perfect slope thank you so much man thank you,1,turtle
scorpionma,yes that what an going to do would that work ill make a slope that she can get out and get in on,1,turtle
scorpionma,this is amazing man thank you do much you probably just saved a turtles life i have no way to get a track or pay for that but i will create something with my yard and i will be due to inform you first of it thank you so much ,1,turtle
scorpionma,so it has a lot better chance living with me than being released that actully kinda great to hear for some reason i thought i was taking the freedom from here i will look for the head in a bit thanks a lot for replying our average tempreture is always between 20 30 in most seasons but mostly get 0 10 in winter in winter we keep her inside in the warm where temperature is of course a lot more than 10 ,1,turtle
scorpionma,yeah the average temperature here is about 20 30 i can change the water every day of it matters thank you so much for helping you are great ,1,findareddit
scorpionma,what is the solution then where can i donate give this turtle we do not have a lot of animals right things here,1,findareddit
scorpionma,thank you very much for replying unfortunately i cannot afford to make her a while fish y all nor do i for the space i am a 17 years old guy who cannot do ask that since my dad does not want the turtle anyway here a link to my post thank you very much for helping https www reddit com r turtle comments 6dhcl0 how to take care of this turtle ,1,findareddit
scorpionma,http imgur com mtdr2ws http imgur com usrn7o0 http imgur com ucsluwr http imgur com omelbl2 http imgur com i6rlhjh http imgur com bsmrnwy thank you,1,turtle
scorpionma,i will make an a lot more specific thread when i know what subreddit to post in i will link you to it once i make it but it basicly means i do not have a river or a sea near me i have my house my backyard to use or to make a water place for it do you think r turtle is a good sub for that i honestly cannot beilie i did not check that out,1,findareddit
scorpionma,this is actully pretty awesome great job,7,islam
scorpionma, r designporn for programmers r crappydesign for non programmers i can see many people not knowing what this means,5,ProgrammerHumor
scorpionma,or he ends up dying after all that and blames you ,1,paragon
scorpionma,when you use your stun your cage your slow your quinshing scales honor the pure your ult your purity censor just to dave your carry from dying while he attacked a 2v1 then you get no fucking thank you or a good job ,1,paragon
scorpionma,also when you teammate with really low health was marked by morigesh follow me follow me follow me while he not responding and going bad to base and dies from morigesh ult i can fucking heal you,1,paragon
scorpionma, sees jungler coming to rightlane carful right lane carful right lane retreat retreat carry dies why did you miss your stun fuck outta here ,6,paragon
scorpionma, i know you do not smoke weed i know this but imma get you high today ,6,BlackPeopleTwitter
scorpionma,thanks a lot for answering you are the best ,2,islam
scorpionma,good bot ,12,im14andthisisdeep
scorpionma,yes but people go a lot more sympathetic and caring for those deaths than third world countries like jordan for example we rarely have terrorists attacks but she they do happen media is not covering and people wo not get sad over it and consider it normal ,2,islam
scorpionma,then why the fuck is he haunting them also was not there a the simpsons episode about such thing where homer ets scared of a black bear and everyone laughs at him ,1,WTF
scorpionma,they do had a guy do nothing the whole game but jungle no team fogts nothing but jungling core inhibs went down while he was jungling reported him and got a thank you for reporting he has been take care of message,1,paragon
scorpionma,jimbo,1,me_irl
scorpionma,not sure but is not shocking news because they are endangered again i am not sure just asking,4,savedyouaclick
scorpionma,the offlaner should not call you before the 5 minute mark if he does then he doing an awful job and saying it 2v1 is no excuse because that his job at 5 minute we want you to bone for a we have a lot of unspent cxp like 3 5 b we took too much damage and tower is under attack c a great bank that will lead tk the jungler death so we really need you at 5 kin unless we already pushed tower tl dr offlaner should at least hold his tower every 5 minutes and should not call you but in hide 5 minutes ,1,paragon
scorpionma,one thing that helps is enabling the ask where to download file every time which will being a pip up window telling you where to download a for if an ad started downloading thing you would notice that and click cancel,4,NoStupidQuestions
scorpionma,if you mean pirating the game the answer is still yes you can run it,3,commandandconquer
scorpionma, r wtf r osha r nononoyes,1,Unexpected
scorpionma,cnc online is free and requires no cd key ,3,commandandconquer
scorpionma,thank you i already know about that i have gathered a list for such occasions where i need to clean my eyes r eyeblech r bigcatgifs r animaltextgifs r mademesmile r dogberg r puppysmiles r aww r patientdogs r startledcats i missed some which i cannot remember ,3,Whatcouldgowrong
scorpionma,what so toy mean reading and driving in public you can do that unless you meant ramadan instead of eid then you also can rest in public it okay i would say just be nice it enough avoiding roman seems kinda extreme the way you prescribed it if you and a woman is pay to talk to each others than talk no one will prevent you,2,jordan
scorpionma,i am going to ask a question here i hope i do not offend anyone and if i do i am sorry bit why when an attack happen in a foreign country like us or uk it ask over media for a few weeks and good hear about it for months while these bombing is okay toy might say is because it a way zone okay buy there are other countries who also have terrorists attack that ate bit takes about it almost like those are not humans and is luke proofs only care about where it happens and who did it not care scott people dying i have nothing but respect and sympathy for every family member of the recent attack and i do not mean to offend anyone just asking,0,islam
scorpionma,sorry but what was the edit thanks,5,funny
scorpionma,hey mf er welcome treat us right and we will treat you as a family member mf er,7,THE_PACK
scorpionma,thank you ,3,Whatcouldgowrong
scorpionma,fuck that sad,7,Whatcouldgowrong
scorpionma,thank you so much for your reply its not really a big deal to me but thank you so much for your reply ,3,baconreader
scorpionma,this obviously happend in his property so pretty it his own recording device so his family wo not post it right right oh god,-10,Whatcouldgowrong
scorpionma,i always play oflane i only call jungler after 5 minutes mark and only if they are pushing tower or i can guarantee a caryy kill from a bank i do not call the jungler for another 5 10minutes if i need help defending tower an oflaner who cannot secure his tower for less than 5 minutes is a bad offlaner and saying i am 2v1 is not an exuse at al and he should be blamed,1,paragon
scorpionma,he did not thought he moves and lifts him self up if he died noone would post this video online ,-21,Whatcouldgowrong
scorpionma,come one what she did is nice but people here are forgetting what uplifting means this sub should make me feelbetter not make me sad of such tragic events what she did is humane awesome amazing brings hope to humanity but that does not make me happy it just keeps reminding me of the tragic event ,1,UpliftingNews
scorpionma,that really really nice of you to do that it is really hard yet you stuck with them absolubtly amazing good job 1,3,PsychologicalTricks
scorpionma,thanks a lot wish you the best as well,2,PsychologicalTricks
scorpionma,i would the enemy want giving him space to land on he would have fallen before he could have knifed him i would he did not knife the air and landed his knife on time he could have landed on his body hope my bad english is clear enough,3,GlobalOffensive
scorpionma,came here to say this,18,4PanelCringe
scorpionma,ramadan is starting for us muslims in the next few days you would make your muslim friend very happy if he knew you are joining him in fasting ,11,PsychologicalTricks
scorpionma,i recieved the same message reported it to reddit linked this thread and they have taken care of it thank you reddit admins thanks a lot ,1,islam
scorpionma,nash this is not going to be front page in other subreddits they do not want to hear this,2,islam
scorpionma,ok ,39,cringepics
scorpionma,the fact that you could have fallen because you right clicked the air is annoying why did you do that u,5,GlobalOffensive
scorpionma,your wish has been granted,24,BlackPeopleTwitter
scorpionma,i wish i can do that to my bullies ,1,funny
scorpionma,oh it the same here you give him 100 jod and he will give you 9 liters ,1,nottheonion
scorpionma, r iamverysmart ,0,gamedev
scorpionma,i dont know the guy nor the music i am just your fellow reposter,1,SlyGifs
scorpionma,i do not even know the guy just reposting from another sub i do not even know anything about k pop like i said i posted not to get karma but only to have some activity in this subreddit,4,SlyGifs
scorpionma,bit why was of that way why it is not still that way any reason behind that ,1,nottheonion
scorpionma,this is the unreal engine they can do a uckjng reality show with art but it is not their main priority right now would you rather have a car with sick colors amazing sound system air conditioning sick as fuck interior but it does not move at all and it broken or have a car with a kinda bad paint job normal interior no air conditioning and average sounding sound system but the car can hey you from point a to b in great amount of time point is game is was imbalanced focusing on art will mean the dev work said being less and we would get more buffs more in balanced gameplay and less heroes my suggesting just wait of you do not like the game art arm which i agree is wrote bad just wait for them to have some time to focus on that they have their priorities right with focusing on gameplay and letting art alone,1,paragon
scorpionma,i would understand that she the love of his life do not think there any way getting a tatoo about yourself is bot shitty or narcissist,1,cringepics
scorpionma,i ,3,funny
scorpionma,you have to use your eye ,1,nottheonion
scorpionma, you are bound to found some i guess there more at r jordan too unfortunately it kinda inactive and most people think it a subreddit for air jordan ,1,nottheonion
scorpionma,i am sorry try now,3,funny
scorpionma, removed ,1,mildlyinfuriating
scorpionma,i have contaxted the guy and i got the original post here it is v,1,mildlyinfuriating
scorpionma,in jordan you just set in your car and a worker will come and you will tell him how much you want and he will pump pump it up you pay cash and you go,116,nottheonion
scorpionma,paragon for switch hype,2,NintendoSwitch
scorpionma,look at her left hand though the hall gap between the fingers stay still the whole time definitely a dummy,75,funny
scorpionma,are you people really still blaming islam why would a muslim blow up another human even worse why would he blow up another muslim ,-8,worldnews
scorpionma,as a dekker the ability to be a lot more tanky now and take a lot more damage as a countess offlaner the help i get from circuit of health and the fun in stealing the gold buff an awesome reddit or taught me a easy to do that ,2,paragon
scorpionma,true but there are some slynessin it if the sub had a lot of posts in it i would not have posted this but its getting inactive with 1 2 post every week every posts helps i guess,9,SlyGifs
scorpionma,is your wife name stanley ,4,Jokes
scorpionma,is not this the one who slaps the owner in the fucking face ,60,Eyebleach
scorpionma,open post bottom right click the 3 dots and click show hide title,2,baconreader
scorpionma,why is here she has autism where the cringe ,14,sadcringe
scorpionma,yeah we all got these mesaages i will go ahead and report them to admins it a throwaway account anyway,9,islam
scorpionma,haha that funny you are obviously mocking the prices posts haha because what you did is impossible holy shit,1,pics
scorpionma,yes of it freezes while a button is pressed it week keep on bring owed it freezes while i was walking in safe lane 2 seconds later found my self in enemy tower and died because of it please fix,2,paragon
scorpionma,we really need a fix for the show ping fps option it rarely works it only works one game or two i have no idea based on what,1,paragon
scorpionma,a boy got suspended from school because he liked a picture of a gun on instagram now that fucked up,9,OutOfTheLoop
scorpionma,i did not day ban muslims i said decided ,5,islam
scorpionma,google her she everywhere interviews music videos tours you name it,1,savedyouaclick
scorpionma,ads youtube channel with 1 million sub instagram dollars product placement she takes 30k for a meet and greet and good know how much for an interview mostly ads and product placement,1,savedyouaclick
scorpionma,i too felt that way for a while but i would like to remind you of something remember the time trump decided to ban muslims did we stand alone did every one agree to kick us out out did hundred of celebrities stood with us and gave speeches i will let this gif give you an answer https gfycat com directidlegentoopenguin these are all a middle of the original size and they are all here to protest the ban shading muslims ,56,islam
scorpionma,why is not the article calling then terrorists ,5,islam
scorpionma,why does it say removed when it right there https m imgur com t current events glxvt,1,SlyGifs
scorpionma,of you do not mind in x posting this to r slygifs,1,gifs
scorpionma,what the fuck how the fuck are you letting her wear only 1 shoe she will trip that way,13,funny
scorpionma, r slygifs,1,gifs
scorpionma,fully agree,1,savedyouaclick
scorpionma,oh god that was so bad to read i am on mobile and looks like swyping does not work very well with water here try now i am very sorry,2,savedyouaclick
scorpionma,he asked a question i answered ,1,savedyouaclick
scorpionma,she does advertisements she has been on a music video she has around 1 million youtube subs she also asks 30k for 1 meet and greet pay 30k to see her in person,0,savedyouaclick
scorpionma,others are saying is catch me outside as in you want to fight sorry mistake on my part,5,savedyouaclick
scorpionma, we are rewarding people for doing illegal things scratch that we are rewarding children for doing illegal things i am pretty sure a kid would see her as a role model to her somewhere and start acting like her because that got her famous and that should work for me personally i am not effected by it butim pretty sure society will there are a lot of great children who are geniuses and artists who deserve a lot more praise but instead it goes to this disrespectful child,5,savedyouaclick
scorpionma,oh i did not know that but still media should bot have made her so famous and gave either of them money,39,savedyouaclick
scorpionma,i am sorry i used the wrong word i meant the word that means illegal thing which i forgot i did not mean crime as in killing but as stealing and such sorry again,2,savedyouaclick
scorpionma,its annoying because we are giving someone money for being disrespectful to their parent hitting their parent and swearing them at only age 13 doing crimes and stealing cars its pretty obvious why i am mad ,29,savedyouaclick
scorpionma,when you open the menu again does it say save or unsave two clearing the app cache,1,baconreader
scorpionma,it saves to your saved tab on your profile not your phone i thus your problem ,1,baconreader
scorpionma,ftfy why you making me so small ,11,savedyouaclick
scorpionma, dunno what i wanted with this post was really annoyed at that moment agreed this post is bad and serves o purpose sorry about that,2,islam
scorpionma,i am really annoyed by it she is not semi famous she is really famous she also a millionaire now and possibly makes 40k a week its really really annoying,341,savedyouaclick
scorpionma,it so cringy it actully good well done,4,paragon
scorpionma,a girl got in dr phil show for being disrespectful and shitty to everyone and doing crimes she said catch me outside how about that now she famous gains thousand of dollers a week all this for being a bitch to her mother and stealing her car ,820,savedyouaclick
scorpionma,came here to say this,9,me_irl
scorpionma,came here to say this,4,me_irl
scorpionma,that very true thanks a lot for that yes killing someone is like killing everyone and helping someone is like helping everyone i rarely stumble upon guys like you thank you for that,2,funny
scorpionma,what i do not understand about these people is that nowhere in the qur an does it say kill believers unless it taken out of context like and slay them wherever you catch them this verse obviously promoted just that right nope gets the context of it fight in the cause of god those who fight you but do not transgress limits for god loves not transgressors and slay them wherever you catch them and turn them out from where they have turned you out for tumult and oppression are worse than slaughter but if they cease god is oft forgiving most merciful if they cease let there be no hostility except to those who practice oppression 2 190 2 193 this verse came out during they are fight with as hl quraish and they did enter mekkah with no killing of non believers i can give you a great amount of hadith ayays stories sahaba stories that indicates not to kill non believers i still have no idea how they are fed with such bullshit ,2,funny
scorpionma,i think it the rank i have never encountered the same player twice i am at silver,1,paragon
scorpionma,holy shit is not that to good for a game that had no advertisement no release still in beta that very awesome ,1,paragon
scorpionma,i have to disagree while it may be the hardest it is the most fun part you get 2 enemies you have to farm without being killed keep your tower from being destroyed and lake the carry farm as less as possible the enjoyment here is the difficulty of doing all that toy have to think every move through,0,paragon
scorpionma,i have to disagree with you supports are missing a lot of utility the new phase i think is the best support to now i am not saying nerf phase i am saying buff other supports,2,paragon
scorpionma,not only that the target can be healed and pulled away phase which i consider a bug and should not happen,10,paragon
