name,body,score,sub
scorpionma,nope unless the online games you would taking about were club penguin and barbie games toxicity is everywhere is part of the internet and there no way you wo not encounter it there nothing epic can do to remove toxicity just mute the chat and go on with your life they will also be introducing voice chat in the future which well result into even more toxicity you gotta get used to having that and just mute people type mute and a list should appear,2,paragon
scorpionma,you can also consider it surprising an enemy so he had no chance to run like imagine if you are attaching an enemy middle of a lane an sky of yours comes from behind the enemy and starts attacking him to stuns him now the enemy is very likely dead ,1,paragon
scorpionma,the idea matters more than the item itself you should not think too hard to find the perfect item give them something expensive being them dates or chocolate or maybe bring them some bottles of juice before eftar ahead of time send then a player of food does not really have to feed them all just enough for them to try it out tl dr idea of doing then something item it self being then something before iftar to add to the table,8,islam
scorpionma,ruin a religion reputation which is already bad while you are at it,1,funny
scorpionma,people calling everything they see cringy is cringy,16,4PanelCringe
scorpionma,he even compensated the extra tribe the terrain takes to stop thats a smart bird,2,funny
scorpionma,enormously ugely,22,todayilearned
scorpionma, if you need it then it either means someone is not doing their job looking after a lane and you are not where you need to be thats excatly what happens im with my carry i keep signaling the lane which is getting fucked nobody goes or enemies are pushing 2 inhibitors etc yes its situational but extremly useful if im losing thanks a lot for the video it is really useful and i will try it out ,1,paragon
scorpionma,well this is fucking great i saw your deck and its very similar to mine in cards but upgrades where quite diffrent in a way thank you so much i have finished my deck i never knew about madspore or thermo bond and they are fucking great i have situationss where im left alone with a wave attacking and dont know how to defend tower a great situational card thank you so much ,1,paragon
scorpionma, do you know is better,4,translator
scorpionma,i think the video shows the training map,2,paragon
scorpionma,as i said i do not have eyes behind my back i thought they were chasing me from the jungle they have phases slow and riktors pull so i thought a jungle was a bad idea so i decided to run to mid only to see then again i told the revenant to retreat but he wanted to save me we won the fight afterwards though,3,paragon
scorpionma,i was giving you more examples i know it allowed ,1,paragon
scorpionma,i can get behind people jumping out i cannot get behind people getting pulled through the cage also an addition to your list is countess can shadow slip to a minion or hero outside too,2,paragon
scorpionma, is this some sort of joke do i need to re install the game did i just pay money for them to rip things out of the game this is pretty much complaining,1,paragon
scorpionma,right click refresh right click refresh they do it for 5 minutes straight nonstop to make the pc faster one of the most infusing things iv seen,0,Showerthoughts
scorpionma,speed,1,me_irl
scorpionma,they did that with revenant,1,paragon
scorpionma,hey there i do not part very often but i will add toy so if i ever catch you online i would support you,1,paragon
scorpionma,and make supports not interact with them like phases pull,2,paragon
scorpionma,that what we want here but i thought a portion of revenant is taken and the target is taken fully ,2,paragon
scorpionma,this is not an exuse though phase should not exist in thee nether realm the bond mist be broken once one of then goes there ,4,paragon
scorpionma,i am sorry to say this but just because you paid for or does not mean the whole have has to go your way you paid to support the devs not to make the game fit your mind,2,paragon
scorpionma,hmmm i wonder where you got that flair ,1,paragon
scorpionma,2400 sharpnel fury and 1k reputation,9,paragon
scorpionma,also dekker cage become useless with phases pull it is really annoying,2,paragon
scorpionma,at first i thought they were behind me while i was running no idea why they did not follow me and i thought that i has no chance of living there because of riktor pull and phases slow,3,paragon
scorpionma,it one of those facebook posts which was made only to make the shitty student feel better ,7,AntiJokes
scorpionma,i guess he does have islam phobia ha,1,islam
scorpionma,a further angle http i imgur com uhv1149 gifv,1,paragon
scorpionma,also is it life goods or is it life is good like is the s possession or is ,1,todayilearned
scorpionma, thanks http i imgur com ywlmbj4 jpg ,131,Piracy
scorpionma,that really placebo would my effect,6,coaxedintoasnafu
scorpionma, fuck the dad for checking up on his son wtf also the dad did not see the fall he only saw his kid on the floor,3,ChildrenFallingOver
scorpionma,what the fuck is this why would they put a person like him in prison and a fucking had champer what the fuck is wrong with them on top of that it is also a false accusation ,1,todayilearned
scorpionma, would be nice to sort the cards how you want,8,paragon
scorpionma,do not worry this is normal,6,unrealtournament
scorpionma,thank you like i said though i did not say they that his son were the one in that hadith just wanted to share some info,1,islam
scorpionma,thank you for the great explanation this is really great and well thought out thanks a lot ,2,GlobalOffensive
scorpionma,advertisements now ,19,Jokes
scorpionma,studying no because qur an must be heard and not talked above workout i think of you are listening to it yes ,5,islam
scorpionma,manage subreddit multi long click edit change,2,baconreader
scorpionma,is really kinda hard to translate but it means my grief or my sadness ,2,translator
scorpionma,yeah ruining your life bt fucking up others like those who suicide by jumping infeont if a car or a train people lives will be destroyed and probably therapy and shit,104,savedyouaclick
scorpionma,seriously asking here how does the top 1 team in the world and top 1 player in the world fall off to such position what happens ,12,GlobalOffensive
scorpionma,i did not receive my salary,5,me_irl
scorpionma,countess having some more centimeters to her shadow slip range like maybe 5 more of the current one,1,paragon
scorpionma,the prophet did have make children 3 but they died early i am not saying he talking about them here just suggesting,0,islam
scorpionma,i think this is the first guy that was actully not aggressive towards him,60,KenM
scorpionma,i think people are downshifting this because they misunderstood the title and thought you only posted a video here i think you should wait or post with a more clear title not rust toy did anything wrong but peoppe love to downvote without knowing what is up,3,islam
scorpionma,a person seeking help is going to get removed he is honestly curtis about the verses and peyote behavior here are only making it more suspicious please hero him or instead is flaming him ,5,islam
scorpionma,oh come on why are you guys down voting he is asking a question help him out here,13,islam
scorpionma,also new hero are a not easier to play with epic is making them really easy while the past ones are still hard,1,paragon
scorpionma,you cannot leave that one guy alone or he will feel lonely or left out bring them all together ,7,wholesomememes
scorpionma,we also need to stick together with those who are affected as well as you said there are a lot of other groups affected from the donald and we should be together againta them,3,islam
scorpionma,what the fuck people actully buy these not only are they stupid they are way overpriced unless it a phycological way to convince people to buy ,17,CrappyDesign
scorpionma,1 if having children causes serious health damage to you for your wife then it haram to have children if you know it will cause you gotta understand adopting in islam you cannot have your kid named after your family you gotta tell him he adopted and he still has to have his real family name ,3,islam
scorpionma,did you see joe budden screaming i am black in black i am white i am white in everyday struggle ,98,hiphopheads
scorpionma,imo any subreddit that bans you for posting on other subreddits is not a sub worth visiting,2,NoStupidQuestions
scorpionma,when i guy first came into this thread bacon reader go occurred up a and showed the only comment here 3 times he only wrote it once so i thought it would be fun to make it loke those cat comments and it fucking worked just 2 comments with the same text started all this ,1,meirl
scorpionma,so in the end it was only introduced so internet companies can make more money luke of it it so has why introduce it at all,2,NoStupidQuestions
scorpionma,so let me net neutrality is giving every hall way the same size that saying every site gets a hallway companies can get in pay the mall more money to expand that hall way thus making it easier and faster for period to user i fucking love analogies thanks man ,2,NoStupidQuestions
scorpionma,thanks man ,2,NoStupidQuestions
scorpionma,thanks for expanding on his comment,2,NoStupidQuestions
scorpionma,thank you for answering ,2,NoStupidQuestions
scorpionma,thanks a lot ,2,NoStupidQuestions
scorpionma,thanks a lot for answering that everyone in this thread is explaining it in s different way now i have a full understanding of it,2,NoStupidQuestions
scorpionma,a for replying man you are the man,2,NoStupidQuestions
scorpionma,thank you so much for replying it all clear now ,2,NoStupidQuestions
scorpionma,that always the story when there 2 subs of something,12,NoStupidQuestions
scorpionma, that really sad,21,sadcringe
scorpionma,when allah wanted to make alcohol haram even though it is really hated and is a big big problem allah did not cut it at once but gave the sahabah time to get used to taking it out you cannot suddenly still such an addicting habit at once you have to start slowly and you will her used to it over time so if you have a morning habit stop it now if you find reading qur an hard start reading now and when we reach ramadan you will be ready and trained good luck y all,12,islam
scorpionma,hooky edit i get mad and reddit sleepy when i only sleep for 8 hours my default is 10 anything lower well make me feel like shit to anyone out there never look at how much is tour default sleep average sleep it week ruin your life and you will always be sleepy if toy do not sleep in that amount it placebo i guess,1,Showerthoughts
scorpionma,be more specific,-3,meirl
scorpionma,what is the good option ,62,meirl
scorpionma,did not he get dissed so hard his career fell of i think by 50 cent,5,todayilearned
scorpionma,iv read that he an asshole guy but i dont think he got anything to do with that he signed another company to do the trips he was the money and publicity behind it i am not saying he not responsible but i am saying that that wasnt his intention even thinking more about it why would a celeberoty who is already falling off make his reputation even shitier that would only cause harm to him tl dr it was the company he signed with who did the scam he is responsible for it but he did not want to scam people the company did edit and i am not saying he not a bad guy ,1,todayilearned
scorpionma,imagine the insects there,1,me_irl
scorpionma,the guy who jumped out of a building to a pool and broke his ankes legs then expected people to pay for that,1,AskReddit
scorpionma,settings detailed view tick the last item,1,baconreader
scorpionma, ,3,absolutelynotmeirl
scorpionma,nope it driver the bulldozer shut down man maybe on radio did the bulldozer shut down driver yes sir it did man i am glad you are alright,4,HumansBeingBros
scorpionma,same goes for dekker though,1,paragon
scorpionma,maroon,1,nonononoyes
scorpionma,no thank you for making the past 2 years of my life easier thanks a lot we hope you have an amazing life with amazing an wife ,3,baconreader
scorpionma,dunno about that really i for some reason rarely get a belica in the opposite team its always in our team kinda werid tbh,1,paragon
scorpionma,holy shit,5,PatientDogs
scorpionma,then how do you plan to fix it any one i asked all had different answers some said more xp less boosters some said more card equipment some said coins others did not want coins people keep saying its too bad without suggesting a fix you need a fix to please both sides epic can make chests give you tons of money and tons if everything but that would make it uninteresting and people would not spend money on the game please suggest one then come shitting about it because ai not no one pleased with anything about it my fix is to make chests extermly rare a 1 chance of getting one or something and it would include a very nice prize inside i say make it a monthly vault with a rare item inside but guess what that rare item is for a hero the player does not play and they will start shittng on epic please suggest a fix,1,paragon
scorpionma,thank you i already installed it along side of malwarebytes that exactly what i want i want a simple anti virus not to strong that it would actully show down my pc but good enough to notice simple chrome adware extensions,2,antivirus
scorpionma,it not do you it can you ,1,Showerthoughts
scorpionma,it goes down to 2 parts 1 you show them the song and do not tell them is yours they will probably roast you for your bad taste on music 2 you tell them it yours and they do not want to hurt your feelings so they say is good but roast you behind your back unless the song is good,61,Showerthoughts
scorpionma,true makegrimgreatagain,1,paragon
scorpionma,i see people complaining about how every chest only has cards crafting items and say they already have all cards v you see people complaining about how there is too much rep i do not think anyone would get irritated because of more money and ud anyone did just font take the money do not open chests if you compare this game to a game like csgo its a fucking generous and amazing you cannot get anything in csgo without paying you people are leaving no room for epic to profit off something game is free to play and having money would only boost skins fun fact when chests first came out everyone was praising epix on gke generous they are but now when peplee got used to their generosity people want more now,2,paragon
scorpionma,this would be hard to input but maybe the wall should lower the stun rate making the shield reduce the stun applied by the beam what do you think,1,paragon
scorpionma,always mocked people for not knowing the difference fuck its not that i do not know the difference it was a simple swype error thank you for correcting me and i am sorry,5,PatientDogs
scorpionma,you are the fucking man thanks a lot im going with bit defender free for now because i dont think my case is that extreme i hope your life will only feature the best for you and for your loved ones thanks again ,2,antivirus
scorpionma,thanks a lot i do not think ill be needing this much software for the stuff im having its not like i click on ads install unwanted programs etc i usually check what i install but these ad wares are bound to come anyway i think ill be going with bit defender now edit i can not pay for an anti virus would you recommend going with the trail version or choosing a free antivirus instead ,1,antivirus
scorpionma,i knew she was when i saw her ult which i would n just like medics overcharge in tf2,1,paragon
scorpionma,the map is mirrored sideways your left of lane is their safe lane and your safe lane is their offlane so left lane offlane no matter which side you are on,1,paragon
scorpionma,1 dekker has a really high chance of missing and the more the range the less likely to hit meanwhile phase cant miss because ifit did you just move the mouse a little bit to the right 2 even if it did hit it does not always stun the target 3 you have time to notice g dekker raised her stun or not meanwhile phase does it instantly either lower the range or lower the stun over time i am not really complaining about how op she is i am more complaining about skill ceiling epic is relewing more easy to use heroes that does the same thing as early heroes while having easier gameplay so same damage same stun but easier to land and t play players will surely favour the easier to use hero ,1,paragon
scorpionma,you do not post for stars you got them from playing noone complained about the lack of chests or vault before they came but when they did people got greedy and wanted more you can get a cheat almost every game a day or 2 can get you above 80 stars and if epic introduced a new free chest like these that you do not pay for people are gonna complain ,2,paragon
scorpionma,phases show beam should not go through steels shield phases shadow beam is too op either lower the stun a bit or lower the range of it,1,paragon
scorpionma, r lewronggeneration,3,pics
scorpionma,a guy gives you free stuff everyday you complain how shitty the stuff is same guy starts giving more free stuff you complain more ffs no other game give stuff as much paragon does before chests where here nobody complained he begs and makes conditions ,4,paragon
scorpionma,at least its not as bad as the other big ass not transparent red arrows that takes the whole screen kind arrow,14,nononono
scorpionma,counter him with countess ult him and then use dark tide on him he is too too squishy and really easy to take out at any point in the game i usually go ult blade siphon dark tide to finish him but usually 2 of them are enough,3,paragon
scorpionma,phases show been does not go through the wall so we will considered it a bug,0,paragon
scorpionma,phases show been does not go through the wall so we will considered it a bug,-2,paragon
scorpionma,a few days ago i got an amazing service from hardeez i think you call it carl jr so i took the little survey note and typed her name and how she handled it all is that a right thing to do ,1,LifeProTips
scorpionma,i fucking did this yesterday my health did not go down past 50 neciae of her healing my passive got a quad because of it jua using dark tide and blade siphons and my ult it was amazing,1,paragon
scorpionma,hahahahahaha classic,3,bee_irl
scorpionma,yep people did not get it they thought i was referring to splinter being wtf while its just a meta joke oh well thanks though,1,WTF
scorpionma,no love for countess she had not had an emote or skin added in a long time,3,paragon
scorpionma,thanks a lot op ,1,RandomActsOfGaming
scorpionma,he noticed that he stopped traffic so he started going faster damn he smarter then than than then most humans ,17,PatientDogs
scorpionma,having a wife with physical support emotional support and hero support that some big relationship goals ,4,paragon
scorpionma,sub an amazing speech giver i fucking love guys who can give such good public speeches we got the gangsta walk gangsta talk ,2,hiphopheads
scorpionma,now i am even more confused,1,islam
scorpionma,things like these makes me question the validity of the elevator safety rates i think i saw there a 0 000000000015 chance of dying on an elevator and just yesterday one stuck between floors with me,1,funny
scorpionma,1 oh im sorry i did not know about that meme sorry about that 2 yes i told jim he was right ajdi was wrong i misunderstood what i heard earlier i apologised to that man 3 please do not take my word for this as i am not so good at this but i do not think there are detailed stuff about such things we use qiyas and ijmaa for example is smoking x drug haram the quran did not say anything about x drug but harming yourself is haram and for that using that drug is haram v again i am not very sure about y answer you should seek information from better people ill look for some of those in a bit if you want i think i can give you some of those subject but from mufties and juges doing qiyas other then hadith or quran,12,Drama
scorpionma,there are currently some activities in forgien countries for male muslims to grow so women muslims does not feel alone in the foreign country i think i saw a video on that i think it was this https www youtube com watch v rczim9hmk00,1,islam
scorpionma, someone take this hothead outta here or in here as it stands and that someone is me hopefully you took my sentence out of context we was debating on prophets making mistakes not the camel urine thing what i meant is the subject that all prophets does not sin or make mistakes is a controversial thing as some mufites says yes and some no i am saying a 17 years old guy like me is not in a place to do such thing as there are a lot more knowledgeable mufties and judges out there better than me to discuss it discuss if prophets can make mistakes or not tl dr if big knowledgable muftis and judges are still not sure about weather prophets makes small sins or not how could i 17yo guy like me with little knowledge discuss that and i did not really understand your second part please repeat that,10,Drama
scorpionma,i have looked up some more hadith and i am now convinced thanks a lot for bringing this i did not know that i think the reason why i debated on that side is because i was hearing about this today on the radio i re listened to it and i indeed took it out of context the prophet cannot do anything wrong in terms of religion or deen but can have wrong opinions is that true thanks again for convincing me and bringing proofs you will surely gain hasanat from this,2,islam
scorpionma,we were discussing weather or not camel urine i good or bad or haram my personally opinion or liking does not matter just because i do not like it does not mean its not good for me and yeah i wo not drink it but i am still on the point that it does not do any harm ,1,islam
scorpionma, ,2,islam
scorpionma,ok we will leave this controversial thing to the big guys i would they make mistakes or not but i am pretty sure if they made a mistake they will inform everyone of their mistake and quickly make duaas and istegfar regarding the mistake i certain no prophet will make humans do something haram or wrong i hope you understood what i meant ,1,islam
scorpionma,but nop,0,AntiJokes
scorpionma,them again prophets do not make mistakes i doubt he will have an opinion on a wrong thing that will just make muslims make mistakes i think is about something good and something better,1,islam
scorpionma,oh forgot the nsfw rule sorry about that removed,1,wholesomememes
scorpionma,the dreamer anderson paak,1,AskReddit
scorpionma, eventually yes that the point we want to hold it as much as possible its our tower its what keeps the team at an advantage we want to farm as much as possible we want cxp too you know and with a hero like phase who can stun us while we are 1km away makes it impossible we also do not want the carry to be fed and take down towers,2,paragon
scorpionma,why not both,1,islam
scorpionma,his speech is amazing he a great orator i love people who knows how to give public speeches snoop the man ,1,videos
scorpionma,by any chance is the old man name creed ,468,AskReddit
scorpionma, r comedycemetery,7,funny
scorpionma,hey there ,8,GlobalOffensive
scorpionma,oh thank you so much you are the best,11,me_irl
scorpionma,boy you have not seen anything i am sure they are currently focusing on gameplay more than visuals in pretty sure one day they will make a visual update that all make toy question life it unreal 4 ,13,paragon
scorpionma,months ago i thought i reached a point where i believed that no one cares about islam anymore no one loves it anymore and every comment or post i saw about islam was anti islam i kept believing that until trump banned muslims then i saw how many celebrities reacted how much people gone their way to help muslims and i stumbled upon this gif which actully made me cry https gfycat com directidlegentoopenguin so thank you for being there with us thank you for sticking with us,5,islam
scorpionma,what does scuff mean thanks for answering,8,me_irl
scorpionma,i always change up my stories a bit so people cannot track me and know where i live that will give them to much personal information but uk pretty sure my friends already know where i live,1,Showerthoughts
scorpionma,holy fucking shit thank you can a ward see if the bee is there or not fucking thank you though,2,paragon
scorpionma, r comedycemetery ,31,im14andthisisdeep
scorpionma,op did you suit in the toilet while the seat wasmt down i have done it before and it fucking hurts,-2,NoStupidQuestions
scorpionma,you did nothing wrong thanks,1,paragon
scorpionma,you were kinda aggressive doing that some wholesomeness would do,1,paragon
scorpionma,damn you guys are harsh just point him in the right direction instead of flaming him let him know what is wrong with his deck and help him build it better instead of letting him down,1,paragon
scorpionma,next up also try alt enter,1,paragon
scorpionma,please notice the word unofficial iv seen people leave the game because their elo gone down dont give it much attention or care about it i will consider op warned,2,paragon
scorpionma,are you saying i should build more than 30 ability pen in countess ,1,paragon
scorpionma,i hated her a lot when she first came out but over time as countess iv learnt to deal with her stay away from her early game if she very marks you and throw a hive at you go to the jungle and heal using killing minions and avoid ult by shadow slippin to one of them ,2,paragon
scorpionma,instead of being salty explain the problem better what happens doesit crash while downloading after downloading more info better help,1,paragon
