name,body,score,sub
urmyheartBeatStopR,yeah they fuck that up but everybody knows nintendo will deliver a good zelda game they have great track record of delivering good product so i did not mind if they delay it because i know when it comes out it will be good i think it a combination of things but their reputation and franchise is the thing that making zelda a success ,3,nintendo
urmyheartBeatStopR,that why they have beers and hotdogs ,9,politics
urmyheartBeatStopR,yep it called water poison a mother died from water poison she was trying to win a nintendo wii from a radio contest ,2,instant_regret
urmyheartBeatStopR, is it bad if i like this am i broken then again i am single and i do not go to the movie theater so i do not have to deal with this i guess i really like their voice ,2,movies
urmyheartBeatStopR,i dunno but he publicly lynching a previous president of doing an illegal act if it false then i would think it should be a huge thing just cause you dislike a person especially the previous president you cannot just go after the previous president like that with lies it tells all future president that current president can go after previous president and plant fake info and ruin their lives it also defamation either slander or libel ,7,politics
urmyheartBeatStopR,el segundo have shitty traffic during rush hours i got stuck in traffic for well over an hours and the distance i wanted to travel was 11 15 miles or so away ,1,California
urmyheartBeatStopR,heatst is the one that started the obama ordered wiretapping against trump rumor trump is using it to try to publicly lynch our previous president they are full of shit u johnkimble111 is the quintessential redditor of r the donald if you have look at his history he mostly post about subjects to rile up people from the left he not even vegan but he will post article about vegan running over people at r vegan just to piss people off you can clearly see his actions via his history that his agenda is just to fuck with people for the sake of it ,0,California
urmyheartBeatStopR,not in usa for some reason ,2,videos
urmyheartBeatStopR,or the dude was disrupting their dungeon and dragon time ,4,JusticePorn
urmyheartBeatStopR, a degree from a defunct university would look terrible on a resume it does not really matter this is coming from a programmer who was in the industry for 5 6 years what matter more is experiences internships network and such is much better knowing what path you want to take in the big field of cs and while in college planning your education and prepping yourself on your free time toward that path will get you the job much better than any piece of paper will the workforce landscape have changed imo i went to ucr for cs it was the cheapest uc at the time and i think their undergrad is much better than uci uc merced might be the cheapest now since it the newest and also located outta nowhere as for csu i have no clue which ones have a good program going back for applied stat at csulb their cs programming is not so good imo i have seen it ,3,California
urmyheartBeatStopR,that fucker is still around he was around when i was an undergrad that like 09 or something ,0,California
urmyheartBeatStopR, no one lives in california anymore it too crowded with that logic we should all move to and live in kansas there are other reasons why people would rather live in california than some sparse places like kansas arkansas etc ,1,politics
urmyheartBeatStopR,i know several people owning guns in california their economic backgrounds varies and many of them are not rich handguns are still legal iirc rifles are much harder and many assault are ban ,2,politics
urmyheartBeatStopR,california have some shitty democrats but in general we do well under democrats we ai not perfect orange country went bankrupt cause of a democrat but in general i think overall we are good under them plus the republicans here are mostly moderate while governor arnold was a great person he was not a great governor governor davis got recall but it turns out energy companies colluded to fuck him over he was really really into education governor jerry brown is great so far ,4,politics
urmyheartBeatStopR,https www quora com does california really have 30 of the usas welfare cases 30 of the people in california are on welfare and california have 11 of the usa pop welfare is seen as a liberal thing medi cal is a healthcare welfare program for all poor californians why do you think that the success mentioned in this article is from progressive policies https en wikipedia org wiki california ideology the majority of the state is democrats 43 vs 28 republican most of the time we had democrats running the government minus arnold and he a moderate republican it would lead people to think that california would lean left in policies why do you say california is great it is great it 1 in gdp out of all other states in that term and does its greatness from leftist ideology it a blue state that mostly blue for a long while now so you kinda would think democrats would pass policies within their ideology for several years now governor jerry brown is running california for a while now bernicrats have taken over california in fact do you have an alternative hypothesis of what make california great edit update i knew i forgot something https en wikipedia org wiki constitution of california the result of progressive mistrust of elected officials the 1879 constitution is the third longest in the world behind the constitutions of alabama and of india 5 and has been described as the perfect example of what a constitution ought not to be also the constitution guarantee uc education and stanford this is seen as a liberal progressive program seeing how many conservatives wants private education betsy devo or whatever trump appointed is fighting for privatization hell i got a buddy that whine about california being a welfare state and yet he going to csulb applying for state grants not even from the state please if it so shitty why are you using our state education system go private ,4,politics
urmyheartBeatStopR,this reminded me of that one website when i was a kid stupid videos where the post video of people like him doing stupid shit ,1,WTF
urmyheartBeatStopR,at ucr it c when i attended it do or die uci was java my buddy went uci at the time and he tried taking graphic class over the summer and most of the student there just did bad i dunno what to say other than maybe c do or die really helped hone in the pointer concepts and appreciate the other higher level languages if you had to choose between those two i would recommend c but overall i think python because you can start teaching procedure first then move to oop then after that another language for system like c or something then functional if you have that luxury ,1,programming
urmyheartBeatStopR,that like a super mario level or something ,2,mildlyinteresting
urmyheartBeatStopR, white ball is haunted let get the fuck out of here ,3,gifs
urmyheartBeatStopR,wow that guy really love you congrats on having such an awesome dad ,1,gaming
urmyheartBeatStopR,better than an android pixel apparently ,2,videos
urmyheartBeatStopR,it magic sometime people do not understand say session and workspace when you create a new project rstudio is creating a workspace and session but i rather have rstudio do this than doing it via console or code it just a little frustrating when i see my professor wonder how the previous variables and such came preloaded when they open rstudio and such and wonder why their other project does not have the previous project save variables and data also rstudio is an ide and r is a programming language i would like to use vim for most programming languages but it not as good as rstudio if i wanted to see the structure of my variables and data rstudio is better rstudio have an ok vim mode the other nice things that rstudio have is easy gui for doing knitr package updates wizard for building a package etc it a little buggy or some rough ui ux edge cases for osx not sure about window or linux tho i think matlab editor is pretty and the ui ux is more refine at least their tab menu is currently on beta version ,2,statistics
urmyheartBeatStopR,garbage or the real death panels ,1,politics
urmyheartBeatStopR,hey man i do not have anything useful to add but i hope you get well ,2,CSULB
urmyheartBeatStopR,fucking crossfit they call it kipping ,75,therewasanattempt
urmyheartBeatStopR,i thought football season was over ,2,sports
urmyheartBeatStopR,i got a puppy for both links ,1,statistics
urmyheartBeatStopR,i know this is kinda suicide strategy but if dnc keep on losing will dnc be replaced with a better party i do not think a third party will ever take over the two major party currently but if they keep on losing ,2,SandersForPresident
urmyheartBeatStopR, sooo what are you going to be doing with time series unfortunately it just a intro class in time series i would like to prep for i have no idea what to do with time series other than i should know it ,1,statistics
urmyheartBeatStopR,what about that puppy book that people keep on recommending ,1,statistics
urmyheartBeatStopR,do you have a type of model in mind any good regression book will tell you not to use all predictors and interactions it will tell you why correlation among variables etc and how to fix it lasso press etc also some model you can interpret like linear regression and other model not so much like random forest neural network etc ,2,statistics
urmyheartBeatStopR,you use webmd too ,3,funny
urmyheartBeatStopR,did not some video said any third party is going to be a spoiler under the current voting system i mean if anything why not just run as republican if trump can win in that party bernie can too well unfortunately trump will be up for another 4 years as main candidate though but dnc is corrupt and enjoy rigging it really unfortunate that rnc has more integrity in term of the process of choosing a candidate for presidency ,3,SandersForPresident
urmyheartBeatStopR,mean while cory booker is infiltrating progressive pretending to be one come on bernie run in 2020 or tulsi or keith ,2,SandersForPresident
urmyheartBeatStopR,love the username bernie4ever it true they are occupying palestinian land people can try to spin it but it does not change the fact jimmy carter is hoping for a two state solution too ,2,SandersForPresident
urmyheartBeatStopR,seriously they made pc politically correct a bad thing or sjw is a bad thing and yet they are afraid to be call or use the word racists ,2,politics
urmyheartBeatStopR,well you are in texas come to california it expensive but we are diverse lots of food the beach is always cold including during hot summer days i have hear from a buddy that you guys do not have the cold current water coming in so the beach water is hot during hot days too and we have met our quota of water for the year also bad drivers in rain ,1,politics
urmyheartBeatStopR,trump supporters are going to show pictures of that one gay muslim mexican jewish black person that support trump see we are gay friendly points to milo the gay pedophile see we are not racist nor do we discriminate bullshit because of trump all these racist people are coming out of their shell most domestic terrorists are white power fucked in the head assholes thanks conservatives you guys truly fucked us over cause obama is soooo bad ,2,politics
urmyheartBeatStopR, bill could have referenced this study and dropped the 170 number and that would have answered tucker question he could but tucker interruptions and just talking debating to people is hard enough hindsight 20 20 no body perfect but i think bill is very prepared for that talk though more so than many people including people who love earth hell dealing with tucker is a full time job without forgetting what the point was bill nye got distracted and forgot the point was trying to make cuz tucker is an asshole ,2,environment
urmyheartBeatStopR,yep newshour fell out of favor for me when judy got caught during dnc nomination criticizing bernie she thought the mic was off gwen recently died they were the duo i used to watch often until the above happened ,1,television
urmyheartBeatStopR,uh not my cup of tea very dark compare to harry potter the sexual theme and growing up is unrelatable at all more contrive for the sake of character growth and exploration imo but some may see it as juicy teen drama so if you are into that ,1,television
urmyheartBeatStopR,this is just a fluff smoke screen he still need to take away funding from other things to fund his ambition of larger army infrastructure and wall because he wo not raise taxes so he have to take away funding ,1,news
urmyheartBeatStopR,because of this administration all the racist people are coming out they think it trump country now thanks r conservative keep complaining about how obama is a bad president ,2,politics
urmyheartBeatStopR,i wonder if r conservatives still defending him prollie still hell they probably cannot swallow it down that obama is better than trump ,4,politics
urmyheartBeatStopR,we need to water board her family too go after the would be terrorist family ,1,politics
urmyheartBeatStopR,it shows how weak of a leader he is he ai not no leader he more of a putin dog than the leader of the free world ,3,politics
urmyheartBeatStopR,first cia fbi epa and now seal trump hates on powerful agencies the only one that on his ball sack is department of homelance it kinda sad he tossing around the blame for a death that he caused i am sure r conservative are still circle jerking on whatever straw they can grasp you cannot defend all the bullshits coming out from this administration ,4,politics
urmyheartBeatStopR,it diminish china power it the same with usa putting defensive missiles on nato countries near russia it increases usa power over russia so if usa were to lunch a nuke at russia and russia retaliate their retaliation is not of equal force or more this is why russia is mad about it this breaks the mad concept of mutually assured destruction since south korea is a us allies this would diminish china power and influences in that area at least this is my thought on why they would be mad at s korea ,8,worldnews
urmyheartBeatStopR,they are just ass hurt cause usa took down fifa https en wikipedia org wiki 2015 fifa corruption case joking aside that muslim travel ban is xenophobic and is going to hurt our country i think it an understandable reaction from uefa even if they do not have great morals grounding such as u stuffiliketosay have stated ,0,worldnews
urmyheartBeatStopR,maybe he ran out of shit to give prollie smirking his ass off trump and the republicans are making people realize how great obamacare is ,5,worldnews
urmyheartBeatStopR,he can always make up fake people i mean they did it with sweden and green bowl massacre ,3,worldnews
urmyheartBeatStopR,i am beginning to think trump specialty is not in thinking especially in the critical department ,2,politics
urmyheartBeatStopR,you should unlearn everything you learn from that horrible place ,1,politics
urmyheartBeatStopR,or choked on a pretzel or fell over a powered off segway or handle that rain poncho at trump inargural ,27,PoliticalHumor
urmyheartBeatStopR,his response timing to katrina was shit too ,1,PoliticalHumor
urmyheartBeatStopR,i am sure they are talking about modern presidents ,2,PoliticalHumor
urmyheartBeatStopR,i love always sunny for philly,2,TumblrInAction
urmyheartBeatStopR,i blocked them so i do not have to deal with them other people can do that i am sick of their shit and i am also sick of hillary and dnc corporate shit too ,18,BannedFromThe_Donald
urmyheartBeatStopR, i do not see why the fuck the left would do that we are more into not targeting groups of minorities if a minority is targeting another minority such as muslim hating on gay i would think they would side the victim the gays and since when the left have ever hate gays so much as to side with muslim refusing to make cake for gay people the religious rights are the ones that are known for that hell vice president pence is involve in pray the gay away and do not even bring that tool milo in as if the right love gays dude is a pedophile ,4,BannedFromThe_Donald
urmyheartBeatStopR,i do not recall cassandra doing that it have tombstone but that about it ,1,programming
urmyheartBeatStopR,on top of the fact they vote down the ban on corporate money donation fuck them if we get 4 more years of trump it their dumb ass fault ,1,Political_Revolution
urmyheartBeatStopR,they are both terrible the current voting system only enable two parties that does not represent the majority also dnc had terrible picks the only major ones were clinton and sanders and on top of that the dncleaks from russian show that dnc debbie and clinton colluded together so that clinton can win they chose a weak ass candidate to represent dnc and ignore their progressive voters they are doing it again with tom perez as chairman and not voting for ban on corporate money you can say corporate money is what drive politic and needed to win but you can also say that we progressive is going to say fuck you to dnc ,-4,politics
urmyheartBeatStopR,he should win the fucking oscar emmy and whatever else acting award if he was the leaker i am serious ,1,politics
urmyheartBeatStopR,everyday we inches closer to nazi germany and 1984 most of the time the rights will call liberals and shit hitler as if it candy throwing that words around but do you really this right now for this administration nazi germany and 1984 is an apt description or a hyperbole ,2,politics
urmyheartBeatStopR,i saw the thread about atom and moving to vs i was like huh i moved from atom to spacemacs for elixir but i rather do vim sweet now if they have something vim for rstudio for r language rstudio have a vim mode but it okay and a bit buggy and clunky i cannot tell if it my crappy vim skill or that rstudio did not register certain commands ,1,programming
urmyheartBeatStopR, about 2 to 3 years ago fuck it probably longer i am old my programmers friend was talking about how they were expanding in los angeles and if any of us were looking for a job one of them got a brother applying there to create original content or someshit hell my english major friend was thinking of it too apparently they got big in meme and shit and now wanted to pivot and expand into news their main thing was they need to make original content now it funny because it like netflix they were basically rehosting reposting until their original creators stopped playing ball with netflix so netflix decided to create original contents plus if you think about it click bait strategy can only last for so long top ten list etc cause other web sites does the same shit it the same recipe for clickbait top ten list outrageous title or popular trends they had to do something with more substance or just die out like other websites that are just clickbait once you build up your user base you kinda need to sustain it ,1,OutOfTheLoop
urmyheartBeatStopR, the voters could do everyone a favor and stop re electing him it florida they elected bush jr twice i grad in 2009 bottom of the recession granted the housing loan explosion was not bush fault but the waging two wars and tax cuts was def his i still do not believe we recover from it obama job growth is good but many of those jobs are not quality jobs ,35,politics
urmyheartBeatStopR,they rigged california hillary won it over bernie and yet you can see bernicrats took over the state ,191,SandersForPresident
urmyheartBeatStopR,fox is for entertainment not for news ,1,nottheonion
urmyheartBeatStopR,fuck them to hell i am busy study for my exam and found out about perez via my friend on facebook only berniecrat and direct i want california to stay bernicrat fuck dnc for as long as i live they can all fucking go to hell i will vote directly for people that care about my issues and americans well being fuck the dnc should be on a t shirt ,3,SandersForPresident
urmyheartBeatStopR,he grab too many pussies and got tired from it ,1,politics
urmyheartBeatStopR,i had a coworker that used to be a vfx for hollywood he works at a start up with me at a smallcompany he talks about this all the time keanu was the nicest guy apaprently giving vfx peeps the money they deserve ,1,Documentaries
urmyheartBeatStopR,learn to not pick on random people you do not know then there are no rules in the real world it not a sport he could got stabbed or killed cops can arrest the headstomper but before that you are fending for yourself cause you think you are one big tough asshole ,20,JusticeServed
urmyheartBeatStopR,ugh i want this so bad as a car when i am rich unfortunately i hear the parts are super expensive to replace still so fucking sexy american v10 ,2,Autos
urmyheartBeatStopR, ada ada is american dentists association ada is the programming language they also tried adding type to erlang awhile back and failed this is after they built the language already just use haskell then but it comes with a lazy paradigm supposely it hard to deal with and it not quite as erlang from what i have read ,1,programming
urmyheartBeatStopR,i would make out with her any day i get one hot girl and a space ship sex would be extraterrestrial and out of this world ,7,TheExpanse
urmyheartBeatStopR,no clue i asked myself that and i think they would think mars did those experiment and start a war between mars and earth description s i mean those doctor without borders thought it was a mars experiment and they were going to broadcast it seeing how they think it mars doing earth would think so too ,3,TheExpanse
urmyheartBeatStopR,i thought he was talking about miller family supposely in the book family in this show is multiple dads and mothers sharing kids ,2,TheExpanse
urmyheartBeatStopR, description s holy fuck i thought it was unrequited love fuck no this is some fucking awesome sci fi romance i am a sucker of scifi great plot line actions and romance it a recipe for good story you can see similar recurring themes in the outer limit including exploration it also why new twilight zone suck ass this is the best episode yet and i am deeply in love with this tv series the best thing about it is that it in my favorite genre sci fi fucking action roller coaster rides cowboy bebop ish etc you know how that one youtube talk about cowboy bebop where people just go about their lives after tragic incident and not dwell upon the past other wise it will eat them up or how the cast are not looking for themselves anymore but trying to run from the past or have already found their identities and just coping with loneliness this is joe miller he embodied cowboy bebop message and style the dude is just looking for a reason to live something to cope with his loneliness we can also see it as we can never run away from our past our past define us and we can only learn to live with it and that what the last episode of cowboy bepop is about imo and this and the last episode seems to show that with joe miller the other cast are not cowboy bebopish and i love it because it a contrast between joe miller especially jim holder vs joe miller jim is new at this and still have hope and a sense of justice joe is like an older version that seen it all and jaded with everything then there are the other crew but the show have not delve deep into it but this and last episode the stark contrast between the two is amazing we get to see jim slowly getting more life experiences experiences that jim have gone through ,6,TheExpanse
urmyheartBeatStopR,we got a fucking dicktaker dictator here ,4,politics
urmyheartBeatStopR,man i might have a summer internship in arkansas and that state is deeper south than fucking kansas at least i am just south east asian looking so maybe i wo not get shot ,6,Fuckthealtright
urmyheartBeatStopR,he hates the fbi and cia cause they are against the russian the only one that up on his ball sack is homeland of security deporting everybody that looks brown ,1,politics
urmyheartBeatStopR,they have a dedicated cyber team just like china ,1,politics
urmyheartBeatStopR,it would have been better if debbie dnc and clinton did not rigged it in the first place then the russians would not have hacked their email and expose it and most of bernie supporters would not have said fuck it i ai not voting for a dnc handpicked crook dncleaks and whatever cause debbie to step down and then she got the gall the blame the russian which in turn basically admitting that she rigged it ,2,politics
urmyheartBeatStopR,they have taken care of blacks they are going to extend private federal prison you can say whatever you want but there are tons of minorities in prison especially private prison there are many theory on this as to why there are far more minorities such as blacks and hispanics in prisons though but the thought of locking people up as a profit is disgusting ,253,politics
urmyheartBeatStopR,no clue they are not even old enough when the union beat the confederate some redditor mentioned it a participation award they did shit but holding a loser symbol ,1,gifs
urmyheartBeatStopR,http thehill com homenews administration 320902 white house hints at crackdown on recreational marijuana it ai not out of trump mouth but yeah he did hire the guy ,1,PoliticalHumor
urmyheartBeatStopR, they need to stabilize the fucking situation they will never do that fullerton cops killed a mentally ill man and they got that on camera and they did not do shit ,8,news
urmyheartBeatStopR,well the reality here is the off duty cop is an idiot and he should get a fence or a better solution than dragging a kid to his lawn and pull out a gun and shot it ,3,news
urmyheartBeatStopR,to be fair fighting the nazi and confederate is part of murica tradition and history ,20,MURICA
