name,body,score,sub
urmyheartBeatStopR,whenever i see maga i see loser donald did not get shit pass he tweeted that it a ban recently he sure enjoy losing to aclu paris accord state is just going to work around his ass wall what wall mexico ai not paying for it i cannot wait for thursday i am ma grab popcorn just to watch comey ,1,BannedFromThe_Donald
urmyheartBeatStopR,i miss california this is also my prefer style of ramen dipping is so much fun 7 more weeks left baby until internship is over ,2,food
urmyheartBeatStopR,damn bernie you even list all incidents where this happened and it went to shit last pages out of the 8 page report the man is still working unlike a certain clinton ,1,SandersForPresident
urmyheartBeatStopR, more in touch with the problems of today screw that he hits on all the major pressing issues i am fine with that healthcare environment inequality etc good enough if he want to be more hip then just get a younger vice president ,1,SandersForPresident
urmyheartBeatStopR,bartenders is a good side gig if you are a broke college student ,1,goodyearwelt
urmyheartBeatStopR,pence is in hiding right now ,1,politics
urmyheartBeatStopR,pft title makes it seems like comey afraid of trump i doubt this patriot is afraid of that pussy grabber i cannot wait to watch him testify ,1,politics
urmyheartBeatStopR,koch brothers is not done destroying that state yet ,1,politics
urmyheartBeatStopR,i dunno looks more like what a holster would look like ,1,politics
urmyheartBeatStopR,you are right only fetus are republicans ,1,politics
urmyheartBeatStopR,why you think he have all those golf clubs for ,-1,nottheonion
urmyheartBeatStopR,he also endangering our soldiers who are stationed at qatar and endangering plans they currently have in that region all over apparently fake news that russian hacked and planted we got a saudi cock holster here ,55,worldnews
urmyheartBeatStopR,making the republican party underestimating the fbi go ahead fuck with the fed i will grab my popcorn i ai not fucking with the fbi ,3,politics
urmyheartBeatStopR, so how is this considered a win for democrats 1 the current governor is a democrat that pushing for it 2 it about the environment which is something democrat party push for more often than republican see palin trump 3 it goes against the current sitting president who is a republican while your point in term of state is true that this is more often a conservative view point but there are plenty of other view on how this is a win for the democrat the democrat would actually want to be in the paris agreement also i doubt donald is doing it because he have better plans on how to save the earth given how he pushing for coal and having an exxon executive in his cabinet so this smaller government is moot it the only game play that the democrats can do given how the republicans own the house and senate ,1,California
urmyheartBeatStopR,it cool man he nominated all the important one to create a swamp as large as disney world parking lot everything else is fluff just lying to people and playing the snowflake card of being attack worst than any other president ,1,politics
urmyheartBeatStopR,are those politicians gonna fix voting already i am sick of this shit it was on the wall for many programmers or people who are into electronic to know how shitty the machine voting booth is i want a paper trail not this stupid e vote thing ,2,politics
urmyheartBeatStopR, free engraving on the back just an fyi to everybody that does not know usually free engraving means you cannot return it if you ever change your mind and want a refund iirc apple start doing this for free cause it reduce refunds ,4,Watches
urmyheartBeatStopR,if op does not answer omega website have a pricing for service it a two tier system depending on the complication how complicated it is over at their website ,1,Watches
urmyheartBeatStopR,i think my brain farted i was wondering how is that world was expecting listing of cities and such but it a gmt it make sense also montbrillant datora is sexy af i wish i can afford one ,2,Watches
urmyheartBeatStopR,it like real life mirroring hollywood spree of bad sequels but to be honest when it over and done donald is going to have a movie about how shitty his presidency is it could be named watergate 2 0 and it wo not be a shitty sequel because it base on real life ,1,politics
urmyheartBeatStopR, what a trade off you just do not understand donald 5d chess it the art of the shitty deal ,1,politics
urmyheartBeatStopR, she bang she bang i knew it it a secret code for ban muslim ,1,politics
urmyheartBeatStopR,he also endanger military operations too telling filipino president about our two secret submarines near n korea dude love to brag even if it confidential or national security and he most likely a fucking soviet traitor insult all pows except for mccain dude serve his country but boy does he have no backbone ,5,politics
urmyheartBeatStopR,trump learned from his dad after all ,1,politics
urmyheartBeatStopR,you sure it him and not the racist president bannon ,7,politics
urmyheartBeatStopR,yeah he using england tragic incidents to promote his travel ban he does not give a damn about those portland people or the mentally ill white dude that killed them his message is radicalizing these people including racists in usa ,116,politics
urmyheartBeatStopR, but you cannot fault democrats for chasing the votes when the far left progressive whatever other groups are completely unreliable voters yeah you can when they got a shitty candidate to run you can fault them cause they lost with their chosen candidate nate silverman did a heads up against bernie vs trump and hillary vs trump bernie was the better bet i can totally fault dnc for their shitty choices and rigged shit from debbie ,4,politics
urmyheartBeatStopR,aca is not single payer and hillary did not campaign on single payer at all did you went back in time i recall bernie sanders was the only one that ran on that platform hillary wanted to fix aca with shitty bandaids and vagueness i also recall that debbie rigged it against sanders the dnc email got hacked ,3,politics
urmyheartBeatStopR,i remember that fuck him we end up with aca obamacare at least but could have gotten single payer i love bernie though go bernie ,18,politics
urmyheartBeatStopR,go bernie it took trump to fuck up this country to do it should have been bernie sanders ,1,politics
urmyheartBeatStopR, i am glad i started out as a sys admin for a year first before going to full stack to web dev other wise i would have been in this situation but as everybody pointed out it the company fault they got shitty dev environment set up there they could have done an image or some kind of vagrant with chef salt ansible etc nooope we will just write this shitty script that could potentially nuke shit ,1,bestof
urmyheartBeatStopR,https docs google com viewer a v pid sites srcid zgvmyxvsdgrvbwfpbnxtb25zdgvyc3rhdhxnedoxntiyndcxotu2nmixmwm4 i googled it and the only decent version was a gdrive one here a diff version https www ndsu edu fileadmin vpsa ndsu edu assessment corstoncolman2000inferentialstatisticaldecisiontree pdf ,5,statistics
urmyheartBeatStopR,wtf is your child hood a ghibli movie who was your neighbor ,2,OldSchoolCool
urmyheartBeatStopR,fucking moon moon,12,AnimalTextGifs
urmyheartBeatStopR,just went you think trump cannot be any more dumber than he is he will prove you wrong ,7,bestof
urmyheartBeatStopR,here the r code and output for it dbinom 4 9 60 1 0 1672151 it 16 72151 update oh i am dumb i did not fully read your question the other comment it binomial base on bernoulli i think bernoulli answer means that bernoulli is the famous mathematician as for the formula it should be binomial ,1,statistics
urmyheartBeatStopR, bernoulli is who you are looking for forgive me if i am wrong but is not binominal bernoulli is only for one trial right https en wikipedia org wiki binomial distribution the probability of getting exactly k successes in n trials,4,statistics
urmyheartBeatStopR,he a traitor and so are those people who are still supporting trump ,4,politics
urmyheartBeatStopR,agreed he was not good as governor and was a staunch republican while as governor he could not get much done governor davis did got fucked by enron he gave so many students including me a college scholarship but i think it seems that gov arnold became moderate after being governor that being said i am pretty happy with governor brown right now ,0,California
urmyheartBeatStopR,yes and no just a really rough draft they still need to figure out how to fund it i really hope it will become a reality but at the same time i would like them to figure out how to fund it i think they need to make up 150 200 billion dollars maybe they can go full crazy and just tax weed right now they are still setting up the system to tax weed full crazy as in cut through the red tape and set a system up asap to tax weed so we can buy some already ,3,politics
urmyheartBeatStopR,it better if with address this now then later but at the same time if we let him borrow he should fix the system have them calculate the pension more conservatively so we do not have to end up in this same situation again ,8,California
urmyheartBeatStopR,singapore is run by phds usa is run by a cheato that twitter all day and golf every two week also the government is really unique and weird i am not sure if we can get people to agree to run anything like them ,5,California
urmyheartBeatStopR, cost of living being what it is in ca i find it unlikely they keep on saying that and then i moved to ak for summer intern the only shit that cheap in ak is lands and home the rent is the same the food cost more especially seafood and there are toooons of single mother on tinder i am paying 86 bucks for 6 mb for dsl not cable not fiber it dsl ,3,California
urmyheartBeatStopR,how does this help nurses they do not get more money out of this because they can only work so much i know a few nurses and they are fill to the brim with work hours are they going to get more money somehow and did they have a history of being a bad entity ,3,California
urmyheartBeatStopR,nasif nahle is also one of the few climate denier scientist in biology he have been noted for sketchy math also a biology major but you can clearly see in his footnote it his interpretation and conclusion it like a personal opinion kinda deal op thinks he she is smarter than the majority of the experts in climatology by posting a picture from one of the few scientists that is a denier that is not even an expert in the field also we got one earth but it okay to risk royally fucking it up i mean even if the body of scientific evidence say there a link that we cause it are we just going to fucking risk it because right now the majority of scientists in this field says global warming is a threat and man made and even if it not man made we just going to twiddle our thumbs while the coast lines and island get fucked by the rising sea level ,1,California
urmyheartBeatStopR,with his hummer he became moderate after being governor though ,196,California
urmyheartBeatStopR,oh fuck i forgot about the cluster super google shit it was awesome ,1,Sense8
urmyheartBeatStopR,t t it such a good show i wish all of them luck in their future endeavors update at least the indian chick and that one thief got to bang each other i think that a happy ending ,2,Sense8
urmyheartBeatStopR, what unit will the component s be in is this even a sensible question pca combine features so i doubt it will make sense to care about it if pca combine bird wings how many poop a day color as one new feature it would not make sense for the unit but if it combine act sat score into one feature it still would not make sense other than it an academic feature if you want to make sense about the combine features or dimensionality reduction i believe you do factor analysis which is a different technique from pca does using a covariance or correlation matrix have any influence in interpretation iirc i think pca goes for eigenvector whatever so all the new features are orthogonal so their should be zero correlation between them https en wikipedia org wiki principal component analysis wiki confirm this principal component analysis pca is a statistical procedure that uses an orthogonal transformation to convert a set of observations of possibly correlated variables into a set of values of linearly uncorrelated variables called principal components or sometimes principal modes of variation ,-1,statistics
urmyheartBeatStopR,but you do not pay at msrp price for seiko do you i think seiko usually are brought below that ,1,Watches
urmyheartBeatStopR,they contribute within their family by inbreeding ,6,politics
urmyheartBeatStopR,i also learned today the fisher first name is ronald and that the f test is named after him thanks to doing bayesian data analysis book jumping between dba 3 and this ,1,statistics
urmyheartBeatStopR, and they cannot even get over trump winning the election it going to be a long 8 years for them it called protesting something we have in america you soviet commie ,20,MarchAgainstTrump
urmyheartBeatStopR,i am in arkansas in the boonie and they are bunch of confederate flags i do not think these people are old enough to participated in the civil war to be hanging that loser flag i guess they enjoy pretending and losing ,29,MarchAgainstTrump
urmyheartBeatStopR,trump is too busy appointing racist people in his cabinet to care session and bannon you would this i would be some of those zealot liberal stating that but once you realize those people are actually racists and in his cabinet it makes you wonder what it takes for some of those republicans to come out and just straight up say they are for white power and hitler did nothing wrong i think current racist trump supporters are too busy with muslim though ,0,California
urmyheartBeatStopR,it from this video https www pornhub com view video php viewkey ph58327c0970959,1,lingerie
urmyheartBeatStopR,i am more weird out by the de seeding cucumber why ,23,GifRecipes
urmyheartBeatStopR,fuck man i am vietnamese if i was in new orleans it would be heaven for me for food love cajun creole food and they have good viet food too ,1,GifRecipes
urmyheartBeatStopR, coveted female vote that hillary that some down syndrome attempt there she into drill baby drill and mama bear this and that she was more republican than she was a moderate that can bring hillary clinton voters in i could never did figure out why they chose her i swear it was the tea party bs ,2,worldnews
urmyheartBeatStopR,dude talk a lot but his actions are the opposite he also whine about his party but will fall in line this guy is such a wuss yeah he was a vet capture torture but he afraid of going against his party come on man also that palin vice president thing was some weak shit ,0,worldnews
urmyheartBeatStopR,i think for my state if you are just in the driver seat you can get a dui so i have to be in the back seat iirc ,1,sports
urmyheartBeatStopR,cop thinks he an alcoholic whisper or some shit ,1,sports
urmyheartBeatStopR,i upvoted thinking it r wtf but r unexpected ly it r aww wtf ,1,aww
urmyheartBeatStopR,he really does better with character dev and relating fucking alien man i hated all of the characters none of them was worth investing cause there were so little development ,2,videos
urmyheartBeatStopR,half of them are soviet bots the other half are downies ,1,Fuckthealtright
urmyheartBeatStopR,when i graduated in the bottom of the recession i applied to any web dev job i could i got an interview as a web master what is this early days of the net during the interview i found out i was to just maintain code from outsource code and once and a while fix it you are fucking right fixing code from other countries usa no offense is the leader at software engineer at least at the time i have no clue if these countries build good code at all 1 and at the same time regardless fixing people code 1000s lines is a soulless job especially if you werent in the fucking team in the first place to have any decision making you know what was worst they wanted a web master because the pay grade is less they wanted to pay around 35k to 40k in los angeles i nope the fuck out in hindsight i could have taken the job to put it on resume or get paid while looking for another one companies especially start ups and shit companies expect loyalty while they treat you like shit you just take money find better position and leave do not put it on your resume if you bail out on them 1 i have no clue of other countries especially india but usa have tons of meetup conventions etc see the top websites google youtube twitter reddit we really really have a good culture and forefront in this field china is supposely is going to catch up though ,2,bestof
urmyheartBeatStopR,i am from the software world my buddy worked at a company that outsource he had confidential slides from his company stating how to deal with indians and cultural differences he showed it to me it was pretty neat one of the few things that stuck to me was one of the slides talked about talking about time to indians if they say something vague like soon etc they will never finish it you need to make them put time a real date to it there were other random tadbits i forgot too but it made it seem like cultural work ethic are totally different i think there is a reason why usa is the top gdp in the world and rank up there in term of hardest working work ethic is different either because the corps are working us to death or expectations are different some european countries have better vacation and work balance life than usa different priorities ,6,bestof
urmyheartBeatStopR,yeah and also quant requires fucking hardcore math not just stat stat especially applied stat is easier than fucking applied math i only have to take stat inference in term of hardcore shit for applied stat applied math requires either ode or pde and at least 2 3 analysis classes analysis class are ape shit crazy unless you really really want math i do not even think they are closely related to make that jump op needs to rethink his or her plan i do not want to shit on his her dream but i think going from ds to quant is crazy let alone doing ds going straight to quant would be better ,1,datascience
urmyheartBeatStopR, but i have heard that plenty of software engineers in the bay area make 200 300k salaries uh no unless they are phds even then they do not get salary that much they get stocks which pay at a lower tax rates google pay you in salary and stock you can have a mix of both ,5,datascience
urmyheartBeatStopR,uh you make 120k to 150k as a senior ror dev in sol cal i do not see getting 120k is a stretch if you have the skill set and good resume or good at selling yourself and i think the skill set for data science is much harder ,2,datascience
urmyheartBeatStopR,op is pissed because they use was a known white supremacist alt right etc and that implies trump it ai not like jeff session bannon are racist fuckers or anything nope not at all w t f this subreddit is putin trump supporters fake news haven with shit logic ,-4,uncensorednews
urmyheartBeatStopR, i am willing to admit both sides are guilty of it sanders is not saying hateful stuff against muslim trump is while he crazy trump message at least is playing with his craziness via a hatred route i do not recall bernie sanders running a negative campaign he did call trump out on his shit ,-9,uncensorednews
urmyheartBeatStopR,i am glad there are article out there that telling us this is not a pipe dream the 400 billion and 200 billion short was scary ,1,California
urmyheartBeatStopR, i do not know a lick about ab test but i am thinking when people do something like this they are increasing their variance so you lose out on accuracy the point of statistic is to control randomness in order to do so we contain randomness within an interval confidence interval what i think you are doing is increases the ci length doing so increases randomness and decreases accuracy nevermind i am wrong here the answer https stats stackexchange com questions 9225 what does it mean for a study to be over powered rq 1,0,statistics
urmyheartBeatStopR,wait including other asian too that super specific ,6,atheism
urmyheartBeatStopR,this is good advice and also solidify bayesian for me i have taken computation stat in spring learning mcmc summer i am doing a summer intern at fda and we are doing bayesian it helps connect what i have learned from comp stat but this reply really hone in on the fact that bayesian is what ml and ai is doing there a few paper trying to figure out what nn really is about and there are a few papers supposely pointing toward bayesian stat thanks ,1,statistics
urmyheartBeatStopR,ran out of viagra plus he thinks he the king of golf land not the president of usa ,1,politics
urmyheartBeatStopR, honoka has kazane unique blood in him due to a transfusion between the two after he experiences a life threatening injury wait what chapter was this i do not recall this part seems super important ,1,Witch_Craft_Works
urmyheartBeatStopR,nooo album got deleted ,35,NSFW_GIF
urmyheartBeatStopR, dick move donald you and the whole t d are all like that no compassion and vindictive ,1,politics
urmyheartBeatStopR,yeah it was so hard that he had to hide between ferns i woulda ran so hard ,1,politics
urmyheartBeatStopR,data scientists are just interdisciplinary so they are master of nothing but knows a few of every thing imo the answer to your question would be they probably have a low bar and low expectations of many areas also my stat program is pretty weak at this unless the student takes multivariate and even then this is optional we touch on a few linear algebra stuff in regression too ,3,statistics
urmyheartBeatStopR,donald trump is worst imo analytics vidhya have some gems imo sure they are doing the old tactic of top list etc to get money but i found a few helpful articles the recent one that stands out for me was the list of top books for imputation shrug it better than no content and their content is not riddle with bad stat as i am typing this out i realize how subpar their articles are ugh meh at least once in a full moon some articles are helpful ,2,statistics
urmyheartBeatStopR,praise the sun,1,aww
urmyheartBeatStopR,i would vote in for pirate 5 yr obama over trump right now if i can ,5,OldSchoolCool
urmyheartBeatStopR,it a functional thing no for pattern matching you pattern match for what you care about anythign else is fuck it here an underscore erlang uses this a lot and it have prolog inspired syntax also you do not have real tradition loops in erlang you have to do recursion pattern matching so underscore everywhere javascript have a functional library named underscore iirc ,3,programming
urmyheartBeatStopR,also dickish to rip off another guy who is trying to promote his honest business via info article ,2,programming
urmyheartBeatStopR,still waiting for this liar to get water board he said he would do it ,3,politics
urmyheartBeatStopR,all their data structures are mutable if you are definition of functional language is this then python and javascript would be in it too just cause it enable you to do functional things does not mean it functional you can do oop in c it does not mean it oop it like comparing ruby with c one language let you do oop and the other let you do oop r is generally immutable that a retarded statement for it being a functional language furthermore almost all functional programming languages allow mutability in some form yeah and it rare in those language to use such r does not encourage any of this r was explicitly modelled after another functional language scheme this doesn t itself make it a functional language of course yeah and it have strong emphasis on immutability and lisp family makes it where the language itself is data r is nothing like that i do not see r having emphasis on functional operation like fold most operations are imparative you are freaking crazy mind as well post this crud in http lambda the ultimate org you are also full of it http r cs purdue edu pub ecoop12 pdf being multi paradigm does not mean it a functional language it multi paradigm also when a someone ask for a functional language they are asking for a functional language not a multi paradigm one they are most likely trying to learn functional aspect giving them python scala r or whatever and say here ya go is a horrible answer ,-1,rstats
urmyheartBeatStopR,scala is not entirely functional it oop functional hybrid i got paid to do it and was totally on the band wagon with scala posted to most articles on r scala a while back before it got really popular i have moved away from it it complicated and most of the time you will be fighting with the type system if you really want to learn functional haskell beautiful functional language with beautiful type system i have only played a bit in haskell but it a joy to read it and play around with it i have seen other company using clojure within the data science field with is another jvm language so either clojure or haskell would be your best bet for functional language in data science stat field imo i have seen ocaml mentioning here but i have not hear anything of it in the stat data science field as for f it plausible since microsoft is highly invested in r now since they bought that one company and they are trying their darnest to enter the data science field currently especially with their cloud solution ,1,rstats
