name,body,score,sub
urmyheartBeatStopR,https www youtube com watch v zbmj sb9gbc joe biden endorses an establishment over keith ellison i was always wary and knew joe ai not no progressive more of the same i am ma just vote green i do not care dnc can go fuck themselves until they cater to progressive ,1,SandersForPresident
urmyheartBeatStopR, in a chaotic system anything could have happened i have no faith in economical models because the dynamics of economy is chaotic not if you have statistic the goal of statistic is the manage chaos i think it silly to dismiss such a thing when we have statistic as a tool of course i may mis intepret your comment though if so my bad ,5,programming
urmyheartBeatStopR,1 gdp state in usa paid the most taxes the fed should get fema to help us and trump should do his fucking job instead of golfing you trump idiots are bitching about shit that us californian paid our tax for ,0,California
urmyheartBeatStopR,i was there and voted no on it the majority voted for it your complaints ai not gonna do squat it was voted for if you do not want it then you gotta put that on the ballot ,4,California
urmyheartBeatStopR,good guy bernie sanders complains on real issues instead of talking about golf vacation he talks about goldman sachs sanders is really good at staying true to his stances and ignoring the fluff sure trump golf and is a hypocrite but there are so much other important issues out there healthcare equal rights etc ,1,OurPresident
urmyheartBeatStopR,uh no apache harmony was open source version of java oracle killed it sun supposely was going to give the tck https en wikipedia org wiki apache harmony difficulties to obtain a tck license from sun when oracle took over they said fuck it then they fucked alot of other project over and dump it on to apache so the defacto opensource is openjdk controlled by oracle they have been on other opensource committee and fucked projects over google and ibm was too chicken shit to anything iirc however it open source so anyone can fork it if they start being dicks about it it not that simple apache do not have the money to go against oracle like google maybe i am old but this is back in the days and the reason why it not simple as fuck it fork this cause oracle is a dick you gotta pay for those tck ,3,programming
urmyheartBeatStopR,did not someone did the math and it did not work third party always end up as spoiler i voted green party and i love them but they always are spoiler in this system unless you do rank voting you should try to change dnc or join existing ones like green party fracture parties especially among progressive will only make the republicans stronger i am not asking to fall in line with dnc i am asking to change it and kick those crooks out of dnc ,1,SandersForPresident
urmyheartBeatStopR,randolph engineering is a good usa made alternative to ray ban for aviation it like well over 100 made in usa if you count the tools they also make to make glasses iirc the tools for making glasses are made by them are used by other glasses makers dita is a super luxury brand ,0,Documentaries
urmyheartBeatStopR,what about getting high alone greenday alone ,1,todayilearned
urmyheartBeatStopR,devos paid rubio boy for the nominee for secretary of education he trying to divert attention ,1,politics
urmyheartBeatStopR,http articles latimes com 1993 10 05 business fi 42487 1 hubble telescope they were dickish after fucking up the mirror for hubble ,1,Documentaries
urmyheartBeatStopR,toyota in project management class we have to learn about their manufacturing process and i understand why their reliability is always top or near the top i am sure they have duds but their overall product lines will be reliable if you get over the sport car phase their prius is pretty dang reliable i sold my problem ridden 2003 benz kompressor for a prius ,5,BuyItForLife
urmyheartBeatStopR,the emotional train was a fun ride meh she can draw something on there and wait for it to grow back imo ,2,instant_regret
urmyheartBeatStopR,i am glad ein got a girl ,4,gif
urmyheartBeatStopR,yep i did scala for a bit and type erasure can be a bitch clr supposely does not have this problem ,4,programming
urmyheartBeatStopR,yea php did not have classes until later on and it shitty ruby had the concept of object classes from the getgo and it elegant as fuck likewise with scala i do not do ror for a living and did php for a living for a while ai not no fanboy ,1,programming
urmyheartBeatStopR, are they going to pull a python 2 python 3 shrug no clue doubt it but anything can happen they did that with angular 1 vs angular 2 where it did not look the same at all completely different mind as well name it something else also supposely it could be me having a nightmare angular 3 is nothing like angular 2 ,1,programming
urmyheartBeatStopR,same with elixir i think newer programming languages are recognizing that having a good package manager is a must ,6,programming
urmyheartBeatStopR,i can have 100 tabs and it does not crash on me chrome chug along with that much tabs also a part of me remember the dark days of ie mozilla came along and made everything awesome chrome was not that better than mozilla the main sticking point is the tab handling i also trust mozilla as a company over google for internet and browser no offense to google but mozilla have very little other side businesses so less incentive for them to be greedy or rig it an example is google nexus phone they refuse to put sd card the only reason i can come up with is that they are trying to nudge people into using their cloud services being more dependent on google stuff which is good thing if you enjoy their stuff but at the same time they do have a track record of shutting things down they took down their newsfeed reader they also redid their messaging system three times i lost count the third or second time they move to a different protocol iirc and so thirdparty instant messaging app cannot use it competition is always good ,1,programming
urmyheartBeatStopR, bernie sanders refuses to help dnc raise money off his email list omg i love this man so much so much integrity and also i really hate dnc so this move makes me really really happy debbie hillary hillary daughter all those corporate whores i hope we can transform dnc ,5,SandersForPresident
urmyheartBeatStopR, the leader of the witch hunt crying upon realizing he cannot use his dead mommy to deflect from his own moral failings how grand more like how fucking sick in the head you have to be to use your dead mother to deflect your shitty morale i would not defile my mother death like that man the fuck up ,39,politics
urmyheartBeatStopR,i do not know what the fuck you are talking about all i see here is an engineering masterpiece ,-2,gaming
urmyheartBeatStopR,30 permanent job with the pipeline is a tons of jobs right right ,10,politics
urmyheartBeatStopR,they also need brown people for the wall and brown people namely mexico to pay for it apparently but in reality he just taxes american for that wall even though bush jr made a fence already which did nothing but destroy the environment and drown some people to death ,8,politics
urmyheartBeatStopR,he also did not drain the swamp ,36,politics
urmyheartBeatStopR,do not worry central california is an outlier those farmers are idiots you drive up there and you see signs on their farms bitching about liberals they bitch about water while they use the california waters for water intensive money crops and then sell it to china they at least do not got no power in california and the majority in california usually prevail via blue unlike those smaller states with small populations that can really dictate who will win the presidency ,2,politics
urmyheartBeatStopR,remember idiocracy 2006 http www imdb com title tt0387808 this just made it so real i love jimmy carter he such a great person he up there with mr rogers neighborhood ,11,politics
urmyheartBeatStopR,now you know why she does not have any friends ,1,AdviceAnimals
urmyheartBeatStopR,i thought it was the platinum preppy ,2,fountainpens
urmyheartBeatStopR,god damn is that what greed and corruption does to your face ,7,EnoughTrumpSpam
urmyheartBeatStopR,holy shit the white house is the fake news donald is calling the media being bias and shit but in reality they are what they are calling everybody ,321,politics
urmyheartBeatStopR,my christian friend facebook me this link the source is a guy in washington the blogger somehow got from 30 to 50 and saying that if we ignore california then donald trump won therefore electoral vote is the best thing since jesus mind blown you know ignoring the fact california make the most gdp and pay the most and get very little back from the fed ,0,California
urmyheartBeatStopR,i have tones of those i went to school in 90s and grew up in gang culture i recently saw a picture on fb of a girl i knew back in elementary her facebook wall post was a picture of her female family members all wearing gangster over side plaid t shirt blue jean below the knee cap and adidas hardcap they had bandana across their forehead making gang signs ,3,trashy
urmyheartBeatStopR,there like one programming language haskell and the rest is tag unrelated to programming languages at all for weekend they are tags about technology or frameworks weekdays have some programming languages the title is misleading since the author did not remove tags that not programming language i personally think it a really bad blog post and bad attempt at analyzing data with the prompt she trying to investigate the two color graphs are the worst offender imo unless i am just plain missing something here ,3,programming
urmyheartBeatStopR,there was a scientist who is a ted cruz fan that did an analysis on why ted cruz have a punchable face iirc ,3,OurPresident
urmyheartBeatStopR,that ai not no family tree that a cess pool of shit ,25,politics
urmyheartBeatStopR,we can never have nice things because of florida yall got bush in twice iirc ,1,politics
urmyheartBeatStopR,sic those garbage trucks at him he will be useful there i need some soylent green ,1,politics
urmyheartBeatStopR, pretty sure the president is talking about the cars burning in paris every night and sexual assaults some of the attacks are engineered some of them are opportunity crimes all of them relate to the refusal of immigrants to assimilate western values that they now benefit from oh am i supposed to provide a link or is there a possibility trump is right about the strange nexus of a blind press and uncontrolled immigration you are dumb as a brick and i source that via the bold font of your comment you went into a racially charge argument spewing negative racial shits and then you say you are not going to source it yeah so your claim is not only baseless you are instigating hatred for your warped fucked up views go back to voat stormfront or whatever white supremacist website altright whatever new brand and bring your horrible thoughts there you will find more people agreeing with you there or seek help ,1,television
urmyheartBeatStopR,you would not know what statistics is if it hits you in the face a statistic grad student see u jrau18,1,television
urmyheartBeatStopR,1st one is the best style because it looks like a loaf of bread ,1,pokemon
urmyheartBeatStopR, it almost twice the size of the russian economy now we know why trump hates california we are better than his home country ,4,politics
urmyheartBeatStopR,seriously so much rain the only problem is so many california people cannot drive in rains ,5,politics
urmyheartBeatStopR,yeah baby california is awesome medical is awesooome wish they do more rent control or stop some people from buying up homes as investment and not live in it it been causing a spike in homes for people that actually live in those cities ,3,politics
urmyheartBeatStopR,from his actions it seems more like he got a big ego and he will get revenge on everybody that go against him so to me i doubt there an ulterior motive other than they did not vote for me motive ,1,politics
urmyheartBeatStopR,i am not down with it texas is the whole reason why patent troll exist it also the bane of start ups in silicon valleys i am down if they git rid of eastern texas of that bullshit patent troll court it a father and son judge and lawyer teaming up for that bullshit ,3,politics
urmyheartBeatStopR,fuck yeah i was a programmer and single i paid a shit load to california hell much more when i was a contractor taxes are crazy if you freelance and do not incorporate yourself when i was letgo i was ashamed of welfare but eventually took it anyway my deal was fuck you i pay taxes and i believe in social program anyway stupid rights kept on making it as if it something to be ashamed of it was fuuucking awesome i use those pay check to figure out what i want to do with my life going back to school now for a different direction data science and california medical is amazing it ai not the best but if you are poor at least you get healthcare insurance without pay unless you count indirectly via taxes ,3,politics
urmyheartBeatStopR, his face was priceless when we googled up welfare states and his home state was number 1 on the list oh and his family grew up on welfare but it different mind as well have a paper taped to his back saying he on welfare ,1,politics
urmyheartBeatStopR,we also have less voting powers than their dumbass per population electoral vote the red states are really powerful it fucking stupid a bunch of minority states with less population than california have more say in whose the next president is ,2,politics
urmyheartBeatStopR,i guess they enjoy losing a second time around ,2,politics
urmyheartBeatStopR, how hard will graduate school be for someone like me you will do fine some programs wo not give you any less than a c if you piss them off if you did bad they will just give a b they have to maintain their program statistic really note some not all you have to really refresh your probability stat and calculus for stat inference though that probably one of the hardest class imo at least in my grad program next to time series time series is an elective for me take inference first before taking any other classes imo it helps tie in many things i regret not taking that first it the bases for everything else and also i took prob 10 years ago so it was hell for me i should have retaken prob and stat ,1,statistics
urmyheartBeatStopR,is it more stupid or less stupid than pizzagate and sandy hook was fake these are the people he conning ,1,politics
urmyheartBeatStopR,he only gets weekly briefing so he forgets they are there unlike that antichrist that get daily intelligence briefing ,1,politics
urmyheartBeatStopR,you should bust out those glitter inks for hw i have emerald of chivor for a week now today in class i finally get it one of the word i wrote had a nice shimmer to it it was purrty and i finally get why people like this ink i am using eco ef so it probably hard to see the sheen and crappy notebook to write quick notes and later rewrite ,2,fountainpens
urmyheartBeatStopR, those guys cannot take a joke that because they are the joke ,8,television
urmyheartBeatStopR,mean while in texas walton lady that own walmart is in texas driving drunk and killing people with porsche ,2,todayilearned
urmyheartBeatStopR,she criticized lied bernie sanders for wanting to dismantle aca obama care when hillary got flak for it she threw chelsea under the bus i was there supporting sanders during 2016 i remembered every lies that the clintons have told about sanders chelsea was in on it too they threw their whole fucking family in on it lying about sanders clinton and debbie rigged it risk it all so clinton can be dnc ticket and she fucking loss trump won because of clinton the dncleaks proved that debbie and dnc rigged it for clinton and turn a lot of sanders voter off fuck the clinton family and debbie chelsea husband is part of goldman sach i hope that that bitch lose she and her mother cause trump to win ,36,OurPresident
urmyheartBeatStopR,he a dictator and his nazi alt rights usa have been taken over and the system have been undermine by them we need to take it back ,1,politics
urmyheartBeatStopR,can california ban him from ever entering the state he can keep his shitty trump casino in nevada ,1,politics
urmyheartBeatStopR,shit come join us we got beautiful weathers diversity lots of food women and men tons of them ,1,politics
urmyheartBeatStopR, that the thing about putin he mentally disabled not enough to rigged trump in or run a shitty country but still in power for all these years or able to kill whoever the fuck he wants apparently ,3,politics
urmyheartBeatStopR,clintons fuck him over jerry brown would likely to win over sanders seeing how dnc enjoys rigging but clintons got power and they got beef with jerry brown they got debbie to get them the ticket for democrat over sanders plus brown is also super old he a two time governor of california http theweek com speedreads 627301 back 1992 jerry brown bill clinton pretty much hated each other,1,politics
urmyheartBeatStopR,while i love california and live here all my life it really does not make sense to have agricultural in california since we keep on having the damn drought problems but we sure make the best damn wine in the world take that french ,2,politics
urmyheartBeatStopR,maybe he enjoys losing to judges that actually give a fuck about laws ,5,politics
urmyheartBeatStopR,he going to give california funding to soviet russia ,1,politics
urmyheartBeatStopR,i am casually looking through the comment and i see your username how and when the fuck did i give you 36 karma points ,1,nfl
urmyheartBeatStopR, they chose an old lady who had never watched the simpsons and sent her a couple hundred dollars sounds like what krusty the clown would do that dude half ass everything and do not give a shit ,924,todayilearned
urmyheartBeatStopR,ted is so gentlemen that billy cannot fuck with him bill is just dancing around in his shit bill also got this hard on for shitting on sanders disgusting ,15,worldpolitics
urmyheartBeatStopR,wtf where the spoon that change color for my cereal fucking discriminating scums ,0,funny
urmyheartBeatStopR,this is a relevant question because i bought parker super quink ,1,fountainpens
urmyheartBeatStopR,guarantee those trumpers are going to use this as a negative even if judge is a republican ,10,politics
urmyheartBeatStopR,his hands and arms are so small and short he cannot even grab them by the pussies ,8,EnoughTrumpSpam
urmyheartBeatStopR,sagat was base on sagat petchyindee it cosplay all the way down ,0,gaming
urmyheartBeatStopR,fuck that sucks that he got fired bitch deserve more than him dude was making an honest living and some raging ghetto bitch gotta fuck it up for everybody making an honest living ,2,gifs
urmyheartBeatStopR,spit counts as an assault in california ,27,gifs
urmyheartBeatStopR,i could buy so many vintage flex and semi flex pen for that it super beautiful tho i would probably just use that for signature no way i am ma handle it like a workhorse ,1,fountainpens
urmyheartBeatStopR,college notes for lectures then i go home and re write them in a good note book midori i recently bought some tomei river notebook ones gonna try those out ,1,fountainpens
urmyheartBeatStopR,that guy got some good friends there ,3,dbz
urmyheartBeatStopR,i swear donald trump his supporters have the tightest assholes in the known universe they need more than lube to fix that ,21,Fuckthealtright
urmyheartBeatStopR, president donald trump has threatened to pull funding from the university of california berkeley after it cancelled a speech by breitbart editor milo yiannopoulos that a dicktaker dictator move from donald there good the dude is a sociopath stephen bannon who now works as mr trump chief strategist boasted last year that breitbart was a platform for the alt right the white supremacist movement ,142,Fuckthealtright
urmyheartBeatStopR,such a nice clean punch also the rep did a really good job at stopping it it was a good call dude was out and no way going to win with that barrage of punches after that ,20,MMA
urmyheartBeatStopR, jesus that guy is sad you have just described his whole base republican is in a sad state right now conservatives have no real party but they still vote republican in ,61,SubredditDrama
urmyheartBeatStopR,can you tell us the name of the book and author in the picture thanks,1,fountainpens
urmyheartBeatStopR,yeah seriously i need to stop too i think my last purchase fp will be 5 jinhao x750 and some zebra g nib for the year then it will i will be moving on to inks t t is that an eco with j herbin emerald chivor i currently have one inked up with that lol ,1,fountainpens
urmyheartBeatStopR,it such a dumb appointment they are all for muslim ban cause security of the nation and then they appointed this clown to be in charge of the nation security republicans are crazy or just want to burn down this country ,4,politics
urmyheartBeatStopR,top one is dotted leuchtturm1917 and the bottom one is the line version leuchtturm1917 the line one did not bleed through but the dotted one did i did not notice this until later after i finished rewriting my second lecture note now i am stuck with two options either write only with my platinum 3776 fine for the whole time or get a new note book to write in pen used swan sparrow flex west med to bb waterman crusader flex west fine to b easterbook flex nib west extra fine to med twsbi eco ef ink used waterman intense black ink j herbin emerald of chivor only in twsbi eco ,1,fountainpens
urmyheartBeatStopR,they asked for it with reagan unfortunately the other side is suffering because of this fucking ugly bunch of people that cannot keep their religion to themselves holier than thou gotta save those sinners bullshit ,1,politics
urmyheartBeatStopR,wait i thought it was a light stat book about stuff i have read the first chapter before and i was really hook on bayesian vs frequentist vs fisherian school of thoughts part i did not realize it a stat inference text book edit the books have slightly different focuses so it is almost like comparing apples and oranges oooh did not read this part i will make time for it then thanks ,1,statistics
urmyheartBeatStopR,that adorable and hot at the same time ,0,Unexpected
urmyheartBeatStopR,from what i have hear amazon tech side is still shit i am from the tech industry you cannot change that culture over night bezos did do a lot of great stuff but whether he give a shit about his employee at amazons is another matter imo ,-1,reactiongifs
urmyheartBeatStopR,this is further proof that i like angry eminem i realize this when i compare his angry albums with his non angry ones the older ones were better ,2,politics
urmyheartBeatStopR,he a nazi that wants to destroy america fascist thinking and a white nationalist that that closest thing you will get to a modern day nazi ,1,worldnews
urmyheartBeatStopR,ugh in all likelihood is on my book to read one day i have tons of fundamentals to catch up first ,2,statistics
urmyheartBeatStopR,https www reddit com r fountainpens comments 3tg2g0 nibs that fit the twsbi eco cx689pf https www fountainpennetwork com forum topic 288486 tswbi classic fpr 55 flex nib ,1,fountainpens
urmyheartBeatStopR,eco twsbi extra fine came in the mail today it much smoother than my platinum 3776 fine i think i am a fan of twsbi now i am probably going to move away from platinum now also a waterman crusade came in from peyton st it pretty good flex just that normal writing is a medium other than that it makes my handwriting beautiful i still cannot believe easterbrook flex steelnib is my current best one next to the waterman ,1,fountainpens
urmyheartBeatStopR,that bowtie makes it super cute ,2,Eyebleach
urmyheartBeatStopR,i want to see spectators dressing up as canes cheering for that cane of justice ,1,worldnews
