name,body,score,sub
urmyheartBeatStopR, granted i only have this much experience in it why dont people like it 1 before javascript harmony version there was no promise or whatever so you have call back hell 2 the concurrency model is shit compare to say actor model erlang elixir there a video joking about it https www youtube com watch v bzkrvzciazg you are basically ignoring the tools that the cpu people built into the chip and doing it by hand you are doing basically doing the threading yourself and have to check every possible state including fail safe state 3 javascript is a shit language it was meant for front end and as a script not 100s or 1000s or more lines of code the language did not even have module until recently 4 javascript is a bad language it implicitly type cast stuff and the rules are stupidly hard https www destroyallsoftware com talks wat 5 during my days nodejs was really hype our new cto did not know shit and he was trying to sell that shit fuck that asshole he could not even defend his choices or even offer what was his other alternative solutions he cannot code a lick 6 mongodb is a shit db the idea of flexible scheme is bad it tricks people into thinking it awesome cause it flexible 7 flexibility is bad because people will choose mongodb to shove data in ignoring the stage of sitting down and actually figuring out what their requirement and what type of data it is 8 my cto wanted mongodb i asked him why he said it flexible i asked him what data does he intend to store he said images hence he one dumb fuck 9 the data structure in nosql really matters in term of what type of data you wanna store image type data like url and look up is better off for hash table type cassandra is pretty nice with this if you want text search postgresql is ok if you need any more then any lucene base tech db like solr or elastic search but he too dumb to know that shit and too lazy to actually do real research 10 erlang was built from the ground up as a concurrency language vm nodejs was shimmy into v8 and used an existing language for it how it goes about solving concurrency is questionable once you learn other concurrency model the pro is if the mean stack is some how fast in term of prototyping and getting a product out then by all means do it it better to do it in a stack you can deliver fast product then to use a stack that you are very slow at and then your passion goes away and it never get finished nodejs fanboys are going to defend it and people like me can hate it but at least i have experiences in it to have some real critiques ruby python hell even php is a prettier language than javascript when i work in real life nobody really knows javascript they do not know it prototype inheritance or hell even how that shit works hell the latest harmony version for javascript they added the class keyword just to sugar coat it hey guys let pretend that javascript is class based inheritance prototype inheritance seems cool function as first class citizen is really cool but i digress it not a language for tons of lines of codes also it current ecosystem npm is a mess the point is do whatever you like to do if you like mean or nodejs then do it but it does not give you the right to get ass hurt when somebody point out the truth and you will see people are going to be all tribal about tech the key take away is there tons of tribalism among tech aka fanboy wars and there are tons of horse racing bet on what is the latest greatest technology web tech is really really on crack when it comes to hype of new technology and sometime you bet on the wrong horse i am looking at you groovy that market went stagnant ,9,programming
urmyheartBeatStopR,i used it often when i did web dev just vim within tmux unfortunately not anymore because i am using r now and doing rstudio wish there a weird commandline editor for exploratory data analysis ,2,programming
urmyheartBeatStopR,energy drink should be their next business venture ,2,nottheonion
urmyheartBeatStopR,i thought you guys were joking secret handshakes sound like something little kids would do this is unexpected i laughed and then afterward i felt weird that this is a real thing ,5,exmormon
urmyheartBeatStopR,adidas cap toe last for 7 ish years for me i had two an all black one and an all white with blue stripes i looked up the name it superstar but yeah not buy it for life because you cannot resole sneakers r goodyearwelt had an interesting conversation why sneakers cannot resole and why they do not do resole able welt it because they wo not look like traditional sneakers and or it cost too much to make it looks like traditional sneakers ,4,BuyItForLife
urmyheartBeatStopR,just one picture why are you so stingy give us an album ,1,AsianHotties
urmyheartBeatStopR,i fucking knew it i was like whoa they seems to be very redpill ish with all these recent posts i unsubscribed from pussypassdenied they went alt right ,2,OutOfTheLoop
urmyheartBeatStopR,suuuuper cute and serene i like how it just link doing his thing treasure hunting as if it some old man fishing on a boat but at the same time it just more magical because it not fishing on a boat and everything in the tattoo is worth exploring and wondering ,2,tattoos
urmyheartBeatStopR,fuck that i miss obama bush was the reason why i had a hard time finding a job ,1,MarchAgainstTrump
urmyheartBeatStopR,when i see out of state license plate state i think how great california is ,2,videos
urmyheartBeatStopR,huh thank you it kind of summarize my experiences with mainland chinese international students some of them are quite like this i will never bring up taiwan with them i recall asking one of them do you know jen the taiwanese and the person quickly replied it belongs to china awkward ,1,Documentaries
urmyheartBeatStopR, season 2 episode 18 my t c w ,2,television
urmyheartBeatStopR,recipe lost me at picking clams out of shell one by one tedious recipe got me back at bacon yum ,0,GifRecipes
urmyheartBeatStopR,ugh if only they are in sol cal i would be all over them applying even if i am biased toward debian ,2,todayilearned
urmyheartBeatStopR,i think i read somewhere that having multiple options can be daunting and some people just enjoy having other people telling them what to do less thinking ,1,politics
urmyheartBeatStopR, that may all be true it is true that how linear regression works everything else after what you have stated is pure speculation and subjective you can head over to r statistic and ask them about it ,0,politics
urmyheartBeatStopR,iirc natural gas oil and coals are subsidize too https en wikipedia org wiki energy subsidies allocation of subsidies in the united states so to point out subsidies in wind and other renewable resources and say natural gas is better without bring up subsidies in natural gas is dishonest unless i am misreading ,204,Futurology
urmyheartBeatStopR,yes but how intelligent that life is is my worry what if we are the most intelligent out there and that all others are just bacteria or random animals ,1,space
urmyheartBeatStopR,do you know what car model is that ,1,vandwellers
urmyheartBeatStopR,i do not just to see if they are trying to bullshit me if you tell them you are a software engineers they will ask you to fix their computers or code their idea with them and when we get successful he she will split the percentage of the profits also there are a sizable amount of software engineers that have impostor syndrome ,0,gifs
urmyheartBeatStopR,paid by america freedom where as you sir is paid by soviet commies ,2,politics
urmyheartBeatStopR,he keeps on winning in the r t d alt world where as in reality he such a loser are you going to tell me that an honest living paint job is not better than some cheetos idiot that inherit his wealth and goes on to create shady businesses such as trump university and scam honest working people ,26,politics
urmyheartBeatStopR,botfly ,1,MadeMeSmile
urmyheartBeatStopR,that funny cause mark wahlberg hate asians and he blinded one too ,1,firstworldanarchists
urmyheartBeatStopR,georgia and they wonder why i a color person have a fear of going to those southern states ,1,Bad_Cop_No_Donut
urmyheartBeatStopR,they also suck down a lot of oil too they use oil to lubricate ,-4,carporn
urmyheartBeatStopR,he quoted the bible for his reduced sentences shit if he followers believe in that shit i should have become a pastor seed me some money ,1,BlackPeopleTwitter
urmyheartBeatStopR, kevin say the n word a lot kevin was white the highschool was 84 black kevin got beat up a lot lmao oh man he probably in some southern state and his parent are cousins are something and product of long generations of inbreeding ,5,worldnews
urmyheartBeatStopR,it not like we inherited these modern wars from the righties oh wait or that black water is run by the brother of betsy devos which by the way cause the withdraw of afgan troops sooner instead of later bush wage a war but he never had an exit plan obama tried to stabilize afgan but black water happened and so usa had to withdraw sooner and afgan end up riddle with terrorists and unprepared yeah obama started a few interventions but i rather trust obama over trump decisions in interventions he got a little girl killed last raid and his looming soviet ties ,6,worldnews
urmyheartBeatStopR,you spin me right round baby right round like a record baby that the first thing i thought about when i read this meme ,2,wholesomememes
urmyheartBeatStopR,it true if you want to understand stat you have to know calculus if you want to use stats there are tons of algorithms and tests you can pick and choose and do it you do not have to understand how that table that you look up come about or how that algorithm was created ,1,statistics
urmyheartBeatStopR,oh man that nice i want that color but with perlon strap ,1,Watches
urmyheartBeatStopR,you got that thing in the neverending story https imgur com hsuudgd,1,corgi
urmyheartBeatStopR,holy shit that is sooo bad that it good funny good it up there with turkish star wars https en wikipedia org wiki d c3 bcnyay c4 b1 kurtaran adam,32,BollywoodRealism
urmyheartBeatStopR,seems like theory if he she wants to go phd stat i cannot see anybody wanting to do phd stat believing that it will be mostly applied unless they are naive ai not nobody is crazy enough to want to do apply and decides to do measure theory for fun ,2,statistics
urmyheartBeatStopR,yeah debating between the two going cocktail time ,1,Watches
urmyheartBeatStopR,no but there are neural network adversarial attack i am not sure how much of a problem it is but it is a thing ,2,programming
urmyheartBeatStopR,husky german shepard ,1,MadeMeSmile
urmyheartBeatStopR,soylent green ,4,worldnews
urmyheartBeatStopR,well they are counting slicks no i mean tires make a big difference ,1,cars
urmyheartBeatStopR,he going to go golfing with donald trump trump will teach him the proper way to grab them by the pussies ,1,politics
urmyheartBeatStopR,that smile is beautiful ,10,Frisson
urmyheartBeatStopR,uh willing to relocate will help but yeah i think you are naive i grad in 2009 with a cs degree and that was the bottom of the recession 6 months for an internship after grad and 2 month afterward for a 45k job as a programmer i really do not get why people in my master program thinks a degree will magically get them a job you are competing with other people with degree you need internship connections etc to stand out of other people with degree you also need to do research on what specific field you go into and tailor your master program to it i am tailoring mine to data science and i have 6 years worth of professional paid as a programmer i got a buddy who graduating asked me out of the blue am i going to get a job she did the bare minimum to get her degree no internship and no relevant experiences she got a thesis at least and a master but she did not really tried to learn anything in depth just straight up get the grades to pass the class kinda deal she also have no clue what she want to get into until 5 weeks until end of this semester her last semester she hear data science is paying a lot and she wants in but she did not tailor her stay in master program for it i think in general you will get a job it just in perspective you are competing with other people with a degree too just put in the effort to stand out of those people while enjoying your stay in the program ,1,statistics
urmyheartBeatStopR, what would you do to me on a leash probably get you to clean my room it kinda dirty and i have an exam and also presentation coming up ,2,AsiansGoneWild
urmyheartBeatStopR,i am ma tag you as pornking ,16,adorableporn
urmyheartBeatStopR,shit that is gangster he signed my book now and forever it was awesome ,1,todayilearned
urmyheartBeatStopR, r idiotsfightingthings buncha beer belly people fighting a door ,1,holdmybeer
urmyheartBeatStopR, asshole that watches fox all day to be fair it not all day he also have to golf too ,2,politics
urmyheartBeatStopR,you know you probably just argued on fox news against an old person ,5,politics
urmyheartBeatStopR,it so fucked up i remember bringing up president carter to a republican friend and he had an instant reaction peanut farmer in a disgusted tone i was like damn even if you think he did bad as a president he cannot be worst than bush jr donald etc to have such a hatred for the man jeez and he fucking religious too keeps to himself does great things post presidency he a great role model up there with mr roger neighborhood both dude are religious but they do not shove it down your throat they practice their religion without discrimination and with out preaching to other people supposely he made home brewing possible ,3,politics
urmyheartBeatStopR,sean spicer ally ladies and gentlemen can they round up that trump supporter milo ,1,worldnews
urmyheartBeatStopR,damn i did not know being president is such a chill job golf every week sign documents yell at people done ,5,politics
urmyheartBeatStopR,do not forget the liberal media and liberal colleges education institutions ,3,politics
urmyheartBeatStopR,his daughter is married to a goldman sach rich jew so trump stances on jews are softer imo but his alt right group just have real hard on on jews ,1,politics
urmyheartBeatStopR,they are rebranding themselves to alt right my delusional libertarian friend think alt right are just a group of people that are attacked by the media he could not connect kkk to alt right then again that dude is not very smart when it comes to this the rebranding helps especially if you went to the banned alt right subreddit it was basically a kkk lite subreddit lots of racial whisper so i think calling out alt right as racist helps tell people like my buddy that they are in fact a facial hate group ,3,politics
urmyheartBeatStopR,it should be a badge of honor to be ban from that shit show sub i think i got shadow ban or some shit i cannot post on it or reply anymore after calling peeps out for their stupid pizzagate ,2,politics
urmyheartBeatStopR,dick pictures increase the ipo value,1,news
urmyheartBeatStopR, same here i am sneaking this in while doing my masters i am doing the same also cause my summer internship at fda is going to be bayesian modeling it clicks so well right now because i am taking non parametric and computational stat ,1,statistics
urmyheartBeatStopR,rethink stat or the puppy book for intro ,5,statistics
urmyheartBeatStopR,what is second 1 cobol 2 3 perl,2,programming
urmyheartBeatStopR,uh i bought a refurbished mac on a mac website it works good but i doubt this is a frugal route dell have refurbished stuff too i dunno if i would buy refurbish off of websites other than companies website such as dell hp apple etc ,3,Frugal
urmyheartBeatStopR,you can call a local toyota dealer to do like a 60 or 100 or whatever points inspection ask them how much it will cost you one quoted me for 100 bucks ,1,Frugal
urmyheartBeatStopR,i was going to guess irish ,1,Frugal
urmyheartBeatStopR,i know this is going to be weird but i was a programmer so my salary is a bit skew in term of what is a lot how much do you think a master in statistic will be making coming out a quick google is telling me it 75k on average 90k plus interest if op grad in 2 years i guess it not bad i think you are right the private sector might be better if gov is offering half ,1,statistics
urmyheartBeatStopR,soviets and people with ties with russia are visiting white house is my guess ,1,politics
urmyheartBeatStopR,even if the person is transgender that a person and he or she should be able to get healthcare also that person is an american so being transgender does not some how negate his or her rights which is why aclu is taking up this case ,28,politics
urmyheartBeatStopR,even if this is true this is not relevant here google is actually adopting type script and it big news and have big implication for typescript as a language ,9,programming
urmyheartBeatStopR, this is one of the reasons why i am reluctant to start using typescript i jumped on the coffeescript bandwagon but now it feels really weird to look at old coffeescript code not to mention trying to include a library written in cs in a modern project this is the reason why i left web dev i was paid to do ember js i wanted to do angular because google is not going to fuck up angular and it back by google google did fucked it up now the flavor flav is reactjs also the constant tribalism and the nodejs mongodb hype train it silly it either reinventing the wheel or just hype after hype choosing what to learn can be like a magic crystal ball or grabbing a paper out of a hat it also seems like the hype train happen much more so in the small startup scene so when you learn these tech you end up mostly in moving from startup to startup so it just a vicious cycle of hype train eventually move to a mid size company with a somewhat stable stack with less hype ,5,programming
urmyheartBeatStopR,maybe he will stop fucking golfing ,1,politics
urmyheartBeatStopR, i have read though that since it acrylic it a cheaper fix i mean sapphire is second hardest thing to diamond no you gotta be aiming to scratch sapphire dome to actually scratch it and then you need to fix it i would also imagine it fixing price is base on complication how hard is it to take it out and put it back together than the material of the dome other than the cost of it so all in all if you have sapphire glass then worrying about fixing the glass is a non issue or at least a rare one ,2,Watches
urmyheartBeatStopR,yeah you usually do not wanna go to the same school as undergrad i know 2 3 professors of mine come from uc davis for phd also the statistical rethink guy is from uc davis from the antropology department ucla for a masters in applied statistics this one is new iirc i was at asa annual career day and there were promoters and i asked them about their program and classes what it entail cause i was interested for my buddy who is still undergrad they could not answer anything ucla is a suuuuper nice campus tho the people are wonderful unlike ucdavis i hear it cows and nothing else carnegie mellon masters do not they have some sort of data science machine learning program 45k ugh not worth it unless i am guarantee a 6 fig job after grad there a program where you work for america fed or state for 10 years and your student loans will be forgiven during that time you have to do your monthly payment for 10 years after that whatever left is forgiven you should look that up if you wanna do this route just incase you are unable to get a decent enough job to live comfortably while paying the loans ,4,statistics
urmyheartBeatStopR, i would like to know how did you learn to use r my batshit crazy lovable thesis advisor was teaching intro datascience in r he cannot really lecture and he have high expectation the class was for everybody including people that do not know how to program the class book was advance r http adv r had co nz red flag we only survived this class because i had a cs undergrad background and i gave the class a crash course once our whole class was more about how to implement his version of random forest i learned r because we had to implement a version of random forest with rpart package and then create a package for it before this a dabble in r for summer research it was mostly cleaning data so my advice would be to have a project and use r how did you learn statistics master program using the wackerly book and chegg slader https www amazon com mathematical statistics applications dennis wackerly dp 0495110817 it a real grind you need to learn probability first before even going into stat wackerly was the only real book that break down the 3 possible transformations pdf cdf mgf ,2,rstats
urmyheartBeatStopR,i am reading through this book and it an amazing book it a great starting point only it gloss over the proof and hard math stuff it great to get intuition i am moving to gelman next afterward ,4,statistics
urmyheartBeatStopR,i am in applied stat anyway i have seen two data science masters one is in chapman university and it a general you do data viz some stat programming etc so it overall more well rounded ucla have a data science stat master that brand new i have no clue but it mostly just stat i think it meh cause it so brand new you cannot ask the promoter about the classes in general my applied stat program is more gear toward traditional stat more parametric and some nonparametric there no real programming lessons but we are expected to code stuff it just here code template just use it i think this is the bare minimum for stat for data science field i think you should at least have a intro prog data structure and algorithm class anyhoo another complain is modern stat are not mandatory the non parametric ones computational stat bayesian etc this suck really badly cause many people wanting to do data science in term of data modeling do not know what to take in this program it feels stat program move very slow to adopt new thing and embraces programming and comp sci aspect so now comp sci department are taking this role and using machine learning over stat instead ,3,statistics
urmyheartBeatStopR,he says a lot of things many time things that contradict or negate each other in the same speech it scary that this is the norm now i think it escalated because he straight up willing to bomb countries without congress ,11,politics
urmyheartBeatStopR,huh the photo actually almost got me to vomit my food i just ate that was so cringey that my stomach wanted to vomit ,0,trashy
urmyheartBeatStopR,it is osotogari op is wrong it an outer leg sweep it more involve in tournament because in judo you can throw and pin only you do not have to worry about getting punch or kick in the face or balls so you can do shit like go in with your chest hitting their chest to break the balance plus these fucker have gi there are tons of gi techniques to break balance via good gripping deashi harai is usually when they shift their weight and center of gravity so that technique is often seen when the opponent lift one of their leg and you catch their lifting foot their with your sweep this is not deashi harai hell osotogari is one of the first move you learn in judo anyway you can clearly see he went from the outside to sweep his sweeping leg is not in between the opponent legs what so ever and it a classic osotogari because there is one side to do that kind of sweep him being on the left side and the opponent being on the right side as he sweep from the out side into his legs edit sorry that a lie i forgot if you are a lefty you can go from the other side to sweep ,1,IdiotsFightingThings
urmyheartBeatStopR,seeing that in real life out side of randori and tournament is crazy as fuck concrete can break bones ,6,IdiotsFightingThings
urmyheartBeatStopR,mathematical statistics with applications by wackerly book with a chegg or slader account i think you should start with probability first before getting a stat book if you do not have a solid prob foundation ,1,statistics
urmyheartBeatStopR,my family except for my dad he a fucking manchild ,1,AskReddit
urmyheartBeatStopR,5d chess,115,facepalm
urmyheartBeatStopR, pearl harbor is about a love story set in hawaii and some explosions happen during that time holy shit and they made that into a 3 hr movie ,115,WTF
urmyheartBeatStopR, i know it may be a bit ambitious but is there a possibility of getting a computer science related internship my summer after freshman year just spam that resume shit to 100 places also if you are nice to your prof then if you do not get internship you can always maybe get them to do summer research there should be a google abassador whatever maybe talk to him her there was one set up after i grad i dunno much about it well anyway any tips for this incoming freshman scrub join acm there should be senior there or people that have taken prof and shit be nice make friends and ask them for tips they will tell you who to dodge and what the tests gonna be like for those classes and professor also just enjoy your stay and learn how to manage your time i was a freshie in 2004 and world of warcraft happened and it fucked up the first 1 5 years of my school year there lol for summer if victor hill is there you can get a gig with him as a jr sys admin or it he the system admin guy sean should be there too both dudes are awesome oh also do not compare yourself to the smartest kid in your program i have seen it in my graduate program right now the dude is so emo cause he compare himself to some smart asshole in my current program programming is just a skill it takes time to get better people learn in different pace and that okay as long as you do not quit ,4,ucr
