name,body,score,sub
xxxskfxxx,oh yes worth getting a heart attack for what a way to start the day fuck this cereal and milk crap,1,food
xxxskfxxx,this is the stuff always left in a box of chocolates i do not know anyone who likes it send it back to turkey,1,food
xxxskfxxx,looks like next doors cat has been in my garden again,1,food
xxxskfxxx,just needs some popadoms and dips and a few beers ,0,food
xxxskfxxx,i like all food well cooked at least you know it safe to eat good effort ,1,food
xxxskfxxx,are you a pimp,1,funny
xxxskfxxx,i do not like too much vocals on a track they get annoying i say let the instruments do the singing,2,blacksabbath
xxxskfxxx,ewan you are a flop get back to acting school,-65,movies
xxxskfxxx,study by sony and microsoft so they do not put it in their consoles and you have to buy new full price software,2,gaming
xxxskfxxx,i hate star wars even star war jokes why did they bring it back oh yes just money,1,Jokes
xxxskfxxx,iv seen this before on here if you want a man to fuck you just ask,4,gifs
xxxskfxxx,lunar lander the one i used to play in the early eighties arcades,1,gaming
xxxskfxxx,great picture,1,pics
xxxskfxxx,what a waste of cheese you cannot make that veg edible,-1,food
xxxskfxxx,oh yes,0,food
xxxskfxxx,i really do not listen to this later stuff but i will try again,1,blacksabbath
xxxskfxxx,it a good excuse to listen to sabbath again,3,blacksabbath
xxxskfxxx,i would fuck her tho ,0,Jokes
xxxskfxxx,that when programmers we are brilliant now the code they write is so bloated if you cannot run their shit you need a new pc ,1,gaming
xxxskfxxx,i think it should be this years xmas number 1,2,videos
xxxskfxxx,you might aswell buy an old fifa they are all the same rubbish but so are all football games i like football but no games maker has made the control truly responsive,1,gaming
xxxskfxxx,i like iron man but fairies wear boots is a close second,1,blacksabbath
xxxskfxxx,yes funny and clean,1,Jokes
xxxskfxxx,it so easy to wind people up on here ,0,funny
xxxskfxxx,no i just do not like old people,0,funny
xxxskfxxx,i thought it was you cannot ride any of them,1,Jokes
xxxskfxxx,i hope someone brakes her house windows,-8,funny
xxxskfxxx,controllers now have too much going on ill admit the snes was great but the ps1 and a copy of doom heaven,1,gaming
xxxskfxxx,no the play station 1 was the best,1,gaming
xxxskfxxx,wow tasty,1,food
xxxskfxxx,nice but get rid of the herbs,1,food
xxxskfxxx,mankind is doomed why do we hate each other so much,3,creepy
xxxskfxxx,1 doom original version 2 tekken play station 1 3 gta ,0,gaming
xxxskfxxx,your right she is not hot pretty plain really,0,OldSchoolCool
xxxskfxxx,i do not mind shit movies but i do mind paying too dollar to watch them thanks to the internet we can avoid being ripped off,1,movies
xxxskfxxx,no it sank i managed to dry it out tho and rode it for a couple of years before selling it wish i had kept it now it worth a bit of money now it was a kawasaki kh 250 i miss the sound of it,2,motorcycles
xxxskfxxx,i hit a deep one at around 60 mph the bike stopped almost instantly and threw me over the bars i aqua planed on my back for a while then sank the water was around 4 feet deep i got up and was wet but unhurt sort from my pride i wo not try it again,33,motorcycles
xxxskfxxx,micheal jackson could not sing he just made dumb noises,-5,videos
xxxskfxxx,very strange,-1,funny
xxxskfxxx,i reckon it like the hot dog stuffed crust we get in england very tasty,1,food
xxxskfxxx,thought we would have a picture of the north korean leader ,1,pics
xxxskfxxx,should be trump pushing us europeans about ,7,pics
xxxskfxxx,i will try remember this one i thought it was funny,3,Jokes
xxxskfxxx,yes i meant 4 it going to be very interesting,1,pics
xxxskfxxx,wow yes i bet her ass is amazing,-6,gaming
xxxskfxxx,only time will tell at least it not dull for the next 5 years if he lasts,1,pics
xxxskfxxx,trump will save america if they do not keep blocking his proposals wish we had him in the uk,-3,pics
xxxskfxxx,yes and we let his parents in should leave em to rot in thier own country,2,pics
xxxskfxxx,we in england let them in pay them social security cos they think their too good to work then they blow us up so where actually paying them to kill us ,0,pics
xxxskfxxx,he such a short arse you cannot take him seriously as an action hero,1,movies
xxxskfxxx,they rip you off with everything what did you expect you where stupid enough to buy a switch ,-4,gaming
xxxskfxxx,do they do a lady boy version,-2,gifs
xxxskfxxx,yes we need a guy like trump in the uk,3,pics
xxxskfxxx,you broke the steering wheel off,5,carporn
xxxskfxxx,he cute,1,aww
xxxskfxxx,pointless but i want one it should have a light that gets switched on and off to be even more annoying,1,funny
xxxskfxxx,and chuck norris is still learning to act,2,OldSchoolCool
xxxskfxxx,morrissey what a knob,0,OldSchoolCool
xxxskfxxx,give me a playboy centrefold any day now they should be old school cool,1,OldSchoolCool
xxxskfxxx,because there scared to say no,1,Jokes
xxxskfxxx,that the trouble these days people take offence too easily it a joke if you do not find it funny your probably some do gooder,2,Jokes
xxxskfxxx,went to turkey once do not make the same mistake,0,pics
xxxskfxxx,nothing special,1,OldSchoolCool
xxxskfxxx,that would be different beating seals to death while listening to tiesto,1,gifs
xxxskfxxx,yes i used to hit it hard but miss those dance tunes,1,gifs
xxxskfxxx,nice i could eat one every day,1,food
xxxskfxxx,that why they should be clubbed to death at birth,0,gifs
xxxskfxxx,i was born on the same planet as elvis so what,1,OldSchoolCool
xxxskfxxx,i could have watched a movie in the time it took to read that post,-11,movies
xxxskfxxx,it things like that which brighten your day,1896,gifs
xxxskfxxx,those ozzy tunes are the best but would have been equally as good with the other two just great songs,1,blacksabbath
xxxskfxxx,oh yes,1,gifs
xxxskfxxx,they all react like that when you try the back door,4,gifs
xxxskfxxx,yeah that cool would like to know how it done,1,funny
xxxskfxxx,he needs a pair of knickers on his head he looks a right c nt,1,aww
xxxskfxxx,never heard of him guess it not been shown in the uk,0,videos
xxxskfxxx,it an obscene amount to pay for a game i just wo not do it anymore,1,gaming
xxxskfxxx,very tasty looking pizza i am in love,1,food
xxxskfxxx,who gives a shit,2,pics
xxxskfxxx,i would be upset if it did not have balls ,-10,Jokes
xxxskfxxx,different to what i do in the uk we just have corned beef from the tin mixed with mashed potato and onion put it in an oven dish sprinkle some cheese on top and bake in the oven to get a crusty top,6,food
xxxskfxxx,wow i would like that with some double cream drizzled over it,1,food
xxxskfxxx,nice picture,1,pics
xxxskfxxx,you can tell their related,2,funny
xxxskfxxx,twins,2,pics
xxxskfxxx,it yellow and this is pointless,1,gifs
xxxskfxxx,i do not even like mint with chocolate and salad is not my thing,0,food
xxxskfxxx,i hate mint in food it does not enhance the flavour i want to taste and smell the meat not make my breath smell nice,0,food
xxxskfxxx,i think she is unscrewing his bottle he wants to be thankful she did not stick it round the back,1,funny
xxxskfxxx,he a wanker who cares what he does you idiots watching him are making him rich ,2,gaming
xxxskfxxx,good job not too many extra to ruin the taste of the burger,1,food
xxxskfxxx,henry rule nice and simple and light enough to do the stairs with and like someone said they just go on year after year pity they got rid of the extra power switch,1,funny
xxxskfxxx,all star wars should have left it alone,-6,movies
xxxskfxxx,i am hungry again just cannot resist pizza,53,food
xxxskfxxx,it worth clogging the arteries for one of those,1,food
xxxskfxxx,why,1,pics
xxxskfxxx,i would say his career is still dipped,1,movies
xxxskfxxx,i had a 175 it was great fun,1,motorcycles
xxxskfxxx,destination unknown by alex gaudino is another one i like,2,funny
xxxskfxxx,it a dance music video it called call on me by eric prydz it comes up on you tube,1,funny
xxxskfxxx,yes it a great video for ass lovers,1,funny
xxxskfxxx,a great aeroplane killed by the usa because they did not make it do not give me that crap about noise and pollution ,-2,OldSchoolCool
xxxskfxxx,there determined to get rid of every socket on their phones and gadgets less pieces more profit,1,gadgets
xxxskfxxx,war pigs for the next xmas no 1 ,1,blacksabbath
xxxskfxxx,he always was an annoying prick,2,funny
xxxskfxxx,bring back gollywogs ,0,pics
xxxskfxxx,i would like to put something between those 2,1,funny
xxxskfxxx,what an inhuman way to treat woman next someone will say they do not mind bollocks,2,funny
xxxskfxxx,you might go deaf or gas yourself as for the car i thought it would be ok a modern car would probably shut itself down to save damage,1,motorcycles
xxxskfxxx,do not you just love burgers oh and pizza what a healthy life i lead,-6,food
xxxskfxxx,well i thought it was funny just reminds me of that blazing saddles scene and the sinking rail bogey,2,Jokes
xxxskfxxx,it a place we are you can say what you like and a few sexy pictures but a lot of redirects to an image hosting site that only let you have a certain amount of views in a day reddit is still the best,1,funny
xxxskfxxx,when reddit is down use voat,2,funny
xxxskfxxx,yes movies of comedy series do not seem to go well look at dad army complete rubbish,1,television
xxxskfxxx,inbetweeners is a hard act to follow,6,television
xxxskfxxx,it like eating a face hugger i just could not do it,1,food
xxxskfxxx,yes please,1,food
xxxskfxxx,i loved the first movie let hope he does not fuck it up,1,movies
xxxskfxxx,do a search on extratorrent to there is a discography on there of every sabbath album remastered original live compilations ep in flac or mp3 it over 20gb if you want it all,2,blacksabbath
xxxskfxxx,early sabbath is my favourite anyway so i would say ozzy i rarely listen to the newer albums,2,blacksabbath
xxxskfxxx,the camel would taste better than his chicken at lest it would be meat instead of bone and skin,-1,OldSchoolCool
xxxskfxxx,i hated those tap the buttons as fast as you can games no skill needed whatsoever,1,videos
xxxskfxxx,is she available for this friday night,1,gifs
xxxskfxxx,he must be having a change from choir boys,1,funny
xxxskfxxx,crocs sandals and flip flops are worn by people who think they are cool no real man would ever wear them ,1,Jokes
xxxskfxxx,it a pigs trough is not it,2,funny
xxxskfxxx,i can tell you they do not taste of anything they dried up years ago they might smell a little of piss but plenty of younger ones do,2,Jokes
xxxskfxxx,thought april 1st had gone,1,funny
xxxskfxxx,there used to be a fruit shop where i lived it was called r sewell someone pointed it out to him and it ended up bob sewell,0,funny
xxxskfxxx,yes iv been doing that since the 70s one tire inside another some old guy at work showed me when i first started work as a cycle messenger at a big company,3,gadgets
xxxskfxxx,you probably need the machine if your a limp wristed juice drinker,1,gadgets
xxxskfxxx,these super cars are stupid you need to be a dwarf or a gymnast to get in and out when are they going to make a proper sized car,-2,carporn
xxxskfxxx,i liked cannonball run and the bandit movies but not great for furthering an acting career but hey he made us happy watching the movies,2,OldSchoolCool
xxxskfxxx,he was unlucky thought they had killed most of the indians by then,2,OldSchoolCool
xxxskfxxx,think that was his best attempt at acting pity he could not do anything else,1,OldSchoolCool
xxxskfxxx,those pads are 50 in the supermarket for the xbox one what a rip off,3,gaming
xxxskfxxx,i got mine a nose hair trimmer we are divorced now she never had a sense of humor,2,OldSchoolCool
xxxskfxxx,mine used to last around 3 000 miles with the chain gone aswell you must be riding like a nun going to a funeral,1,motorcycles
xxxskfxxx,he will be able to get a shave when he gets some,-15,pics
xxxskfxxx,pity that all there is,1,blacksabbath
xxxskfxxx,well it got me listening to all the albums again ,2,blacksabbath
xxxskfxxx,fuck margaret thatcher,2,pics
xxxskfxxx,yes i am an idiot responding to you now go away,1,gadgets
xxxskfxxx,why did you it a camera get over it,1,gadgets
xxxskfxxx,and most pictures end up on social media sites viewed on small screens unless your doing a large print who needs one my slr rarely comes out of the house i used to do a4s of the family but no one wants the prints anymore ,1,gadgets
xxxskfxxx,agreed low light is bad on most phones but it only a matter of time,1,gadgets
xxxskfxxx,iv a good camera and if i am doing a football match i will take it or say a wedding but otherwise i cannot be bothered to lug it around,1,gadgets
xxxskfxxx,who buys cameras these days it just something else to carry about and it comes second best to your phone,-13,gadgets
xxxskfxxx,back when it was actually good,3,OldSchoolCool
xxxskfxxx,sit on my face eva,0,OldSchoolCool
xxxskfxxx,i still have a megadrive genesis at my moms she actually plays it she is 80 she is addicted to lemmings,1,gaming
xxxskfxxx,yes i have just sold my n64 and 20 plus games i miss it already,1,gaming
xxxskfxxx,wondered who he was then lost all interest when american football was mentioned ,1,funny
xxxskfxxx,every wrestling game,2,gaming
xxxskfxxx,yes remove old silicone fil the bath then uses a thin nozzle to try get some between the wall and the bath you can use masking tape around where your silicone is going to try get a neat edge then pull it off and leave it to dry overnight maybe,1,DIY
xxxskfxxx,he is not even worth a comment a one hit wonder,-1,videos
xxxskfxxx,i know the less we see of him the better,1,funny
xxxskfxxx,i hate that jervais he not funny ,1,funny
xxxskfxxx,another album i need to listen to again,1,blacksabbath
xxxskfxxx,love those early movies drunken master meals on wheels armour of the gods that easter monday sorted for me,1,videos
xxxskfxxx,well it safer than watching young girls at the playground,5,funny
xxxskfxxx,your right woman and girls are lower than dog shit in that part of the world,2,gifs
xxxskfxxx,maybe achieved gold at the school of fisting,4,funny
xxxskfxxx,who cares apple is dying too expensive and nothing new,2,pics
xxxskfxxx,neighbourhood watch their a pair of curtains,22,funny
xxxskfxxx,do not bother do not listen to all those zelda addicts to a normal games player their boring,-5,gaming
xxxskfxxx,we christians can laugh at it but if it was a joke about the koan cannot say anymore i think the bit is muslim ,1,gifs
xxxskfxxx,europeans would vacation in iran americans are chickens ,2,funny
xxxskfxxx,cannot see a long line of people waiting to say something good go home buddy no ones listening,3,videos
xxxskfxxx,you have overdone it for easter,1,pics
xxxskfxxx,i like it,5,Jokes
xxxskfxxx,no one threatening a fatwa on you or have they not seen it yet,1,Jokes
xxxskfxxx,we are did i go wrong my wife has no arse and cannot cook,1,pics
xxxskfxxx,a christmas cracker contender,2,Jokes
xxxskfxxx,no,5,movies
xxxskfxxx,sushi is only fit for cats as far as i am concerned pineapple should be banned too ,-5,food
xxxskfxxx,the old ones are the best,498,Jokes
xxxskfxxx,what is wrong with it,1,funny
xxxskfxxx,wall papering and decorating im great at it but hate doing it,1,Jokes
xxxskfxxx,if be cross if he damaged my ceiling,4,funny
xxxskfxxx,that a proper burger why waste money at the fast food places we are the burgers only fill a 2 year old ,0,gifs
xxxskfxxx,what is grammar got to do with it we are commenting on acting ability,1,movies
xxxskfxxx,who could tell if she was dead or not her acting was that bad,-36,movies
xxxskfxxx,doom or quake style games none of this cooperation rubbish one man killing machine,1,gadgets
xxxskfxxx,the big difference between the games is the control method tilting a stupid controller or waving it about i actually liked mario and mario cart but once the n64 bit the dust the new consoles did nothing good to the games as for zelda i thought it a waste of time pointless puzzles and wandering about but if that what you like then great just give us something new i play very few games now been playing since the first tv ping pong game so played everything even games that never got released maybe i am just bored of the whole gaming scene im still in love with original doom tho ,0,gadgets
xxxskfxxx,nintendo bring out a new game character this is the same old crap on every console you bring out oh yes mario mario cart i am sure we have been playing the same game since the snes super nintendo entertainment system for those of you who were not even born when nintendo first released these games please bring us somthing new or give up,-2,gadgets
xxxskfxxx,maybe he asked for it in large print,1,gifs
xxxskfxxx,yes strange enough people are paying to see them,1,movies
xxxskfxxx,what is he shouting lego of me ,1,pics
xxxskfxxx,he is one of those annoying people you just want to punch in the face and his movies stink too,2,funny
xxxskfxxx,the movies are garbage what idiot puts the money up for them to be made,1,movies
xxxskfxxx,4k will probably be old news by the time it released i think they need to look further ahead and really make a leap in gaming and do we really need it to play the same old fifa updates and the like,2,gadgets
xxxskfxxx,ok thanks for that i will have another look,1,blacksabbath
xxxskfxxx,can you still enjoy a wank,1,pics
xxxskfxxx,it would be interesting but it from a site iv never heard of so who knows if it true or not anyway i like the early stuff so probably not for me,1,blacksabbath
xxxskfxxx,you said i am going with you next time,7,Jokes
xxxskfxxx,the finance company still owns the bike so you cannot sell it best to get it stolen if your insured they get their money back or most of it and you get it off your hands only thing is you do not make any money and loose you no claims reduction on your insurance policy maybe just give em it back and get a bad credit rating lots of options but not any good ones i am afraid,-9,motorcycles
xxxskfxxx,the program was no good i tried it and dumped it 10 minutes later,1,funny
xxxskfxxx,oh yeah i remember now just ads i cannot get rid of movie never starts might work on laptop but not on iphone,1,BestOfStreamingVideo
xxxskfxxx,cannot think what happened cannot say i even commented on it who knows who cares,1,BestOfStreamingVideo
xxxskfxxx,was in warrington last month and did not see that beauty,1,food
xxxskfxxx,yes please,5,food
xxxskfxxx,it still an expensive way to look at facebook because that what 99 of people use them for you cannot actually do anything useful on them well maybe a bit of shopping ,0,gadgets
xxxskfxxx,have i struck a nerve,1,videos
xxxskfxxx,just more ads,1,BestOfStreamingVideo
xxxskfxxx,they we are rubbish,0,videos
xxxskfxxx,we all know who behind it send in the air strikes to all those countries that believe in a certain religion it the only way to stop them influencing the mentally challenged around the world,-1,worldnews
xxxskfxxx,i want one,5,pics
xxxskfxxx,who watches ads anymore as soon as the as break comes up we all look at our phones till the program restarts but usually we record most stuff and fast forward through the ads pepsi and other company save your money because we are not watching,0,videos
xxxskfxxx,the great days of wrestling,1,OldSchoolCool
xxxskfxxx,well i never knew that i must admit i am not a great reader of history and you only seem to get hollywoods version,1,pics
xxxskfxxx,well i never knew that i will have to check up on ww2 history instead of believing hollywoods version,1,pics
xxxskfxxx,why would mexico need to worry about nazis,1,pics
xxxskfxxx,well i am going to have to listen to this again before i vote cannot remember the last time i listened,1,blacksabbath
xxxskfxxx,when are nintendo going to bring out a new game not the same stuff that started in 80s zelda was boring i hope nintendo go bankrupt they cannot get away with selling underpowered consoles any longer wake up suckers,1,gaming
xxxskfxxx,that great would look nice in one of those 50s style diners,1,pics
xxxskfxxx,plenty of veins to get the drugs into,2,pics
xxxskfxxx,did not think you could get more tacky than an elvis clock,1,pics
xxxskfxxx,you must have had the shits tho,0,food
xxxskfxxx,the first wi fit,1,OldSchoolCool
xxxskfxxx,probably those who did see them live in the early days are around 70 years old now and have no idea what reddit is but someone prove me wrong ,2,blacksabbath
xxxskfxxx,what a waste of money i would rather spend it on ladyboy ass,2,worldnews
xxxskfxxx,never had one as deep as that we are missing out in the uk,5,food
xxxskfxxx,these last 2 are so bad i never listen to them come to think of it i skip the whole album ,3,blacksabbath
xxxskfxxx,i can still drive better than my wife after iv drunk 2 bottles of wine woman should stick to baby buggies,2,Jokes
xxxskfxxx,blow the whole of russia up and do us all a favour,-11,worldnews
xxxskfxxx,do not know who they are and do not want to know fuck these no talent reality nobody ,2,funny
xxxskfxxx,those turks are trouble let shut them off from europe now before anymore find their way out and start bombing us they will have another go at cyprus,0,worldnews
xxxskfxxx,cannot believe hard road went,3,blacksabbath
xxxskfxxx,she was too skinny i thought her quite plain give me one of those playboy centrefolds any day,1,pics
xxxskfxxx,the best handheld ever mario and tetris are still great,1,gaming
xxxskfxxx,your giving your tips why do you think your way is right thats why the world is in a mess you must achieve this you must follow me just do your own thing do not force your ways on anyone else,0,videos
xxxskfxxx,who listens to jerks like him live your life the way you want to not how he thinks you should ,0,videos
xxxskfxxx,nothing,1,videos
xxxskfxxx,good for those who remember the old a team think they should re run those old series,1,Jokes
xxxskfxxx,i would just like a good world map you can zoom in to so you can find the place that interests you and it proximity to surrounding countrys,1,Map_Porn
xxxskfxxx,i am looking for something similar to teach my grandsons some basic mechanical know how,2,motorcycles
xxxskfxxx,yes a lot of people believe what they read and get conned into paying good money to watch dog crap the film companies need to fill their wallets at our expense i know all movies are not masterpieces but paying top money at the cinema for a film that should only be in the budget bin at the supermarket is not on no wonder people do not go to cinemas anymore be honest film studios and if it stinks admit it and move on to the next release oh and stop paying actors ridiculous fees and spend the money saved on a decent script and special effects that might just turn a poor movie into an average one that you do not feel you have been robbed well that my rant for today ,1,movies
xxxskfxxx,i never take much notice of critics or posts on movie sites you just do not know who is getting paid to talk up the movie just download a the movie when a decent copy becomes available and make your own mind up movie sites are ok to find out what the movies about tho no point watching a musical when you want action,1,movies
xxxskfxxx,yes it is pretty poor just gone thru 13 again and it makes this look even worse,1,blacksabbath
xxxskfxxx,well i would not try it i could not afford the repair bill if it went bang,1,motorcycles
xxxskfxxx,i just search on the torrent sites usually find all the music and movies i am interested in i have thousands off cd in the loft but cannot be bothered to get them out i just download the mp3s to listen to just spotted a live in japan double sabbath cd evil in the evening ,2,blacksabbath
xxxskfxxx,i had one new in 1977 it was red i used to really abuse it flat out everywhere used to take it off road too over a few small jumps the bike never let me down happy days,1,motorcycles
xxxskfxxx,the kawasaki dealer i used to buy from in 80s used to set the cable to the oil pump slightly under constant tension so the pump was always pumping more oil than it normally would the triples i had never had any problems,1,motorcycles
xxxskfxxx,only joking never thought i would find music on there as for woman i think if i have my time again i will give them a miss well maybe hire one from time to time,3,blacksabbath
xxxskfxxx,a bad day for her what hurt most the ticket or the realisation your not as pretty as you thought or maybe he was gay,0,funny
xxxskfxxx,you we are looking for anime porn,12,blacksabbath
xxxskfxxx,looks like he has had too many currys with that gut,8,worldnews
xxxskfxxx,yes i enjoyed it made me spurt my juice,0,Jokes
xxxskfxxx,thought it was an isis bride,-1,movies
xxxskfxxx,i thought it was computer generated it just does not look natural,1,pics
xxxskfxxx,iv been gaming since the first tv ping pong game probably around 1970 ish i had most consoles and home computers atari spectrum etc think the only one i did not buy was a thing called a pc engine the biggest jump in gaming tho was the play station 1 i got a jap import cost me 650 every kid on the estate came round to just look at it running tekken you just do not get that excitement now no real big leaps in the games,1,gaming
xxxskfxxx,nintendo have not made a good console since the original game boy that was truly portable and batteries lasted ages i gave up buying nintendo after the n64 after that all there consoles have been underpowered and gimmicky same old games im afraid there going to end up like sega,-4,gaming
xxxskfxxx,still like the 2 stroke sound miss my old triple,1,motorcycles
xxxskfxxx,why would you want to cut it tail off i thought the tusks where valuable ,0,pics
xxxskfxxx,well there only 2 songs worth listening to but let wait and see if they make the top 2 but hey i wish i could write a song and play a guitar ,1,blacksabbath
