name,body,score,sub
xxxskfxxx,pity he in it he cannot act god knows who thought he deserved an oscar ,0,movies
xxxskfxxx,i never was a star wars fan,0,OldSchoolCool
xxxskfxxx,back from the future,1,gifs
xxxskfxxx,he is a muppet did he ever work after star wars he was rubbish in that too,-14,OldSchoolCool
xxxskfxxx,all i can say is wow i would love a taste,2,food
xxxskfxxx,forget what it called its a fantastic sculpture i doubt there is anyone good enough to do it today,2,Art
xxxskfxxx,is this story fact or just got air,1,todayilearned
xxxskfxxx,what a stupid game come to england and play a real game football ,-6,sports
xxxskfxxx,lucky bastard,1,funny
xxxskfxxx,i like the early stuff but each to his own i am still listening to 13 but it still has not got me hooked i downloaded an uncompressed version while it ok it just a rock album,1,blacksabbath
xxxskfxxx,i cannot get excited about either song,1,blacksabbath
xxxskfxxx,come a long way no the games are not as good as the originals the control methods are terrible jumping about and shaking waving a control pad is no way to play a game properly just one gimmick after another let get back to proper gaming,-2,gaming
xxxskfxxx,i wish all religion was banned only idiots believe in a god or idol ,3,Documentaries
xxxskfxxx,why would anyone want a mac book or any other apple computer i was given a mac book pro and after a week i gave it back just an overpriced screen for looking at facebook and youtube,1,gadgets
xxxskfxxx,there all crap not what you want sabbath to sound like,-3,blacksabbath
xxxskfxxx,well they are educated to the same standard as russian woman now and their still brighter than russian men,1,TwoXChromosomes
xxxskfxxx,i get mine ready the night before cut em in half and slot in the toaster tea bag in the cup under the one cup water machine just get up press 2 buttons and it done,5,Showerthoughts
xxxskfxxx,cannot believe dirty woman gone ,3,blacksabbath
xxxskfxxx,i had him down to win i am not racist but i think we need to make our countries secure and as safe as we can,1,worldnews
xxxskfxxx,could be was in the 80s i will have to do a search,1,OldSchoolCool
xxxskfxxx,i wish they would re run those old wwf shows can anyone remember that south west wrestling it was pretty good too and violent at times,1,OldSchoolCool
xxxskfxxx,he was a wanker,-6,OldSchoolCool
xxxskfxxx,it the sort of thing you get on an aeroplane for 5,5,mildlyinteresting
xxxskfxxx,we need our own trump in the uk ,81,worldnews
xxxskfxxx,your right no one gives a shit i wish we had trump as prime minister in the uk ,-10,worldnews
xxxskfxxx,until it confirmed by the bbc and sky news in the uk you just have to dismiss tweets and other internet news outlets too much fake news about,-1,worldnews
xxxskfxxx,disney rip millions of people off every year the cost to get in the theme parks is robbery so taking someone else story is no surprise ,0,movies
xxxskfxxx,like a lot of the later stuff i listened once then threw it in the loft,2,blacksabbath
xxxskfxxx,maybe have a word with someone who has made a recording studio or an indoor rifle range and ask what they did,1,DIY
xxxskfxxx,interesting brings back memory of chipping play stations ,1,DIY
xxxskfxxx,i am not a fan of this album it just not heavy and dark enough but dirty woman is ok but only ok,3,blacksabbath
xxxskfxxx,well that was close top 2 are both great tunes so cannot really complain my fave did not get top spot ,4,blacksabbath
xxxskfxxx,i think yahoo leaked this to make it look like they had some actual users 499 million are probably dead and years old,1,worldnews
xxxskfxxx,it the sound of the band as a whole what counts there is a lot i like and i do not think who is singing this also the tunes i do not like i just do not like no matter who is doing it ,2,blacksabbath
xxxskfxxx,great i really regret not learning to play a musical instrument,1,blacksabbath
xxxskfxxx,iv not read any yet we we are on about someone making a movie about tony in an earlier post,2,blacksabbath
xxxskfxxx,it a family bucket just need 4 straws,1,funny
xxxskfxxx,come on symptom,2,blacksabbath
xxxskfxxx,great tunes this could be close,2,blacksabbath
xxxskfxxx,well i am back voting think i was a little hard on this post,1,blacksabbath
xxxskfxxx,raquel still looks good but the trouble with all older woman their dryer than an arabs sandal down below dont matter what you use to oil it up a couple of minutes and it stop and grease up again i know some of you will say how do you make it last a couple of minutes,-2,OldSchoolCool
xxxskfxxx,symptom of the universe has got to win,1,blacksabbath
xxxskfxxx,why are people still obsessed with star wars the original 3 we are o k the new ones are rubbish just 2 hour adverts to sell toys hence all the new characters in every skin colour to cash in as many countries as possible,-1,gifs
xxxskfxxx,i like it,1,Jokes
xxxskfxxx,the old ones are the best,1,Jokes
xxxskfxxx,i have an iphone 4 what was given to me a few years ago it underpowered now but will use it until it breaks then i will buy a samsung no more f cking around with itunes ,2,gadgets
xxxskfxxx,two of my favourites are in there,1,blacksabbath
xxxskfxxx,i am 58 and have never read a book in my life i always found something more interesting to do and kids today have no end of things to keep them occupied so i can see even e books not being of interest reading is boring,-2,books
xxxskfxxx,yes paranoid is my top sabbath album too but no album is perfect so there always a track or two you want to skip,1,blacksabbath
xxxskfxxx,why are we still talking about black this and gay that he just a another person who gets paid too much,0,movies
xxxskfxxx,the thrill of it all must go,1,blacksabbath
xxxskfxxx,what is brown and sticky a stick,1,AskReddit
xxxskfxxx,i know it sad but it my favourite tv show just now poor guy probably had a good cry of camera,2,videos
xxxskfxxx,it an ugly looking thing i used to make my stocks out of hardwood all nice and polished i am not knocking the mechanics tho nice job,1,DIYGuns
xxxskfxxx,it a shed on wheels,-5,carporn
xxxskfxxx,great we know how to get rid of kittens now,-2,todayilearned
xxxskfxxx,i thought you we are terrible in the star wars movie mind you the movie was rubbish why would they ask you back to do another and why apart from money would you want to appear in another crap star wars sequel ,1,IAmA
xxxskfxxx,he was scary anyway suppose his mother loves him,1,gifs
xxxskfxxx,thrill of it all for the thumbs down,1,blacksabbath
xxxskfxxx,nice i am looking for a project to do with the grand children so they can learn some skills ,3,motorcycles
xxxskfxxx,leave the tea bag in the mug cant stand weak tea and coffee a few slices of toast and real butter would make it perfect,1,food
xxxskfxxx,they wanted to milk some more money out of it and thought it was clever after the original movies the rest stink bad actors and bad story ewan mcgreggor was a piece of wood completely talentless as an actor ,2,Jokes
xxxskfxxx,wish i would seen one of those last gigs there nothing as powerful as live music,6,blacksabbath
xxxskfxxx,they we are real men in those days not like the faggots today where everything is done for them all they have to worry about is the helmet ruining their hair,1,motorcycles
xxxskfxxx,i had a listen and it not bad hopefully they should release an official version soon,2,blacksabbath
xxxskfxxx,the way of the gun i thought it was very underrated,1,AskReddit
xxxskfxxx,i have had a listen to it now and the sound quality is pretty good i only bluetoothed it from my phone to the car music system and that does not have much power,1,blacksabbath
xxxskfxxx,well that made a lively discussion if nothing else,1,blacksabbath
xxxskfxxx,it business they will do anything to make a profit,1,philosophy
xxxskfxxx,i do not see it like that i just use it as another place to look for things i am interested in i suppose i am guilty of bieng social if i up vote something or add a comment,1,pics
xxxskfxxx,do not know what happened there this was on the front page when i saw it,1,blacksabbath
xxxskfxxx,this should be on the black sabbath reddit,4,blacksabbath
xxxskfxxx,how much did they pay the referee,2,sports
xxxskfxxx,nice ,1,creepy
xxxskfxxx,maybe the cia leaked this stuff itself so they could trace the hackers any real important or nasty stuff will never be written down so there is no evidence of wrong doing ,1,worldnews
xxxskfxxx,do you really need one ,1,gadgets
xxxskfxxx,how long before that piece of crap is in the bin,0,videos
xxxskfxxx,thankfully i do not use facebook snapchat messenger twitter or any other social network so do not get invites i have a real life,-5,pics
xxxskfxxx,i remember when i had hair like tony and ozzy sadly it looks a bit grey now zoom in and you can see plasters on tonys fingers we are they holding on those plastic tips he made,10,blacksabbath
xxxskfxxx,hi do you think people are afraid to reject religion because of peer pressure from family and relatives and do you believe in any religion or are you afraid to say no in case you do not get paid from your latest paymaster,1,IAmA
xxxskfxxx,ban all religion like the 80s drug message just say no it been the cause of trouble since time began,1,IAmA
xxxskfxxx,iv laid more laminate than i can remember but some people wo not take your advice and are too lazy to do it properly i am amazed how many people lay it over carpet then ring you up thinking you can fix it in a few months when it all parted no word of lie i went to the same house who did it twice,1,DIY
xxxskfxxx,if the tiles are hard vinyl it ok but anything soft and the laminate joint edges will all part the edges will be damaged and you will have to bin it,1,DIY
xxxskfxxx,get a wallpaper steamer their very cheap or borrow one of a relative or friend and a couple of cheap wallpaper scrapers you will be able to use all this stuff in years to come so it not wasted money you say house was built in 1998 so walls should be sound just make sure you do not keep steamer in one spot too long as this may lift the plaster skim off especially we are cables are buried in the plaster keep the scraper fairly flat to the wall so you can get under the paper and not dig into the plaser once you have paper off fill any holes marks and use a bit of sandpaper wrapped round a small block of wood to sand the filler flat so it level with the rest of the wall run your palms over the full wall and sand out any raised bits that feel like a bit of grit once your happy everything is ready to paint vac all the dust up and go round the skirtings and electrical fittings with masking tape making sure you get a nice straight line along top of the skirting you should be ready to paint now matt emulsion is easiest to use a ncd covers a lot of little imperfections make sure you stir it well before you start use a small brush maybe 2inch to go along where the ceiling meets the wall do this very carefully so you get a nice straight line do the corners of the wall and go round light switches and sockets then go along the skirting you should now have a border of paint around 2inch now use a big roller to fill the rest of the wall in with paint cut in another wall while that dries once dry repeat and that should be that wall done take masking tape off as soon as you can even when second coat of paint is still damp as it will stick to the paint sometimes when it dry use a children artist brush to touch in any awkward corners or bits the masking tape has pulled off sounds like a lot of work but it will look good and it is good to learn so you can do a good job on the rest of the house when the time comes,1,DIY
xxxskfxxx,iv never read a book since leaving school in 1975 and i think of all the trees we could have all saved if we all did the same ,-2,books
xxxskfxxx,interesting i have an 8gb one i will think i will have a go at as for music i torrent most of mine and transfer it to my devices i will never get another apple product tho too much messing around with i tunes ,1,DIY
xxxskfxxx,yes jonny depp could maybe do it im going to think about this for a few days it not easy finding some one to play one of your hero ,2,blacksabbath
xxxskfxxx,i do not really know why i never got into books probably as you say i have no real interest in the written word but each to their own as for the book i would rather someone made it into a movie so i did not have to read it now there an idea who would play tony ,2,blacksabbath
xxxskfxxx,samsung are great but do you really need 4k your going to be paying netflix and sky tv just to watch something in 4k and if you sit more than 10ft away you probably cannot tell the difference from hd anyway it uhd now we always get japan and korea old stuff,2,television
xxxskfxxx,he was never cool just a film studio model who could not act,0,OldSchoolCool
xxxskfxxx,i thought sharon stone was hot in total recall,1,AskReddit
xxxskfxxx,i did start looking at the first few paragraphs i will try finnish it but not having read a book since 1975 when i left school it may take me a while i will track down ozzy too ,3,blacksabbath
xxxskfxxx,this wo not happen when the wall is built,0,funny
xxxskfxxx,as someone said there will be some timber frame under the plasterboard these are spaced at 600mm to the centre of the wood try measure from the corner plasterboard fixings are quite strong but for peace of mind i would stick a piece of mdf or ply to the wall with some wood glue and plasterboard fixings paint it if you want to blend it in that should hold anything you can also drill through that into the block or brick if you feel you need to,-1,DIY
xxxskfxxx,thanks i will have a look my ultimate aim is to try get doom running that would be great,1,gadgets
xxxskfxxx,we need lemmings game for our phones,1,photoshopbattles
xxxskfxxx,i was trying to get windows 98 working on my old psp any ideas ,1,gadgets
xxxskfxxx,she is guilty of murder bring back the electric chair ,1,Documentaries
xxxskfxxx,i am back listening to sabbath again and you gotta admire the guys skill with their instruments and song writing they still sound great and i do not think they have aged unlike say deep purple who sound of their time ie the late 60s and 70s let hope they do one last album and make it real heavy like their early stuff,1,blacksabbath
