name,body,score,sub
Red_SL4,decent human being eh i am such a decent human being too i do my share of down voting fascism it the moral thing to do i am told so ,-4,Jokes
Red_SL4,what kind of shitty life do you guys have to waste your time on subreddits like those kids on both sides ,1,The_NewDonald
Red_SL4,you will survive ,0,BlackPeopleTwitter
Red_SL4,a friend of mine reached global in csgo last week thanks to a wh aimbot he never enjoyed the game as much as he does now he loves pissing people off ,1,AskReddit
Red_SL4,woman or faggot ,0,Bitcoin
Red_SL4,before it too late,25,paris
Red_SL4,people who know the true meaning of fascism and how it is displayed saw it in france during the last two weeks control of the information control of what can and cannot be said thought etc fascism won and the election just revealed it was there all along ,217,paris
Red_SL4,there a place for every culture and it where it comes from cultures do not mix well ,65,paris
Red_SL4,there are no important communist movements in france or maybe you think the far left commies just like far right nazis in which case do not bother answering ,0,europe
Red_SL4,you cannot use reason with them they are sick in the head a friend of mine got assaulted by a group of 15 peaceful and well integrated young french men of arabic descent he went to the police to notify them his phone got stolen and said but it not their fault they do not have a choice what do you want to do it crazy how men have become women ,5,europe
Red_SL4,the french made their choice between the two worst candidates ever to reach the second round of the presidential election nothing to be happy about ,-5,europe
Red_SL4,what relates to nazism in the other candidate program according to you i am having trouble finding sources on the subject ,10,europe
Red_SL4,reddit is an echo chamber itself for mainstream ideas and beliefs that why you are so intolerant towards td and the other way around ,-8,europe
Red_SL4, it not just a move for attention i am trans and ,-18,television
Red_SL4,your snakephobia is disgusting ,5,mildlyinteresting
Red_SL4,why do you say below who implied there was a judgment of worth here nobody you instinctively are attracted to people of your race color mist of the time is it immoral should we get with people of other color just for the sake of morality ,6,mildlyinteresting
Red_SL4,we do not need a sub to be disgusted ,13,holdmyfries
Red_SL4,i see a girl standing in front of a bald guy ,2,pics
Red_SL4,you are definitely good at goodthink ,1,worldnews
Red_SL4,so you suggest muslims in france will turn to extremism if they feel unwelcomed you think there is a potential terrorist in every muslim what the fuck,1,worldnews
Red_SL4,years of whimps in power ,4,worldnews
Red_SL4,they will gladly accept them if it means no more islamist bullets coming their way ,10,worldnews
Red_SL4,perfect i do too deus vult,1,worldnews
Red_SL4,hopefully they do,1,france
Red_SL4,i feel strongly about deviant behavior motivated by mental disorders especially when it being talked about so much i express my disgust when i feel like it ,1,happy
Red_SL4,you do not choose what you are attracted to and you do not choose what you are born as but you are intended to be what you are every cell in your body confirms what you are if you are a man you will never be a woman unless you undergo a total biological shift not possible yet and it might be at some point if the west does not disappear in the mean time but as long as it not barbaric self mutilation wo not change anything more than aesthetics with varying degrees of success ,1,happy
Red_SL4,it does not make me happy i think it needs to be said and i believe it more helpful than brainless approval for the sake of not hurting anybody feelings ,1,happy
Red_SL4,tiny majority on reddit maybe but a majority in the real world thank god some of us have common sense ,-4,happy
Red_SL4,trans kids what is wrong with you people it one thing to be a coward and not wanting to confront mentally ill people it an other to abuse children and screw up their development because you think respecting biology is bigotry ,-8,happy
Red_SL4,just checked him out what the fuck and all those subs bloody hell i am speechless ,-14,happy
Red_SL4,i wanna be good to everyone and never ever be a meany and above all never confront anyone with their bullshit,-1,happy
Red_SL4,something tells me the op wo not be happy for long and that something is statistics you cannot cure mental illness with a few edgy body mods ,-5,happy
Red_SL4,i try to take care of depressed or mentally ill people that are close to me i do not encourage them further into their illusions people do not turn out to be trans what the hell am i reading like they turn out to be gay they are just sick people that convinced themselves they are something they are not and want to be comforted in this idea they get hurt great that part of facing reality ,-2,happy
Red_SL4,in my 20s while commuting no thank you ,1,motorcycles
Red_SL4,i recently got a car and i am starting to realize how truly dangerous riding is bikes are so incredibly invisible i now know my defensive riding skills will never be enough there too much luck involved i cannot keep going like that i am selling the bike ,1,motorcycles
Red_SL4,and clouds ,30,interestingasfuck
Red_SL4,horses are dumb they are just fast cows ,1,AnimalsBeingBros
Red_SL4,history is full of people like you were you to be born in 1900 you would have said we were a thousand years away from getting to orbit good thing people with dreams and the will to act on them never wait for your approval ,5,space
Red_SL4, r esist the nazy president wake up sheeple ,2,space
Red_SL4,this is not just about science it colonization hard to colonize with robots only ,2,space
Red_SL4,i do not know what it is with tricolore liveries but they do crazy things to my body whether on car or bikes that fin ,1,formula1
Red_SL4,your lack of faith is disturbing humans will get there eventually trust progress and see further than a few decades ,1,space
Red_SL4,nah transhumans only i think it would be cheaper to develop transhumans that can live on mars than develop the infrastructure on mars to make it suitable for normal humans ,1,space
Red_SL4,sidebar essential books like no more mr nice guy the rational male etc ,1,TheRedPill
Red_SL4,some people will say you are hamstering i say you are free from women and that great ,35,TheRedPill
Red_SL4,glad to know the moon has that big an atmosphere ,1,space
Red_SL4,2deep,1,TheRedPill
Red_SL4,what if he actually a witch ,1,HumansBeingBros
Red_SL4,i disagree ,2,pics
Red_SL4,and it going to get way worse before it gets better fear of strangers is a survival mechanism ,1,pics
Red_SL4,reeeeee,1,AdviceAnimals
Red_SL4,after 26 sure ,1,AdviceAnimals
Red_SL4,radical islam does not constitute a race in my book it a racist misogynist xenophobic ideology that contaminating all the muslim world the motivation for the ban is all but racist the fact most muslims in countries suffering extremism are either black or arabs does not mean the ban targets black people or arabs correlation causation ,1,pics
Red_SL4,op mentioned racism in his mind color is a factor in our criticism but maybe race means something else to him ,1,pics
Red_SL4,dae think ideologies from 8 centuries ago are still comparable and relevant to modern religious extremism ,0,pics
Red_SL4,idgaf what color he is it not relevant to what he wants to convey that precisely what i am saying ,1,pics
Red_SL4,great let make sure it does not have to happen so we can move on after 3 months and apply the process to others countries where islam is all but moderate despite appearances ,1,pics
Red_SL4,leftists may own the place but we are here too and you are the ones most uncomfortable with the cohabitation ,-2,pics
Red_SL4,recycled berner ready to attack ,2,pics
Red_SL4,you see a black man you think it what he is first and foremost for everyone we are not in the 20th century anymore most trump voters are not racist but you certainly are ,-1,pics
Red_SL4,you know you dont know we do not know who are they where do they come from we do not know who they are or where they come from ,1,pics
Red_SL4,and add countries one can hope ,0,pics
Red_SL4,sounds like a muslim thing to do,0,pics
Red_SL4,fags eriwher,1,pics
Red_SL4,be glad people in power are willing to shelter you from actual terror and nightmare fuel so fragile people like you can keep living in their bubble ,1,pics
Red_SL4,reddit is very scared of the outside world it seems you do not do well with differing opinions and avoid debate on the base of your supposed moral superiority ,1,pics
Red_SL4,you sound stable very educated great energy ,1,pics
Red_SL4,not relevant to the context of this thread ,1,pics
Red_SL4,better not seeing my mom for a few months or ever again if she were to die tough luck than letting someone in the us that will kill tens of people or more making much more people grief ,0,pics
Red_SL4,empathy for the people here in the states that might be the target of worse and more regular terrorist attacks down the line ,-2,pics
Red_SL4,he cannot live without his mom for 3 months he probably was not planning on visiting her in the following months anyway and it not like the internet does not exist must definitely suck for a few for the time being but it necessary and what was wanted by the electors of the president ,0,pics
Red_SL4,you people are actually so pathetic you make me happy ,1,blog
Red_SL4,keep your hate speech off this website keep your hate speech off this website keep your hate speech off this website ,2,blog
Red_SL4,sorry for not fitting your moral standards i feel good with mine ,15,blog
Red_SL4,well many of us fear islam which is a sensible thing to do and thus is not a phobia but racism nah you do not chose your skin color at character creation ,8,blog
Red_SL4,soooo many galaxies hopefully we will meet neighbors in ours then in others ,2,space
Red_SL4,yup i truly think depression is curable with sheer willpower it just so hard to see the light when you have lived years as a slave of your dark thoughts ,1,TheRedPill
Red_SL4,from the outside maybe but the guy that miserable in his ferrari could not care less about the car the good news is that depression is a temporary state for he who chooses to fight it mentally and physically ,1,TheRedPill
Red_SL4,you do not fucking say unsubbed ,1,science
Red_SL4,everything moves in the universe constellations are not some magical fixed gravity objects they do not even exist we just invented them to act as a map of the sky but their distances to us vary greatly even within the same constellation ,11,space
Red_SL4,when i read no more mr nice guy i understood some patterns that lead me to a depressive mood are my needs being met did i progress towards my goals yesterday today am i being a little bitch again to drown my responsibilities in my apparent sadness i learned to ask myself those questions whenever i feel down and believe me a year ago when i did not have any tools to handle the thoughts it was scary now it alright i usually stop the downwards spiral before it gets too much momentum sometimes as fast as a few seconds i hope to get rid of them entirely after i master mindfulness meditation ,0,TheRedPill
Red_SL4,bitches are poor creatures they have no underlying life purpose that does not involve a man in fact i would say they can not find happiness at all if their man lacks vision and purpose that why they feel so empty and often times depressed even if the dicking is good if i were not so glad to be a man maybe i would spend a little time feeling sorry for them ,12,TheRedPill
Red_SL4, r shittyaskscience,1,space
Red_SL4,i am sure she ok with it she would not brag about it on the internet otherwise ,-1,AdviceAnimals
Red_SL4,das racys,1,worldnews
Red_SL4,i found the head of a t rex in a cave not sure i know exactly where as i glitches and feel to the bottom of the map should have taken a screenshot,1,Astroneer
Red_SL4,it called being an homophobic fascist nazi communist he the second coming of hitler as is trump all blacks will be killed all illegals will be tortured and genders will be limited to only 2 and the worst tendies will face a price increase of at least 250 according to experts ,2,politics
Red_SL4,patrice o neal noted that just be good to me also conveys a lot of truths https youtu be khj9jynvhpq,3,TheRedPill
Red_SL4,i think absolutely anything can be done through science and knowledge it possible to find unsuspected ways to interact with reality and achieve things we could not even comprehend i am not saying we will do it i am saying it been done or will be it not like there are time and space restrictions in any direction ,2,space
Red_SL4,last time i looked into absurdism it did not do me any good i got lost in my mind and felt worse than i ever did maybe i am not strong enough to handle those existential thoughts ,1,TheRedPill
Red_SL4,i was in this market this time last year nice place nice enough to be attacked by the subhuman scum we call islamists ,1,worldnews
Red_SL4,in any other case i would have said the same but i will always feel for a man who got his dog stolen if it was mine i would have it back in a week or two though one way or another ,2,TheRedPill
Red_SL4,defensive riding goes a long way but i agree if i had the choice i would ride only with good weather as a leisure activity on nicely paved mountain roads in the mean time i am as careful as possible and expect every car on the road is trying to kill me ,2,TheRedPill
Red_SL4,i am so triggered right now such bigotry ,1,daddit
Red_SL4,read common sense ,3,The_Donald
Red_SL4,sweden is screwed ,1,TheRedPill
Red_SL4, fucking landslide folks as expected ,3,The_Donald
Red_SL4,make america great again ,2,The_Donald
Red_SL4,i am proud western civilization will not die just yet ,3,The_Donald
Red_SL4,much better ,2,pics
Red_SL4,we become the front page of the internet ,1,The_Donald
Red_SL4,seriously this was a great year thanks guys ,2,The_Donald
Red_SL4,that quite literally what a nazi would say we need hillary to protect us from the rise of extremism in this country she the only one brave enough to rig an election for the greater good ,-4,PoliticalHumor
Red_SL4, reddit is a liberal circlejerk ftfy,4,PrettyGirls
Red_SL4,even the best riders in the world crash every weekend in motogp when you are on the limit sometimes the slightest difference in grip can send you flying ,5,videos
Red_SL4,i need myself a human sized otter mom ,63,aww
Red_SL4,1 361 384,3,counting
Red_SL4,i find the black phillip show to be much more insightful on intersexual relationships matters than this sub lately the quality of the conversation would improve drastically if reading the sidebar and a few books was somehow mandatory ,1,TheRedPill
Red_SL4,it was her voice you can hear it in the for christ sake video with the little girl ,1,The_Donald
Red_SL4,do not cut yourself on that edge,1,photoshopbattles
Red_SL4,redpillers confirmed misogynist virgin pedophile neckbeards ,13,TheRedPill
Red_SL4,thanks for the explanation ,1,space
Red_SL4,i do not understand how a planet could sustain life if it orbits a binary system with a third one somewhere around the variation in tidal forces and temperature must surely affect the planet quite a bit ,3,space
Red_SL4, r whowouldwin,1,space
Red_SL4,you can even read through my emotions this is getting out of hand ,4,pics
Red_SL4,that a very nice way of phrasing it i would personally go with he must have a small dick lol what a loser if i was as mad as you but i am clearly not educated enough on phallic anatomy to make an educated statement on the subject either i guess you probably even expected me to respond in such a way ,3,pics
Red_SL4,you sound frustrated ,3,pics
Red_SL4,buying a car this rare at such a price is financially sound considering the manufacturer in question this car is now worth at least 2 million pounds and even that could be conservative ,5,pics
Red_SL4,you are a tough person ,4,vegan
Red_SL4,how then ,-1,facepalm
Red_SL4,it their fault weak people elect weak leaders ,1,The_Donald
Red_SL4,not everyone has to live the same way i do not want to live like an indian and wo not ,1,dataisbeautiful
Red_SL4,it what happens when you are put away from family and friends since your early childhood to become an olympic athlete ,1,gifs
Red_SL4, he was not even a true muslim tm,-1,ImGoingToHellForThis
Red_SL4,well sanity is the extreme opposite of pure insanity i guess ,2,The_Donald
Red_SL4,nowadays even firefighters cannot go in those places the arabs throw piss and rocks from their windows ,5,The_Donald
Red_SL4,7d korean chess,11,facepalm
Red_SL4,amirite guise,-7,facepalm
Red_SL4,reddit users like to think people who disagree with them are stupid at best fascists at worst when a intelligent discussion is not possible dank memes do the job ,-6,facepalm
Red_SL4,next thing you know reddit will blame people for hating a death cult oh wait it already does ,-1,facepalm
Red_SL4,last bastion where you can call a muslim terrorist a muslim at least ,-3,facepalm
Red_SL4,well op fantasizes about exploring the stars when he cannot do shit about it and that paralyzes him i am offering him another conquest a very real one he can be a part of because space exploration has always been done best in the america and if we want it to stay this way we must be pro active not neckbeards complaining about our fate ,1,space
Red_SL4,born to late to export earth too early to explore the stars but born just in time to make america great again ,4,space
Red_SL4,great work man keep at it ,3,Fitness
Red_SL4,aim for 4 plates ,1,TheRedPill
Red_SL4,rare username,3,The_Donald
Red_SL4,for some reason only now do i realize how much faith in the machine you need to have to trust it with your life as you decelerate through the atmosphere at mind blowing speeds the shuttle was such a beautiful thing surely the machine we can be the most proud of as a species yet ,12,space
Red_SL4,i changed my mind on the subject too i may have kids later in life when my financial situation will allow it without much trouble and with a young woman the decline of the white man in his own land is something i take seriously and snipping my tubes wo not help ,3,TheRedPill
Red_SL4,he will do another one after he won and the campaign is over ,3,The_Donald
Red_SL4,i think so the man is so busy he already on to another rally ,1,The_Donald
Red_SL4,we will need to find a place to put all our extra energy at some point ,2,The_Donald
Red_SL4,great question centipede i hope he answers a space exploration related question ,8,The_Donald
Red_SL4, mr president will you support america effort towards the exploration of mars and beyond maga ,1,The_Donald
Red_SL4,i do not have a question besides asking mr trump what are his views on mars exploration so i will do my best to report the shills ,2,The_Donald
Red_SL4,he makes me laugh so much ,2,The_Donald
Red_SL4,the thermomemetics of karma fluids is a fine science ,1,conspiracy
Red_SL4,he owed you the millions that ultimately ended up used towards helping hillary ,-8,politics
Red_SL4,reading them makes me sick,2,The_Donald
Red_SL4, tip ,3,The_Donald
Red_SL4,from a conquering muslim point of view a demographic take over with no terrorist attack is an almost guaranteed win within 30 years in most european countries the attacks are giving people a chance to acknowledge the problem with this part of the population people are not ready yet to go to war against muslims but attacking so often will surely accelerate the process and increase the chances of facing opposition it not a good strategy and i fail to understand what they want out of it ,0,worldnews
Red_SL4,wonder no longer my friend ,27,worldnews
Red_SL4,islam is the problem let fix the issues we have with muslims that were born there before accepting others what tells you that europe will do a better job of integrating the new one ,0,worldnews
Red_SL4,reasonable opinion we do not want them as is but give them western education early on even younger in my opinion that not racism hey share our culture 100 or they go ,-1,worldnews
Red_SL4,well the majority of murders are thug on same race thug it a thug problem ,-1,worldnews
Red_SL4,the west is at war with islam as a whole do not insult people for acknowledging this war assuming an attack on a church and a priest getting his throat slit was lead by muslims is like assuming a shit came out of an asshole open your fucking eyes ,13,worldnews
Red_SL4,the attackers came out of the church screaming snack bar swat did not have to breach ,0,worldnews
Red_SL4,your genes may be safer in a vietnamese womb ,2,TheRedPill
Red_SL4,that exactly what i was talking about with my red pill grand mother yesterday i went from wanting to be childfree incel hamstering to wanting at least 3 kids though later in life with a young woman there a demographic war in the west we need soldiers ,2,TheRedPill
Red_SL4,we need to report the trolling as soon as it appears ,1,The_Donald
Red_SL4, under budget,2,The_Donald
Red_SL4,depending on your country being a non believer in islam ,10,AskReddit
Red_SL4,boys grow to be men and girls grow to be women it the way it should be oh sorry i am such a bigot ,3,science
Red_SL4,fucking brilliant song,3,The_Donald
Red_SL4,i guess hillary offered him a brand new exhaust for his r8 ,0,politics
Red_SL4,so he hates hard working americans ,1,politics
Red_SL4,he will win he wo not prove you wrong though because he could save your mother and you would still think he wanted to rape her sad ,0,politics
Red_SL4, than,1,The_Donald
Red_SL4,that seriously underestimating how many cucks are in france ,1,The_Donald
Red_SL4,it will be cleaned by honest french workers who have better things to do they should save their spit for living islamists ,3,The_Donald
Red_SL4,fair point i fucking love toy story ,11,TheRedPill
Red_SL4,beyond the terrorist attacks here and there that ultimately are not a real threat to the west however horrible and rage inducing they may be the creeping lethal danger is the demographic aggression europe suffers within 30 years they will have used democracy against those who let them reproduce uncontrollably islamic states will dominate from bangladesh to france save some countries that actually value their heritage ,10,The_Donald
Red_SL4,that sad to read i have the feeling that besides the banter and dank maymays the french people are just very proactive when it comes to hiding the issues in order to avoid facing difficulties during the war most french collaborated were passive towards nazies i have the feeling it happening again and true resistance is frowned upon ,3,The_Donald
Red_SL4,dude come on ,2,The_Donald
Red_SL4,i guess without any means to defend themselves they are only so much you can do vote real patriots into power too many of their people are still cucked they will need at least 2 other attacks to even consider electing far right parties ,1,The_Donald
Red_SL4,see i do not want to have children because they will likely have to go to war against islam or at least live in a shitty world but if i and others do not we are responsible for losing the demographic war that going on in the west i do not know what is the right thing to do ,1,The_Donald
Red_SL4,i am calling for the end of islam which is a threat to us nazis hated jews because they were jews i do not hate arabs i hate the religion of muslims and those of them who want me dead i call for no death other than that of an ideology if there are people to kill then so be it a war is coming fast no matter how deep you choose to burry your head in the sand and peaceful behavior is not what wins wars ,1,AskReddit
Red_SL4,so you also believe that lie police shootings make up 2 of black people death by gun they are mostly responsible for their death but maybe it because guns or because white supremacy or racist cops ,1,AskReddit
Red_SL4,no we must get rid of an ideology that aims towards our destruction getting rid of it is only reasonable ,0,AskReddit
Red_SL4, should we kill all muslims then kill them deport them convert them your pick their end goal is to overthrow the west not 70 at a time like you said but through aggressive demographic progress 25 of the youth in france is muslim in 30 years they could have a muslim president without the help of the left and it will be to late then when they show their true motive it not about protecting the white it the greatest civilization on the face of the earth the one that supposed to take us to mars and beyond that under threat ,-3,AskReddit
Red_SL4,yes i do i do not want islam they can stop being muslims if they want to live ,-2,AskReddit
Red_SL4,alright i see where you stand you can count on people braver than you to protect you ,1,AskReddit
Red_SL4,isis connection means nothing at this point france has millions of muslims it does not take much for one to find a kuran read it for the first time understand he should agree with what the caliphate stand for and prepare an attack ,0,AskReddit
Red_SL4,we wo not get rid of religions altogether people have a need to believe in something a god a political ideal etc ,3,AskReddit
Red_SL4,genes have nothing to do with it we must kill islam or at least wipe it in the western world everybody can leave islam in an instant no one has to die but some value the holy war more than their lives so we will get rid of those ,0,AskReddit
Red_SL4,sshhh let him sound cool by saying violence is bad acceptance is good reddit circlejerking hard to rationalize peace when we are at war ,1,AskReddit
Red_SL4, triggered ,1,AskReddit
Red_SL4,let eliminate them so there are no more then it a necessary step towards protecting the western civilization the muslim ideology is education resistant throw all your acceptance at them just like the french and other countries are doing and you see what still happens ,-1,AskReddit
