name,body,score,sub
Red_SL4,do you think muslims in france have no opportunities they are using all kinds of excuses not to integrate they know damn well they do not have to do jackshit they will be fed without working and while hating those who are trying their best to make them feel at home ,5,AskReddit
Red_SL4,and you will be the place where those rights disappear if you do not uncuck yourself ,-8,worldnews
Red_SL4,that message of peace you are talking about muslims do not share it you wo not save your country by spreading your butt cheeks wider ,1,worldnews
Red_SL4,terrorists win when you kill them nice logic bro us westerners do not want to go on a crusade for now we want them out of our countries ,3,worldnews
Red_SL4,islam,27,worldnews
Red_SL4,more like niss in fact ,-1,The_Donald
Red_SL4,they are having a contest they are trying to tolerate the most stupid dangerous shit because they think it will make them good people ,2,The_Donald
Red_SL4,hurr durr us liberals are so educated anyone that disagrees with me must be a climate change denier trump supporter that works in a farm and cannot read ,1,science
Red_SL4,it way easier with google ultron though ,1,The_Donald
Red_SL4,if someone hates dogs i know he a piece of shit if i did not already hate islam that would be enough for me to make an opinion ,188,The_Donald
Red_SL4,there should be only one community in america the american one when you belong to such a great nation you should feel close to your fellow citizens regardless of color sexual orientation etc ,2,The_Donald
Red_SL4,but it current year ,2,The_Donald
Red_SL4,evolved does not mean shit we are as evolved as ants and fishes ,2,space
Red_SL4,duh,1,AskReddit
Red_SL4,he feared there might be a conflict of interest with this judge considering the stances he took on illegal immigration as for muslims they do not blend well with western civilization and the religion as a whole does not aim towards it it really is not that bad here in america yet and patrolling neighborhoods is overkill when taken individually muslims can be great people when they build communities of thousands of individuals though the religion gets stronger and the hive mind leads them back to the radicalism of their writings america does not need that i hate islam but i do not hate muslims those people can change not their sick ideology ,-4,SandersForPresident
Red_SL4,would be a great thing to do america does not owe it citizenship to anyone and those that come we must make sure are good people you have never lived close to muslim communities if you think those people are peaceful towards us kuffar ,-1,SandersForPresident
Red_SL4,you know this is bullshit right is it hard to admit trump can care about all americans do you believe he genuinely racist ,-3,SandersForPresident
Red_SL4,he cannot he just spewing the lies he been fed because actually believing rational people could think differently than him is too hard it easier to blindly believe that trump and his supporters are all crazy racist rednecks because that way you do not have to actually debate with them and face your own ignorance of what these folks stand for ,3,SandersForPresident
Red_SL4,are you kidding me ,4,SandersForPresident
Red_SL4,yes so i guess our governments effort to increase this risk is not that bad ,1,AskReddit
Red_SL4,eat less but eat better from now and for the rest of your life otherwise you will gain back what you lost ,1,AskReddit
Red_SL4,i do not know if you do already but reddit enhancement suit res allows you to preview your post as you write it formatted and all ,3,TheRedPill
Red_SL4,relevant username ,1,TheRedPill
Red_SL4,now get that to a good seven ,1,TheRedPill
Red_SL4,i have been eating 4 a day for 2 months i will have my blood checked soon to see if i can keep going ,1,Fitness
Red_SL4,100 intensity at all times and when you run out of carbs you brain starts to run on chicken tendies instead ,50,Fitness
Red_SL4,she thought she had you locked but now that you improve yourself she knows she will have to work on herself if she wants to keep a man of your value and she does not like it ,1,Fitness
Red_SL4,we are all gonna make it brah ,1,Fitness
Red_SL4,more of a blue piller than a cuck this divorce is a threat to the future of space exploration and human innovation in general all that because of a pussy ,7,The_Donald
Red_SL4,woah thanks for that ,1,TheRedPill
Red_SL4,long term relationship ,1,TheRedPill
Red_SL4, that respect is lost everything he experiences tells him otherwise and he just acknowledges his superior value it not like he crams it down people throats at every interaction he does not even need to ,1,TheRedPill
Red_SL4,excuses excuses stop being a fucking loser who posts on losers subreddits and get your fist out of your ass take responsibility and be a man ,4,TheRedPill
Red_SL4,definitely not ugly do not forget to delete the link ,1,TheRedPill
Red_SL4,everything is falling right into place some call it meme magic maybe it just fate ,4,The_Donald
Red_SL4,lvl 45 tanks can deal no damage to yellow squares red triangles and pentagons ,-2,Diepio
Red_SL4,lol i bet that tv costs more than the van ,1,pics
Red_SL4,what is dangerous is that the moment their feelings are in opposition with reason they will change the truth for it to match the way they feel ,4,The_Donald
Red_SL4,former belgium prime minister ,2,The_Donald
Red_SL4, i remember thinking i would get some insight into women back in my freshman year of university by taking feminist oriented classes haha oh man that goes to show how misguided we can be ,1,TheRedPill
Red_SL4,the moment i saw it on tv i knew it was a conspiracy of some sort one week before the vote and the media immediately making a link to her views on the brexit when there no obvious reason to come on ,2,The_Donald
Red_SL4,good thing most of them will be dead by 50 ,1,The_Donald
Red_SL4,that why i focus on reading all the top post of all time down to 400 upvotes it will give me a better idea of trp than just reading the daily submissions ,1,TheRedPill
Red_SL4,he will need armed guards 24 7 the french journalists had some and it did not stop the muslim filth ,10,The_Donald
Red_SL4,shit going absolutely crazy the people are loosing their fucking mind all over the west it feels like we are at the end of a cycle society will blow up and we will build another one on top of the ashes only for it to corrupt itself again a few decades later ,23,TheRedPill
Red_SL4,the demographic war in the west is not going to win itself ,7,TheRedPill
Red_SL4,looks good to me maybe some bold titles here and there but very readable nonetheless ,-2,TheRedPill
Red_SL4,inversely proportional i would think you are such a nice guy i can talk about everything with you i know you are not going to judge me the girl that will be your girlfriend will be so lucky what no not me i would not want to lose you as a friend ,-1,science
Red_SL4,it sure it just politics for the deciding few i met a lot of muslims while traveling though let just say they struggle a lot to blame fundamentalists for what they do they know at their core they are better muslims than they are themselves ,1,news
Red_SL4,the replacement of white people is not what is important and saying they are better than non white people is definitely racist but we need to make sure the people that live here are true americans regardless of the color ,2,news
Red_SL4, are you kidding meee,1,news
Red_SL4,what is that regular islam thing that you are talking about ,3,news
Red_SL4,muslim mods they must not share their terrorist friends strategy towards invading the west they prefer to silence opposition ,4,news
Red_SL4,i have french friends who tell me that it will take quite a few other terrorist attacks for the people to find their balls and to speak up against pc the people there are very weak let see what they will say after the next attack it would not surprise me if it happens during the european soccer cup in the next two weeks ,7,The_Donald
Red_SL4, she is ,-4,Jokes
Red_SL4,the left will destroy our civilization in every western country if we let them the politics of feelings must end ,1,The_Donald
Red_SL4,yeah whatever other color when you are in the heat of the fight with lots of allies it hard keeping track of where your tank is and which health bar is yours ,2,Diepio
Red_SL4,make a golden circling around our tank so we can distinguish it from allies,-1,Diepio
Red_SL4, and most women feel that need from very early on unless they have been brainwashed to hate motherhood or most little girls are brainwashed to love motherhood which they certainly are but i agree with you beyond the way they were raised it an instinct in most women more so than men when single women hit the wall at 30yo they start to panic at the thought they might never find a man that gives them children ,1,The_Donald
Red_SL4,the instinct is not to have children it is to fuck we are tricked into reproducing ,12,The_Donald
Red_SL4,this had to be done as much as i hate the f1 layout ,4,motogp
Red_SL4,how often do you watch motogp do you even ride good luck making the bike stop let alone yourself when it 5 meters away from you and there no gravel when riders go in the gravel it rarely on their two wheels and when they do it often at low speed and they lose balance that wo not ever justify a tarmac runoff area for motorcycle racing gravel traps are vital for all the times riders fall and slide into it every weekend sometimes at high speed ,1,formula1
Red_SL4,not sure if joking ,2,UpliftingNews
Red_SL4,this campaign is all about sharing high energy i will have to get myself one of those t shirts ,8,The_Donald
Red_SL4,i was there earlier this year i swear they must hide the ugly ones because i did not see any sub 7 ,3,TheRedPill
Red_SL4, do people really make up fake stories like this oh boy you are a hardcore lurker it seems but know that most redditors would sell their mom for approval karma i admit it was difficult even for me to abandon my old account ,4,TheRedPill
Red_SL4,i am ready to accept meme magic as my religion ,3,The_Donald
