name,body,score,sub
cookiemanluvsu,i would bust my own nut on these and still enjoy eating the whole bowl my kind of meatball ,1,FoodPorn
cookiemanluvsu,bro lebron james is the definition of a household name ,1,supremeclothing
cookiemanluvsu,who dylan ,1,supremeclothing
cookiemanluvsu,sofie hagen looks like a real fat cunt,1,pussypassdenied
cookiemanluvsu,yeah they do i just tweeted out nike and they responded with the same thing garbage they made it look like everyone got the box only a select few got it signed ,0,Sneakers
cookiemanluvsu,i know that but they did not ship the pins nothing just the regular shoes ,1,Sneakers
cookiemanluvsu,thank you so so much that just great ,1,minnesota
cookiemanluvsu,i am confused what you mean ,0,Sneakers
cookiemanluvsu,did anyone who got the special edition kd 10 tipoff special shoes get fucked and only have the regular box delivered with no pins or special box today i sure did garbage ,1,Sneakers
cookiemanluvsu,oh man it says the image is gone ,1,minnesota
cookiemanluvsu,oh boy that last part got a little real yikes,1,ForeverAlone
cookiemanluvsu,bro that a great idea just do that what an adventure now i am jealous of you lol look at that ,2,ForeverAlone
cookiemanluvsu,thanks man,0,lego
cookiemanluvsu,laser lab search lego stand on ebay and you will find one of their listings click on their store link and boom they got like 80 different stands i found out about them from another dude who had them pictured in his post i cannot remember his username or i would give him credit ,1,lego
cookiemanluvsu,motherfucker no just no im dead now ,3,NeckbeardNests
cookiemanluvsu,where did they go ,1,Incels
cookiemanluvsu,let be honest you are in this sub to garner attention which is the opposite of what the members of this sub are looking for take it for what it is nothing more nothing less ,9,Incels
cookiemanluvsu,lol,5,Incels
cookiemanluvsu,could i have the one with the british flag for galaxy s7 edge please ,1,minnesota
cookiemanluvsu,anything but that fucking picture,-2,minnesota
cookiemanluvsu,nice 2 piece denims fags ,1,h3h3productions
cookiemanluvsu,does this mean these have less recoil ,1,guns
cookiemanluvsu,i know this used to be a nice place then this douche just ruined it ,-10,MealPrepSunday
cookiemanluvsu,pfft id take 300,10,WTF
cookiemanluvsu,nice,3,Sneakers
cookiemanluvsu,dude,1,madlads
cookiemanluvsu,yeah because she was a dude,-6,madlads
cookiemanluvsu,i dont know its kind of hard to say but my retro 4 premium snake skins are probably my favorite to look at actually ironically one of my favorites is the 1 all star that came out this year i dont know why but i love them think they look smooth as fuck ,2,Sneakers
cookiemanluvsu,yes i agree i own all those you listed deadstock the 11 low or high are just my favorite ive been working on trying to get all the 11 deadstock for about 6 months now ,2,Sneakers
cookiemanluvsu,its a perfect shirt for her it shows off her big tits but hides her huge gunt ,18,FestivalSluts
cookiemanluvsu,these are those nicknamed columbia ,1,Sneakers
cookiemanluvsu,alright dude so did you jerk off to completion watching her or what ,0,AskReddit
cookiemanluvsu,k but who the fuck is mazzy star ,-1,AskReddit
cookiemanluvsu,it fucking weird,1,AskReddit
cookiemanluvsu,yes it is sir,3,Sneakers
cookiemanluvsu,yeah what is with his gray skin ,1,howardstern
cookiemanluvsu,lol,5,howardstern
cookiemanluvsu,they are dope the problem is 4 are just so much doper so it like might as well just get 4 ya know ,2,Sneakers
cookiemanluvsu,how are you this big of a douche read below and explain yourself pussy ,3,classic4chan
cookiemanluvsu,marty dude,2,hockey
cookiemanluvsu,gay,4,cringepics
cookiemanluvsu,jalen has a new fucking abc sitcom tell me this ai not happening,1,nba
cookiemanluvsu,oh man that should be illegal,1,GlobalOffensive
cookiemanluvsu,cray cray,1,collegesluts
cookiemanluvsu,what happened,3,rupaulsdragrace
cookiemanluvsu,bro she not 9 10,39,trashyboners
cookiemanluvsu,i did it was awful,5,Music
cookiemanluvsu,what are you serious ,2,collegesluts
cookiemanluvsu,god you made that sound so douchey,2,collegesluts
cookiemanluvsu,totally agree,1,minnesota
cookiemanluvsu,dude please,3,nba
cookiemanluvsu,that show is awful and i cannot believe it has been on air for so long ,-6,aww
cookiemanluvsu,can someone explain to me what ghosting is ,1,GlobalOffensive
cookiemanluvsu,honest question please do not rape me but does dubs stand for w as in warriors ,2,nba
cookiemanluvsu,i am glad to see youre doing well,2,bottomlulz
cookiemanluvsu,this stuff tastes like gunt juice,2,Minneapolis
cookiemanluvsu,dude wow wendy looking rough,1,howardstern
cookiemanluvsu,ok this shit is funny ,2,Incels
cookiemanluvsu,dude know your audience ,7,ForeverAlone
cookiemanluvsu,dank,1,ForeverAlone
cookiemanluvsu,because he a hood rich jamface,-43,OopsDidntMeanTo
cookiemanluvsu,that not what happened here he wanted to show off his fucking bling and try and not look like a douche ,-23,OopsDidntMeanTo
cookiemanluvsu,i like how you said the same thing only a little different trying to be funny you really nailed it good job ,1,lego
cookiemanluvsu,hey at least he went for it now the crawling out the window thing just made me chuckle ,10,Incels
cookiemanluvsu,lol he could not wait to get the fuck outa here,3,Incels
cookiemanluvsu,nah it could have worked ,7,ForeverAlone
cookiemanluvsu,dude that sucks and i am sorry you want to come out to minneapolis and hang out with me for a weekend i will show you a good time and i promise you will go home with renewed optimism what do you say ,5,ForeverAlone
cookiemanluvsu,what does this even mean,3,minnesota
cookiemanluvsu,how you gonna troll them ,-1,minnesota
cookiemanluvsu,i completely agree i hate those people even more ,5,minnesota
cookiemanluvsu,howd you get dar gopher flair i want that ,1,hockey
cookiemanluvsu,chin up bud you are on the right path,1,NeckbeardNests
cookiemanluvsu,good man chin up ,1,NeckbeardNests
cookiemanluvsu,i have 2 children buddy ,2,lifehacks
cookiemanluvsu,so your stuff does not go stale ,1,lifehacks
cookiemanluvsu,i am on it,1,Sneakers
cookiemanluvsu,oh o k thanks,1,wholesomegreentext
cookiemanluvsu,super fresh i am going to try and find these bad girls now ,3,Sneakers
cookiemanluvsu,someone explain what dayz is ,10,wholesomegreentext
cookiemanluvsu,oh wow that metal,12,lego
cookiemanluvsu,really i thought the house looked like a shithole ,5,NeckbeardNests
cookiemanluvsu,totally ,8,greentext
cookiemanluvsu,what about me ,18,greentext
cookiemanluvsu,it should have,1,justneckbeardthings
cookiemanluvsu,lol what ,1,mildlyinteresting
cookiemanluvsu,fuck you are telling me i chaperoned my 3rd graders field trip at the arboretum today niggas was dying out there ,2,mildlyinteresting
cookiemanluvsu,eden prairie checking in baby luv u guys beep beep ,2,mildlyinteresting
cookiemanluvsu,you are such a queef,1,mildlyinteresting
cookiemanluvsu,hot garbage,0,streetwear
cookiemanluvsu,this blue this picture doesnt do it justice ,1,Sneakers
cookiemanluvsu,then you know what you may be right i just do not think you get the pins and special box but who cares the shoe is dope ,1,Sneakers
cookiemanluvsu,dank,1,food
cookiemanluvsu,well that explains it all thank you for helping me ,1,FellowKids
cookiemanluvsu,no man they were only for the game ,1,Sneakers
cookiemanluvsu,this is so great,2,hockey
cookiemanluvsu,k i did not see nothing lequeef,1,nba
cookiemanluvsu,let be honest you are not having children ,0,news
cookiemanluvsu,oh thanks man where does the name fellowkids come from ,1,FellowKids
cookiemanluvsu,that where i got mine go get em boy they are ,2,Sneakers
cookiemanluvsu,these are the kd 10 year that quick striked about 6 days ago the still kd chromes dropped at tipoff and sold out quick they come with the special box and pins and shit ,2,Sneakers
cookiemanluvsu,i am confused by your question mate ,3,Sneakers
cookiemanluvsu,they do come with them changed them out right away ,1,Sneakers
cookiemanluvsu,hmmmm i got mine fine i saw people on twitter the app glitched out on them ,3,Sneakers
cookiemanluvsu,honest question what is fellowkids like what is this subs mission statement ,1,FellowKids
cookiemanluvsu,you should become our archive master ,2,howardstern
cookiemanluvsu,oh wow that crazy,1,howardstern
cookiemanluvsu,what is usenet ,1,howardstern
cookiemanluvsu,lol why would you tear it down honestly asking ,8,lego
cookiemanluvsu,good job buddy ,16,lego
cookiemanluvsu,i read what you said and it sounded reasonable to me mate ,2,environment
cookiemanluvsu,the guy gave a very honest and fair comment and all you can come up with is off yourself you should be ashamed of who you are ,1,environment
cookiemanluvsu,you know what man the guy was giving his opinion you do not need to act like an asshole ,1,environment
cookiemanluvsu,i am taking about aladdin carpets ,1,atheism
cookiemanluvsu,we should just carpet bomb these motherfuckers and be done with them ,1,atheism
cookiemanluvsu,i went to one in minneapolis for the minneapolis sub and the people were super chill and nice they meet up like once a month at shitty bars and get hammered prolly like 12 people there it was fun ,4,sadcringe
cookiemanluvsu,let be honest that why he leaving he a fucking douche and everyone would call him on it when he would make a comment or post ,8,AdviceAnimals
cookiemanluvsu,i would offer up 200 but that all i am willing to go for b grade,1,kicksmarket
cookiemanluvsu,i have never heard that saying,2,ForeverAlone
cookiemanluvsu,honest question why did they do this ,1,betterCallSaul
cookiemanluvsu,lol good point,6,AskReddit
cookiemanluvsu,that beautiful,3,AskReddit
cookiemanluvsu,correct those are all the recent bricks plus the outlet pricing on these are shit it basically still retail and most the shoes are banged up so they will just sit there for a couple months till they decide to tank the asking price ,1,Sneakers
cookiemanluvsu,for my sake please,3,avocadosgonewild
cookiemanluvsu,dude this sub is just a bunch of fags that recycle the same old shit it that simple ,60,greentext
cookiemanluvsu,he was drunk give him a break ,0,news
cookiemanluvsu,that awesome you sound like a wonderful person keep being you ,6,RBI
cookiemanluvsu,do not care tiger is my hero,0,news
cookiemanluvsu,you are a good person for caring op do not give up the fight ,6,RBI
cookiemanluvsu,dude you are over thinking this you did a good thing and your job be ready to do it again and be greatful whenever you help someone in life no matter how big or small that the real meaning of life caring for others ,1,self
cookiemanluvsu,minnesota winter fam,7,4chan
cookiemanluvsu,lol,1,ireland
cookiemanluvsu,what city do you live in ,1,succulents
cookiemanluvsu,care telling us how that been ,1,Incels
cookiemanluvsu,thank you ,3,netflix
cookiemanluvsu,he can fuck right off honestly,-75,fantasybaseball
cookiemanluvsu,gallowboob is a douche,-23,malehairadvice
cookiemanluvsu,is there a true user generated system of reviews on netflix anymore ,7,netflix
cookiemanluvsu,holy fuck,6,Celebs
cookiemanluvsu,holy crap it not an asian guy from california ,5,streetwear
cookiemanluvsu,good job op this is funny,9,betterCallSaul
cookiemanluvsu,this is ridiculous,4,h3h3productions
cookiemanluvsu,correct,4,Sneakers
cookiemanluvsu,no theres a hell of a lot more white people that enjoy basketball then black or any other color ,5,Sneakers
cookiemanluvsu, ,1,videos
cookiemanluvsu,k,1,whatisthisthing
cookiemanluvsu,i am glad that gorilla is burning in hell he died how he should have ,-1,Harambe
cookiemanluvsu,oh o k that sounds like a good thing thank you ,1,GalaxyS7
cookiemanluvsu,omg that brutal,1,self
cookiemanluvsu,yes iam ,10,ForeverAlone
cookiemanluvsu,do i want the floating sound button or no does it help or do anything ,1,GalaxyS7
cookiemanluvsu,i am cringing reading this,2,self
cookiemanluvsu,what is fee fees mean ,3,self
cookiemanluvsu,that actually funny i am going to steal this and use it all over reddit ,2,self
cookiemanluvsu,yeah fuck those cunts we all know their an insecure douche that no one likes beat it nerd ,4,self
cookiemanluvsu,do they really enjoy this tho ,2,self
cookiemanluvsu,its because the majority of people on reddit are loser dorks that were are nerds and they still desperately want to be funny fit in and garner approval from others it that one kid you know who always trying to hard that reddit ,0,self
cookiemanluvsu,here my theory op is actually the one replicating this and is using this sub as a barometer if it can pass for real or learn what he needs to work on he has a small screwdriver chisel tool in his damn hand in the photo ,441,whatisthisthing
cookiemanluvsu,good job mate,1,pics
cookiemanluvsu,my sides orbit,2,CringeAnarchy
cookiemanluvsu,yeah because that karma is valuable ,1,pokemongo
cookiemanluvsu,nike sent me a rsvp presale invitation thing to my nike app so i snapped them up immediately they went on sale for all of 4 seconds on nike com ,3,Sneakers
cookiemanluvsu,i have never heard of this guy and i am a hip boy,1,wholesomebpt
cookiemanluvsu,what is cheesing ,2,nba
cookiemanluvsu,why did you make this exact comment twice ,9,streetwear
cookiemanluvsu,dude wtf are you talking about ,2,cringepics
cookiemanluvsu,k but what is a newfag ,5,niceguys
cookiemanluvsu,damn dude ,2,niceguys
cookiemanluvsu,damn those are some fried eggs hanging on a nail,-5,niceguys
cookiemanluvsu,interesting,4,niceguys
cookiemanluvsu,yeah yeah on the catwalk ,1,OldSchoolCool
cookiemanluvsu, ,1,OldSchoolCool
cookiemanluvsu,oh no no no no no no,1,Turkey
cookiemanluvsu,jews am i right ,2,Turkey
cookiemanluvsu,damnnnnnnnmn ,9,CringeAnarchy
cookiemanluvsu,she she delete her reddit account lol ,1,Incels
cookiemanluvsu,oh fuck that lame as shit lol,33,funny
cookiemanluvsu,who the fuck came up with this term ,1,Incels
cookiemanluvsu,well this is dank,8,funny
cookiemanluvsu,honest question what does qt 3 14 mean i have always wondered this ,10,funny
cookiemanluvsu,yeah fuck that,0,fantasyfootball
cookiemanluvsu,good advice here boys,2,howardstern
cookiemanluvsu,damn op that mental checklist is rough sorry man ,3,Incels
cookiemanluvsu,that completely incorrect ,1,Repsneakers
cookiemanluvsu,is that really him i do not know lol ,6,CringeAnarchy
cookiemanluvsu,honestly i am not a chad at all but a get most the women i choose because i understand how to game them i come here because i think the opposite of what you are saying i think you boys are honest funny and all around pretty decent dudes i find your ability to talk about this deep seeded issue you face openly and honestly pretty amazing i have a lot of insecuritys too but i cannot face them or talk about them openly maybe one day i will after reading your incel stories and understanding there nothing to be ashamed of you have a lot of courage ,3,Incels
cookiemanluvsu,hey thanks bud i really like em ,1,Sneakers
cookiemanluvsu,interesting,1,wildhockey
cookiemanluvsu,ok ninja guy,-1,self
cookiemanluvsu,i stand by you,2,nba
cookiemanluvsu,that fake as fuck,0,HadToHurt
cookiemanluvsu,i like you stupid pussy moths ,1,WTF
cookiemanluvsu,i do not believe you,1,news
cookiemanluvsu,lol you are probably right,8,CringeAnarchy
cookiemanluvsu,i am dying ,1,golf
cookiemanluvsu,those would be the gayboy specials you do not want that garbage ,1,Nike
cookiemanluvsu,stole this from streetwear eh ,16,nba
cookiemanluvsu,hey thanks i am going to listen to you ,1,cringepics
cookiemanluvsu,so fucking sick of those round glasses they look horrible,24,streetwear
cookiemanluvsu,honestly asking but how would one save this for later ,1,streetwear
cookiemanluvsu,oh just seems kind of pussy to me but i will take your word for it ,0,nba
cookiemanluvsu,sure bud whatever you say ,-4,streetwear
cookiemanluvsu,i like your gray base that looks like rocks and pebbles good job ,7,lego
cookiemanluvsu,yeah i am sorry it just looks like hu bumped him how are his knees involved ,3,nba
cookiemanluvsu,help me out what did he do wrong ,1,nba
cookiemanluvsu,dude that rad,14,lego
cookiemanluvsu, ,1,videos
cookiemanluvsu, had it coming ,8,pics
cookiemanluvsu,what is this supposed to mean ,2,Blind
cookiemanluvsu,i was thinking the same thing ,1,HadToHurt
cookiemanluvsu,it will get better or it will get much worse i am not sure but you will find out ,3,HadToHurt
cookiemanluvsu,damn thanks for the link tho ,1,BannedFromThe_Donald
cookiemanluvsu,oh wow that fucking crazy shoot me a picture of yourself please i would like to put a face to this craziness ,2,Incels
cookiemanluvsu,i am,1,BannedFromThe_Donald
cookiemanluvsu,why were you imprisoned ,1,Incels
cookiemanluvsu,no they do not ,1,BannedFromThe_Donald
cookiemanluvsu,it awesome but the stock should be the same color wood as the other pieces ,2,guns
cookiemanluvsu,make sure every model is a picture of an asian guy ,10,streetwear
cookiemanluvsu,what is this garbage you are a shit knife bud ,-3,tifu
cookiemanluvsu,also that website is cancer i asked me to take a quiz to continue reading the article awful ,1,BannedFromThe_Donald
cookiemanluvsu,i am absolutely taken a back by this disgusting that a country could think this is alright to do to it citizens ,1,BannedFromThe_Donald
cookiemanluvsu,true that,1,BannedFromThe_Donald
cookiemanluvsu,what are you fucking serious ,1,BannedFromThe_Donald
cookiemanluvsu,but you did not graduate highschool or attend college ,1,Incels
cookiemanluvsu,thank,1,BannedFromThe_Donald
cookiemanluvsu,you fucking are best at reddit baby love you man ,2,BannedFromThe_Donald
cookiemanluvsu,i love the killers ,2,Music
cookiemanluvsu,lol k good job on your ged ,1,Incels
cookiemanluvsu,you did not answer my question jeff,18,subredditcancer
cookiemanluvsu,how is this question related to my comment ,16,subredditcancer
cookiemanluvsu,dude are you serious you know this bitch is probably gross right ,1,Incels
cookiemanluvsu,it sounds like you consider yourself really smart ,5,Incels
cookiemanluvsu,bro this is the most fucking cringe thing i have ever read ever god save you ,27,Incels
cookiemanluvsu,totes,1,CringeAnarchy
cookiemanluvsu,hey i am a fucking douche,6,r4r
cookiemanluvsu,dude it a website to waste time with it not that big of a deal ,-6,subredditcancer
cookiemanluvsu,good thing he nuked his account all that valuable information and secrets could have got out what a honorable hero o7,-9,subredditcancer
cookiemanluvsu,why ,-9,subredditcancer
cookiemanluvsu,i have not noticed any difference at all ,9,subredditcancer
cookiemanluvsu,who banned who ,-1,subredditcancer
cookiemanluvsu,honest question what makes you say this ,5,subredditcancer
cookiemanluvsu,have you two ever met each other ,1,ForeverAlone
cookiemanluvsu,again how many miles away ,-1,ForeverAlone
cookiemanluvsu,i completely agree with you i,0,legaladvice
cookiemanluvsu,you need to be an active employee to gain access ,2,Nike
cookiemanluvsu,all aboard ,12,wholesomegreentext
cookiemanluvsu,pfft i got my permit 2 weeks ago i took a 2 hour class shot 5 rounds and got my licence to carry a fucking handgun in public its ludicrous i prolly should not have a gun ,14,the_meltdown
cookiemanluvsu,i think you got the right take on him ,1,fantasyfootball
cookiemanluvsu,no,2,LifeProTips
cookiemanluvsu,what fuck that if i split an uber you at least owe me a cleveland steamer and you are going to give it to me ,1,niceguys
cookiemanluvsu,man that brutal i am so sorry dude the good thing is you are in highschool and you will be away from these people and never have to see them again and do not forget to stand up for yourself voice your anger with people treating you like an asshole ,3,ForeverAlone
cookiemanluvsu, ,6,streetwear
cookiemanluvsu,oh cool stuff thanks i thought i heard of that name as a driver ,9,NASCAR
cookiemanluvsu,fair,1,BlackPeopleTwitter
cookiemanluvsu,cool,13,NASCAR
cookiemanluvsu,bro,13,uglyduckling
cookiemanluvsu,filthy bastards ,1,memes
cookiemanluvsu,lol,5,rupaulsdragrace
cookiemanluvsu,they are actually cement 4 ,1,hmmm
cookiemanluvsu,one,1,hmmm
cookiemanluvsu,are you a racecar driver sir ,18,NASCAR
cookiemanluvsu,that and they are going bankrupt,0,mildlyinfuriating
cookiemanluvsu,lol you are just sending it back to timmy ,2,mildlyinfuriating
cookiemanluvsu,what a faggot,1,Justfuckmyshitup
cookiemanluvsu,lol k,1,BlackPeopleTwitter
cookiemanluvsu,you are wrong ,1,BlackPeopleTwitter
cookiemanluvsu,what retard is buying weed that is cut cutting is for cocaine you would notice that shit with a glance ,2,BlackPeopleTwitter
cookiemanluvsu,honestly your edit just made you look like a little bitch i am sorry you did this to yourself ,1,BlackPeopleTwitter
cookiemanluvsu,depends on what the value the shipper claims on 300 usually 40 00,1,Sneakers
cookiemanluvsu,what ever you say my dude,0,TrashyText
cookiemanluvsu,i did not know that,7,betterCallSaul
cookiemanluvsu,ok guy,0,TrashyText
cookiemanluvsu,true,1,TrashyText
cookiemanluvsu,yeah dude just stick to marijuana and percocets like the rest of us ,1,TrashyText
cookiemanluvsu,that thing needs to be set on fire ,1,TrashyText
cookiemanluvsu,this is fake as fuck come on people ,1,TrashyText
cookiemanluvsu,totes,1,TrashyText
cookiemanluvsu, just promoting it little bitch does not want to be wrapped up in it just look cool promoting it ,1,TrashyText
cookiemanluvsu,it tis a very rough deal my dude ,2,TrashyText
cookiemanluvsu,holy fuck this went cray cray,1,TrashyText
cookiemanluvsu,this is brutal,1,TrashyText
cookiemanluvsu,lol so true,1,hockey
cookiemanluvsu,oh geez,1,news
cookiemanluvsu,you are description is completely over blowing what happened and your comparisons to this being like 9 11 is outrageous ,-1,news
cookiemanluvsu,good points here ,2,CringeAnarchy
cookiemanluvsu,teach me computergeek you seem wise on the fats ,1,CringeAnarchy
cookiemanluvsu,how is this cringe ,2,CringeAnarchy
cookiemanluvsu,skol wait ,2,wildhockey
cookiemanluvsu,oh wow good job ,1,justneckbeardthings
cookiemanluvsu,cool thanks man ,1,CringeAnarchy
cookiemanluvsu,are you a big girl now ,2,justneckbeardthings
cookiemanluvsu,you are probably correct on this ,8,netflix
cookiemanluvsu,yeah i thought i caught both but must not have what is the name of the hobby shop ,1,CringeAnarchy
cookiemanluvsu,what is a feeder ex and who wants to take someones wild game ,10,justneckbeardthings
cookiemanluvsu,wait do they own a hobby shop i must have missed that part ,1,CringeAnarchy
cookiemanluvsu,exactly this it the perfect figure to actually get paid ,5,IAmA
cookiemanluvsu,the dolphins ,1,WTF
cookiemanluvsu,did i miss the hobby shop did you like justin as much as i did i thought he was a solid dude fat as fuck but a solid normal guy and you are right that was the apex nothing ever will top that episode ,6,CringeAnarchy
cookiemanluvsu,stephen suffers from being the biggest piece of shit drug addict ever places in this earth ,3,CringeAnarchy
cookiemanluvsu,lol i could not believe his shit head son i wanted to crush his stupid face his other son i actually felt bad for ,4,CringeAnarchy
cookiemanluvsu,what a unique comment,-1,educationalgifs
cookiemanluvsu,i do not know what you mean ,0,educationalgifs
cookiemanluvsu,no,1,nba
cookiemanluvsu,lol this is what everybody is bitching about he did nothing i am sorry but nba fans are fucking pussys ,1,nba
cookiemanluvsu,y all niggers want to talk about real fans staying with a shit team ,1,nba
cookiemanluvsu, nvm rofl bro be better then this,2,nba
cookiemanluvsu,i dont,3,WTF
cookiemanluvsu,i know them but i would not say well how long did it take you to think of that joke ,31,WTF
cookiemanluvsu,i hope that man dies yah i said it ,1,PublicFreakout
cookiemanluvsu,this is true tho tough but true ,4,Kanye
cookiemanluvsu,he not,148,Kanye
cookiemanluvsu,these girls are my neighbors,20,WTF
cookiemanluvsu,i just got back did the celtics lose in 7 ,0,nba
cookiemanluvsu,excellent right up ,1,guns
cookiemanluvsu,i agree i thought it was pretty funny ,0,legodeal
cookiemanluvsu,gross ,-8,bimbofetish
cookiemanluvsu,yeah then the state trooper shook his hand as he was yelling nigger ,22,minnesota
cookiemanluvsu,uhhhhhh hmm ,-10,minnesota
cookiemanluvsu,that green is fucked,2,golf
cookiemanluvsu,this was sort of a boring story sorry ,0,tifu
cookiemanluvsu,what auto oem mate ,2,news
cookiemanluvsu,unfortunate name this would be much more touching if his name was daniel ,1,pics
cookiemanluvsu,dude what holy shit lol what a peice of shit ,1,news
cookiemanluvsu,honestly tho it kind of a lot of undesirable stuff ,1,legodeal
cookiemanluvsu,here this object flew directly over your head,1,funny
cookiemanluvsu,that what that is ,1,Repsneakers
cookiemanluvsu,nice that should be worth about 2 99 ,-12,ThriftStoreHauls
cookiemanluvsu,that what i am thinking pretty sure they are both women ,8,Repsneakers
cookiemanluvsu,honest question what is that image on the guy girls sweatshirt with the teeth i saw some dude have it tattoed on his arm just curious ,1,Repsneakers
cookiemanluvsu,i like her ,0,SubredditDrama
cookiemanluvsu,oh man this hurts my heart i think you are a very strong wonderful person to come here and talk about this i look up too you and i love you im praying for you ,20,personalfinance
cookiemanluvsu,preach,7,CringeAnarchy
cookiemanluvsu,good points you are right fuck that guy who made that comment we should beat the shit out of him in front of his father ,2,CringeAnarchy
cookiemanluvsu,i am just telling you what my eyeballs see ,1,todayilearned
cookiemanluvsu,oh thank you not really interested in that tho i just want lego ,1,lego
cookiemanluvsu,brand is duracell,1,lego
cookiemanluvsu,i like red ,12,facebookdrama
cookiemanluvsu,no it not it a joke and its funny and you are a fag ,2,holdmyfries
cookiemanluvsu,fag,3,holdmyfries
