name,body,score,sub
cookiemanluvsu,fucking brilliant,1,photoshopbattles
cookiemanluvsu,thanks dude,5,Sneakers
cookiemanluvsu,you take this a bit too seriously,17,natureismetal
cookiemanluvsu,dank memes bro,6,natureismetal
cookiemanluvsu,that would make sense is she a 14 year old girl by any chance ,8,natureismetal
cookiemanluvsu,no because then he would not feel cool and special anymore ,225,natureismetal
cookiemanluvsu,please do not act like a 4chan faggot,1,me_irl
cookiemanluvsu,god you guys are fags,1,BlackPeopleTwitter
cookiemanluvsu,ohhhhhhhh lol,1,place
cookiemanluvsu,i agree with you it just one you yourself wo not make a difference and there is not anywhere close to the amount of people willing to do what you are doing to make a change ,2,netflix
cookiemanluvsu,how exactly are these new percentages equated what gets something 96 ,1,netflix
cookiemanluvsu,oh damn i applaud you for your conviction but does not that move only really hurt you in the end ,2,netflix
cookiemanluvsu,go on ,14,greentext
cookiemanluvsu,ahhh you are right did not think of that ,5,carporn
cookiemanluvsu,ive never understood the collective boners everyone has for these cars i think theyre ugly ,-5,carporn
cookiemanluvsu,lol deep down we all know its so true ,2,AdviceAnimals
cookiemanluvsu,whats amazing ,1,place
cookiemanluvsu,are you planning on drinking you are planing on drink arent you ,5,nba
cookiemanluvsu,oh boy,1,pics
cookiemanluvsu,never heard truer words,1,pics
cookiemanluvsu,yeah thanks,1,FestivalSluts
cookiemanluvsu,he a giants fan i just realized ,0,news
cookiemanluvsu,what is a neocon ,1,news
cookiemanluvsu,jets fan eh,65,news
cookiemanluvsu,dank,1,news
cookiemanluvsu,was it worth the money and the build ,1,lego
cookiemanluvsu,come on guy,0,lego
cookiemanluvsu,it weird i just bought a new lego one and my son just built it your one actually looks more detailed and cooler then the one from lego what is up with that ,2,lego
cookiemanluvsu,i got to ask are you a women ,-6,FestivalSluts
cookiemanluvsu,i will go one step further that show sucks cock and it fanbase are huge dorks ,-2,self
cookiemanluvsu,it super cool ,2,Nerf
cookiemanluvsu,did you guys design your logo or was it already there ,2,Nerf
cookiemanluvsu,this is the worst i have ever seen ,1,OopsDidntMeanTo
cookiemanluvsu,thank you ,1,fantasybaseball
cookiemanluvsu,got it can i do it on mobile ,5,CollegeBasketball
cookiemanluvsu,informative good job my man ,2,TheKillers
cookiemanluvsu,doctor to the burn unit please ,2,hiphopheads
cookiemanluvsu,lol,1,hiphopheads
cookiemanluvsu,those are dank,5,minnesotavikings
cookiemanluvsu,there big man who gave the worst postgame interview after their elite 8 game ,-18,CollegeBasketball
cookiemanluvsu,oh ok thanks i will try and find that ,11,CollegeBasketball
cookiemanluvsu,no limit and it not categories it just straight up overlall points ,1,fantasybaseball
cookiemanluvsu,great greentext mate i enjoyed it ,5,4chan
cookiemanluvsu,what does flair up mean ,-82,CollegeBasketball
cookiemanluvsu,what should i do with andrew miller and betances i dont get any points for holds and i need bench space i dont know why i dont want to drop them ,0,fantasybaseball
cookiemanluvsu,gay,-4,gaybros
cookiemanluvsu,he kind of douchebag so i actually enjoyed it,-130,CollegeBasketball
cookiemanluvsu,i will give you 220,1,kicksmarket
cookiemanluvsu,could you not have looked into the camera in your after pic mate come on ,-12,malehairadvice
cookiemanluvsu,that fucking awful i am sorry you had this happen in your life i respect your honesty to talk about it mate ,11,ForeverAlone
cookiemanluvsu,sadly i do this ,5,ForeverAlone
cookiemanluvsu,you can do that ,7,ForeverAlone
cookiemanluvsu,what that sucks how did that come about and why ,11,ForeverAlone
cookiemanluvsu,4 more months and that animal can and will attempt to hurt that women ,4,Awww
cookiemanluvsu,cripes,3,CringeAnarchy
cookiemanluvsu,oh i see got it thanks ,1,hiphopheads
cookiemanluvsu,what is biting mean ,1,hiphopheads
cookiemanluvsu,can you explain it to me,10,creepy
cookiemanluvsu,creepy is officially dead,4,creepy
cookiemanluvsu,you burnt the fuck out of these,35,MealPrepSunday
cookiemanluvsu,got it,3,CringeAnarchy
cookiemanluvsu,but how is this cringe ,5,CringeAnarchy
cookiemanluvsu,it annoys everyone and you did a good job calling him out on his weird immature douchebagery ,18,holdmyfries
cookiemanluvsu,can someone explain to me what is going on here what is this and why is everyone mad ,8,CringeAnarchy
cookiemanluvsu,calm down,1,lego
cookiemanluvsu,this one was pretty poor did not flow i hope you are not slipping ,1,pics
cookiemanluvsu,oh damn 800 kids,1,IAmA
cookiemanluvsu,oh my lord this thing is cray cray ,1,pics
cookiemanluvsu,ha ,2,pics
cookiemanluvsu,huh is it a well known college in the academic world ,2,IAmA
cookiemanluvsu,that and they were all below the poverty level ,1,IAmA
cookiemanluvsu,lol ,1,IAmA
cookiemanluvsu,what is mudd ,1,IAmA
cookiemanluvsu,tell him to leave,1,bestof
cookiemanluvsu,i did,1,Sneakers
cookiemanluvsu,fair dues appreciate the perspective ,1,Sneakers
cookiemanluvsu,my man,3,Sneakers
cookiemanluvsu,good man seems reasonable ,3,Sneakers
cookiemanluvsu,i mean i care about branding and honestly everyone else in this sub does too that why we are sneakerheads does not mean i only like 1 brand as you can see i bought both these shoes ,12,Sneakers
cookiemanluvsu,i own the vapormaxs i do not hate them i like them ,1,Sneakers
cookiemanluvsu,damn bro,8,lego
cookiemanluvsu,lol,2,gifs
cookiemanluvsu,think of it this way what should they have done put another standard airmax unit on it they do that and it just another regular airmax i like the ambition of the sole its grown on me and let me tell you they were able to combine comfort firmness and a sort of high end performance feel all into one i have not quite experienced beforw look i love the 93 17 too i own 3 pairs of them i think people should pick up a pair of these and give them some run they will like it lastly the upper and cuff of this shoe is pure class and wraps around your foot like a nitrile glove that my review on the nike vapormax i hope you enjoyed it ,30,Sneakers
cookiemanluvsu,you are speaking like you have done a test on these shoes ,17,Sneakers
cookiemanluvsu,or ya know people love airmaxs and these are dope ,46,Sneakers
cookiemanluvsu,oh geez,2,ireland
cookiemanluvsu,k now go,-4,Documentaries
cookiemanluvsu,i am confused by this as well but in the end i think he says he lives alone now ,3,ForeverAlone
cookiemanluvsu,wait whats happening ,1,CringeAnarchy
cookiemanluvsu,post yourself on reddit amateur porn ,-4,sex
cookiemanluvsu,lol what ,2,sex
cookiemanluvsu,you do not do it for him anymore love ,-20,sex
cookiemanluvsu,drama kid fag,7,CringeAnarchy
cookiemanluvsu,i dropped mine 3 days with a solid case on it and the left bottom corner cracked and spider webbed as well ,1,samsung
cookiemanluvsu,fuck that site my goodness it was a hot fucking mess ,2,Repsneakers
cookiemanluvsu,lol,0,xboxone
cookiemanluvsu,we get it he made a mistake why people feel the need to point them out i will never know ,2,JusticePorn
cookiemanluvsu,fuck your awful edits,1,AskReddit
cookiemanluvsu, this what kind of weirdo uses this word to start a sentence,1,AskReddit
cookiemanluvsu,welcome ,1,mildlyinfuriating
cookiemanluvsu,who is barry allen ,1,movies
cookiemanluvsu,chik fil a is overrated huge bun and awkward size chicken filets dontike the waffle fries either ,3,mildlyinfuriating
cookiemanluvsu,thank you,-4,videos
cookiemanluvsu,wow op you are the man great textured advice right hur ,84,malefashionadvice
cookiemanluvsu,ummm i disagree with this completely ,-11,videos
cookiemanluvsu,that my bitch,0,Celebs
cookiemanluvsu,well that cray cray,2,4chan
cookiemanluvsu,so just being as gay as possible is the cool thing to do here now eh ,3,4chan
cookiemanluvsu,also he made all that shit up just to start talking about putting his cock in your mouth for 200,6,cringepics
cookiemanluvsu,this is fucking brutal,3,cringepics
cookiemanluvsu,you still should right now punch yourself in the face for this ,1,niceguys
cookiemanluvsu,damn dude you are right ,1,im14andthisisdeep
cookiemanluvsu,claws paws and hooves in eden prairie,2,Minneapolis
cookiemanluvsu,interesting ,0,Minneapolis
cookiemanluvsu,you skumd like an awfull girlfriend but a great friend ,2,r4r
cookiemanluvsu,do you have the receipt that came with it ,1,kicksmarket
cookiemanluvsu,what did you pay shipped for these ,2,Repsneakers
cookiemanluvsu,help me out on the joke they do not look like belugas ,2,Repsneakers
cookiemanluvsu,you wonderful autistic robot ,1,relationship_advice
cookiemanluvsu,getting a little butt hurt are not ya ,7,relationship_advice
cookiemanluvsu,dude please stop this is embarrassing ,6,subredditcancer
cookiemanluvsu, oh hey baby looking good oh hi honey btw i have a penis beating death i do not think this is how it works ,13,relationship_advice
cookiemanluvsu,oh ok that explains everything ,16,relationship_advice
cookiemanluvsu,honest question how old are you ,4,relationship_advice
cookiemanluvsu, not sure how being so specific about what genitalia you would fuck is a sexual preference that the definition of a sexual preference,16,relationship_advice
cookiemanluvsu,i would say they would be more to likely get beaten and or killed by disclosing this information too late not to early ,11,relationship_advice
cookiemanluvsu,i do not agree with any of this ,8,relationship_advice
cookiemanluvsu,yeah dude no big deal ,17,relationship_advice
cookiemanluvsu,yeah wtf here a sticker look at this sticker cool sticker couplings the plate is made out stickers look at my stickers fuck dude they are stickers ,29,lego
cookiemanluvsu,200 individual sets ,2,lego
cookiemanluvsu,man those guys are lame,0,lego
cookiemanluvsu,what a fucking cunt,1,cringepics
cookiemanluvsu,i am from ep found them in my size 12 for 75 00 deadstock on ebay the funny thing was when i was checking out i looked at the sellers ship city and sure as hell it was ep dropped them off to me this morning ,2,Sneakers
cookiemanluvsu,yeah i think a couple shades darker is the way to go good eye man i am very impressed with your art thus far ,1,Sneakers
cookiemanluvsu,nobody rip my shit this is a 1 1 commisoned for me lol,10,Sneakers
cookiemanluvsu,oh this is that dank dank i am waiting for i am gonna make a display in my office for all 3 you are doing for me so ill actually have each shoe on a floating block mounted on the wall with the matching print framed behind the actual shoe gonna add a little led lighting to the mix and we are gonna have a beautiful piece of sneaker art you are the bomb dude ,5,Sneakers
cookiemanluvsu,honest question what does heel tab is forehead mean ,2,Repsneakers
cookiemanluvsu,dank,1,AdviceAnimals
cookiemanluvsu,dank,2,HighQualityGifs
cookiemanluvsu,that true but you did not win the fight if you lost it that simple ,1,nba
cookiemanluvsu,sure buddy ,-4,nba
cookiemanluvsu,nah that a hard pass,3,gonewild30plus
cookiemanluvsu,nah you are just a queef,-11,Kanye
cookiemanluvsu,dont,6,OopsDidntMeanTo
cookiemanluvsu,what the hell did he say in those 9 seconds,10,4chan
cookiemanluvsu,totally,-2,nba
cookiemanluvsu,fuck i am 34 and feel to old for all these fucks you are doing good mate sound like a good dude ,1,AdviceAnimals
cookiemanluvsu,what is this bullshit ,1,HillaryForPrison
cookiemanluvsu,is it it does not make any sense to me ,-5,nba
cookiemanluvsu,i know you are pretty bad ass ,2,SubredditDrama
cookiemanluvsu,what is sourcefed ,1,SourceFed
cookiemanluvsu,i see ,33,4chan
cookiemanluvsu,op this is my favorite one ,1,reallifedoodles
cookiemanluvsu,i sure would not ,1,standupshots
cookiemanluvsu,this is clever i am stealing this ,1,standupshots
cookiemanluvsu,i love obamacare fuck trump ,8,AdviceAnimals
cookiemanluvsu,how old is she op ,2,AdviceAnimals
cookiemanluvsu,oh i see is he funny ,24,4chan
cookiemanluvsu,this is flimsy as fuck you should not really make the accusations you did with this kind of whispy garbage as your proof ,2,SubredditDrama
cookiemanluvsu,could you explain how they are not directly correlated ,1,JonTron
cookiemanluvsu,and stressing our healthcare system,8,Whatcouldgowrong
cookiemanluvsu,this is a great question,1,Whatcouldgowrong
cookiemanluvsu,how the fuck do you know who this guy is ,19,4chan
cookiemanluvsu,i do i do,3,4chan
cookiemanluvsu,are you serious ,4,4chan
cookiemanluvsu,ok this might be a very stupid question but did someone actually build this or is it a computer render i cannot tell ,1,lego
cookiemanluvsu,fuck yeah keep real flexing op,2,Sneakers
cookiemanluvsu,fuck your boost ,-2,Sneakers
cookiemanluvsu,if you look at picture 1 you will notice loose red thread mixed into the pattern where it should not be i was able to cut it out and it not noticble any longer but still ,1,Repsneakers
cookiemanluvsu,too close to the pull tag ,1,Repsneakers
cookiemanluvsu,i just received these today placed my order about 3 weeks ago i honestly do not even know if these are good or bad this is probably what you are going to get if you have ordered zebras from david in the last month or so what do you boys think ,2,Repsneakers
cookiemanluvsu,anyway i could get some of your work so i could make prints for my office ,2,Sneakers
cookiemanluvsu,that not the right attitude mate send the girl a nice message and tell her a little bit about yourself ,1,r4r
cookiemanluvsu,those tits are comical goodness those are ridiculous looking ,-1,bimbofetish
cookiemanluvsu,michael what is the best way to order through you ,0,MichaelSneakers
cookiemanluvsu,oh calm down,-10,legaladvice
cookiemanluvsu,why did you delete your comment ,1,lifehacks
cookiemanluvsu,except 93 and 00 ,1,funny
cookiemanluvsu,is it enough to keep you secure and at least somewhat comfortable ,3,SubredditDrama
cookiemanluvsu,how do you support yourself mate ,2,SubredditDrama
cookiemanluvsu,fucking unreal,8,rage
cookiemanluvsu,what do you keep making that stupid fucking p ,32,videos
cookiemanluvsu,is that red peice a cheese block ,1,lego
cookiemanluvsu,help me out here what does this tell us ,12,4chan
cookiemanluvsu, i will take my eggs danny thomas style linda please and thank you ,2,news
cookiemanluvsu,same shit just happened to me with david ordered 2 pairs and only got 1 asked what is going on they said 2 3 days they ship still have not seen shit ,1,Repsneakers
cookiemanluvsu,you are not wrong,1,xboxone
cookiemanluvsu,careful what you wish for mate,-1,news
cookiemanluvsu,well you cannot blame him for that,-7,news
cookiemanluvsu,i do not believe you,2,news
cookiemanluvsu,now i want to know who danny thomas is ,3,news
cookiemanluvsu,nice,2,lego
cookiemanluvsu,man i did not understand anything you just said ,3,lego
cookiemanluvsu,oh wierd thanks had no idea what they were now i do ,2,lego
cookiemanluvsu,no one understands me,2,lego
cookiemanluvsu,this is a marvel i am really impressed op please do another ,2,lego
cookiemanluvsu,nah,1,geek
cookiemanluvsu,nice i cannot believe that kid was a spy already by 2nd grade he must have been so badass i am 34 and i am not even a spy yet ,14,justneckbeardthings
cookiemanluvsu,the reddit circlejerk has officially closed with this image the website has imploded into itself ,1,pics
cookiemanluvsu,what does gl mean ,1,Repsneakers
cookiemanluvsu,that all you took from his paragraph ,1,Repsneakers
cookiemanluvsu,i ordered a pair 3 weeks ago and got my tracking yesterday ill let you know how they come in ,2,Repsneakers
cookiemanluvsu, ,2,minnesota
cookiemanluvsu,what does sharing themes mean ,1,redditsync
cookiemanluvsu,hmmm this is nice and also helpful ,1,ForeverAlone
cookiemanluvsu,that nice,10,ForeverAlone
cookiemanluvsu,what did you do ,1,technology
cookiemanluvsu,i am iam ,3,teenagers
cookiemanluvsu,no,1,videos
cookiemanluvsu,it gets so much worse if it makes you feel better you know they are huge pussys in real life that always makes me feel better ,10,gaming
cookiemanluvsu,lol true,5,esist
cookiemanluvsu,we do not people are cunt monkeys ,3,pics
cookiemanluvsu,this is the correct answer ,-2,pics
cookiemanluvsu,this is the correct answer ,4,pics
cookiemanluvsu,see i find shit like this super funny do not know why but i do ,1,funny
cookiemanluvsu,got an affordable pen recommendation for a business owner with sales guys who use pens ,1,PenmanshipPorn
cookiemanluvsu,o k well talk to you later ,1,transtimelines
cookiemanluvsu,ah i see good work ,3,KenM
cookiemanluvsu,i agree with you i mean fuck she doing what she told to do ,1,rage
cookiemanluvsu,dude this is girls highschool basketball in wisconsin there no after game drug testing lol,2,rage
cookiemanluvsu,nice,1,movies
cookiemanluvsu,nice,3,KenM
cookiemanluvsu,how did you find this ,4,KenM
cookiemanluvsu,oh boy here we go,1,transtimelines
cookiemanluvsu,was i wrong ,1,transtimelines
cookiemanluvsu,no i did not ,1,transtimelines
cookiemanluvsu,i feel the way you are behaving is quite angry to be honest i also was not aware this sub only belongs to a certain few i do not believe i have shown any hate like you say iam can you provide me an example of hate i am bringing here if you could then i will reflect on that ,1,transtimelines
cookiemanluvsu,yes i read the bullshit that you wrote i am asking you why are you writing this bullshit ,0,transtimelines
cookiemanluvsu, also i have seen you before in the comments tryin to troll what is your obsession with this sub if you are trans and still deep in the closet lemme know if you wanna talk what the hell are you talking about ,0,transtimelines
cookiemanluvsu,just be happy they are making a movie at all that alone is pretty cool right ,1,movies
cookiemanluvsu,can you explain what the hell this movie is about ,1,movies
cookiemanluvsu,including myself,1,4chan
cookiemanluvsu,hmmmm hes right ,2,4chan
cookiemanluvsu,why,6,mildlyinteresting
cookiemanluvsu,oh this bot is cool,30,Sneakers
cookiemanluvsu,this might sound ridiculous but i have a question my phone just did an update 3 days ago and a bunch of the look and feel has changed is this the nougat update ,1,samsung
cookiemanluvsu,welp you are completely wrong,-25,whiteknighting
cookiemanluvsu,i see youre choosing the sjw starter pack for your new look,-5,transtimelines
cookiemanluvsu,this does not count please delete this post and message the mods for further instructions ,-1,knifeclub
cookiemanluvsu,huh i learned something here ,10,ShitAmericansSay
cookiemanluvsu, i wonder who hurt you i have noticed this is the new reddit phrase to piss people off and try and finish off a conversation like you are smart i hate shit like this be original at the very least ,1,pics
cookiemanluvsu,thank you it what our country is founded on ,1,pics
cookiemanluvsu,awesome ,1,Sneakers
cookiemanluvsu,him hes a skater plays mite hockey ,2,Sneakers
cookiemanluvsu,i share your sentiment ,7,Sneakers
cookiemanluvsu,nah bud it hockey season our flow is important to us where we come from ,20,Sneakers
cookiemanluvsu,thanks dude,4,Sneakers
cookiemanluvsu,well i no longer have a wife so it nerf guns and knee hockey nets for days bud ,40,Sneakers
cookiemanluvsu,i said gross not fat,1,Tinder
cookiemanluvsu,i agree,1,minnesotavikings
cookiemanluvsu,those are dope and you are looking super clean and fresh go flex on em ,5,Nike
cookiemanluvsu,i do not like how people just downvote unpopular opinions in this sub ,1,minnesotavikings
cookiemanluvsu,no they dont,6,Tinder
cookiemanluvsu,yeah but your girlfriend is gross a half eaten pot of macaroni would have gotten you your girlfriend ,1,Tinder
cookiemanluvsu,i got the texas ones too i actually like them the best ,1,Sneakers
cookiemanluvsu,yeah i agree,2,Sneakers
cookiemanluvsu,someones getting a beating,1,videos
cookiemanluvsu,shit i did not reply directly to you lol what do you mean by perforated ,2,Sneakers
cookiemanluvsu,honest question what do you mean by perforated ,2,Sneakers
cookiemanluvsu,what is her website ,1,Repsneakers
cookiemanluvsu,lol,1,minnesotavikings
cookiemanluvsu,get out,11,minnesotavikings
cookiemanluvsu,bro you need to calm the fuck down ask her out for drinks on saturday ,2,ForeverAlone
cookiemanluvsu,yes you can ,8,ForeverAlone
cookiemanluvsu,dear god mate,5,r4r
cookiemanluvsu,they are little fucking shrimp come the fuck on i am literally eating shrimp right now man some people are huge pussys ,0,mildlyinteresting
cookiemanluvsu,no,0,mildlyinteresting
cookiemanluvsu,stop,3,mildlyinteresting
cookiemanluvsu,your fob is a 285e3 jk65a hit your boy up if ever need an extra ,1,ArtOfRolling
cookiemanluvsu,can someone help a brother out and tell me how to get a hold of edith ,1,Repsneakers
cookiemanluvsu,bitch looks hagard,-4,bimbofetish
cookiemanluvsu,fucking awesome i am writing a letter to the vikings asking them to consider you good luck ,1,minnesotavikings
cookiemanluvsu,there always that one guy eh,3,lego
cookiemanluvsu,yeah they are great the only thing is the detail is a little off the paint edges and some stuff like that is a little wonky not the best quality build ,2,Sneakers
cookiemanluvsu,sounds like the past 6 women i have been with ,1,4chan
cookiemanluvsu,is it though ,1,4chan
cookiemanluvsu,fuck that show was awful,-1,4chan
cookiemanluvsu,oh shit did you just call me a cuck ,1,funny
cookiemanluvsu,i know right ,2,funny
cookiemanluvsu,wo not be the last murica ,2,funny
cookiemanluvsu,man i am sick of seeing stupid shit about rick and morty honestly the show is highly overrated and the circle jerk on it is awful ,-23,funny
cookiemanluvsu,do not listen to them you are doing good you are a way better anthony then that other fag ,1,funny
cookiemanluvsu,bro,5,nba
cookiemanluvsu,it not racist it the truth it also exactly why you are reading the article right now and they are sitting in jail ,-10,minnesota
cookiemanluvsu,should not be downvoted for this it the most ridiculous shit they could have planned to do this ,-10,minnesota
cookiemanluvsu,dude can my girlfriend go with you she cool as fuck and pretty hot i do not know how she will feel about this but it sounds like it could be a blast for her ,-10,r4r
cookiemanluvsu,where were you before i bought my note7 ,1,videos
cookiemanluvsu,this is an absolute marvel the united states lacks things like this ,2,bizarrebuildings
cookiemanluvsu,i feel you gay bro hugs ,13,ForeverAlone
cookiemanluvsu,what is a foxhanx hanky ,1,knifeclub
cookiemanluvsu,i disagree with your mother appearance but i do not blast that opinion all over the internet ,6,NeckbeardNests
cookiemanluvsu,how could it not this is the purest form of neckbeard his pile of porn garbage toppled over and killed him while popping his eyes out of his head ,48,NeckbeardNests
cookiemanluvsu,that fucking wales weather ,1,thegrandtour
cookiemanluvsu,lol perfect ,-2,cringepics
cookiemanluvsu,oh lawd what have they been saving up a private stock for a couple years lol ,1,Sneakers
cookiemanluvsu,yeah that running joke needs to die ,-1,Sneakers
cookiemanluvsu,i get that bot error 80 of the time ,1,Sneakers
cookiemanluvsu,are these obsidian jordans gonna be a hard copy what do you all think about them ,1,Sneakers
cookiemanluvsu,just bought these from them i think they are dope ,1,Sneakers
cookiemanluvsu,what is dropping there tomorrow ,2,Sneakers
cookiemanluvsu,damn the color is that bad on the reps ,1,Repsneakers
cookiemanluvsu,thanks man ,1,Repsneakers
cookiemanluvsu,what does this pen do ,1,Repsneakers
cookiemanluvsu,thank you very much any yeezys you recommend getting from her ,1,Repsneakers
cookiemanluvsu,got it thanks ,1,Repsneakers
cookiemanluvsu,where do you find him ,2,Repsneakers
cookiemanluvsu,you got a link to find her ,1,Repsneakers
cookiemanluvsu,link it up,1,Repsneakers
cookiemanluvsu,how do i pay david ,0,Repsneakers
cookiemanluvsu,i know your british from the grass that some british grass we do not have that here in godland ,2,streetwear
cookiemanluvsu,get out fag,1,CringeAnarchy
cookiemanluvsu,who is this chick ,-1,shittyrobots
cookiemanluvsu,you think she attractive ,-1,shittyrobots
cookiemanluvsu,wot ,-2,shittyrobots
cookiemanluvsu,and this is why retail is literally dying before our eyes ,1,mildlyinfuriating
cookiemanluvsu,lol what is this shenanigans ,-7,tattoos
cookiemanluvsu,your edit made everything you have done before it awful i hate you ,0,movies
cookiemanluvsu,nah,0,Celebs
