name,body,score,sub
cookiemanluvsu,i do not know why but i always see fat gross white women with skinny normal looking black dudes i mean i know why they can manipulate them and turn them into their slaves financialy and sexually and they use their credit to get them cell phones ,-22,todayilearned
cookiemanluvsu,lol,0,todayilearned
cookiemanluvsu,i wonder if op mom would shit on me for 5 bucks ,87,todayilearned
cookiemanluvsu,these fans actually suck at being a fan no hard airflow ,1,interestingasfuck
cookiemanluvsu,that because you are an alcoholic but that o k ,3,quityourbullshit
cookiemanluvsu,what is a lepin ,3,lego
cookiemanluvsu,oh man that crazy lol cool stuff man ,2,hockey
cookiemanluvsu,saw them tonight at costco and bought them they are battery operated and have 4 different colored lights comes with a remote and different timer settings so you do not leave them on all day and drain the battery quite impressed with them to be honest 20 for a 5 pack and they come with individual toggle mounts pretty cool ,2,lego
cookiemanluvsu,i saw another guy on here with it and bought one it from a company called laser lab out of australia they have a store on ebay it was about 14 including the shipping i bought about 8 other ones too because shipping is only an extra 1 for them and i need good clean ways to display my boys lego sets hope this helps ,2,lego
cookiemanluvsu,oh man we had a semi pro team here in minneapolis about 20 years ago called the minnesota moose had the exact same logo they were all we had when the northstars were gone i wonder if they moved to manitoba ,2,hockey
cookiemanluvsu,no it does not black people are notoriously awful tippers that shits fact ,1,cringe
cookiemanluvsu,i think it a bit rude to be honest ,4,cringe
cookiemanluvsu,so dank,3,hockey
cookiemanluvsu,is your flair of the minnesota moose i cannot quite make it out on mobile ,1,hockey
cookiemanluvsu,they can do it a lot like alot ,1,nba
cookiemanluvsu,i was pretty disrespectful to your mom last thursday if you know what i am saying i am just kidding i do not know your mother,79,nba
cookiemanluvsu,so i can enter you ,10,nba
cookiemanluvsu,lol give him a good beating it should help ,-1,gifs
cookiemanluvsu,no,9,classic4chan
cookiemanluvsu,lol this picture is funny,1,lego
cookiemanluvsu,this is beautiful fuck chuck 2017 ,1,betterCallSaul
cookiemanluvsu,got to love that bonus track hidden in there shit that might be my favorite atmosphere song ,2,Atmosphere
cookiemanluvsu,lyndale ave users manual,3,Atmosphere
cookiemanluvsu,man will this guy shut the fuck up and act like a president this shit is embarrassing ,2,the_meltdown
cookiemanluvsu,i agree but i do not even think that the fucked up part here what is going on with his cock ,12,classic4chan
cookiemanluvsu,is anyone going to mention that fucked up dimensions of his penis i mean what the fuck it like 6 x 6 x 2,34,classic4chan
cookiemanluvsu,lol ,2,classic4chan
cookiemanluvsu,you know this is a show right ,3,betterCallSaul
cookiemanluvsu,good job brandon he gonna put you on blast ,1,Tinder
cookiemanluvsu,kill me,1,Tinder
cookiemanluvsu,this is the lamest shit i have ever seen lol,2,Tinder
cookiemanluvsu,oh i see ,2,asmr
cookiemanluvsu,that shits amateur hour try splitting 2 8 balls and 8 pills of thumbs up x ,1,justneckbeardthings
cookiemanluvsu,you nailed kim body language you are going places ,2,betterCallSaul
cookiemanluvsu,these are super dope nice pic op ,3,Nike
cookiemanluvsu,sup fam how you doin i am in the market for a hood nigga felon you know how to treat a down bitch ,3,facebookdrama
cookiemanluvsu, instead of gushers bitch you crazy ,13,ArtOfRolling
cookiemanluvsu,what is 8ch ,3,asmr
cookiemanluvsu,i will give you none of the things you are seeking ,1,r4r
cookiemanluvsu,why does the price tag say 600 ,1,Sneakers
cookiemanluvsu,lol i like you,4,evilbuildings
cookiemanluvsu,uhhhhhh,11,evilbuildings
cookiemanluvsu,yeah thanks but other people do ,4,evilbuildings
cookiemanluvsu,that an awful thing for him to do and i kind of hate him now ,7,evilbuildings
cookiemanluvsu,calm down do not over gay this ,52,gaybros
cookiemanluvsu,you mean like sell the baby i am down with this if it about making money ,2,CrazyIdeas
cookiemanluvsu,fuck you op well kill you ,1,OopsDidntMeanTo
cookiemanluvsu,do not worrie that person just a know it all douche,1,iamverysmart
cookiemanluvsu,why did you delete a ton of your comments like a bitch ,36,Sneakers
cookiemanluvsu,as he should what a cunt ,5,Sneakers
cookiemanluvsu,oh geez,1,CringeAnarchy
cookiemanluvsu,bro this is not yours fucking lame ,21,Sneakers
cookiemanluvsu,i support you othlan i stand with you ,-30,oldpeoplefacebook
cookiemanluvsu,lol,3,ForeverAlone
cookiemanluvsu,it a girl who married ,6,ForeverAlone
cookiemanluvsu,thank you mate that cray cray ,7,holdmyfries
cookiemanluvsu,wot links immediately please ,4,holdmyfries
cookiemanluvsu,please send proof of your location then i will send instructions ,3,CringeAnarchy
cookiemanluvsu,rad autisim ,3,CringeAnarchy
cookiemanluvsu,lol ok skinny 7 year old hulk ,1,nba
cookiemanluvsu,nice,4,WTF
cookiemanluvsu,ha stupid fucking baby got what was coming to him ,2,WTF
cookiemanluvsu,oh i see but why and where did this come from also thank you for answering this is the 3rd time i have asked this question in the last 3 days and no one has answered ,2,nba
cookiemanluvsu,lol,1,nba
cookiemanluvsu,help me out what is with all this le shit in the sub ,2,nba
cookiemanluvsu,what is a honeypot ,1,classic4chan
cookiemanluvsu,he also forgets to mention that the pay is garbage ,-24,ShitAmericansSay
cookiemanluvsu,please op,1,justneckbeardthings
cookiemanluvsu,nah,-8,Celebs
cookiemanluvsu,yeah i own all 4 the shining ferocity summer and black ice i am gonna keep stocking them ,5,Sneakers
cookiemanluvsu,explain your take here,18,todayilearned
cookiemanluvsu,yes,3,todayilearned
cookiemanluvsu,can you help me out and explain why i honestly have no idea ,1,nba
cookiemanluvsu,i am glad you are doing well,1,nba
cookiemanluvsu,lol,1,nba
cookiemanluvsu,nice,4,nba
cookiemanluvsu,lol,-1,nba
cookiemanluvsu,fuck man calm down,-3,AdviceAnimals
cookiemanluvsu,yikes that tough living ,1,Sneakers
cookiemanluvsu,i took it that same way and i think chuck did too you could see him turn away and do that fuck face grin of his ,20,betterCallSaul
cookiemanluvsu,yeah he seemed pretty cool actually lol,1,justneckbeardthings
cookiemanluvsu,wait what what are you talking about here ,0,justneckbeardthings
cookiemanluvsu,i like the one guy who looked like jesus i actually gave a hearty chuckle ,1,justneckbeardthings
cookiemanluvsu,i would say they are damn fine walking shoes ,1,Sneakers
cookiemanluvsu,yeah i am hoping these are dropping at my local nike store i want them ,1,Sneakers
cookiemanluvsu,honestly man i collect so i have not even worn them im at the nike store and just asked them and they said they run dead on tts so i guess i would go with that ,1,Sneakers
cookiemanluvsu,it would not be that long of a shot tho,1,videos
cookiemanluvsu,nigga you trippin,1,cosplaygirls
cookiemanluvsu,yes they are they make me feel like a fancy boy ,-1,Sneakers
cookiemanluvsu,not really most of them are not general release putters and they probably cost more than you would want to pay right now for a putter i love each and everyone in their own special way lol ,3,golf
cookiemanluvsu,he did not even make a move worthless ,1,blackpeoplegifs
cookiemanluvsu,that an ugly cat,-5,youseeingthisshit
cookiemanluvsu,do you know how you get custom stamps made ,4,futurama
cookiemanluvsu,kek,1,4chan
cookiemanluvsu,yeah i was talking about the marriage part lol,2,golf
cookiemanluvsu,it still ridiculous that the south is fucking ignorant and stupid to think beating your child with a stick that causes sever bodily harm is ok and normal ,1,minnesotavikings
cookiemanluvsu,i guess that does sound kind of bad ,3,golf
cookiemanluvsu,absolutely i cut him 10 days ago and have not looked back ,1,fantasybaseball
cookiemanluvsu,i own 63 scotty cameron putters it literally cost me a marriage ,10,golf
cookiemanluvsu,that fucking ridiculous he beat the shit out his his children genitals ,9,minnesotavikings
cookiemanluvsu,so not deadstock got it ,3,kicksmarket
cookiemanluvsu,post it my dude,-10,legaladvice
cookiemanluvsu,are these deadstock ,1,kicksmarket
cookiemanluvsu,must have a cool wife,2,TheKillers
cookiemanluvsu,dope,2,golf
cookiemanluvsu,honestly it probably your personality from top to bottom not trying to be mean ,1,ForeverAlone
cookiemanluvsu,good stuff man thanks ,2,WTF
cookiemanluvsu,holy fuck this is brutal,6,OopsDidntMeanTo
cookiemanluvsu,that super dope cool stuff ,2,lego
cookiemanluvsu,he was to much of a pussy to rape anyone and i mean that in the most respectfull way possible ,-2,niceguys
cookiemanluvsu,lol ,1,niceguys
cookiemanluvsu,can we please see the other 13 pictures please edit that light looks very useful and cozy for reading spooky stories ,1,WTF
cookiemanluvsu,good work,1,WTF
cookiemanluvsu,lol,1,WTF
cookiemanluvsu,lol,1,WTF
cookiemanluvsu,i believe you are right ,1,WTF
cookiemanluvsu,wow dude that crazy can you choose what location you want to go to ,1,WTF
cookiemanluvsu,did it help you get a job and a future career ,2,WTF
cookiemanluvsu,damn,1,WTF
cookiemanluvsu,thank you you explained this the best out of anyone ,2,WTF
cookiemanluvsu,what are they trying to prey on tho what is the benefit for this group ,2,WTF
cookiemanluvsu,i am tell us what the fuck it is is it governmental why do you go ,2,WTF
cookiemanluvsu,but also yes,1,WTF
cookiemanluvsu,geez dude that fucking cray how long did you have to stay there i am still confused why people do this ,1,WTF
cookiemanluvsu,lol like my heart ,1,videos
cookiemanluvsu,totes tree ,2,videos
cookiemanluvsu,i actually enjoyed him more then bob weird i did not know about him wonder what he doing now ,2,videos
cookiemanluvsu,i thought you were talking about taking a shit,2,justneckbeardthings
cookiemanluvsu,yeah and hes not worth a first or second round pick ,3,fantasyfootball
cookiemanluvsu,i actually cannot tell at all what you used to mount the ships to the wall ,3,lego
cookiemanluvsu, ,5,minnesotavikings
cookiemanluvsu,what did you do to have such limited parental rights and restrictions in the beginning ,1,daddit
cookiemanluvsu,hes not adrian peterson,12,fantasyfootball
cookiemanluvsu,murray sucked shit last year,2,fantasyfootball
cookiemanluvsu,this is exactly correct,2,fantasyfootball
cookiemanluvsu,the running game comes second fiddle to the passing game this ai not seattle anymore and he been gone a full year trainwreck incoming ,7,fantasyfootball
cookiemanluvsu,just drive home,2,minnesota
cookiemanluvsu,get back into that shithole and leave us with our childrens game ,5,minnesota
cookiemanluvsu,nah i do not give a fuck,-15,minnesota
cookiemanluvsu,can you explain wtf you are talking about,4,justneckbeardthings
cookiemanluvsu,it beautiful,1,justneckbeardthings
cookiemanluvsu,how did you mount the ships on the wall ,6,lego
cookiemanluvsu,alright,1,videos
cookiemanluvsu,i am a recovering drug addict and alcoholic i completely disagree with everything you are saying is it an uncomfortable question sure should i never ask it absolutely not ,3,ForeverAlone
cookiemanluvsu,well i do not know how i feel about all this now ,2,videos
cookiemanluvsu,oh shit this guy in the business himself ,22,videos
cookiemanluvsu,do not ever change ponyboy,3,pokemon
cookiemanluvsu,but those d ,-1,pics
cookiemanluvsu,how wonderfully autistic of you ,0,pokemon
cookiemanluvsu,you like it ,1,pokemon
cookiemanluvsu,the older one looks like a dope addict,1,aww
cookiemanluvsu,tell me this is not what i think it is ,1,Atmosphere
cookiemanluvsu,they already are but that not the point they make 70 of their wage in commission but i also pay them an hourly that the problem i cannot be forced to pay them 15 00 an hour plus that commission ,0,Minneapolis
cookiemanluvsu,you and i both know this story is real ,1,4chan
cookiemanluvsu,you are missing the point i would not be able to run my business if this law goes into affect ,0,Minneapolis
cookiemanluvsu,this is not a deal ,1,SneakerDeals
cookiemanluvsu,he has nothing,1,minnesotavikings
cookiemanluvsu,lol,1,minnesotavikings
cookiemanluvsu,oh i know why because he a fucking idiot ,1,minnesotavikings
cookiemanluvsu,that is not a babe ,0,FestivalSluts
cookiemanluvsu,yikes that sucks ,3,ForeverAlone
cookiemanluvsu,how old are you and what is your sex ,2,ForeverAlone
cookiemanluvsu,are you an alcoholic ,6,ForeverAlone
cookiemanluvsu,why ,8,holdmyfries
cookiemanluvsu,definitely british with the pimms,1,OldSchoolCool
cookiemanluvsu,uh yeah people go to church every sunday,3,NeutralPolitics
cookiemanluvsu,i am with ya man but we both know we are getting that note 8 and they know it too ,2,samsung
cookiemanluvsu,i see no picture,1,magicTCG
cookiemanluvsu,clean your sneakers homie,1,streetwear
cookiemanluvsu,why is this weird ,4,ShitAmericansSay
cookiemanluvsu,34 m hockey playing douchebag here holla at your boy ,1,r4r
cookiemanluvsu,wtf is desi ,1,r4r
cookiemanluvsu,i agree but what are we honestly going to do not but the note 8 fuck that the phone is going to be amazing i loved the note 7 ,2,samsung
cookiemanluvsu,lol,1,kicksmarket
cookiemanluvsu,you are definitely that guy ,22,magicTCG
cookiemanluvsu,muh you are young and having fun part of life ,0,meirl
cookiemanluvsu,you did nothing wrong mate ,4,meirl
cookiemanluvsu,what happened ,8,meirl
cookiemanluvsu,you sound terrible but honest but still terrible ,14,meirl
cookiemanluvsu,fucking money mate,1,whatisthisthing
cookiemanluvsu, ,1,funny
cookiemanluvsu, ,1,funny
cookiemanluvsu, ,1,funny
cookiemanluvsu, ,1,funny
cookiemanluvsu,please tell me you are not serious ,50,whatisthisthing
cookiemanluvsu,carmelo and kg have a feud with each other and fuck each others side pieces and talk shit about it on the court to each other theyre both married btw i know kg side women he been banging her since she was 18 she 35 now ,2,MMA
cookiemanluvsu,big up to you bro ,1,IdiotsFightingThings
cookiemanluvsu,i am at paisley park as we speak,1,Music
cookiemanluvsu,o7,8,ShitAmericansSay
cookiemanluvsu,i am gonna take a wild guess here and believe there are a lot more companies this would affect then just mine but ok ,-1,Minneapolis
cookiemanluvsu,is this called shoe raffle for shitty nmd is this sub called promote my instagram no and guess what you ai not raffling yeezys now delete this post and get the fuck back to instagram ,0,kicksmarket
cookiemanluvsu,so you are not giving away shit for free and are actually making money on this bullshit raffle get the fuck out of here with this garbage ,1,kicksmarket
cookiemanluvsu,i am a small business owner and this actually quite frightening to me ,-1,Minneapolis
cookiemanluvsu,what does this mean for me i own a small business and pay 10 00 hour to my employees plus commission their commission is much larger then their hourly would i still have to pay 15 00 hour ,-1,Minneapolis
cookiemanluvsu,take it easy,6,Minneapolis
cookiemanluvsu,are you selling something or giving away something for free ,1,kicksmarket
cookiemanluvsu,well that ridiculous,5,ArtOfRolling
cookiemanluvsu,lol,4,howardstern
cookiemanluvsu,super dope fits,1,golf
cookiemanluvsu,this shit is so lame,2,pics
cookiemanluvsu,thanks for your edit now i think you are a douchebag ,-1,pics
cookiemanluvsu,thanks,2,trees
cookiemanluvsu,oh damn ,9,oldpeoplefacebook
cookiemanluvsu,i will send my fine in tomorrow k,2,wildhockey
cookiemanluvsu,i will take this pain for you child so you can be better then me and live freely ,3,AskReddit
cookiemanluvsu,you have some pretty shit days ,-13,AskReddit
cookiemanluvsu,pssst nothing personal kid,6,wildhockey
cookiemanluvsu,it makes perfect sense ,3,AskReddit
cookiemanluvsu,i am frankly a bit tired of them but i am sure i am in the minority ,-78,AskReddit
cookiemanluvsu,man 420 is lame as fuck,7,trees
cookiemanluvsu,no you did not faggot ,-1,4chan
cookiemanluvsu,not really though,-1,fantasybaseball
cookiemanluvsu,if you have one you are offering then yes i will take it ,1,Kanye
cookiemanluvsu,yes i would rather kill myself then care for an autistic child ,1,Kanye
cookiemanluvsu,i am not assuming i know him it his job ,1,Kanye
cookiemanluvsu,do i really need an s on this i mean come on ,5,niceguys
cookiemanluvsu,o7,2,niceguys
cookiemanluvsu,interesting,1,4chan
cookiemanluvsu,good work,1,4chan
cookiemanluvsu,it does bud,2,4chan
cookiemanluvsu,fucking awesome,2,4chan
cookiemanluvsu,ahhh got it cool ,6,Repsneakers
cookiemanluvsu,if it shows retail price at other stores does that mean they are not honoring the deal ,1,legodeal
cookiemanluvsu,i am crying here,3,ForeverAlone
cookiemanluvsu,fuck i am dying in this thread lol,2,ForeverAlone
cookiemanluvsu,lol,1,ForeverAlone
cookiemanluvsu,is oath like the new truth ,28,Repsneakers
cookiemanluvsu,enough man,9,streetwear
cookiemanluvsu,so is this sub now just asian people wearing clothing from revenge of the nerds ,4,streetwear
cookiemanluvsu,it worth nothing ,18,holdmyfries
cookiemanluvsu,good point,44,holdmyfries
cookiemanluvsu,look i will be the one that comes out and says it your uncle is trying to have sex with you i am sorry if you need someone to talk to about this i would suggest calling your uncle ,-67,niceguys
cookiemanluvsu,but whos gonna do all that shit for me i think the ban probably needs to stand ,-1,pics
cookiemanluvsu,yes sir,3,Political_Revolution
cookiemanluvsu,ok fine i am going geez,12,Political_Revolution
cookiemanluvsu,no im fucking tired ,-7,Political_Revolution
cookiemanluvsu,time to take old yeller out back,1,rarepuppers
cookiemanluvsu,this guy should be a mod,1,Blind
cookiemanluvsu,dipped his knees like a bitch,1,Whatcouldgowrong
cookiemanluvsu,well that absurd,7,Marvel
cookiemanluvsu,op i think you might be retarded,2,facepalm
cookiemanluvsu,this is the most trashy thing i have ever scene i am unsubing now ,6,trashy
cookiemanluvsu,man i am really not a dick but op and his friends sound like a bunch of fucking dweebs ,1,KendrickLamar
cookiemanluvsu,you are a busy boy ,1,Blind
cookiemanluvsu,yeah thanks ,3,Awww
cookiemanluvsu,lol nice good job op,4,FoodPorn
cookiemanluvsu,you are incredible,1,Unexpected
cookiemanluvsu,f,15,4chan
cookiemanluvsu,and this is why i carry a gun,0,news
cookiemanluvsu,she did not turn around and get hit she was looking right at him and got punched in the face edit i actually went back again and you can see she had been throwing punches at someone and was in a fighting stance ,4,CringeAnarchy
cookiemanluvsu,where was the selfie could not find it ,1,SubredditDrama
cookiemanluvsu,bud you are getting recked and sound like a cunt,-1,place
cookiemanluvsu,i am old,1,pics
cookiemanluvsu,lol i know just busting balls never played a moment of basketball i do love basketball shoes though ,1,Sneakers
cookiemanluvsu,they are sir they are ,1,Sneakers
cookiemanluvsu,dat molly will get ya ,1,videos
cookiemanluvsu,of course just one more,2,Sneakers
cookiemanluvsu,oh cool,1,Music
cookiemanluvsu,performance i need these to perform my ass to the mailbox in the morning and possibly to a concert once a month will these work for that ,2,Sneakers
cookiemanluvsu,it definitely an enabling group we will need to work on that ,2,Sneakers
cookiemanluvsu,cool thanks,1,nba
cookiemanluvsu,you know what sub you are in right ,1,pussypassdenied
cookiemanluvsu,pfft look if you go looking for a fight and then get clocked it your own fault also that was not a sucker punch they were squared up ,5,CringeAnarchy
cookiemanluvsu, thank you for making great music sir ayyyyyyyy ,2,Music
cookiemanluvsu,i have never heard this band but they really sound like a new age rush good stuff though ,8,Music
cookiemanluvsu,how old is this song mate ,1,Music
cookiemanluvsu,i actually love carpeted bathrooms the floors always comfy and warm i know it ridiculous but fuck i like it ,2,CrappyDesign
cookiemanluvsu,honest question what does iso mean ,1,nba
cookiemanluvsu,tell me more about this back ally shoe buying please ,5,Sneakers
cookiemanluvsu,hahaha what the fuck,1,nba
cookiemanluvsu,i believe it said private plane but whatever the shit is fake anyways ,0,BlackPeopleTwitter
cookiemanluvsu,bro i am not trying to outsmart you i am shedding light on why they did it ,1,Sneakers
cookiemanluvsu,suppose you are right feels good to know i am not alone in this crippling addiction i am here for you bros ,8,Sneakers
cookiemanluvsu,i think these are the coolest kobe to drop you cannot tell much from the pic but the heal has a hard plastic on with a marble swirl pattern on it pretty cool shoes ,4,Sneakers
cookiemanluvsu, chill out lol k,-1,Sneakers
cookiemanluvsu,will you all shut the fuck up you sound like 9 year old whining little bitches ,1,Persona5
cookiemanluvsu,oh damn i hadnt heard about these im getting them ,1,Sneakers
cookiemanluvsu,not weird they capitalized on the popularity of these and wanted to sell a ton of units this was about making money today ,1,Sneakers
cookiemanluvsu,red ones if so what size you need ,1,Sneakers
cookiemanluvsu,no they are so a nuke walked into a bar with a nip ,1,AirForce
cookiemanluvsu,you really are,1,StarWars
cookiemanluvsu,they are sick i actually really dig em ,4,Sneakers
cookiemanluvsu,well it appears these are not a fan favorite ,3,Sneakers
cookiemanluvsu,listen to you you are very meta out in the wild ,2,oldpeoplefacebook
cookiemanluvsu,please do not use this phrase again,1,CringeAnarchy
cookiemanluvsu,she sounds like a fag,1,CringeAnarchy
cookiemanluvsu,this is the correct answer we have all been waiting for mods please pin this to the sidebar ,2,Sneakers
cookiemanluvsu,oh boy that was a poor choice ,1,classic4chan
cookiemanluvsu,lol did not even notice that ,11,classic4chan
cookiemanluvsu,nice,1,worldnews
cookiemanluvsu,nothing sounds like a good dude ,1,sex
cookiemanluvsu,this must be in honor of tomorrow eh op ,1,Nike
cookiemanluvsu,no i definitely wo not ,4,Sneakers
cookiemanluvsu,who would have thought ,2,xboxone
cookiemanluvsu,i have seen them severely injure other animals and humans and it crazy it like a switch gets flipped ,1,Awww
cookiemanluvsu,yeah we do not live in croatia,34,Sneakers
cookiemanluvsu,it looks like the guy in the picture might need to get to the gym and get his swole on ,0,Awww
cookiemanluvsu,they excluded the rainbows from this all the other racer colorway will work it worked for 30 minutes 2 days ago until they realized their mistake ,1,Sneakers
cookiemanluvsu,why are you posting this ,2,Nike
cookiemanluvsu,this comment section is the greatest thing i have ever seen in this sub keep it coming boys ,1,r4r
cookiemanluvsu,oh damnnnnnnnn,5,r4r
cookiemanluvsu,this guy,1,r4r
cookiemanluvsu,this breed of dog scares me ,1,Awww
cookiemanluvsu,i agree we need people to post recipes but not having this one is ok it looks like someone took a grumpy right in the container ,7,MealPrepSunday
cookiemanluvsu,look this guy seems to be doing all the right things and trying to put his wifes needs and comfort above all else he hurting because his wife is hurting and she cannot just sit down like an adult and tell him exactly what the problem is so he can at least have some answers on what the hell is going on hes clearly hurting too and she wo not even give him a chance to help or heal constantly running away crying is childish in my opinion and is only making the situation much much worse that my rationale behind it ,5,sex
cookiemanluvsu,i guess so,1,howardstern
cookiemanluvsu,it is just not your grandma recipe ,1,FoodPorn
cookiemanluvsu,i love how much you guys hate jan ,13,howardstern
cookiemanluvsu,good thing you blocked out his face because i was going to rape your dad ,4,Repsneakers
cookiemanluvsu,i know this is not helpful but your wife seems a bit immature ,-19,sex
cookiemanluvsu,who gives a shit it look delicious ,19,FoodPorn
cookiemanluvsu,yeah it better because this is the most beautiful scrumptious beautiful thing i have seen look at those tortillas eyeing that skillet up by gawd i am in love ,3,FoodPorn
cookiemanluvsu,trust me mate,1,ForeverAlone
cookiemanluvsu,hes out 4 weeks,2,fantasybaseball
cookiemanluvsu,thanks man ,1,fantasybaseball
cookiemanluvsu,good man thank you so much for the help,2,legodeal
cookiemanluvsu,those would be a fake pair of chinese knock off airforce 1 ,3,Nike
cookiemanluvsu,what is the cartwheel app worth it easy to use ,3,legodeal
cookiemanluvsu,what is your question,4,facebookdrama
cookiemanluvsu,op please answer this claim were better then that here ,0,ForeverAlone
cookiemanluvsu,they do not you just think they do ,1,ForeverAlone
cookiemanluvsu,right,2,ForeverAlone
cookiemanluvsu,wait they both turned into women ,4,netflix
cookiemanluvsu,why did they delete it ,1,videos
cookiemanluvsu,i am not coming at you i am just telling you the reality ,1,kicksmarket
cookiemanluvsu,bro these are still sitting in a lot of stores and online drop that price by 40 and maybe you will sell them ,3,kicksmarket
cookiemanluvsu,cripes,2,Awww
cookiemanluvsu,yeah i own 2 pairs of uggs and im a guy,0,rage
cookiemanluvsu,ahhh got it lol yeah you right ,1,betterCallSaul
cookiemanluvsu,help explain this to me ,1,betterCallSaul
cookiemanluvsu,yikes i am not feeling this ,0,streetwear
cookiemanluvsu,it probably your dad but i like your oreo flyknit racers,2,rage
cookiemanluvsu,lol go to his website,1,WTF
cookiemanluvsu,yeah they did that why people call them banned ,2,Sneakers
cookiemanluvsu,nah,-9,FoodPorn
cookiemanluvsu,thanks mate,1,SneakerDeals
cookiemanluvsu,that was a very nice and kind message this is also my favorite sub and im a normie i wish you well mate ,3,ForeverAlone
cookiemanluvsu,chapelle would be perfect ,2,howardstern
cookiemanluvsu,this is honestly the only correct and realistic answer ,2,howardstern
cookiemanluvsu,whats up with all your gay edits i know you are trying to be funny but bruh it awful ,1,pics
