name,body,score,sub
CrimsonCape,so uplifting it makes me want to sing ,3,pics
CrimsonCape,i do not think enough people realize the distinction that the justices control the fate of individual court cases and it the justice system that immediately interprets the application toward other cases some of which it would be a fallacy and incorrect application in this case comey said that the precedent was not there to prosecute h for gross negligence since they could only find one person in history who was brought in for that at the same time he proclaimed the exceptionally rare circumstances for this case in my opinion comey put too much weight into requiring precedence in essence now we have proof of a crime the classified docs on the server which they admitted to we need mens rea proof of the criminal mentality the only possible case being hillary wanted the convenience of a homebrew server imho convenience should equal gross negligence you could easily prove she wanted the server for her own convenience the extraordinary circumstances here are proving there is no current way to deal with convenience as a defense now it should be apparent that you could claim convenience in any manner of cases ie you incidentally committed a felony because you needed something else to be made convenient and use the same justification as hillary ,5,The_Donald
CrimsonCape,i have done both solo hunting in wma and group hunting in a club i would not suggest the wma route here are the two best ins i can suggest as a hunter hunting clubs revolve around dues to pay camp bills leases operating costs maintenance etc if you have friends in a club your best bet is to offer to be a due paying member at the very least that will show them that you are serious about your interest and they can save some money more people to share the cost of the dues and no sweat if you want to quit as dues are periodical your second in is to teach yourself some good recipes with game i took some of my neighbor rabbits and made some damn good grilled rabbit calvados and other hunters do not even need a bite they hear secondhand and they throw meat my way hunters want to eat what they kill and you would not be surprised to learn a lot of hunters are older and lazier people who can turn a hunt into a meal are highly prized cultivating this talent would possibly make you a sweet deal for a club to invite you ,1,AskReddit
CrimsonCape,do you blame hunter gatherers for not hunting gathering when they can go to mcdonalds you could call them really lazy that they choose to get easy food instead of getting difficult food but if they started hunting gathering again you would laugh at them for not getting their food like everyone else do you see what i am getting at participation in hunting gathering has simply been antiquated you could do it as a tradition or as a hobby but the activity is no longer necessary this is essentially the problem all activities face ,1,worldnews
CrimsonCape,carrying bags that resemble purses i am convinced this practice was hijacked from men by women at some point in history it is one of those things that women project they find men with big burly leather bags full of tools attractive so they start doing it and then men go ew and stop i had no idea it would be so useful to have a notebook a screwdriver crescent wrench and a place to put pocket stuff and packages and a place to put my carry anyway most men get by with messenger bag style i hated how straps and buckles are constantly hanging off of them and said fuck it ,3,AskReddit
CrimsonCape, song dongzhe a third mainland investor from the north eastern city of dalian bought his first british property a three bedroomed house in selly oak south west birmingham in 2012 for 125 000 earlier this year he bought two more pittar believes the story of ordinary middle class investors is more significant than that of china s globe trotting ferrari driving elite what we read in the newspapers is always about the very wealthy chinese who come and buy a 5m 10m 15m property but the middle class is key how big is the middle class it could be 120 million we tend to think it s probably closer to 150 million once they ve got somewhere to live in china the reality is that the domestic market is quite expensive so that s why they are looking more for international opportunities like anyone who wants to preserve their wealth diversification is important one veteran hong kong investor with a portfolio that includes properties in london manchester and liverpool explains you buy a large number of properties but lower priced ones you pay something like 200 000 or 250 000 rather than 1m for zone one in mayfair places like that this article is fairly unbiased but if you are a middle class american you should realize that there are lots of chinese investors ready to buy property that would otherwise be affordable to the middle class ,1,The_Donald
CrimsonCape,nice and spic e e y,2,The_Donald
CrimsonCape, hauled all over the world to answer to world courts this is the problem globalists like obama have with this law we are giving ourselves a unfair advantage we can sue you go ahead and try and sue us it unfair but it also unfair that a saudi can come and buy real estate that you or i might have been able to buy if things were different nbsp if your fellow americans in a jury determine that saudi arabians have some involvement in the deaths of innocent americans the best most impartial legal system on earth ours has arrived at that conclusion do you not respect the legitimacy of our legal system nbsp i do not see this law suddenly bending the rights of americans to a kangaroo court third world standard if anything foreign legal systems will probably get a healthy dose of manning up to our standards if they attempt to reciprocate ,0,The_Donald
CrimsonCape,you should be prepared in the diy mindset to handle mechanical issues yourself fundamentally that should precede your decision to buy an industrial machine this would include researching available parts online understanding what the parts do and having a minimum set of tools to maintain the machine older machines you pretty much just need a variety of screwdrivers and wrenches there are two directions i would suggest taking 1 if you are going to bring production up to the facebook business level ie making items to have a product line you would best be served 1 buying a machine 5 years old if you are willing to learn everything about it or 2 buying a new machine and having a relationship with a service center 2 if you are going to stay in hobbyist quantities one item every now and then you should get a well taken care of machine made in the late 50s to mid 70s these machines were mechanically designed for self service if you buy that juki the minute you use a triple feed or needle feed machine you will kick yourself simple test lay two pieces of sil on a desk use your finger push down on both layers and drag your finger across the desk this is pretty much how a straight stitch will handle sil the feed dog will not bite both layers and they will slip wacky now pinch both layers between your fingers and pull the material across the desk this is how the walking foot above pinches against the feed dog underneath and drags the fabric sandwiched together night and day ,1,myog
CrimsonCape,surprisingly well put the first clinton trump debate was roughly a draw which is bad news for her because she needs to turn this race around and she failed donald trump remains the candidate of change hillary clinton the tribune of the status quo ,5,The_Donald
CrimsonCape,in my head i heard that stupid song sail which made it on to almost every youtube clip at one point ps you have to have a shirt with embroidered flames on it to play that song ,1,gifs
CrimsonCape,this sooooo much why in the world is everybody demanding immunity in this case yet supposedly nothing illegal happened sure does seem like it and why the fcuk they can plead the 5th and have immunity is not the point of immunity allowing you to not need to plead the 5th all this makes no sense ,51,The_Donald
CrimsonCape,what exactly is colin kaepernick narrative for protesting i cannot say he makes any more sense than his naysayers the image of black people being shot by whites is really evocative and polarizing but he does not seem to have an opinion beyond the baseline emotional reaction does he have a problem with people being trigger happy does he have a problem with drug laws does he have a problem with the concept of civic patrol a problem with criminal prosecution police preponderance of evidence more training less cops what he is essentially like a child who whines that their bologna sandwich is stolen at lunchtime if we acknowledge the problem is the bully who stole the sandwich or the people who sat by while the sandwich was stolen that is sensible ,-8,AskReddit
CrimsonCape,dude might want to rephrase that before someone calls cps i suggest adding when my kids grow up to be adults ,3,AskReddit
CrimsonCape,where do they get this impression that the entire syrian population should be thought of as potential future us citizens protip they are not,1,The_Donald
CrimsonCape,found some juicy information from this government document https assets documentcloud org documents 2842429 esp 16 03 final pdf in march 2009 after unsuccessful efforts to supply secretary clinton with a secure government smartphone ds was informed that secretary clinton s staff had been asking to use blackberry devices inside classified areas the assistant secretary of ds then sent a classified memorandum to secretary clinton s chief of staff that described the vulnerabilities associated with the use of blackberry devices and also noted the prohibition on the use of blackberry devices in sensitive areas according to a ds official shortly after the memorandum was delivered secretary clinton approached the assistant secretary and told him she gets it remember those blackberries smashed with a hammer coincidence heres the big one in november 2010 secretary clinton and her deputy chief of staff for operations discussed the fact that secretary clinton s emails to department employees were not being received the deputy chief of staff emailed the secretary that we should talk about putting you on state email or releasing your email address to the department so you are not going to spam in response the secretary wrote let s get separate address or device but i don t want any risk of the personal being accessible so hillary was perfectly cooperative turning over the yoga emails but that contradicts what she said herself in the above quote does not it what risk was there in her personal being accessible it obvious something happened between 2010 and the day she released that made her not worry ie deleting the risky ones ,1,The_Donald
CrimsonCape, votebuilder as title sounds so devious i can picture a hypothetical explanation of what a votebuilder software does well you see you might have cast a republican vote but we apply an algorithm that applies a complex metric to determine if average income economic outlook geographic considerations or demographics might play a factor in the vote you cast if your vote deviates significantly from the metric bounds your vote is either dropped or a logic is applied that smoothes the curves and refactors the outcome writing corporate doublespeak is so fun ,2,The_Donald
CrimsonCape,i am not surprised suits is struggling the premise of season 1 was two buddies who excelled at kicking butt in the batman robin dynamic the challenges were thrown at them and we got to see them fight it out and be victorious apparently the creators cannot recognize their own successful formula nobody cares about robin outside the context of batman when the plot turned so that mike went investment banking it was over ,1,television
CrimsonCape,do they think we have all kinds of excess iq points we can throw at interpreting this sign gah too hard to read ,0,pics
CrimsonCape,yeah good point is snowden a deplorable is assange a deplorable ,3,The_Donald
CrimsonCape,it a complete joke clinton supposedly did not send any classified information through her unsecured server so why is everything redacted and placed in a secure room for classified information ,148,The_Donald
CrimsonCape,what exactly does ron paul advocate under the umbrella term liberty is it liberty for gangstas to own detroit is it liberty for american isis supporters to go about their business is it liberty for countries and corporations to waltz across what used to be a federal border any of those could be protected under the mistaken notion that they deserve liberty yet none of those groups behave in constructive ways toward society ron paul is culpable in the greatest travesty of the 20th and 21st century the perpetuation of dystopia decay nihilsm as a constitutionally protected freedom these people who do not have a lick of constructive contribution to society should not be protected ,2,The_Donald
CrimsonCape, finger steeple intensifies ,3,The_Donald
CrimsonCape,i feel like you are trying to squeeze this into the frame of republican versus democrat i am squirting out of that frame and out of this thread like a wet bar of soap just remember in november that trump was supposedly a secret plant by the democratic party for months he was attacked as being a closet democrat in every debate his talking points were actually all democrat positions and he sounds awfully like bill clinton used to and by then i hope then you will finally understand what you seemingly do not get at the moment ,1,AskReddit
CrimsonCape,your writing and you belief that the republican position defunds and obstructs the government does not give one ounce of consideration to the people paying taxes which funds the government so in that regard you are making the case for trump existence and why he will win much of what used to be the democratic base if you still think this is a partisan issue that yours to think if your objective is to purposely diminish that taxpayer contribution again all yours a more accurate description of what is going on is defunding people from their paycheck and obstructing their ability to put savings in the bank just read around this thread and you will see the case in point except now people with preexisting conditions can get insurance too they will just be defunded along with the rest of the healthy people p s of course none of this mentions people who are purposely gaming the system of which low class is not a life happenstance but a badge on the sleeve the kind of people ready and blessed to cash in on that plan to cure all their maladies before the ink dried i am sure there are plenty of those out there there nothing noble about it ,0,AskReddit
CrimsonCape,op described the back pain as a moderate issue that he can no longer pay for with insurance maybe he is now paying cash out of pocket maybe he stopped treatment altogether the point is that he no longer has insurance as an option for a moderate health issue which in this case might mean he no longer has any treatment period maybe you applaud the aca rolling erosion of the ability to treat moderate issues but like alot of people are finding you still pay the exorbitant bills for something that you cannot even use ,2,AskReddit
CrimsonCape,the aca does not move in the free market direction it moves in the socialized medicine direction this discussion is about how insulin costs continue to rise under the aca the anecdotal evidence is contradicting your belief that we need more of the same to suddenly become good ,0,AskReddit
CrimsonCape,sparrower1 pays a shit ton more and he cannot get treated for his back problems you were not able to get insurance now you can and can get insulin because it helped you you seem willing to accept that someone else has suffered because of the aca now he has to live with back pain that could have been treated you claim that your family is well off yet cannot afford to pay for insulin which is it if it were life or death would not you spend whatever it takes to survive maybe the cost of insulin rises because now insulin is being offered to everyone else who joined the aca market and can get it covered point being you will not avoid the reality that price will always set by the market the elephant in the room that is raising the cost of insulin is thirty years of socialization of medicine ,11,AskReddit
CrimsonCape,come on your reply is non sequitur you did not actually address his point about aca being overly burdensome on working people ,2,AskReddit
