name,body,score,sub
CrimsonCape,i would think having health insurance is a prerequisite before volunteering at any volunteer fd that not a good example ,1,explainlikeimfive
CrimsonCape,my company pays health insurance that practically guarantees an mri as soon as it needed i am barely middle class why argue for a system that only the rich get expedient service ,1,explainlikeimfive
CrimsonCape,lol so why argue for government healthcare while simultaneously pointing out how common it is to avoid government healthcare ,1,explainlikeimfive
CrimsonCape,i wonder why you say i cannot even imagine having to think about choosing life or money to me that is sick yet two sentences before you say we probably would not have wanted to since we just bought a house and would not want to financially ruin ourselves so for the record you choose to have money instead of spending it on treating lynch syndrome ,2,explainlikeimfive
CrimsonCape,til an unborn child is as vicious and deranged as a murderer ,8,explainlikeimfive
CrimsonCape,media double standard of the day white man but always black teens youths young men ,-8,news
CrimsonCape,another victim of roomba our robots work great some assembly required removing most of your furniture required ,1,mildlyinteresting
CrimsonCape,i just need you to save one more settlement ,-1,gifs
CrimsonCape,hugging a rifle helps the larger the caliber the safer you will feel protip stainess steel guns will not be affected by the salts in tears ,6,science
CrimsonCape,agree that men are superior is dysfunctional but maybe you focus on this to avoid addressing women are are inferior which to me is the predominant form of sexism anecdotally the former is rare whereas the latter is prevalent telling a woman haha i can lift more weight than you is quite a different thing than jesus do not try and lift all that weight ,1,science
CrimsonCape,nah cannot stand to go to the canada realm you cannot equip any weapon better than a crafted bow and arrow who wants to grind fishing trout for sustenance everybody kinda learned back oregon trail alpha build you need at least muskets ,1,outside
CrimsonCape,my assertion is that an atheist would best think of himself or herself as a sort of luddite and not make votes on religious issues on behalf of religious people i oppose cherry picking from somebody else staunch beliefs and assuming that the resulting moral slurry is actually superior ,1,TwoXChromosomes
CrimsonCape,cannot tell if heresy or upvote,1,pics
CrimsonCape,ohhhh good god man,1,OldSchoolCool
CrimsonCape,in the context of making governmental policy if an athiest reliably makes pro choice votes or pro life votes they are not atheist it a wrapper around their true self if they refuse to vote on abortion on account of it a moral gray zone and i do not believe there is morality that would be some corroborative evidence that they are indeed atheist but i doubt people would elect or respect the opinion of atheists ,2,TwoXChromosomes
CrimsonCape, if you can show me anything scientific that indicates that an embryo does meet all of qualifications to be called life based on the definition if you need proof why ignore the guaranteed final form that the embryo takes ie a child it wo not become a frog or a snail or anything else living or dead you cannot swap out the dna to turn a frog embryo into a human embryo nor can it survive halting development at pre infant level it guaranteed to die there nobody with a jar of pet embryos it guaranteed to become a child it not the obligation of a religious person to define prenatal life in a way that makes it any less sacred ,1,TwoXChromosomes
CrimsonCape,the person is arguing from a rhetorical neutral not a moral neutral rhetorical neutral being feel good phrases like yes abortion is a serious issue which makes the person sound really concerned but you still do not know if they are pro life or pro choice it a low risk way to participate in the discussion while avoiding challenges your question about killing kids is perfect for 1 people who are too meek to take a position and 2 for people who think they have the answer without morality for the record i obey the 6th commandment ,1,TwoXChromosomes
CrimsonCape,does a man leave the family because he hates the child or because he hates that the mother is going to fight to take his income of the two possibilities one is a lot more prevalent than the other men who do not want the child and do not contribute child support well these men deserve the state verdict and the resulting penalties for running from child support as to the gestation yes it a biological reality men have made it simpler by constructing quiet and clean hospitals inventing painkilling medication during caesarian section antibiotics to prevent infection surgical procedures etc that not literally nothing ,-1,news
CrimsonCape,he she took that position to seem neutral that how you make sense of it ,0,TwoXChromosomes
CrimsonCape, i would need proof this is a part of a larger picture as it seems you likely do not believe in god asking for proof if an embryo is alive is not what you meant because scientifically it a multicellular organism and is alive you meant to say is it a person or does it deserve the same sanctity of respect as a human these questions in principle have no possible answer much like asking if god exists the issue is purely a matter of faith for example you are relying on some kind of faith by suggesting that murder is bad if i play devil advocate competing animals kill each other all the time maybe it amoral do you believe that can you prove to me that killing another person is bad ,4,TwoXChromosomes
CrimsonCape,trump is currently in the process of building an administration that will vote away roe vs wade and you are confident enough to crack jokes about who has legal control i applaud your confidence ,1,news
CrimsonCape,it your opinion that obviously more of a direct and physical impact to the woman than it is the man whereas one could strongly argue the opinion that 18 years of labor to pay child support is actually akin to enslavement by the state and by far more of a direct and physical impact to the man than the woman would not it be fair to assign financial responsibility based on want ie if the father wants the child he pays more while if the mother wants the child she pays more and if neither wants the child tough cookies they both pay 50 50 that seems truly equal and fair ,1,news
CrimsonCape, we could have a society with potentially no unwanted children where everyone grew up wanted in a loving home do you think men feelings should be respected when determining who is an unwanted child maybe you think a loving home does not include his feelings that would be pretty disturbing ,-1,news
CrimsonCape,men should be given legal control of the percentage of y chromosomes in the fetus y chromosomes are not part of the woman body ,-5,news
CrimsonCape,do you not understand hypocrisy pro life people argue every day that children deserve the support of their parents in addition to deserving the chance to live why would a child deserve one but not the other ,1,news
CrimsonCape,we are best friends ol buddy i will fookin kill yeh i love you always,60,aww
CrimsonCape,saying i hate black people without context and being criminally charged for it is madness ,0,worldnews
CrimsonCape,https www bfads net ebay black friday cyber monday deals sneak peek this one is on black friday says ebay could have the xps 13 at 899 for the same i5 256gb model as that cyber monday link that would be 50 cheaper ,1,blackfriday
CrimsonCape,if there was no dirt in the leaked emails there would be no story here ,-1,worldnews
CrimsonCape,where can i a pair of a wesome b alancing s truts ,13,gifs
CrimsonCape,we want her to illegally emigrate duh do not you want her she funny and bonus has a vaaaggginnnnaa,1,pics
CrimsonCape,just like some latinos are legal some are not though ,2,pics
CrimsonCape,trade him for a few decent cute otter gifs some healthcare and that spicy reddit thread about shitty places in canada fair trade in my book ,1,pics
CrimsonCape,one of your recent refugees presumably somebody remind him there are not actually virgins in those islands ,1,pics
CrimsonCape,latency is low and perks are still available in the us 1 server but they cannot keep handing out characters to trial users it drives away the high level players ,1,outside
CrimsonCape,dude do not come complaining in this thread you know what our answer would be grind more or drop more on dlc the last dlc drop included all kinds of stim packs ,2,outside
CrimsonCape,people keep donating free keys over there i think they feel like there is no other choice but to make more players to accomodate all the keys ,23,outside
CrimsonCape,xp not spent on research is still xp sometimes a high level player can contribute unspent xp to a tree research and instantly unlock multiple branches very little grind involved ,8,outside
CrimsonCape,just use logic next time not fallacy,1,television
CrimsonCape, universally condemned as racist rhetoric you are going against the grain on this so i am pointing that out my definition of the grain would be the voting majority which would make my opinion pretty well substantiated i could argue that trump comments fit all of webster various definitions that would be a bad idea since you would be heaping a lot of word salad on what is already a fallacy the term race is hardly use in the research field nowadays researchers prefer to use ethnicity instead blatant rhetorical appeal from a book titled racism and ethnic discrimination published in 2011 by lentin page 84 you need a different hobby this is what speaker ryan had to say about it you are still appealing to authority yet more rhetoric and paul ryan is still a benedict arnold putting all your fallacies weak appeals and paper thin justifications aside you seem determined to prove that trump is racist that was pretty much the modus operandi of hillary clinton strategy of the election trump is a racist xenophobe vote for me since she lost the outcome according to you must mean that more than 50 of the voters agree with the racist bigot and therefore are probably racist and bigoted too that kind of broad stroke divisive belief toward half the country literally just lost a presidential election i am not sure why your strategy is to double down on it ,1,television
CrimsonCape, this is judging someone not by the content of their character but by their color or heritage using the words color which describes skin tone and heritage which describes nationality and trying to equate the two is the fallacy i mentioned they are factually not the same if you need to research what makes this fallacious non sequitur is a good starting point every republican criticized trump for this comment argumentum ad populum yet another fallacy ,6,television
CrimsonCape,your example is fallacious and wrong it would be racist for example if the implication was that a white person would do a better job as a judge than a brown person or if he made some kind of blanket judgement like brown skin people always make different judgements than whites ,3,television
CrimsonCape,you did not actually address his point everybody has problems so why force somebody to acknowledge and possibly diminish their own problems and disown their own accomplishments to make somebody else feel better ,1,pics
CrimsonCape, pour some sugar on me def leppard ,-8,news
CrimsonCape, barack obama tortilla curtain if we are attributing responsibility to the leadership cannot wait to call the wall donald trump labyrinthine abbatoir defended by the meat grinding gargoyles we are going to make flaccid political issues great again ,1,worldnews
CrimsonCape,she a died in the wool hypocrite no way she is going to forsake the manhattan penthouse she just spent millions on in lieu of self deportation lets cut straight to deportation ,3,The_Donald
CrimsonCape,need cnn permission at the very least ,2,IAmA
CrimsonCape,here i fixed your edit to make more sense since you did not provide any evidence for your claims i am going to research why you would make such an outrageous statement wow i found a scientific paper utility of predicting group membership and the role of spatial visualization in becoming an engineer physical scientist or artist from the journal of applied psychology 78 250 161 1993 ,0,The_Donald
CrimsonCape, holy fuck i am currently an engineer and a woman then you are a statistic minority why do you think other women are not like you ps hypothetically try to answer without saying the patriarchy held those women down i would have felt totally unfilled my whole life has i listened and believed those things were true if a girl honestly asks what careers would satisfy curiosity in math or science absolutely nobody would deny engineering as a potential choice the problem is getting her to ask the question to begin with i can promise you that more women would love to be engineers if they were not told these things their whole life did people seriously tell this to you as a girl if they did they are asses but i get the feeling you are making it up i would love to see studies that prove what you are saying is true if it false and i made it all up then in your eyes i am a liar and reprehensible if it true that there are many studies then you would say it the patriarchy fault and still i am reprehensible being a man and all either way it appears i lose and you never acknowledge reality ,0,The_Donald
CrimsonCape,i had some issues when i was in college because i was bitter here were 18 year old kids rolling in on a wave of their parents money driving luxury vehicles and seemingly getting all the attention and success i thought would fairly come to me too my parents had encouraged me to be intellectual i trusted that intellectual people were noble and right and yet here were people in college spending every day fucking around lazy and nevertheless constantly with an abundance of social connections i could not square the difference between what screamed success among the college crowd and what whispered success from my intellect so here what changed for me nobody vocalized to me that the situation was unfair and that society mashes up everybody into school with no inherent care i had to figure that out if there was a growing up book paragraph 1 would be life is not fair or it not fair for some while it really fair for others which does not change the fact that there is nothing determining fairness or success i started to question why would school put intelligent people in with people who could not wait to get out of class to hammer down bud light it started to make sense how the educational system is the victim of numerous political levers for example if your school is dependent on state funding and state funding is awarded for good grades would not the teachers and administrators be compelled to bend grades to pass dumb people they get funded dumb people get passing grades everybody is happy what would be the potential downsides of that form of corruption being able to ask this question is like three magnitudes of maturity from where you are up until that point i had an almost blind trust that no people are noble we are all the same in that regard so to relate my story to you i shared it because nobody will tell you that much like o p topic very rarely are these issues caused by the individual alone do you stop and think that society might value you for being a social shut in ,2,Documentaries
CrimsonCape,you are posting in a conservative subreddit therefore i feel obliged to comment from a conservative point of view i am obliged to point out that 1 women in engineering is an aspiration very often politically motivated bad and 2 it contradicts scientific proof of differences in mens brains versus womens brains i am not suggesting it a bad goal to get more women into engineering i am suggesting it is a bad goal to get women into engineering by willingly ignoring science or purposely defy science because of an aspiration it doubly bad to encourage this because it causes political feel goods ,-6,The_Donald
CrimsonCape,there is a difference between discussing the issue and being confronted with the issue in a compulsory challenge by an antagonistic left wing establishment masquerading as a neutral moral authority the debate was a typical journalist attempt at a gotcha ,1,The_Donald
CrimsonCape,i disagree his stated position is perfectly moderate you are just used to counter abortion arguments being so weak that silence ie no argument is better ,1,The_Donald
CrimsonCape,pretty sure it won for best bus chase under 50mph not involving a chase car and for best explosives not real simulated in a supporting role ,1,funny
CrimsonCape,i guess the article missed the part where he said i was genuinely shaken to my core no just no i really cannot it 2016 that not who we are america and had a sudden urge to fling some chicken schwarmies against a wall ,2,The_Donald
CrimsonCape,find a way to turn your nice sentiment into a reality for everybody and we will give you a billion dollars until then you only deserve a worthless upvote cheers ,1,AskReddit
CrimsonCape,hypothetically if just one other person supports a candidate having the support of one person qualifies as representing a constituent belief i going to make an assumption what you are really upset about and let assume that candidate has 40 of support that seems like substantial evidence the candidate is representing the constituents ,2,AskReddit
CrimsonCape,you must not have been around like 6 months ago reddit pulled the ability to sticky items this was part of the batch of reddit changes that manipulated the r all algorithm the front page of r all used to be a wall of t d posts because of their immense popularity the reddit announcement at the time was literally we have unfair representation in all results and are changing this to be more fair reddit ceo spez let talk about orlando https www reddit com r announcements comments 4ny59k lets talk about orlando edit added link to spez post ,1,The_Donald
CrimsonCape,too late my bros and i call ugly chicks no vaj ,0,pics
CrimsonCape,maybe you are not assertive enough to turn an acquaintance into a hookup question for you pretend one of these girl friends is having a conversation with another girl the other girls asks hey i see you hang around with darkfade sometimes why are you friends with him what would be your guess to what friend girl says ,1,videos
CrimsonCape,this is spicy the most logical reason you do that is to keep non business emails out of your business account except business in this case is the presidency so chances are this address will contain lots of emails about the machinations of the democrat party that they do not want the government knowing about ,2,The_Donald
CrimsonCape,every time i see israel position quantified in print they appear to take the most nationalist stance on everything all nationalism for them none for americans i take it so hypocritical ,5,The_Donald
CrimsonCape,foval does the dirty work but make no mistake bob cramer is the snake and a piece of scum ,1,The_Donald
CrimsonCape,two laws could affect bringing charges against her this one and the gross negligence one this law requires the prosecution to prove mens rea which means mentality at the time of the crime so proof is not enough you also need to prove that she had criminal mentality or intent at the time in addition comey refused to follow the gross negligence charges because nobody had ever been prosecuted under this law except for one fbi agent once definitely nobody at her power level that paper thin hilariously there is proof of intent out the wazoo that she established the server for her own convenience what comey verdict means is that combined with the physical evidence that that the law has been violated that means comey is indirectly protecting convenience as a justifiable way to violate the law ,28,The_Donald
CrimsonCape,can someone eli5 the obscured light coming out of the galaxy center is it obscured because there is so much space junk between earth and the center would it be really bright otherwise ,1,space
CrimsonCape,that steer looks just like i feel ,1,pics
CrimsonCape, say no more fam signed disney ,1,movies
CrimsonCape, trump is a megalomaniac is not eloquent it borderline slander which is prosecutable in court ,0,caseyneistat
CrimsonCape,so you do not like that he openly endorses hillary but have no comment on him calling trump a megalomaniac in terms of causing anger pretty sure the latter will set off more people than the former he is insulting half of the voting electorate ,0,caseyneistat
CrimsonCape,you seem to have conflicted beliefs on this issue you seem to believe that automation is an inevitable reality which in principle requires you to take a political stance that is at best naive of the effects of automation people and could be portrayed at worst as proof that you are overtly pro corporation consequences on normal people be damned so in that regard you seem pro big business right wing however based on your belief in redistribution which would be a socialist leaning position you seem liberal at the same time i guess maybe you want the technological advancement and the social programs at the same time ,1,Futurology
CrimsonCape,you prefer the ground beans the plant beans are much better ,1,funny
CrimsonCape,well why not half or in other words why not 50 of what you have why not give me 50 of what you earn if you do not like 50 maybe you would give me just 15 would you be surprised to know that trump is proposing a 15 flat tax i am going to go ahead and assume since you wo not give me 50 but you would give me a little i will pretend a little is 15 and surprise suprise you sound like a conservative again ,2,AskReddit
CrimsonCape,well assuming you want equality if i give you my paypal address will you send me half of the money you have how do you feel about that if not i am genuinely curious why not i mean if you think it would be unfair or if you think i did not earn half of your money or you think i should get my own money and not take yours congratulations you are conservative and you are preventing me from being equal to you the only other option pretty much is that you would rather share your money with people you like which is a much clearer and honest assessment of what equality means take money from whites and give it to another race tribe or political affiliation ,2,AskReddit
CrimsonCape,the white middle class was not left out as much as it was treated like a treasure chest that was overflowing and in need of taking from search obama redistribution and have your fill of reading ,5,AskReddit
CrimsonCape,dude do not non sequitur non governance is fantasy that a convenient way to avoid your cognitive dissonance about thinking dirty right wing thoughts ,1,news
CrimsonCape,you can call white working class low skilled workers losers in today market losers but qualitatively the chinese guy on the assembly line working 12 hour shifts is living a life of suck we just do not talk about them because the market has been a massive case of dilbert just keep tossing the suck to the next loser who is too poor to complain ,1,news
CrimsonCape,taking the foxconn example and an iphone what qualities contribute to the workflow of making the iphone hypothetically it is a mashup of culture socioeconomics and demographics in addition to technology socioeconomically chinese laborers are willing to get paid far less culturally chinese are more efficient at suppressing emotion and focusing on their assigned task demographically there are enough candidates for the assembly process that one guy can master soldering one chip and there are 100 guys in addition to him mastering soldering the same chip not to mention the x number of dozens of other components this frame of reference the discussion of the homosapien aspect is what i think is purposely concealed by discussing automation even with much more advanced automation an american laborer is not going to overcome the market benefits of a chinese laborer apple will simply keep replacing its chinese workforce with robots in other words apple will probably never achieve an automation level enough to relocate the factory back to the usa ie automation sufficiently advanced to overcome the market inefficiencies of american labor because even during the process of replacing workers with robots it makes more sense to be replacing chinese workers with robots ,1,news
CrimsonCape,they might want to diversify their operation it might not be a good idea for the ceo to be chief tester ,1,videos
CrimsonCape,i get the feeling that automation as a conversation topic is meant to avoid discussing the problems of a skewed labor market realistically automation is not a blanket wonderdrug for all industries even with automation some products need a lot of human labor to get them to spec lets hypothetically you have a company a and carbon copy it b at the same time company a decides to invest in automation company b decides to find a cheaper labor pool when b finds cheaper labor it can immediately take the expenditure difference and shift more profit to the ownership squirrel some away for r d and charge less for the product maybe there would be a day that company a automation could overtake b but realistically b is going to undercut them much quicker and probably drive them out of business in principle automation only becomes a viable pursuit once labor costs have been minimized to the lowest possible amount ie exporting work to the cheapest labor pool possible ,1,news
CrimsonCape,a brief google search showed ron paul cosponsoring a bill for the cu national associates organization http news cuna org articles cuna welcomes visionary cu capital bill ,2,The_Donald
