name,body,score,sub
CrimsonCape,it proves comey is a sperg who goes into conniptions comey was shaking literally shaking ,2,The_Donald
CrimsonCape,not to mention inadvertently skewering flynn as if flynn was an evil guy it just making comey look like the snake ,1,The_Donald
CrimsonCape,without the wicked witch of the west wing we would never have had cheeto benito,0,Libertarian
CrimsonCape, i must complete this homework so that i can play outside later i am understanding delayed gratification but consider this circumstance what happens to your decisionmaking when you realize the homework will take hours to complete puts you past dark and you cannot play outside the quid pro quo do homework now play later would require like 1 hour of painful work and a reward of 1 hour of play for it to make sense in a child mind how does the mind react when the circumstance is at best unfair i will really spend 2 hours of homework for 30 minutes of play and at worst diabolic whats wrong with you kid to be normal you have to work for hours and hours and you probably will work through playtime anyway oh well go to bed and hope tomorrow is better i can see this cognitive enslavement causing more neurological problems than anything mentioned here ,7,askscience
CrimsonCape,what supportive media apparatus is brainwashing people to deny climate change aka global climate shift aka global warming ,3,news
CrimsonCape,according to that article non hydroelectric means provided 9 2 of power therefore of 16 9 only 7 7 was solar wind and other green sources i personally see the lasting effects of dammed reservoirs as something we absolutely do not need more of ,5,news
CrimsonCape,or you could do the unthinkable and back off your untenable positions you first of course ,1,news
CrimsonCape,such a non sequitur fallacy the question is whether the president is granted powers to deny visas to foreigners ,1,politics
CrimsonCape,is not the law written to allow the president the ability to block immigration at his discretion cannot he do it regardless of the purpose they are trying to distract from the whole point which is if the president has the authority to do this pretty sure he does no matter if it on a campaign promise or if he simply cares about americans the reason is irrelevant i thought ,2,The_Donald
CrimsonCape,this person is a living breathing stereotype in the wild ,1,news
CrimsonCape, pathetically small neo nazi crowd incites violence in peaceful downtown brussels news,4,news
CrimsonCape,so the producers already frantically caught some of the leaky plot holes but not others how i understood your comment ,2,movies
CrimsonCape,yep good thing every ship tech like life support avionics cooling heating ai landing gear autopilot are unaffected let us throw humans into the meat grinder ,3,movies
CrimsonCape,this all sounds like the absolute robotic decisions of a focus group or a disconnected studio head instead of scott vision james cameron i must watch this and think so glad i got out ,3,movies
CrimsonCape,remove one digit from covenant and you get the same number of digits as combine and since they both start with co hl3 is practically a given ,1,movies
CrimsonCape,it seems like the characters of alien and aliens were stupid in no way very good movies it seems like the characters in every alien film since are purposely made stupid bad movies i cannot stand the jarring expectation that viewers are ignorant of this when in fact dumbing the characters down is the one factor that makes the move bad ,2,movies
CrimsonCape,do a search for eth rich no results at all ,2,The_Donald
CrimsonCape,searching that sub for seth rich returns no results wow ,5,The_Donald
CrimsonCape,trump signed comey resignation letter which included the statement that on 3 occasions comey admitted they were not investigating trump how is firing the guy who did no investigating an obstruction of the investigation ,0,esist
CrimsonCape,the rent is too damn high ,1,aww
CrimsonCape,i will acknowledge this cynical rationalization and build upon it the majority of opinions are useless when employed as self expression the reality is that opinions reinforce social proof and create social cohesion and have nothing to do with self expression ,2,QuotesPorn
CrimsonCape,exactly backwards the part where you conjecture what the new exciting trend is ,0,news
CrimsonCape,it an american colloquialism from the jewel atkins song the birds and the bees which was a popular love song that got associated with sex let me tell ya bout the birds and the bees and the flowers and the trees and the moon up above and a thing called love ,1,explainlikeimfive
CrimsonCape, science denier is a purposely broad term so that global warming denial can be fallaciously extended to e mc 2 denial nobody is actually denying e mc 2 as reported in the article global warming is not nearly as theoretical as e mc 2 it erodes the philosophy that led to science ,1,environment
CrimsonCape,tyson uses two rhetorical devices to argue a point reminder that rhetorical devices are not scientific quite the opposite use of language to conceal or otherwise remove empirical study from an argument its fallacious the first major fallacy is an ad hominem attack if you do not accept the evidence of global warming you are therefore a science denier the second major fallacy is a non sequitur ie the conclusion does not follow the argument fallacy by denying climate change you are also denying e mc 2 that a fallacy ,2,environment
CrimsonCape,you practically said it this concept is dead which is part of this problem the older generation still thinks this is a valid concept while conveniently ignorant of the quality of people who inhabit the less desirable areas neighbas for thee and not for me ,3,explainlikeimfive
CrimsonCape,the point of his character was to give chinese audiences someone that they would like characters created by the marketing department ,0,AskReddit
CrimsonCape,it would be so easy to make a killer movie recruit some veteran stuntmen and japan racing subculture recruit aspiring chop shops across the usa with the order to make technopunk vehicles 1 10th the budget of fury road vehicles would probably do give it road warrior level of dialog not much and as much in special effects budget practically nil finally drop all this into tokyo at 2am and record the sound of v8s and 1200ccs as they echo among the buildings snip in shots racing around detroit at 2am shot in cinemascope ie ultra widescreen should not be any pretty boy or pretty girl faces to warrant closeups would kickass ,1,movies
CrimsonCape,all you need to do is bring your mainwindow into the scope of program which you can do 1 of 2 things public program mainwindow window application mainwindow static reference accessible anywhere set any properties you want window show or public program mainwindow window new mainwindow set any properties you want window show ,1,csharp
CrimsonCape,says the administration that needed continuing resolutions to operate and was deathly afraid of the word budget ,-54,investing
CrimsonCape,the aptly named slowjob ,2,aww
CrimsonCape, ultimately i am not willing to trade any liberty for any amount of security i can sympathize it just not clear in my mind why extend those protections and liberties to non citizen immigrants some of which do not even want to become a citizen the muslim ban is blocked under the auspices that it was a religious test but on a general level it only would have affected non citizens the judge complainant believes that because his mother in law currently in syria might have lost her immigrant visa it would have caused him irreparable harm i do not buy that she not a refugee she will have gotten a plane ticket to and from syria if i were conspiratorial i would think this judge ruling was a line in the sand allowing us to broach the sunbject of other non citizens namely illegal immigrants ,0,PoliticalDiscussion
CrimsonCape, how do you view the muslim ban if i were to hold the view that i hate muslims they should all return to a muslim country p s it is not my view that would still be constitutionally protected free speech i would like some event legal case that gives proof that we all agree on the constitutionality of the above but frankly i am losing faith that we would agree on that not on account of the conservative side so before it ever about muslims it about us first that kinda my pretense of the muslim ban subject we can identify a group like isis that openly and freely hates americans and wants to kill americans but they happen to be combatants who do not identify as combatants they blend into the population and hide among innocent people i pitch the question to you how do you distinguish between a person who looks innocent and a person who looks innocent promptly before killing somebody in my opinion this is a specific combative strategy which is targeting a fundamental weakness in the constitution it just so happens that the weakness is actually innocence in the sense that a terrorist number one weapon is the presumption of innocence before committing the act if this was a castle defense and you acknowledge the weak part in your wall ie terrorists use innocence against us you really have two choices fix the weakness or do not fix it and face the consequences does a muslim ban fix it probably not but like i just pointed out your options are 1 remove the ability of a terrorist to use innocence as a camouflage or 2 do not try do not worry about terrorists they really are innocent and conveniently ignore judicial system concepts like mens rea modus operandi etc when was the last time a liberal or republican vocalized a way to defeat terrorism that had us all like huh that might work in my opinion they mostly stopped seeing terrorism as a problem tldr how do you distinguish between a person who looks innocent and a person who looks innocent promptly before killing somebody ,-1,PoliticalDiscussion
CrimsonCape,of course you are not training a dog you are not really doing anything a problem needs a solution not a complaint do something anything really,0,AskReddit
CrimsonCape,if you read the article there is no such metric in the judge order the test is whether the order causes irreparable harm to a defendant enough to warrant a winnable lawsuit that entirely different than religious discrimination watson agreed with the state on virtually all the points he ruled that the state had preliminarily demonstrated its universities and tourism industry would be hurt and that harm could be traced to the executive order he wrote that elshikh had alleged direct concrete injuries to both himself and his immediate family in fact even if trump said i am doing this because i do not like muslims i hate em the court cannot violate his first amendment rights surprising is not it that you can still legally say i hate muslims the court still has to prove that the order would cause irreparable harm in this case to a man named ismail elshikh the article continues with the other defendants the ban will hurt the ability of state businesses and universities to recruit top talent and damage the state s robust tourism industry these are the meat and potatoes of what conservatives want to see judgement on since in essence the same corporation that would fight h1b restriction is essentially going to jump in on this case too see the tourism and university part ,2,PoliticalDiscussion
CrimsonCape, at this point i am going to call a spade a spade and say that trump may not actually care about getting anything done his first 50 days have been laughably ineffective he caused a lot of controversy but he has not really done anything http www cnbc com 2017 02 24 trumps cabinet waiting for confirmation html here an article about how trump is setting records in that democrats are staunchly refusing to approve his cabinet ,0,PoliticalDiscussion
CrimsonCape,i am a conservative and curious when you read the information on that page do you think it fake propaganda or do you acknowledge but reject it because of your interpretation of the constitution ,1,PoliticalDiscussion
CrimsonCape,why do you let someone awful at time management manage your time ,1,AskReddit
CrimsonCape,schedule an event that only you know the actual time of tell her the event is scheduled for an hour before the actual time when you are seemingly running late as usual and pull up to the event location casually tell her we have a few minutes before it starts if she gets angry my friend you are being taken advantage of by a prima donna she is annoyed by your lack of leadership and inability to control her bad behavior so she does it to spite you if she gets pleasantly embarassed my friend you have a keeper and you can expect much adulation and respect from her for your mastery of the situation and accounting for all the variables ,0,AskReddit
CrimsonCape,hate to tell you this is a neg if you have ever heard the pickup language term it is a backhanded compliment that is meant to sound complimentary but is really meant to lower your status raise their own old people believe that learning technology is akin to doing work and most people who will effusively praise simple tasks on a computer are simultaneously praising themselves they are privileged enough to not have to learn ,1,AskReddit
CrimsonCape,it kinda makes sense that if a car helps you be a more efficient office drone some people will buy the exact opposite kind of vehicle because fck being an office drone next time you go out try and identify how many things you see because the person is like fck you all ,2,Showerthoughts
CrimsonCape,are you suggesting a skill learned by medieval people long dead has been taught to consecutive generations without teaching non jews and therefore that explains why jewish people today are disproportionately better at commerce or are you suggesting jewish people have an evolutionary trait that makes them disproportionately better at commerce that seems like quite a stretch to believe compared to the likely truth that jews simply prefer to work with other jews before working with somebody else ,2,TheGreatWarChannel
CrimsonCape,i disagree with telling kids not to fight do they think productive kids cruise around looking to start trouble never if a productive kid is fighting they should full well know they were instigated a rule like that is so that administrators never have to discipline it helps keep kids in the category of kid and not future adult in training who might one day have my back ,2,todayilearned
CrimsonCape,every time somebody mentions that language i cannot unsee images from the pc game rust namely nude men fighting with primitive sticks and rocks nude men wielding weapons cobbled from rusty parts shanty town forts etc ,2,programming
CrimsonCape,considering how beat up my phone is you should draw a conclusion about my sex life ,1,Showerthoughts
CrimsonCape,terrible example especially the violinist bit in the example the violinist is a simile for the baby the kidney system is a simile for the pregnancy the kidneys being used to save the violinist is a simile for you gestating the baby but the society of music lovers who kidnap you is a simile for what men who kidnap women into having children ,1,TwoXChromosomes
CrimsonCape, because if they knew they would never allow it do you think men have a rational reason to not allow abortion ,1,TwoXChromosomes
CrimsonCape,for a second i was going to lookup what looked like the name of a garand reproduction company called plzno which looks plausibly czech ,26,guns
CrimsonCape,the waggers need to go home ,2,worldnews
CrimsonCape,lol just dawned on me that if rey is going to be a jedi she will have to be asexual else she violating the jedi code that or she wo not be a jedi therefore not cool and can have a love interest ,0,movies
CrimsonCape,i am calling bullshit that all these women knitted these hats some look knitted some of those look manufactured who had these already produced beforehand another soros op what the fuck were they handing them out ,5,The_Donald
CrimsonCape,i really wish the refs were not so anal so things could progress from i made you dazed to i am going to make you regret your career choice ,-4,sports
CrimsonCape,damn good thing sexual harassment charges only goes top down and not bottom up ,240,tifu
CrimsonCape,there a difference between making a new class and a new class file but visual studio kinda does not explain that just think of a class as the public class hat text that you write in a cs file class is code cs file is a computer file and class file is kinda bad terminology you will realize that in a cs file you can put classes static classes namespaces delegates enums interfaces and more you can make a new file whenever you want although rule of thumb is one cs file per each class that you write it also important to understand the difference between class property and method you would make a hat class with a size property of type double or decimal and a returnsizeininches method the class is the object the size is some characteristic of the object and the method is some processing that you ask the computer to calculate or run because net or the c language has many classes for you to use both for working with data and displaying data in a gui you would create a class typically for your own personal program model that could be a gameworld class a vehicle class or so on eventually you will understand that your programs need a separation of concern so that your truck class does not include information like screenresolution nor does your gameworld class contain screenresolution whereas your gameworld class and truck class are model classes screenresolution is related to the gui which you will see belongs elsewhere in a class for displaying your world tl dr some specific info about creating classes and determining their concerns ,1,csharp
CrimsonCape,how dare you have an upvote ,2,GetMotivated
CrimsonCape,they used two forms of fuel straight liquid and gelatanized liquid straight liquid makes short range clouds gelatanized fuel shoots a long range stream the clouds disperse rapidly the stream sticks and keeps burning if you are clearing a bunker you want clouds to disperse inside the space if you are aiming at a structure or target you want streams to fly over and stick to the target source coincidentally watched many youtube videos the past week,59,gaming
CrimsonCape,charlie munges what charlie munges what charlie munges what upvote for who can guess the reference ,3,GetMotivated
CrimsonCape,i once returned into the living room with scuba after someone release a particularly smelly fart ,1,history
CrimsonCape,you are noticing that the power of generics allows net devs to write classes that handle your use cases generically such as a list t so you could do that for sure but of the built in classes for a pebble a collection t would be more appropriate logically do not you agree i collect pebbles but not list them neither is wrong however between a collection t or a list t one contains methods and properties that are logically more applicable c has several collection types all of them suffice just fine like you notice each gets more specific if i had to create a glass jar class i would imagine the logic would lead to such properties as this public struct volume public class glassjar t where t pebble public t myfavorite get set public t thelargest get set public volume jarsize get set public color jarcolor get set notice i left out any collection ability maybe you want the glass jar to inherit from collection to get the ability to call those methods ie public class glassjar t collection t where t pebble but i do not want that for now for now my logic says that all i need ,2,csharp
CrimsonCape,pretend you want to collect pebbles in a jar the pebbles have some inheritance public abstract class rock public class boulder rock public class pebble rock the container public class glassjar t but there a problem you know logically that you can fill the jar with pebbles but not boulders so right out the gate the above class declaration is bugged because nothing currently keeps us from making a new glassjar boulder in fact the declaration is doubly bugged since you can also make a glass jar full of integers new glassjar int or booleans new glassjar bool which makes no sense so rewrite it to constrain it old bad remove it public class glassjar t rewritten good public class glassjar t where t pebble now you know your client can only put pebbles in a glass jar by declaring the class in no other way but constrained ,9,csharp
CrimsonCape,no matter if it is a disorder via hereditary illness or a disorder via psychological problem we recognize it to be unhealthy and unfit either way we want to make babies with healthy people to give the child the best chance i would argue this root cause without even looking at the secondary effects such as physiological damage to joints inability to run from danger elevated risk of heart disease diabetes etc and if you think obesity is somehow not a problem does not that add evidence to the likelihood of a psychological problem causing you to be in denial ,42,explainlikeimfive
CrimsonCape,if you gotta do it all going from excel i could see a basic workflow being basic raw data entry in a frontend like access connected to your sql database use access to get raw excel data into your db design a c project with your business models and logic to call on the sql database optional you could put the models in the asp project make an asp mvc project and add dll from your business project to get your model objects into the asp mvc design the controller in the asp project design the view s in the asp project your example image would require a layout cshtml a main cshtml a styling css some significant familiarity with html css razor syntax and probably javascript and json the only other complexitys would be if suddenly you need users editing data which would make your job a lot harder to design in asp you would probably want to keep them editing dumb excel files that you handle the design a controller step above would get harder also the basic asp mvc project makes it your responsibility to decide if you are handling user authentication which could add some extra responsibility on you to assign credentials ,1,csharp
CrimsonCape,ehhh you are giving him too much credit how about prattulant taken from petulant insolent or rude in speech or behavior characterized by temporary or capricious ill humor seems to perfectly define the way he portrays adult characters overgrown children who counters perpetual adolescence with gross or irreverent commentary and have no self awareness or interest in acting mature ,1,AskReddit
CrimsonCape,i see some smell with turning programid and customerid into entityid this suggests that anywhere you have an id property should either be in a base class or an interface as plain ole id edit i am unconsciously refactoring to make solving your problem easier and didnt actually address your issue my actual suggestion is inheriting from an interface that makes sense for your business logic then you can return a list of activities completely custom to each class ,2,csharp
CrimsonCape,works as expected made a new console application and add item the cs file you get from github using system using system collections generic using system linq using system text using system threading tasks using antfx add this namespace consoleapplication1 class program static void main string args logfilemonitor l new logfilemonitor needs a file path but otherwise ok ,1,csharp
CrimsonCape,do not care for his wide eyed deer in headlights face that signals humor is coming i would love to craft a new term for chris pratt humor it not ironic slapstick standup insult or pop culture referential ,50,AskReddit
CrimsonCape,hillary could have tweeted something anything really that was not fed through a committee of dozens of pr brown nosers and it would probably have netted her 10 000 votes per tweet it not that he speaks his mind so much as he speaks for himself ,6,gifs
CrimsonCape,obama was the perfect cool cat african american for the presidency the fact that you cannot recognize your own participation in what should be an antiquated stereotype leaves the rest of us shaking our heads giving this award to biden is nepotism at best and at worst it an indictment who really was the leader during the last 8 years ,0,gifs
CrimsonCape,i would argue it is more realistic that the intelligence community is made of of normal partisan people and that a good chunk of them do not like the idea of obama legacy being repudiated they do not like the idea of policy changes incoming and want to protect the policies they like so they attack the man instead if ics do not feel they can trust trump it a problem if this is true we have a bigger problem rogue feelings influencing matters of national security in which trump is commander in chief acting on these feelings in a way contrary to the orders of the commander in chief could be seditious and treasonous ,-1,worldnews
CrimsonCape,have an upvote would rather watch the martian a few dozen more times ,1,movies
CrimsonCape, could still be absorbed with sufficiently agile robotics could why not say will or is actively being could as a choice of words is ambiguous and not convincing that it will happen in 10 years ,-4,AskReddit
CrimsonCape,i can count on zero fingers the number of times a woman has volunteered to install a new toilet disconnect plumbing level with epoxy install new wax ring etc ,-1,AskReddit
CrimsonCape,as a girl could you explain why women get a turn on by something like being called worthless ,0,AskReddit
