name,body,score,sub
CrimsonCape,just to make a counterpoint literally every wartime innovation out of trench warfare was an innovation in killing technology meant to kill you chronologically earlier in a battle than hand to hand fighting they would rather vaporize you with an artillery shell ,1,AskReddit
CrimsonCape,you say this jokingly but practically every consumer product comes from poor chinese laborers ,0,Futurology
CrimsonCape,dayum son droppin bombs maybe stauffenberg shoulda got with you ,12,funny
CrimsonCape,that word we makes quite an indiscriminate attempt to box a lot of people into your analogy ,-1,AskReddit
CrimsonCape,that detentionally infinite ,2,funny
CrimsonCape,you can obviously conceptualize the type of person who does not want to learn so where do you think these people end up yep it some shit job somewhere or freeloading on welfare or the like i would suggest that society must require everybody to work at something instead of letting them drop out and suck on welfare there should be no such thing as freeloading on the system if they cannot cut working safely with basic hand tools in any trade make them janitors or farm hands there should be no way for an adult to be unemployed you realize that there a demand for farm hands currently filled by illegal immigrants that could go to said people ,1,AskReddit
CrimsonCape,i know you are being cynical but the truth is still probably just as cynical after dropping out the kid is not going to disappear off the face of the earth the kid is going to either end up in some shit job serving us educated people or will find a wily way to live off welfare child support etc hell even if they land a decent job expectation of day one at any job is to hit the ground running my suggestion if student is failing desk classes relinquish the student to be under control of a faculty member for apprenticeship during school hours let the student pick the faculty member at first and interview with the faculty member teacher needs help with remedial stuff great have a swarm of apprentices maybe does not have time to make a powerpoint presentation great apprentice can do it give the apprentice a shot apprentice cannot handle that or is obstructive in that role if they cannot pass a review send em down to apprentice under the chef or the janitor or groundskeeper or head carpenter ,1,AskReddit
CrimsonCape,the russians made public how dirty and colluding the democrat leadership is i personally see this as o trying to save face on behalf of the democrat party the confirmation bias is trump saying the media is corrupt and then the russians release evidence you cannot blame the evidence but i guess you can blame the source of the evidence you know if you want to look extra corrupt ,7,news
CrimsonCape,care to share what your solution is instead of the handwringing ,-1,Futurology
CrimsonCape,gosh darn yet another case involving teens gimminy willickers ,8,news
CrimsonCape,congratulations you discovered a double standard in the wild from this point forward you only really have two choices ok three acknowledge the double standard induce within yourself a state of cognitive dissonance and lie to yourself that double standards do not exist it too unfair fap,9,Showerthoughts
CrimsonCape,they were essentially routed during world war ii and have not recovered it seems to me like postwar people thought do not do insert vaguely masculine behavior we do not people to think we are white supremacists nazis take that to an autistic level and you end up with all sorts of sexual dysfunction that women were disgusted at and ready for some young bucks to come in violently and dominantly and ahem integrate them ,1,The_Donald
CrimsonCape,real world numbers like this that common people grasp but politicians avoid like the plague are a huge problem upvoted ,3,The_Donald
CrimsonCape,those do not necessarily convey willingness to integrate australia and canada have enclaves that by no means demonstrate successful integration in society the most realistic outlook for australia immigration policies is a rollback and repudiation ,3,The_Donald
CrimsonCape,portlandia sketch ,2,worldnews
CrimsonCape,it alright dude theres six bedrooms we easily got this if we get 4 more people then it will only be 16 million each ,1,pics
CrimsonCape,i did a zillow lookup on houses in my area that are approximately the same square footage these homes are 2 6 of o p quoted 96 million ,5,pics
CrimsonCape,literally every comment condones the behavior of the real estate agent who tried to bully the woman into selling her mixed use building while it inexcusable to suddenly start chasing jewish strawmen there really is no excuse for the real estate agent who tangentially represents a group called love lives here to have incited this episode ,0,news
CrimsonCape,excellent absolutely perfect ,2,spaceengineers
CrimsonCape,like your name for him if i were to improve on it might i suggest orcblood ,3,aww
CrimsonCape,would be awesome if a seagull flew into frame and snagged a bite ,1,space
CrimsonCape,from the washington post article but at this time it appears that no financial information or sensitive employee donor or voter information was accessed by the russian attackers he said obama himself said the podesta emails contained vanilla everyday stuff it looks like democrats are warmongering when nothing even sensitive leaked ,3,worldnews
CrimsonCape,the alt right white supremacists and malik obama wait wut,1,The_Donald
CrimsonCape,not to throw a wrench in there but you are not guaranteed to go on to the afterlife when a power surge kills your battery backup ,4,AskReddit
CrimsonCape, she said this where nowhere yet that does not stop a stranger from guessing the context macho posturing is not a prerequisite to achieve quiet confidence true i have seen the deepest cuts from posturing with things like choice of beer and clothing brand or words like momofuku casually uttered ,1,AskReddit
CrimsonCape,it has definite religious implications if you trust technology to capture your soul why not trust god will ,7,AskReddit
CrimsonCape,the idea that one day social media will assign a public numeric score to your reputation as a person edit i know the chinese are trying a form of this and i know credit score is similar i do not think the chinese or credit bureaus deserve to be credited as owners of the concept though ie it not a chinese concept it seems to be a corporate concept and highlights the growing disparity between corporations and common people ,1,AskReddit
CrimsonCape,you treat this as if it is an intrinsic personal trait when in reality you want quiet confidence as a reflection of status you are slandering the posturing as if it was worthless when in reality an accumulation of the posturing and the experience thereof affords the ability to be quiet and confidently so ,0,AskReddit
CrimsonCape, aka i enjoy talking to this girl playing with this girl warm fuzzy nether region but i do not want her to fall in love with me fixed ,10,AskReddit
CrimsonCape,i love occam razor for beliefs like this the definition occam razor is a principle from philosophy suppose there exist two explanations for an occurrence in this case the simpler one is usually better another way of saying it is that the more assumptions you have to make the more unlikely an explanation is now here two perspectives on guys like this perspective 1 the man is deeply unsatisfied with himself repels the affection of others cultivates a mindset that person cannot see his worth discovers and subsequently rejects his actual self perspective 2 the man wanted to have sex and not much else subsequent profuse emitting of much else from the girl made the not much else here defined as liking back part really awkward which does occam razor confirm to be true ,-2,AskReddit
CrimsonCape,who wants to load up on burritos and go for a train ride with me will be fun,6,videos
CrimsonCape,that question is tightly connected to your beliefs and your own personal bank account fiscally conservative people tend to like deflation fiscal spenders and credit users tend to like inflation we used to get like 10 interest on bank account savings if you had 10 000 in your account you would get 1 000 in interest banks needed your money because deflation had made it so scarce it almost heretical today to discuss how amazing your returns were on saved money because a large part of the great recession recovery was to lower borrowing rates to have more chance to go into debt cheaply and have more pocket cash to spend on consumer products to stimulate the economy they printed lots and lots of bailout money and banks no longer needed your money to do business the recovery ruined savings returns to like 01 banks have so much cash that they are collectively like the time warner communications of people who value savings ,3,explainlikeimfive
CrimsonCape,pretend a government legislates inflation and also orders businesses to augment an employee starting salary each year to keep up with inflation would that defeat the purpose of creating inflation ,1,explainlikeimfive
CrimsonCape, there are still only 10 people though and there is still only so much work those 10 people can do based on this would not it logically follow that when the government intentionally chooses to make more money it also intentionally chooses to make your labor worth less in a sense the careers involving work you have to perform ie all careers are made less valuable by the government saying so ,0,explainlikeimfive
CrimsonCape,the us went through the 80 gulf war stage because getting on the neocon foreign oil resource exploitation bandwagon was a cashing out it was an ideological pendulum swing to counteract the vietnam era moral decay i am going to get mine morality replaced fellow countrymen today we shifted that away from resources to products the hunger for consumer crap to avoid looking out the window at the rapidly uglified usa has empowered consumer crap companies much like the 80s globalist boom we seem to like getting stuff and condoning where it comes from ,1,The_Donald
CrimsonCape,let assume it takes 3 maintenance guys to service the robots that replace 10 guys you are now down 7 positions and reliant on at least 3 of 10 being able to handle robotics and computer programs based on this thread https www reddit com r dataisbeautiful comments 5gsayd the distribution of users computer skills worse that would be a hard sell considering the numbers are more like 5 8 of 100 can grasp that level of computation now remember that we are displacing thousands of people ,1,Futurology
CrimsonCape,you outsource 10 jobs because the 10 foreigners will do it cheaper you automate 10 jobs so a robot and 1 tech can replace 10 foreigners it a paradox to think 20 people outsorced locals outautomated foreigners will suddenly have new roles ,5,Futurology
CrimsonCape,your example does not make sense the business owner installs a robot so that he can lay off 10 people and if the current trend is any proof this will continue to be automation after outsourcing in other words the cheapest dumbest least qualified candidates have already been educated a bare minimum to fill those 10 positions so somehow the 10 lowest bidders will suddenly all be smart enough to handle robotics computer programming and engineering ,1,Futurology
CrimsonCape,if you want to program and your current curriculum is not making the cut go specifically to your cs department head and explain that you are not being challenged prove yourself and they will place you where you belong skill wise if he she refuses to consider your advanced skill find somebody who will consider you and if they do not try again until you either get upgraded or nobody else remains to help you quit at that point but i think demanding to be pushed into higher skill classes will gain you some attention and respect from fellow cs people and they will help a degree will add to your social value but so long as you are not being challenged it will not add to your skill i sense that you might not be committed to programming though because when you find something you like you will end up thinking i just need more time to do x college sucks but i have lots of time to do x ,1,personalfinance
CrimsonCape,now a good time to remember trumps joke on my way up to the stage hillary chair bumped into my leg she looked up and said pardon me ,9,The_Donald
CrimsonCape,i am leaving and in doing so will close on a quote canned beans are part of the capitalistic elite u grumpy kong december 2016,1,Futurology
CrimsonCape,put these in order for me in order of most likely to happen to least likely to happen assuming we are all dirt poor after an economic collapse 1 people will buy cans of beans to warm up over a stove 2 people will go to jim warmed meals where jim has warmed up beans and serves for just a bit more than the cost of raw beans 3 people will go to mcdonald and get served burgers and fries by robots your ridiculous premise the economic apocalypse is just a strawman demonstrating that you would rather an economic collapse than to concede the point i will say that if robots are implemented in a more widespread sense it because people can afford to buy and do buy the robot products and if somehow they can no longer afford those products well the company will do whatever possible to make sure people keep buying the products because it is their existence on the line too and then our motto will likely become make american robots great again so there that ,1,Futurology
CrimsonCape,if by this you mean implementing robots i totally agree there no reason to worry about automation when everybody is broke to think someone would buy food from a place that would willingly choose robots over giving relief to unemployed people suffering from hard times ,1,Futurology
CrimsonCape,in every city there are dozens of unique local homebrew restaurants and food trucks etc that take all the credibility for being good food i would argue that these local restaurants can earn a price premium due to their reputation even further than that in select cities exists the hipsterish phenomenon of craft eateries and gastropubs and handmade foods all of which command an even greater reputation and price premium having said that we have not even touched the quality of both the ingredients nor the cooked meal which is a separate layer of complexity as some restaurants thrive on image that props up poor quality while some have excellent quality that suffer from problems like remote location or poor architecture and sadly for the automation destiny false prophets robots will not affect any of that implementing robots will likely turn away people in principle as they would rather support local implementing robots will likely not change the hamburger patties to suddenly be 1 2 pound grass fed beef on organic bread the automation destiny crowd like yourself has yet to address the reality that people will likely avoid the robots in principle edit to add companies that can afford to pursue automation are corporations that are so big and the food so blandly similar that they live and die by brand image that affects them nationally i would love to see the brand image they craft to encourage how good the robots are for us the customers ,1,Futurology
CrimsonCape,you seem to be ignorant of powers and rights clearly delineated in the constitution there is no secular foundation there is no such thing as a right to conscience in fact the equality attributed to man by the founders is specifically derived from god we hold these truths to be self evident that all men are created equal that they are endowed by their creator with certain unalienable rights if you have no creator i would argue you deserve no unalienable rights it is not for the government to speak of god to do so is to offer religious speech from a position of authority an action that offends the very kernel of who we are and yet the first amendment is the government butting in and telling us i have the freedom to practice any religion i want the government is made up of people who have the same freedom p s whatever you mean by offends the very kernel i am not offended most people are not offended ,1,todayilearned
CrimsonCape, we sold our soul during the cold war how do you think in god we trust is selling out our soul e pluribus unum from many one constitutional republic of states joined to make one united states that is who we are agree a constitution republic of states and we somehow sacrificed that so that christians could pretend they live in a christian nation are you suggesting they gave up the republic to some kind of religious monarchy do not follow what are you trying to say in this next post it epu is more inclusive representative appropriate and constitutional that in god we trust which is an offense to the principles our nation was founded on are you suggesting the us government was agnostic and became spiritualized or something like that ,1,todayilearned
CrimsonCape,1 year here feels like a balancing act between very short stepping and ahh fuck it lets write for a week and see how it goes ,2,Showerthoughts
CrimsonCape,that phrase refers to one government formed of many states not one people formed of many races religions ,1,todayilearned
CrimsonCape,that phrase reflects that us is a constitutional republic comprised of individual states with their own governments from many one refers to one country formed of many states it has nothing to do with being formed of races or religions ,0,todayilearned
CrimsonCape,why is it worrisome should other people not have the right to make judgement about another group what if their concerns are valid what if your view of the world is distorted and theirs is rational ,1,dataisbeautiful
CrimsonCape, this will likely lead you to a distorted view of the world even if it filled with actual verifiable facts can you perhaps explain why you think a view of the world filled with actual verifiable facts is distorted or at least why you think of this negatively you are absolutely right that this is information you are more interested in do you think a media company should deliver information to you that people have no interest in would not they lose viewership and go out of business doing that ,2,dataisbeautiful
CrimsonCape,cnn money source link http money cnn com 2016 01 11 news economy america coins index html ,1,AskReddit
CrimsonCape,boys are portrayed as dark mysterious and powerful girls are portrayed as exotic sexy and harem like people must have a subconscious deeper than feminism politics desire nobody buys smells based on a diploma or a job credential ,1,explainlikeimfive
CrimsonCape, so they get off the hook to send you a fixed drone by fixed drone i meant repaired in essence while it might be smart business to pull the stabilizer off the drone and sell it thereby recouping costs it appears desperate if their confidence in the product was there why not recall the aerial portion of the drone and let the customer keep the stabilizer the free camera is really an indictment that they want the fastest shortcut to get the trouble off their plate once you accept a free camera not only do they avoid sending you a repair they can free themselves from the responsibility to what seemed like their future direction drone we understand our cameras to be our brand strength and are changing gears introducing the new gopro zipline gimbal ,3,gadgets
CrimsonCape,this camera seems to have a sweet little attachable screen but it would be so awesome to have an attachment for the screen sticking off like an old camcorder ,3,gadgets
CrimsonCape,even worse than that i hear they offer a gopro camera in exchange for the recall drone so they get off the hook to send you a fixed drone and sell your handle to another sap ,1,gadgets
CrimsonCape,correct on all counts this new accessory is a handle with some very fluid mechanical joints that keep the camera oriented horizontal image stabilization is a software processing attempt to average the pixel position difference between frames to smooth out the peaks of vibration ,8,gadgets
CrimsonCape,could we get i have a surprise in my pants for you translation for the next time i bump into a japanese girl thanks ,7,todayilearned
CrimsonCape,that movie is a conservative moral hazard do you support the police or the veteran ,1,todayilearned
CrimsonCape,truer words could never have been spoken about similar affect change movements cough cough blm cough,2,news
CrimsonCape,you fallaciously imply conservatives want fossil fuels for the sake of having fossil fuels instead of truth wanting fossil fuels for the sake of american workers and energy independence from opec so that we do not have to be morally complicit with middle east regimes maybe you like sharing morals with sheiks but in regard to developing worlds while you satisfy yourself with the thought that we demonstrate smart clean growth in reality those paisanos want gasoline for their chainsaws to cut down first growth trees to split into board feet they can sell to put food on the table i am making fun of your environmentalism because i am not even an environmentalist and yet i sure do sound it smart clean growth will in no way change the demand for things like mahogany and therefore the demand to deforest because growing economies are not deforesting strip mining or maybe i am a rabidly environmental war hawk whats do you call that ,0,AskReddit
CrimsonCape,by that logic you must be staunchly xenophobic because developing nations are the biggest ecological black hole factually deus ex machina that somehow developing nations will skip their upcoming dirtiest part of development with savior technology does not count ,1,AskReddit
CrimsonCape,my characterization would be old conservatives seeing a party that is having an existential crisis to the older generation many positions in this thread would require serious moral resuscitation prior to even touching the politics in my opinion that why gen x and milennials and so on will never obtain the empathy of older generations,2,AskReddit
CrimsonCape,that could easily be intaglio nice,2,Art
CrimsonCape,all the characters in that movie knew all this ancient history and had a perfect historic knowledge about doors halls trolls balrogs etc that somehow were never seen opened killed until the main characters got there made all the grandeur look like a limp noodle ,16,pics
CrimsonCape,if hollywood has taught me anything 1 you are currently being coerced by bad guys to find how to open that 2 the bad guys are idiots because the button is obviously hidden in the face somewhere 3 do not look down in the water there are sharks 4 somehow the inevitable booby trap will get said bad guy into the jaws of said shark much blood ,217,pics
CrimsonCape,point taken their consumer gps division will be dead ,1,news
CrimsonCape,give us your ten step plan or five step plan or any number of step plan of what the government should do to reverse climate change ,-1,pics
CrimsonCape,a 400 camera is the price point for prosumers until a comparable chinese camera comes out at 250 ,2,news
CrimsonCape,at a guess no screen preview wonky compression algorithms shit tier control of exposure aperature wb etc lack of useful accessories floaty handle yes battery bank why would we make that one day somebody is going to drop a gopro sized cube covered in knobs and dials to control settings that will come with a mini lens but let you pull that bad boy off and slap on a dslr lens maybe covered in proprietary hot shoes to slap on an lcd think a micro teeny red camera ,6,news
CrimsonCape,the karma drone is a bland product the dji mavic looks amazing the gopro cameras were amazing but are becoming a bland product did you see the xaomi yi touchscreen 4k cheaper price comparable vid quality gopro used to have a customer base in convincing normal people they could be prosumer with cheaper chinese cameras filling that market at the chinese price you can no longer hit prosumer pricing and video quality in the gopro product line gopro is left with the big name recognition and a core customer base but i cannot see that base expanding outside of black friday deals and low end products ,3,news
CrimsonCape,i will get back to you after work ,1,Showerthoughts
CrimsonCape,the second someone puts some decent vector topo in openstreetmaps garmin is dead ,1,news
CrimsonCape,we found the one guy who watches both back to the future and its lesser known brother mad scientist time traveller ,50,Showerthoughts
CrimsonCape,upvoted for it simplicity but reality is more like joe you stubborn bigot i want you to vote so i can legally penalize you with taxes and fees how dare you not buy carbon credits from the big oil carbon offset program joe you are a stupid simpleton who does not obviously see what is obviously obvious ,1,explainlikeimfive
CrimsonCape,the fat person freeloading on healthcare and the working single mother are two extremes that do not actually address the point of how personal choice might affect the social burden if the fat person has a disorder then this is not that person choice and is not an example of choice the single mother with cancer does not choose that this does not change the reality that the system must factor choice i disagree how you seem to sweep choice under the rug or judge choice to be indicative of a free loader in a hypothetical situation where a person makes a choice that will require healthcare the us healthcare system will assess fault the possibility of criminal intent and will determine if somebody pays more for the circumstance is not that the definition of fair ie considering all related factors and then making a judgement ,1,explainlikeimfive
