name,body,score,sub
Kolyin,you might want to talk to your brother about his research as another commenter pointed out this stuff is just wrong 97 cases of kawasaki disease in 2014 over the last thirty years or so since 1990 only about a hundred cases have been reported to vaers your brother flat wrong and that a pretty glaringly obvious mistake i really wish anti vaxers would not dribble falsehoods like this all over the internet to scare people source https www ncbi nlm nih gov pubmed 19755926 eta same issue with the second stat i checked the heb b adverse events you are taking thirty years of numbers and lumping them into one year and you know vaers makes no claims as to causation right so if dividing these numbers by thirty to correct the bad research does not change your opinion on vaccines what does that say about the basis of those beliefs maybe they are not based on the data after all so your brother group studies vaccine trial design if not can you identify any expert in clinical trials who thinks vaccine trials are done badly this seems like really really bad statistics and motivated reasoning to be honest there a reason the epidemiologists who actually study this stuff unanimously stand behind vaccines and it ai not the illuminati ,2,conspiracy
Kolyin,ok i have checked out suissa he an actual epidemiologist unlike the schoolteacher education consultant and bioengineer you earlier cited as epidemiologists but i do not see anything he ever published about vaccines help me out really seems like you are identifying science type people who say what you want to hear then assume that they must be right rather than assessing the total body of research because i still do not see any epidemiologists agreeing with these conspiracy theories ,1,conspiracy
Kolyin,any professional epidemiologists who agree with your risk assessments link ,1,conspiracy
Kolyin, name a scandal that has not been exposed by a minority do you think that answers the question minorities have been correct is not the same thing as this minority is correct thompson candid statements as in vaxxed are heavily edited but even more significant to me is the failure of the anti vax movement to show actual problems with the cdc data despite great amounts of tone and money to pour into it their best effort was retracted for basic methodological flaws and they gave up after that made a movie because their core audience does not need proof just wild eyed accusations any links to show those people are epidemiologists or vaccine experts ,1,conspiracy
Kolyin,they did not fudge the data though anti vaxers with all the data have been unable to show any problems with the cdc study hooker tried but as he admitted he did not understand the statistics and his results were so bad his paper got retracted he also failed to disclose his conflicts of interest they also pulled the paper for that reason you can read my interview here https violentmetaphors com 2016 05 29 a skeptic on the conspirasea cruise so no i am not lying to you paranoid much i cannot speak for thompson in his own statement through his own lawyers he said parents should not avoid vaccines personally i think wakefield and hooker screwed him took his honest concerns and blew them way out of proportion to salvage a failing conspiracy theory my evidence for that is the lack of actual problems in the cdc data not a single statistician agreed with hooker the fact that they chopped and edited thompson voice for the movies and wakefield lying to me ,1,conspiracy
Kolyin,can you cite that not in white bio or hooker have not checked suissa thompson actually says parents should not avoid vaccines check his statement why do you find the minority voices more compelling than the consensus do you think they are smarter more experienced bigger studies what ,2,conspiracy
Kolyin,all of those people are people none of them are professional epidemiologists or vaccine experts jenni white is an ex science teacher turned political activist hooker is a biochemist i think carol stott is a psychologist wakefield mostly just makes money off of nonprofits stott does have a master degree in epidemiology at least so if we count her despite her financial and personal conflicts do those not count when it an anti cancer we are at about 10 000 to 1 your beliefs will be scientifically validated in no time just hang tight and wait for the evidence to roll in any day now surely coming soon momentarily even ,1,conspiracy
Kolyin,no i do not know what you think godwin law says but it not anyone who points out that my pseudoscientific beliefs are unsupported by the actual scientists who study this question must be a shill ,1,conspiracy
Kolyin,have you found any epidemiologists who have really studied the issue and agree that we give too many vaccines ,2,conspiracy
Kolyin,so no no actual epidemiologists just a bunch of guys screaming shill to keep people paranoid ,0,conspiracy
Kolyin,writers do when they are writing about it there were also a couple of reporters on board and now you have completely derailed the discussion by screaming shilllllllll ,0,conspiracy
Kolyin,no i am not a shill or agitator or agent provocateur jesus do you see how that paranoia keeps you from even thinking about information that challenges your beliefs i am writing a book wakefield knew who i was and all about the book when he talked to me https violentmetaphors com 2016 05 29 a skeptic on the conspirasea cruise ,1,conspiracy
Kolyin,i actually interviewed wakefield personally about the movie i was on the conspirasea cruise where he premiered it i asked him what data was destroyed he literally could not answer the question the whole vaxxed thing is designed to scare people by making them think the cdc tried to destroy data when you look at the actual claims though it turns out they shredded hard copies which you have to do all the actual study data was digital and no one ever tried to destroy it i confirmed that by talking to wakefield like i said he could not identify any actual thing the cdc had done or tried to do wrong with the data wakefield and a guy named hooker tried to use the cdc data to prove that the cdc fiddled the stats they failed hooker used a bad statistical analysis which statisticians pointed out the journal retracted his article partly for that reason and partly because he had undisclosed conflicts of interest c mon this is r conspiracy people should care that antivaxers like wakefield and hooker are so shady with the money they make from this stuff no statistician or epidemiologist agrees with the anti vax spin on this stuff not one vaxxed is manipulation it comes from inside the tent as it were so conspiracy theorists lap it up instead of questioning its facts ,1,conspiracy
Kolyin,literally every sentence in your comment is wrong literally every single one 1 i see no support whatsoever for your 1 100 estimate which appears to be made up 2 vicp claimants actually do not have to prove causation at all for most claims table injuries are compensated without the court ever even considering the question of causation the vicp by design compensates claimants whose injuries might be unrelated to vaccines just to reduce the burden on parents 3 the omnibus proceedings did look at causation evidence to assess the claim that vaccines cause autism the claim failed hard on the strength of the evidence which surprised basically no one given that the anti vax plaintiffs relied on bogus experts who had zero scientific credibility and were unable to produce other evidence 4 and of course the government does not give a damn how much gets paid out in damages by the vicp the government does not pay for it pharma companies pay for it through an excise tax on vaccines ,2,conspiracy
Kolyin,is that what epidemiologists say ,1,conspiracy
Kolyin,i think he referring to vicp payouts although i could be wrong vicp statistics also show that vaccines are an extremely safe product personally i am particularly impressed that vicp over includes adverse events by not requiring claimants to prove causation yet still the ae vax ratio is extremely low ,2,conspiracy
Kolyin,here a sample analysis of anti vax studies by someone who did read them all http lizditz typepad com i speak of dreams 2013 08 those lists of papers that claim vaccines cause autism part 1 html sheryl atkinson is a dedicated anti vax crusader do you think that her hand selected group of studies is representative of the total body of research why when we think about what the research as a whole says i am curious whether there are any epidemiologists who buy into the anti vax theories any at all if not why not ,2,conspiracy
Kolyin,it not surprising at all it also not because of any pro vaccine conspiracy it because unnecessarily exposing people to preventable diseases is neither good medicine nor good science but hey maybe i am wrong could you identify any epidemiologists or study design experts who think the standard here is wrong lots of bloggers and redditors of course but what about the people who are actual experts ,2,conspiracy
Kolyin,i am not paid to post anything by anybody nor have i ever been but it sure is easy to drown out the science if you just yell shiiiiiilllllllllll loudly enough huh ,2,conspiracy
Kolyin,you sure will repeat yourself you will repeat ridiculous things over and over and over again before you will reconsider the anti vax propaganda here what is in that link safety publications by year over a decade worth linked to the original publication so that you could even read them if you were so inclined they are not brochures they are peer reviewed research publications about vaccine safety and you sir are a very silly person for pretending otherwise as for formaldehyde i find it very doubtful that an outspoken anti vaxer like yourself was unaware that there some in vaccines but do not worry there far more in fresh fruits and even in your body already it a natural part of many living organisms including humans the dose makes the poison and you will notice a real lack of actual science identifying any problem with the dose in vaccines science is pretty cool and no shills here friend you are just having fun falling back on conspiracy theories when people point out how ridiculous your obviously false talking points are ,1,conspiracy
Kolyin,anyone reading your comment might think that vaccines do not improve over time in other words get a false impression it almost as if you are primarily interested in scaring people in fact vaccines have vastly lower antigen levels than in the past and improve just like any other product see improvements in rotavirus vaccines for example and the idea that vax manufacturers are immune from liability is predictably another anti vaccine myth the vicp precludes some product liability claims but a the damages awarded to parents come from an excise tax paid by vaccine manufacturers and b parents can still sue pharma companies here an example of such a suit https d3bsvxk93brmko cloudfront net datastore opinions 2012 09 25 08 16557 pdf,3,conspiracy
Kolyin, you can cite studies using results obtained 2002 with a sample that went until 1993 was it this might have made more sense in your head than on the screen ,1,conspiracy
Kolyin,here is a list of vaccine ingredients https www cdc gov vaccines pubs pinkbook downloads appendices b excipient table 2 pdf here is a list of safety studies https www cdc gov vaccinesafety research publications here is an anti vaxer who will keep repeating anti vax myths to spread fear about vaccines https www reddit com user alasbabylon103,-2,conspiracy
Kolyin, you are not smarter about the law than the entire legal profession you are not so special i want to print in copperplate on business cards to distribute as needed ,10,amibeingdetained
Kolyin,even cooler story bro i will let people reading your comments decide whether claiming you are not anti vax is ridiculous or super deluxe ridiculous your vaccine liberation web link is 404ed great research really great by fixing the link we find predictably a bonkers anti vax conspiracy theory site whose explicit mission statement is to make people believe that vaccines are unsafe and ineffective lots of whale to links of course and some copied and pasted citations to journal articles with zero analysis or even explanations of what is inside them in other words a literature bluff look at these articles and believe me once again there a reason anti vaxers like yourself cannot find actual professional epidemiologists who oppose vaccination the people who really study sids do not buy into the conspiracy theories ,0,conspiracy
Kolyin,cool story bro false though http www drwile com lnkpages render asp vac sids these claims are absolutely false but they have been repeated over and over again by anti vaccination advocates how do we know that they are false because a study was done on the autopsy records of infants aged 1 week to 1 year old who died in the tokyo area this study found that the number of sids cases rose continually from 1975 through 1993 the last year that the study considered in fact from 1979 to 1993 the number of sids cases in the tokyo region increased by more than a factor of 15 clearly then sids did not disappear from japan once the vaccination age was raised in fact it increased considerably anti vax research consists so heavily of anecdotes and online shouting there a reason professional epidemiologists around the world support vaccination unanimously ,0,conspiracy
Kolyin,i am not a shill and anyone curious about the quality of your research can go to the linked page https www cdc gov vaccinesafety research publications check out safety publications by year and compare that list of peer reviewed research publications to your assertion that they are patient safety brochures ,1,conspiracy
Kolyin,you are being extremely silly the linked lists over a decade of research papers on vaccine safety those are brochures is an excuse for ignoring the data if you want more papers do a pubmed search ,4,conspiracy
Kolyin,here is a partial list of safety studies https www cdc gov vaccinesafety research publications you will be disappointed the research does not support your scaremongering ,2,conspiracy
Kolyin,you keep telling people that no studies are conducted and ignoring the fact that many many many studies have been conducted here a partial list https www cdc gov vaccinesafety research publications the fact that the studies do not conform to your pre existing beliefs is not a valid reason for pretending that they do not exist ,8,conspiracy
Kolyin,many studies have been conducted here a partial list of over a decades worth https www cdc gov vaccinesafety research publications ,6,conspiracy
Kolyin,the math with citations is here https en wikipedia org wiki herd immunity mechanism if you did not find that in your research then how thorough was that research i think your blanket dismissal of people who disagree with you as vaccine shills and of people who are more knowledgeable than you as big pharma specialists not doing actual science says a lot about your process ,5,conspiracy
Kolyin,i am guessing that they wait as long as they can because it the last thing they want to do once they get violent even against just the car i bet there a ton more paperwork to do and of course the risk to the officers goes up i think it also appropriate as a matter of policy this guy an ass but he should be given every chance to reconsider his nonsense before something gets broken ,10,amibeingdetained
Kolyin,kemtrayls ,11,amibeingdetained
Kolyin,there a few threads around about him https reasonablehank com 2015 12 10 death threats from frank vazquez of south australia ,9,amibeingdetained
Kolyin,a z lister antivax zealot known for bomb death and rape threats ,9,amibeingdetained
Kolyin,thank you i appreciate that ,1,amibeingdetained
Kolyin,weird thanks for the heads up i cannot replicate it but i will keep an eye out i do not know anything about these things so all i can figure is that maybe wordpress is inadvertently serving you a malicious ad or maybe you have got malware no idea if those are even remotely plausible guesses apologies regardless ,2,amibeingdetained
Kolyin,yeah i agree i am the author i analogize it to plumbing or electrical work because it just as applicable there if someone tells me to buy this kind of pipe instead of that one because it got a better flow regulating pvr coating how am i going to tell whether it baloney advice or not on the other hand if someone tells me to rip out the wiring and replace it with lead wires because the electricians are all part of a pro copper conspiracy i would be able to tell that the advice was suspect especially if they could not show me any example of lead wiring that actually worked these theories are definitely in the lead wiring camp but everything a spectrum the fact that very few people fall for it does not mean that no one falls for it so i would disagree only with the very last thing you said the pseduolawyers win the debate with a few people some of the time and that can be disastrous see malheur but in the long run they always lose on the other hand in the long long run there are always more of them so i guess you are right after all this may not have been the most helpful comment i have ever written ,7,amibeingdetained
Kolyin,author here do you mean violent metaphors the linked blog just checked and it up and working fine ,4,amibeingdetained
Kolyin,i am the author and yes it can definitely do that it can also recruit people to join them in their delusions as they find the fight online but if no one engages then the people on the margins of the irrational idea have fewer reasons to second guess it and are more likely to fall for it i think the best approach is to debunk bunk openly and honestly without outright attacking believers ,1,skeptic
Kolyin,there a fantastic book called the last duel about one of the last recorded trials by combat highly recommended just do not google the story before you read it the outcome of the trial is very dramatic and suspenseful and the book is written to emphasize that better to go in cold ,1,skeptic
Kolyin,they tend to see driving as a right citing a right to travel freely between states ,3,skeptic
Kolyin,lots of reasons but among others engaging people before they go full sovereign citizen can keep them from getting to the point where they do something that requires jail time ,6,skeptic
Kolyin,what i meant was that people can of course have their own opinions about what the facts are but that those opinions do not change what the facts are ,5,skeptic
Kolyin,one of the scenes in which the tommeys are using their kid room to watch a video because the family other vcr or whatever is broken disturbed me the kid wanted them out of his space it felt a bit like they were provoking him with a camera running to catch his reaction i thought it was nasty ,4,skeptic
Kolyin,right but i am glad you guys were there i was focused so much on the factual shortcomings of the movie i did not even think about how it tokenizes people on the spectrum the protesters at the kansas city screening got me thinking about that and i hope some of the vaxxed fans too ,6,skeptic
Kolyin,thanks really appreciate the comment new one up ,1,skeptic
Kolyin,you are welcome that my favorite faq of all time we have a vaccine version in the works but have not had time to work on it in over a year ,4,conspiratard
Kolyin,and it seems to me that wakefield hates it he looks so glum all the time and i have not seen him socializing around the ship at all i think he very unhappy about sharing billing with chemtrail and reptile alien experts ,1,skeptic
Kolyin,i think smith is more effective for his cause than wakefield as much as aw tries to rebrand himself as a documentarian he will never get out from under the fraud label and he not a very engaging speaker smith is and very focused on creating new activists not unfortunately on understanding the science behind what he attacking he seems to get all of his science by rote from stephanie seneff who seems to get it from thin air ,2,skeptic
Kolyin,bandwidth exceeded it will be up again before long i wrote another piece that has a short discussion linked below but professor reiss is more in depth and a better overall explanation ,1,skeptic
Kolyin,thanks that my piece i could not believe the nonsense in that nn article ,1,skeptic
Kolyin,i do not think ignoring it will work out vaccination is a powerful issue to people on both sides of the question and you might not be able to keep it submerged better to jump on it now and try to exert some positive influence i think you are on the right track looking for good objective resources when you share them with your so make sure you give him plenty of time and space to talk about his own opinions too you will be more persuasive if you are having a back and forth conversation than if you try to make it a lecture or infodump ,2,BabyBumps
Kolyin,that definitely will make it harder to get traction with her but i think it still a good idea to try to persuade her if you assume that it impossible to make a difference you wo not try and wo not succeed if you do try as long as you do so respectfully and straightforwardly you should not be offending her very much and you might be surprised how much influence you have many people are not used to someone else having a serious involved conversation about their beliefs as long as you do it carefully and give her plenty of space to tell you all about what she believes you should have plenty of opportunities to influence her you probably wo not see much in the way of immediate results but it a long term process and it a worthy goal i think you should absolutely go for it ,1,BabyBumps
Kolyin,i wrote a guide to having this conversation that just posted this morning http violentmetaphors com 2013 12 20 the most important playground conversation how to persuade a friend to vaccinate you should absolutely try to talk your friend into getting the vaccination do not try to scare her with the outbreak though she will probably see it as a pressure tactic and it could make her defensive and harder to reach by sympathetic and straightforward and discuss the facts with her do not expect miracles but this is too important a subject for you to not try to change her mind if you do have this conversation i would really appreciate it if you would let us know how it went we would like to track real world examples of that discussion to see what works best in different circumstances i would also be happy to answer any questions you have personally good luck and thank you for trying to get involved i wish more people took that initiative ,1,BabyBumps
Kolyin,registered an account to respond as i just posted a piece this morning that might be helpful it intended to be a field guide http violentmetaphors com 2013 12 20 the most important playground conversation how to persuade a friend to vaccinate to convincing a parent to vaccinate their child but it should be relevant to your situation as well some of the resources i have found helpful are http www cdc gov vaccines vac gen common faqs htm http www mayoclinic com health vaccines cc00014 http www who int features qa 84 en i particularly like these resources because the facts are solid and the sources are credible there a lot of scaremongering about big pharma running various blogs and whatnot but the cdc the mayo clinic and the who are fairly unimpeachable sources ,2,BabyBumps
