name,body,score,sub
Kolyin,no cnn cited a source as saying that comey would testify that he did not tell trump that he was not under investigation then the comey prepared statement came out and it looks like he will testify that he did tell trump that he was not under investigation for context this is not a big deal is it comey apparently told trump that he personally was not currently under a counterintelligence investigation that did not make waves the first time we heard it and since then we have had mueller appointed ,1,conspiracy
Kolyin,i think they are arguing that cnn predicted that comey would deny that he told trump that he was not under investigation and that now comey is apparently going to testify that he did say that ,1,conspiracy
Kolyin,nothing no actual law enforcement personnel were taking pizzagate seriously and no one is going to tomorrow ,1,conspiracy
Kolyin, the whole conversation started by you claiming she does not know what she is talking about my first comment is still up there if you want to check whether that correct what i said was that a her phd is in computer science and b her work at mit has nothing to do with genetics gmos autism chemistry vaccines or anything related to this subject those are simply objectively true statements why have they made you so angry is screaming fuck at me supposed to make me think you are an informed consumer of science it makes me think instead that you really want her theories to be true and you are very upset that someone thinks she not very credible as i said from the beginning the best approach is to start by looking at the best science what do the biggest trials the most powerful studies the most independent labs say seneff does not rate on any of those scales she a fringe voice who does no original data production or serious analysis and has a longstanding and aggressive bias when the op points out very explicitly that she a phd from mit it trying to hide the problems with her work under the cover of legitimate scientific authority but to do that it has to ignore the fact that her phd and mit work are irrelevant to her anti gmo crusade this is r conspiracy man instead of screaming fuck and monkey at me think about how the op tried to manipulate you ,1,conspiracy
Kolyin,reverse engineering someone plugged in spaces and apostrophes until they got a result that made sense one more apostrophe and you get i will puff https translate google com auto en cov 20 fe fe if you google how the translation works you will find people explaining that it basically a mistake in the translation algorithm it missing a glottal sound necessary to actually be accurate i do not speak any arabic so i cannot vouch for that but come on how hard do people have to bend over to avoid acknowledging that the guy made a typo trying to write coverage ,1,conspiracy
Kolyin,true like dr seneff i do not have a relevant terminal degree do credentials matter to you or is this just a tactic for disqualifying voices that say things you do not want to think about if credentials matter then of course it relevant that dr seneff are irrelevant to her conclusions of those who do have relevant degrees and do actual research in these fields no one seems to take seneff work seriously why is that more to the point why do credentials only matter in some cases ,1,conspiracy
Kolyin,are not you a treasure none of her expertise is in relevant fields natural language gene analysis is not expertise in genetics generally and does not seem to be at all at issue here that not surprising her work is primarily modeling how auditory systems work glyphosate is a hobby for her and not one where she made any mark with actual experts look at the journals and papers where she publishes her glyphosate stuff seriously check it out notice anything consistent about where she publishes i have a jd from a school down the road from where seneff works on digital ear models and preaches that all boys will be autistic in a few years i am not a scientist but i can tell legitimate expertise from a results oriented wannabe if you started by looking for the best science in these fields instead of the science that agreed with your preconceptions seneff would not be on the radar she lacks the education experience and most importantly research results her papers in these subjects are all hand wavy low impact diatribes she does not produce data or serious analyses that have made any dent in these fields of course maybe that because monsanto buys all the scientists right pays all the neurologists and chemists and biologists and geneticists to ignore her amazing cross disciplinary genius or maybe she just out of her field writing to express her sincere beliefs but without the data or expertise to support them ,0,conspiracy
Kolyin,that a cool study thanks for linking to it what does it have to do with seneff she was not involved with it as far as i can tell and does not do any similar research she does research on simulations of auditory systems according to her faculty bio ,1,conspiracy
Kolyin,why would it be relevant that computer ai just beat regular doctors in an analysis of outcome versus diagnosis i do not know what outcome versus diagnosis means but i doubt that ais have outperformed human diagnosticians outside of perhaps a very limited and strictly controlled test and why would it matter even if it was true seneff does not make or work with diagnostic ais she builds simulations of the auditory system if i understand correctly seneff is not an expert in or doing any real research in any field relevant to the op points she just has theories that some people like so they look for any excuse to prioritize her over the people who actually do research in these areas ,-5,conspiracy
Kolyin, this is all podesta would have to show and ten thousand of the craziest fringe basement dwellers would take the target off his back can you think of any example of the target of a conspiracy theory explaining himself out of the crosshairs of the theorists ,12,conspiracy
Kolyin,if you are going to tout seneff as a phd from mit you might mention also that a her phd is in computer science and b her work at mit has nothing to do with genetics gmos autism chemistry vaccines or anything related to this subject nor do experts in those fields seem to take her at all seriously partly perhaps because she does not do serious publications on any of these subjects touting seneff as an authority on these subjects is a strong indication that you are cherrypicking your science accepting only the people who say what you want to hear and rejecting the rest as shills or whatever the alternative and i think much better approach is to first identify the best science and then see what that science has to say seneff does not make that cutoff in my opinion edited to remove the quotation marks around her phd as i did not mean to imply it illegitimate as far as i know she a perfectly respectable authority in the field of digital auditory systems ,4,conspiracy
Kolyin, comment by u fat dumb american https www np reddit com r conspiracy comments 6fo87k seth rich was at white house for a two hour dijye62 is buried in a thread a little bit so just to elevate it it looks like he was there with a jillion other people on july 4 for a concert ,31,conspiracy
Kolyin,this is why it drives me nuts when people gripe about how there must be brigades bots shills on the loose because why else would the 976th thread about his name was seth rich why fbi wo not release the drone footage of massile strike killed him be downvoted ,1,conspiracy
Kolyin,i am no chemist or any kind of relevant expert so my thoughts are worth what you are paying for them having said that it looks pretty scammy to me they are selling their potion as what is called a flocculant which is a real thing chemicals like aluminum sulfate or sulfite not a chemist can cause impurities in water to coagulate so they can be removed to get any benefit i think you have to then remove the coagulate either by drawing the purified water off of the top of the container or filtering out the coagulated particles so if that all they are selling great but why pay magic potion prices for a basic chemical just looking at amazon real quick the price they charge for 2 oz of their stuff will buy 2 pounds of concentrated flocculant and personally i would much rather trust someone who selling their product as the chemical it is rather than someone who obfuscates and sells it as a magic cure all bear in mind that most cities already flocculate filter and otherwise treat their water if you are drinking from the mains i think it pretty unlikely you will get better results re flocculating it yourself and you wo not get any results as i understand it if you then just drink the coagulates so you will need to use a filter yourself although if you are buying purifying potions for your water i guess you probably are already filtering anyway that my take i think they are selling a real thing but not a thing that likely to be any real benefit to you since the water supply is already treated in a similar way and they are making vastly overstated claims for it in my opinion as well as vastly overcharging for it ps as someone who grew up in a region with massive natural fluoride deposits in the water dude it not hurting you even people on wellwater did not see any ill effects except fluoridosis turnign their teeth brown as kids and city water does not do that of course it r conspiracy so i get it but do not let people use fear to pick your pocket pps flocculate is a fun word flocculate flocculant flocculating flocculation ,1,conspiracy
Kolyin,i am no expert but my understanding is that modern office printers are expected to hold process multiple large documents simultaneously i suppose it could be done in ram too but a hdd seems like a cheaper alternative i have no idea how big nsa print jobs are but at my old firm i would routinely print hundreds of pages at a time and i was just one of several people sharing the same printer big jobs could stack up for some time while other people were simultaneously using the printer to scan documents and or fax them at some point the printer needs to be a computer all on its own ,8,conspiracy
Kolyin, and the senate intelligence committee has yet to subpoena sasquatch inexplicable appalling and obviously part of the deep state plan to not take nonsense seriously ,35,conspiracy
Kolyin,not sure how to confirm that but the download is now working with default settings ,2,TheMagnusArchives
Kolyin,thanks ,2,TheMagnusArchives
Kolyin,is anyone else having trouble downloading this episode pocket casts sees it but cannot fetch it it keeps timing out ,3,TheMagnusArchives
Kolyin,every single sentence in this comment is factually wrong and extremely silly ,3,conspiracy
Kolyin,that the survivorship fallacy you see 95 year old nazis because they are the ones who happened to survive so long not the vast majority who died younger does not reflect the odds of any of them living so long ,5,conspiracy
Kolyin,the video appeal was to gofundme supporters not 4chan shitposters you are not investigating anything you are wallowing in a grotesque and completely unsubstantiated conspiracy theory for kicks ,2,conspiracy
Kolyin,might be a good thing it being upvoted if it means r conspiracy checks thread and finds r conspiracy collectively calling bullshit on it in the comments ,4,conspiracy
Kolyin,just another shill for terry steak house ,69,conspiracy
Kolyin, people on r conspiracy take this so seriously ,1,conspiracy
Kolyin,like i said i appreciate that you have put some thought into this i really do not see any difference between the person you are describing here and any random partisan though ,1,conspiracy
Kolyin,how do you distinguish between a shill and someone who just a a partisan b wants to persuade you and or c disagrees with you i really respect that you have put some thought into this your list seems like a lot of assumptions though partisans parrot their candidates and parties lines or the latest conspiracy theory no people who want to persuade you try to be persuasive so are these factors guesswork or are you comparing them to known proven shill account strategies ,2,conspiracy
Kolyin,yeah this is the trend i am talking about creating a bubble and defending it against criticism ,2,conspiracy
Kolyin,i think wild unevidenced suppositions are the basics on the conspiracy sub ,2,conspiracy
Kolyin,no i am pretty new to reddit and mostly use it for reading not commenting but there a lot of reasons why the community might change most political conversations are different today compared to what they might have been ten years ago right ,2,conspiracy
Kolyin,you might start by supporting your assertion that they are designed to shill on reddit ,2,conspiracy
Kolyin,1 the fbi is not involved the pi claimed they were but not based on personal knowledge it does not appear to be true http www newsweek com seth rich dnc staffer wikileaks leaked emails fbi 610383 2 he was not as far as i know i think this comes from an anonymous pol post right 3 can you source this claim 4 i am not an expert but i do not think it all that rare for robberies to get botched someone shoots freaks out and bolts without taking the time to take anything sound impossible look at it from the other perspective why would a s00per s3krut demoncrat assassin ninja shoot him and forget to take his wallet thus creating avoidable suspicion what is more plausible a dumb robber which we know exist everywhere or a dumb ultrassassin which only exist in movies 5 dunno why does it matter no answer to those questions would make his death a black op 6 more speculation and again no answer to this question would be evidence that rich was murdered because of leaks people leak every single day without getting killed for it especially post hoc 7 cannot speak for the poster you are responding to i do not have a strong opinion ,5,conspiracy
Kolyin,and what evidence is there that they actually get involved in posting comments here ,1,conspiracy
Kolyin,assuming that people do buy reddit accounts that not evidence that enough accounts are bought sold to make a dent in a sub like r conspiracy or that any particular account is a shill people who freak out about shills put themselves into an ugly mental space where it impossible to listen to a dissenting opinion disagree with me fuck you shill you say this pi retracted his statement fuck you shill you want evidence of this conspiracy why are all the shills allowed to post here it an excuse for not communicating or thinking outside the bubble ,4,conspiracy
Kolyin,so you refuse to read a piece because it cites a guy that you have heard has a lab partly funded by sanofi do you feel like you are out there working to find out what is true or that you are out there defending your pre existing beliefs ,1,conspiracy
Kolyin, the original data of thompson study very clearly shows does it can you show me a single analysis by an actual expert that agrees with your interpretation the only anti vax take i am aware of that even pretends to be scientifically serious was hooker and as we have established that was a hack job so if it so easy to show these terrible facts why did they make such a hash of it and why did they give up when actual statistician started pointing out how bad the anti vax analysis was and as for your long copy and paste job on autism with all due respect somehow i doubt you are an expert so where are the autism experts who agree with these takes where are the neurologists why are all the people who actually study this subject for a living focusing on prenatal indications rather than chasing anti vax conspiracy theories down the reddit rabbit hole russell blaylock was a surgeon not an autism or immunology or epidemiology or vaccine specialist and a chemtrail nut although that might not be a knock against him on r conspiracy shaw a professor in an ophthalmology department and has apparently done some legitimate work with als but is again not an expert in any of these fields if i had to go to the far far far fringes of science to find people to support my conspiracy theories i would start to wonder why the evidence was not lining up to support those beliefs at some point you should be able to start by looking at the best science the biggest studies the most consistent results the most experienced researchers rather than cherry picking fringies based on whether or not they agree with your hot hot take ,1,conspiracy
Kolyin,1 the us has a high sids rate does not even begin to address the original point that supposedly every office sees deaths following vaccinations it just holding up a fact that sounds a little like the question at issue and using it as an excuse to not reconsider your pre existing belief the numbers just do not support what you want to believe screaming in all caps and bold wo not change that there no font big enough or bold enough to change the data 2 you are overlooking the fact that the vicp pays out table injuries without even asking for proof of causation 2800 payouts may reflect fewer than 2800 injuries as people make claims on unrelated conditions i do not know if the payout rate is higher or lower than the ae rate i suspect it pretty accurate given that vicp lawyers beat the bushes pretty hard to drive in business i know that the professionals who study the question even those in independent labs and centers think the vaccines are safe even thompson 3 wakefield likes to tell people the retraction was just because of an oversight about hooker conflicts it not true the editors stated that hooker undeclared conflicts compromised the peer review process ie more than just he did not tell us he was part of x group and then observed furthermore post publication peer review raised concerns about the validity of the methods and statistical analysis therefore the editors no longer have confidence in the soundness of the findings there were serious problems with his methods and results as statisticians have made clear in public comments about his work it no surprise he also stated publicly that he did not understand the stats thompson is not the leading immunologist in the world and he did not hide a vax autism connection he was worried that he had but actually looking at the data it apparent that a the cdc did not hide anything even wakefield could not identify a single piece of data they tried to destroy and b there was not any problem with their results there a reason hooker could not get the answers he wanted with an appropriate statistical analysis the numbers do not show a real causative connection between vaccines and autism which is why vaccination rates do not autism rates do not believe me find a statistician who agrees with the anti vax interpretation i mean how deep does the evil baby killing conspiracy go all the epidemiologists immunologists neurologists autism specialists now the statisticians too all the research on autism is showing a it not a growing epidemic and b it has prenatal causes so not vaccines it amazing that you think the data is clear as fucking day but somehow only conspiracy theorists and screaming redditors can see it not the you know neurologists and immunologists and epidemiologists and autism specialists there is not enough money in the world to buy all of those people it not a conspiracy the theory is just wrong ,1,conspiracy
Kolyin,you think a surgical oncologist profits from the sale of vaccines huh hell of a wall you have built between yourself and thinking ,1,conspiracy
Kolyin,yep as anyone can see from checking out my writing about conspiracy theories http goodfightbook com ,1,conspiracy
Kolyin,yeah except no i hardly ever comment on reddit at all when i do in the past it been about sovereign citizen types most of my comments are on this thread because i have left a lot of comments over the last couple of days this is me https violentmetaphors com 2016 05 29 a skeptic on the conspirasea cruise i am writing a book about conspiracy theories and attended the conspirasea cruise as research as you will see my primary interest is legal conspiracy theories but those tend to be less harmful than anti medicine conspiracy theories ,1,conspiracy
Kolyin,i saw the excerpt in the study it does not support the claims anti vaxers make about him and of course that excerpt has not been peer reviewed nor do we know if it was even printed with permission or in context ask thompson about giving personal correspondence to anti vax zealots you are complaining about being seen as hysterical and asking who my handler is in literally the same breath only on r conspiracy does the conclusion shared by a vast scientific consensus get taken as proof that you are a super secret agent i do not have a handler you are a neophyte hysterical no one has ever paid me to post anything at all ,1,conspiracy
Kolyin,did you read the link it does not sound like it it interesting to me that it only bloggers and anti vax activists who think the research is still inconclusive the actual scientists who study it all the epidemiologists for example and no they do not all work for pharma consider the question definitively closed and the autism experts are looking at prenatal indications not vaccines because they too consider the research definitive on the subject vaccines do not cause autism it analogous to creationism answers in genesis will scream all day that the science is still in doubt the science is still in doubt but the actual scientists are off making important discoveries having long since disposed of the conspiracy theory ,1,conspiracy
Kolyin,1 the nvic is an incredibly biased organization and it shows in that bogus statistic if only 1 40 office reports a death they assume that means that there are 40x as many deaths because they assume every office should be seeing deaths no pediatrician or doctor of any kind i have ever talked to has seen a death following vaccination they are not reporting those deaths because they are not happening i do not see any link for the fda statistic i would be interested if you have one because i am obviously skeptical and do not take online bs as gospel 2 the vast majority of vaers reports are things like redness and swelling at the injections site others are things like car crashes because anyone can report anything they want to you say only about 1 4 of claims get compensated as if you are assuming that all claims should be compensated that not how human beings work people do make claims that are wrong or not supported by any evidence like autism 1 4 is much more than would be compensated in normal court where evidence of causation is required speaking as a lawyer the vicp is a claimant dream high comp rates free lawyers non adversarial process 3 yeah thompson was very worried about the study methodology as for its results he personally wrote when he was protected from discipline by the whistleblower act that parents should not avoid vaccination and since he spoke up anti vaxxers have had years and gobs of money to test his claims they have not identified any actual problems with the cdc results hooker tried but his paper was retracted when it came out that a he would deceived the journal about his conflicts of interest why does that never matter to anti vaxers and b his results were garbage because he bungled the math google the statistics of his paper there a great explanation by a statistician the anti vaxers never found a single statistician who would stand up for hooker bogus methodology and eventually they totally gave up on it and made vaxxed instead pandering to conspiracy theorists instead of trying to show actual problems with the research because they could not 4 i do know what taxes are and you are right the taxpayer pays for it and the vaccine manufacturer is the taxpayer they write the check they cannot raise vaccine prices arbitrarily if they could raise a 2 vax price by 0 75 they would already be charging 2 75 so it impacts their profits i think probably some has been passed on through prices but barring perfect price elasticity which vaccines obviously do not have they are eating the cost of that tax ,1,conspiracy
Kolyin,did you read the link that not what it says it goes into the details behind each study which the anti vax propaganda does not ,1,conspiracy
Kolyin,so are the anti vax zealots posting here not activist authors with an agenda like people who post bogus statistics or is it just people who disagree with you who have to be disqualified asap lest anyone hear how bogus those stats are ,1,conspiracy
Kolyin,nope i am interested in conspiracy theories but mostly just lurk i jump on threads about sovereign citizens my favorite type of ct and here where i just saw some absolute gibberish i hate seeing lies like yours deposited into the public record your numbers are complete fabrications i do have children or at least i will have a son in a few months my wife got her flu vax while pregnant and we will of course vaccinate the kiddo all the data that would weigh against that decision falls apart upon closer investigation like yours ,1,conspiracy
Kolyin, through october 14 2007 does not mean in 2007 it means from the beginning of the reporting period 1990 through that date your numbers are inflated about 30 fold you might not understand these issues well enough to have an educated opinion on the statistics ,1,conspiracy
Kolyin,that a google search not actual data and the only link i see that supports your claim says that only 1 40 doctor offices report a death following a vaccination the vast majority of people have no adverse events after a vaccination much less deaths of course doctor offices do not see such deaths and therefore do not report them ,1,conspiracy
