name,body,score,sub
Mangoinhand,escalating to dirty talk and then text snapchat wtf that not eacalating that wasting time on text you should be using text only to schedule a meetup and then do real kino and escalation ,1,TheRedPill
Mangoinhand,where the pyramid was looking for a visual,3,TheRedPill
Mangoinhand,i did not say it was mildy difficult and back out i said that if it no longer suited me as in i have better options for clients customers contracts if someone crosses the line of drama disrespect then they get soft nexted or hard nexted clients customers included when there are multiple income streams already and other clients customers wanting to enter my life waiting in line then there is no need to put up with anyone bullshit you tell another man where to go because everything i do i make sure the other person company needs me more than i need them,1,TheRedPill
Mangoinhand,yes the matches are rarer i get about 10 matches per week women aged 29 32 only about 2 3 matches of under 25 a week i am lean lift and have good style ,1,TheRedPill
Mangoinhand,you can get hsv1 and hsv2 in either place still wo not have issues if you a get lots of sleep b take vitamin d c exercise regularly,1,TheRedPill
Mangoinhand,wow thanks for the tip to stay away ,9,TheRedPill
Mangoinhand,i am 33 and only took trp last year no regrets life actually gets better in your 30 i keep getting older but they stay the same age ,10,TheRedPill
Mangoinhand,squats bench press bicep curls boost your testosterone plus it better if your women are your type attractive extra points if she is of ethnicity body type that you fap to all love swallowing and worship your cock if you are with a girl that you cannot get an erection with after sleeping with her dozens of times then she is not for you,19,TheRedPill
Mangoinhand,you most certainly have had hpv pretty much everyone gets it at some point ,3,TheRedPill
Mangoinhand,this is terrible advice so many upvotes makes me wonder first off there is no disclosure requirement for herpes it is a skin condition that is most often passed on from parents to their kids kissing touching that why about 80 of population have anti bodies you going to sue parents too maybe the government and courts can help you get your revenge sound familiar emotional damages makes me think this is a troll post do not be a fucking pussy for getting a skin condition that 80 of people have victim mentality all over dating websites for herpes talk about perma blue pilling yourself ,7,TheRedPill
Mangoinhand,dude it not that bad unless you have herpes in the eye or some shit like then sorry of that the case i know how you are feeling and it taboo and all this shit blah blah blah but it not life threatening and pretty much goes away completely with lifting weights cardio and 8 hours of sleep every night plus 4000iu vitamin d every day which everyone here should be taking no matter what anyways ,3,TheRedPill
Mangoinhand,herpes who cares 80 of people have it get lots of sleep and keep your immune system tops and you will be fine and experience little to no outbreaks if you feel like you need more control take 1000iu of l lysine per day stay away from foods with high arginine nuts almonds etc drink plenty of water and lift weights and 4000 iu of vitamin d always no exceptions on this one herpes or not do not spend a decade feeling inferior and then realizing you were a complete dumbass for worrying about something that does not matter always use condoms do not fuck anyone when you have an outbreak trust me you will be totally fine and wo not give a shit and neither will she if you are a strong attractive and wealthy male ,1,TheRedPill
Mangoinhand,fail if you think you were borderline abusive then you were that guy drama fun fact where do macro aggressions get hamstered into a post on micro aggressions in your post spin more plates and lift more,5,TheRedPill
Mangoinhand,not sure if this is an insightful post are dumb as fuck,-1,TheRedPill
Mangoinhand,where the lay wtf i am willing to bet you will not get the lay why too much communication too much sexualizing experience up front she will flake from the pressure prove me wrong,4,TheRedPill
Mangoinhand,with his abundance mentality he will have another job soon im willling to walk away from any situation within 2 seconds if it does not suit me including all my clients and jobs never have one income stream,4,TheRedPill
Mangoinhand,400k property pulling 35k gross yearly 20 down for 80k 25 year amort at 2 59 interest left with 3k year net of piti vacancy and repair budget and snow removal lawn care 3k return on 80k invested is 3 5 coc and i am talking about triplexes and fourplexes sfh and duplexes no longer cashflow at all,2,realestateinvesting
Mangoinhand,yes it is gossip but he is still making a good point gossip is defined aa talking about someone specific you know when they are not present at some level all studies and adectodal experiences involved gossip as the subject matter to build ideas from there are a number of things the priveleged class get to do including stay at home parenthood getting 8 hours of sleep every night not commuting for hours each day multiple vacations a year one or both parents being stay at home these are foundations for a great quality of life listen up men if you do not have the easy opportunity to freely and realistically choose to stay at home with your children then you are not part of the privileged class better make sure you structure your finance and circumstances so you can bask in having that option on a whim you never know when you want to tell your boss client customer to fuck off if you cannot walk away from any situation with little impact to all your income streams then you are dependent and not in more control of your fate and happiness ,28,TheRedPill
Mangoinhand,that fantastic on what downpayment is that and how long mortgage amortization i am calculating things with 20 down and 25 year amort very hard to get an 8 9 cap rate here but thankfully i found a couple over past year and a half after intense searching,1,realestateinvesting
Mangoinhand,when you say cash on cash return are you calculating it with vacancy and also saving up for future repairs if you get 15 cash on cash return each year after all that then i am truly envious ,1,realestateinvesting
Mangoinhand,there also principle pay down and the fact that i have control of the asset directly another benefit is that you get to use the property for tax deductions,3,realestateinvesting
Mangoinhand,in ontario you have to be happy with a 3 cash on cash return brutal,1,realestateinvesting
Mangoinhand,buy it now ,1,CommercialRealEstate
Mangoinhand,fail she led the interaction and took you to meet her parents actions not words actions showed that you wasted time with someone disinterested,1,TheRedPill
Mangoinhand,not reading this post helped me tremendously ,52,TheRedPill
Mangoinhand,also do not worry about working long term us millenials prefer jobs that last 1 3 years tops or get laid off due to shifting labour market and major techno structural changes are underway the job market is shit even if you make 150k year like me who wants to spend the better part of the sunniest parts of the days indoor working for some asshole with a bunch of douches for colleagues mind your own business ,3,TheRedPill
Mangoinhand,sales what does buying a duplex triplex 4plex for yourself to live in and rent the other units have to do with sales if the property market is over inflated ie no cashflow left after paying mortgage taxes and insurance then that has everything to do with deciding not to make a dumb decision every market has gems to find with effort took me over a year of intense effort to find my dream triplex that is beautiful and generates cashflow to allow me to truly live for free it like saying that since over population is out of control that you rather not contribute to it by continuing to live something else is at play here in your statements ie certain myths are ingrained and are dismissing things prematurely ,1,TheRedPill
Mangoinhand,and then the nsa has your dna too fuck that,1,TheRedPill
Mangoinhand,it not easy being beta after sex when you have 5 plates what kind of garbage is this,1,TheRedPill
Mangoinhand,real estate is not part of your values you mean you live in a cardboard box real estate puts a roof over your head you care very deeply about real estate unless you live in a cardboard box ,1,TheRedPill
Mangoinhand,agree and amplify someone said make it worse they are correct or ignore it you should be so busy with your mission goals lifting spinning other plates that you dont even bat an eye trust me it a great feeling when you realize a day later that you passed a shit test without even noticing it barely or trying,1,TheRedPill
Mangoinhand,paying her rent and car first things if you are on the lease give notice immediately to terminate it if you are on the car note take the car back immediately and sell it cut your losses those 2 things will show you the way forward,1,TheRedPill
Mangoinhand,i feel your pain it must have been hard to love her the solution cease all contact lawyer up and start lifting and spinning more plates sorry not sorry you know what you have to do ,1,TheRedPill
Mangoinhand,if the conversation goes to a place that you did not plan or is not furthering your goala then you are operating in her frame take control back,7,TheRedPill
Mangoinhand,ive got one fb like that myself i acted too much like a bf and broke my own rules of cuddling and seeing her more than once a week thankfully i have 4 other plates where i did not fuck up in that way ,1,TheRedPill
Mangoinhand,then be clear to yourself that she is an mltr and not just an fb,1,TheRedPill
Mangoinhand,should not flake that disrespectful and she would be right to soft next you then you did alright just more drama may come your way in future soft next means completely ignoring her with no warning for 3 7 days then picking things back up like nothing every happened,2,TheRedPill
Mangoinhand,not bad but you responded to her drama by complaining about her treating you like shit became a mini drama queen the result short term gain sex tonight long term more drama from here could have just soft nexted her for 3 7 days,3,TheRedPill
Mangoinhand,no stronger bond as you can see the bond was so strong that she cried and became needy which caused you to further lose frame you want her coming back for more and she will come back for more with giving her orgasm s and fucking her like it your last time before going to prison not talking too much and seeing her too often and not texting too much,8,TheRedPill
Mangoinhand,let me count your mistakes snuggling too much after sex seeing her more than once a week saying when i am with you your the only girl that matters and i expect you to treat me the same being too verbose and telling her your banging other girls should have just said something like it complicated as another poster said and fired back with a topic changing question gradual disclosure is key here ,18,TheRedPill
Mangoinhand,this is juvenile why didnt you fuck her ghosts do not talk let alone fucking snapchat a girls best friend wtf is this this is probably the funniest lame post i have seen here in a couple of weeks i mean that as a compliment ,3,TheRedPill
Mangoinhand,that a fucking awesome story and nugget of wisdom you made my day sir ,1,TheRedPill
Mangoinhand,look within yourself before blaming anyone,1,TheRedPill
Mangoinhand,you get oneitis because you do not have enough plates i used to be like that but it is hard to get oneitis when you have 3 5 plates on the go that you had sex with recently spin more plates ,13,TheRedPill
Mangoinhand,outcome independence that the key depending on making her feel a certain way is not good for success it should not matter what she does because you are busy working on your mission goals career health family etc if your goal is her then that is oneitis hatred or love she the one of your efforts next her and spin more plates she may even come to you in a few months ,2,TheRedPill
Mangoinhand,you waited too long to say hello finishing your dinner and no balls to say hello at the start that was the mistake that cost you ,3,TheRedPill
Mangoinhand,what are you after ie your goal you did not ghost her because ghosts are invisible and she sees you around at best was a next not clear on what your request is here,1,TheRedPill
Mangoinhand,3 days including friday night,1,TheRedPill
Mangoinhand,soft next her for 3 7 days ,1,TheRedPill
Mangoinhand,i nailed it this weekend with 4 of my 5 plates again ,0,TheRedPill
Mangoinhand,banging 1 or 2 girls in a 3 month span it a stretch to call that a plate but i will accept try banging 5 plates in 5 days and then repeating that within the next 2 weeks,1,TheRedPill
Mangoinhand,you are the alpha fucks he the beta bux she will fill less guilty the more you pleasure her and the more you lift,27,TheRedPill
Mangoinhand,you identified your mistakes like the others pointed out it was your intention to do this should not have lost frame,2,TheRedPill
Mangoinhand,i do not ask about paternity test i merely bring up the talk about abortion children and then slip in there with any child i would always get a paternity test before signing birth certificate it not a question to her it is a statement ,1,TheRedPill
Mangoinhand,you do have feelings for her or you would not be posting here ignore her completely make her initiate get togethers make sure she pays her share or at least alternate paying be seen have with other women escalate touching her after a few weeks months go for the kiss if she recoils turns away then walk away and next her be prepared to walk at any moment ,17,TheRedPill
Mangoinhand,why that ,1,TheRedPill
Mangoinhand,should have played along for at least 3 months that way you know she will carry the pregnancy to term and then see the look on her face when you tell her about your vasectomy ,23,TheRedPill
Mangoinhand,no you do not just sleep with anyone you want almost but not fully you cannot sleep with oltrs friends family you cannot sleep with your oltrs coworkers boss you cannot sleep with ex you used to love you always use condoms ,1,TheRedPill
Mangoinhand,end game is that you obtain healthy grand children signing a peice of paper with the goverment is not end game ,2,TheRedPill
Mangoinhand,wow faithful there is nothing unfaithful about you and your wife getting some on the side in an open relationship ,1,TheRedPill
Mangoinhand,this not sure why the downvotes since it is actually nuanced position maybe the guy and his wife are in an open relationship maybe she allowed him to do it once for whatever reason you can be in an emotionally committed open relationship people ,1,TheRedPill
Mangoinhand,jesus just tell her you are not exclusive aand there no dilemna about resisting urge to cheat simple,10,TheRedPill
Mangoinhand,all humans revolve around relationships autistic dumbass all of them the self other women are more intune to this that all,4,TheRedPill
Mangoinhand,tinder is great haters gonna hate op abuse of statistics is laughable ,4,TheRedPill
Mangoinhand,the solution is simply lift weigts and get in the best shape of your life women will be hitting on you all the time and she will notice and either a up her level of fitness b several of those women will sweep you away from her and you go living an awesome life,2,marriedredpill
Mangoinhand,going on a trip alone is boring wtf are you talking about that is the problem that repulsed her if you do not love your own company why would anyone else ,1,TheRedPill
Mangoinhand,i also do not have a job i have a corporation and do bullshit that is tax optimized if someone tried to disrespect me you got no job then i laugh with no shit what the hell are you doing offering a full trip to someone for free rich or not she wouls have found a way to make you feel bad because you were acting like needy beta ,3,TheRedPill
Mangoinhand,you missed the point if you are already tall ripped stylish bad boy type and you are an engineer then you slay pussy like zeus plus it is very masculine to be able to build actual useful things in the real and online realms ,3,TheRedPill
Mangoinhand,your mistakes with her not at least escalating to kiss by 2nd date not at least doing everything to escalate to sex by 2nd date not getting sex by 3rd date asking her whats up is needy behaviour dig a much deeper hole now probably leaning in too much to her when she talking probably not letting her express herself and properly listening to her answers to your leading quesions ie up your conversational active listening game your foundational mistakes not approaching multiple woman per day not making enough options for yourself ie no existing woman in your life acting as if you think you will see her again after the x date every date must be fully utilized to escalate as fast as possible not lifting enough weights and not having a 6 pack abs,4,TheRedPill
Mangoinhand, in general you ll tell her straight what she has done which is unacceptable you ll tell her not to do it ever again then you ll tell her how you want her to behave and usually end by commanding her to apologise and think of a way to make it up to you sounds like guy drama why do you desire to be respected so much so that you will set her straight would not a soft next be equally or more effective at accomplishing the same ends ,9,TheRedPill
Mangoinhand,it is a beta job on the sense that there are a lot of beta in it which is awesome since it is easy to be the best less competition in your field for woman look at salary stats for a field and then pick one with the highest pay be careful about being a lawyer tho a lot of that shit will get automated quick with smart contracts ie ethereum over the next 10 years i am a software engineer and i am upset that salary consulting rate is only about 160k year should have become a md and worked for 5 years and then retired with my half dozen rental properties ,3,TheRedPill
Mangoinhand,rich dad poor dad start there and work studiously to buy your first duplex triplex fourplex it will take concerted effort and focus since other guys like me are always on the hunt for the gem of these properties it is more than worth it over any other kind of big purchase or investment,9,TheRedPill
Mangoinhand,i am 33 and discovered trp last year do not feel i have missed out at all more than happy with my life 20 years old you know what will be your stupidest mistake picking a dumb degree or not buying an investment property soon enough do not be a dumbass and do yourself a favour and make sure you retire by 35 it a beautiful view from here,25,TheRedPill
Mangoinhand,that why i love engineering because you can be the top 20 of men in general and then automatically be top 5 10 smv of software developers and make a ton of money,9,TheRedPill
Mangoinhand,others reject you because you reject yourself unless you are grotesque or hideously ugly in which case you should save up or borrow money for serious plastic surgery,1,TheRedPill
Mangoinhand,alpha porn and obsession ,1,TheRedPill
Mangoinhand,i am coming from a time and place in my life where pussy is so overflowing that i have to go out of my way to hide evidence from friends woman family sexual pre selection photos on facebook sure a couple select ones with friends attractive women creating new facebook wall posts with new fbs woman hell no invites drama and then someone will say something and then i will spend 3 minutes time educating or setting them straight it alpha male 1 0 behaviour wanting to feel respected and setting people straight ,1,TheRedPill
Mangoinhand,everyone does this to an extent they are just more aware more comfortable and less angry with knowing this basic psychological aspect it called priming this is about taking lead of the conversation and guiding it to what you both want sex fun relationship making babies etc perhaps you can be more disingenuous and just guide the conversation to cars and whatever are bullshit hobby people have instead of romance give me a break you and the women are dating for a sexual relationship potential not a platonic one if you felt more comfortable with talk of sexuality then perhaps you will see how much women genuinely love to talk about this stuff openly with you ,0,TheRedPill
Mangoinhand,yes educating woman about your life is a good use of time are you sleeping with her or planning on sleeping with her or is it someone inconsequential to your goals ,1,TheRedPill
Mangoinhand,you better not have told her you loved her before she told you the same man you blew it if you did ,5,TheRedPill
Mangoinhand,show off your fb girls etc on facebook and then act surprised when people comment on them in a way you did not anticipate you are giving yourself drama,5,TheRedPill
Mangoinhand,always aim for higher standards for yourself and everyone in your life keep upgrading everything,7,TheRedPill
Mangoinhand,invite her over on the first date and i do care who has to pay since i have 5 plates and it important they pay their share and also continue to sleep with me ,1,TheRedPill
Mangoinhand,what is wrong with doing the odd gig through your corporation and then using the money from said odd gig to pay for internet cell phone etc it not all or nothing guys i started out merely incorporating myself and doing the odd job made 30 dollars in first year then 500 dollars next year then 4000 in after and now pulling in about 23 000 this year all while having another job and slowly moving all to consulting best part all the losses from the first couple years can be carried forward and then written off ,2,TheRedPill
Mangoinhand,maybe the conversion ratio of a new girl to plate is at best 40 i am in aggressive plate building mode then i will tone it down like you say go out with 5 8 spread out over 2 days in a week or so then make your pick and add her to the roster ,1,TheRedPill
Mangoinhand,the standard answer to a woman that cancels flakes or wo not agree to a meet up is no problem i will make other plans then some other time this preserves your value and show that she will need to step it up with you if she wants to meet i cannot tell you how many times woman do a complete 180 and about face after dropping that line ,40,TheRedPill
Mangoinhand,speak for yourself i have a lot more free time than you clearly now you are asking for free articles written by me on how i made my wealth maybe go buy those books that you seek or make the posts yourself on your own time nice try cheapskate yes have 5 plates and they are wonderful hb7 8 in process of replacing the hb7 with hb8 9 slowly hence the importance of being top of the game all the time ,1,TheRedPill
Mangoinhand,right so you will go dutch each and every single time you go out 100 of all interactions i call bullshit cheque game is useful for analyzing situations and not just giving a single simple solution with basically saying go dutch for all interactions ,2,TheRedPill
Mangoinhand,it her body and time not yours she is free to do with it as she pleases without having a controlling type like you in her life you know what bothers me more than a girl sleeping with another guy that i would have to only have sex with 1 women while in a committed relationship i get to bang my 3 5 fb while non legally married and she can bang some other dude if she feels like it about 60 of women will not take you up on the offer and prefer to only be with you even though you did not give them sexual exclusivity win win,-1,TheRedPill
Mangoinhand,this 2 is the path i have gone before unfortunately i did that to a work colleague where his daughter was an hb10 age 19 i was 20 and had a girlfriend at the time face palm ,3,TheRedPill
Mangoinhand,i think it ok the alternate who pays full tab with a plate if the bill is large then i will insist on splitting it regardless of who turn it was to pay i only think it is ok to pay full tab on first cheap date with someone that is truly into you however would love to hear other peoples success data on how it works out if they do not pay the first ,1,TheRedPill
Mangoinhand,this is interesting i like the do you want me to pay for both of us even with coffee it can easily cost up to 10 for 2 if i go out on 4 first dates a week and i do for about 6 months straight then that is around 150 month small amount but in 10 years that is over 20 000 plus i want to increase her investment in me all of this short circuits if it is the first date and she likes you a lot and you like her ,4,TheRedPill
Mangoinhand,yes pay for first date 2nd date is at your place,1,TheRedPill
Mangoinhand,you did the right thing totally however there was another totally right way to do it as well remember her trying to ruin your objective and controlling conversation in this manner is ome big shit test you sitting walking with her right and you had a plan for you and her right always see the outcome in mind always be closing abc my objective is to always direct and lead the interaction to sex always this means that i am only talking to women to ask her out or for her number setting up next meet up talking while escalating while having sex talking after sex if you did not have a goal in mind with your hopefully short and sweet interaction then you will be used as an emotional tampon now because you had a plan in mind then when a woman says she is banging another guy you follow like this her i am fucking so and so you oh cool so did you hear about this new movie just act chill like it did not phase you for a split second if she brings it up again somehow then you say something to the effect of sounds like a relationship counseller may help and laugh and change subject again all the while keeping on task to your goal for the interaction she keeps talking about other people on my interaction with her then it clear to me she not interested hard next,8,TheRedPill
