name,body,score,sub
Mangoinhand,yes there is a plan for multi venue first dates and it would be more like you describe i do not do multi venue first dates because i keep the first date short less than an hour then the 2nd date is at my place where i escalate all the way thanks for the feedback,3,TheRedPill
Mangoinhand,yes wanted to still emphasize that you can be the silent provider type in your mind if that your thing when you know she down best plan instead of all of this dates that cost no money but i do not mind paying 20 bucks for first date and knowing full well i will do the you got this line on the subsequent meetup that costs money edit agreed on others posts about not man shaming leaving original post as is for posterity,2,TheRedPill
Mangoinhand,no smile at all not chummy not anything just business casual almost like asking your teammate to pick up the tab when you both have company credit cards you got this ,5,TheRedPill
Mangoinhand,happy with each other got an awesome vibe she down you are digging it with her ,1,TheRedPill
Mangoinhand,no cocky grin in this case just casual like between good friends,2,TheRedPill
Mangoinhand,reformatted and started a more detailed post https www reddit com r theredpill comments 60r6wc cheque game the art of getting her to pay ,1,TheRedPill
Mangoinhand,casual like as if it your good friends turn to pay i am usually leaning back talking to her usually she is talking and i am listening and then casually look at bill and then her in the eyes and saying you got this asking confidently with it still sounding like a no big deal kind of a question she will reply with yeah ok sure then act like nothing happened and ask her a question about what she was talking about make sure not to shift your body language or move around too much when asking you want the conversation to go with the flow and not make it even a small interruption to the rhythym you have going there also do not really acknowledge the fact that the bill check is sitting there when server brings it out keep conversation flow going after you have decided you are ready to leave then look at the bill do not fucking touch it or open it and say the line to her you can and should thank the server for bringing it if the server asks immediately upon bringing bill then tell the server to fuck off nicely by saying to the server in a bit thanks you can still ask the server for the bill when you are ready to go server brings out bill might ask if you want to pay with cash credit whatever then say the in a bit thanks keeping conversation flowing immediately after with your date then in 10 15 minutes when you are ready to leave then start the you got this sequence what if she gives any kind of resistance and makes a sniping comment then simply say something quick and casual like no problem we can split it if you and her are digging each other and it is the first date then you must offer to pay and fully intend to pay for the drinks short circuit the whole you got this game plan line and be a fucking man and buy the entire first date off however some caveats to the above first date and digging each other a if then she insists 2 times to pay the whole bill herself then you offer to split it instead and go that route if she offers the 3rd time then let her pay the whole thing she likely reeeaally likes b if she insists 2 times to split it then you say ok and then actually split the bill keeping conversation fluid and relaxed as if it all no big deal worst that can happen is you pay for whole thing which you have been likely doing up until this point anyways ,22,TheRedPill
Mangoinhand,do what i do to get cheaper dinners and often free meals when the check comes say casually you got this i have only had it twice where she offered to split it the rest she paid if i feel she is into me and i am into her then i pay but if i feel a slight non connection then i do the above just had an epiphany maybe another reason that women are nice enough until the end of the date is because she knows this is what guys would do otherwise,19,TheRedPill
Mangoinhand,there are no accidental or unplanned pregnancies if there were unplanned pregnancies then a baby would just magically appear out of no where from a woman and no one around to help her you didnt say unplanned or undecided by man pregnancy but accidental or unplanned the point is that the woman and her caregivers had it planned so adequately that she had a bed to stay on people happened to be around medical supplies and even blankets for the child were brought in well in anticipation do not fall into the feminine imperatives language on accidental or unplanned pregnancies they are the ones in full control for the most important decisions ,2,TheRedPill
Mangoinhand,grey area depends on a number of factors did she thrust it at you did she make eye contact and smile nicely did she ask if you can take it offer her more etc did she touch your arm leg while doing it cultural expectations eastern europe vs the god awful north american hosting etiquette if you felt she was on the demanding colder side then you did good ,1,TheRedPill
Mangoinhand,there are no accidental pregnancies there are at least 5 decisions a person must make to have a child in their life 1 have sex or not 2 use bc pills or not 3 use condom or not 4 shoot load inside or not 5 use plan b or not 6 get abortion or not 7 give baby up for adoption or not there are no accidental pregnancies just decisions accidental pregnancies is in the feminine imperative lack of agency hamstering vocabulary ,6,TheRedPill
Mangoinhand,no for fucksake is not it obvious ,1,TheRedPill
Mangoinhand,a soft next is where you completely ignore her for 3 7 days duration depends on how bad her drama directed at you was delete her texts ignore calls do not give her the satisfaction of knowing you are responding or affected by her in the slightest after the soft next message her with a quick hello and schedule your next meetup do not talk about it at all if she brings up how you ignored her or how she feels bad just play it cool no problem let check out x this sunday at 5pm cool let go out on thuesdsy at 4pm we are not discussing this on text hey let grab a drink in the next few days the key is to not be a pussy and start reading her texts and getting sucked in focus on your mission job self improvement and put it in your calendar when the soft next ends so you remember to message her after that like nothing ever happened ,6,TheRedPill
Mangoinhand,let us enumerate some of your mistakes why not f close before brewery it was 2nd meetup after all she may have taken it as a date in your early interaction which sprung boyfriend feelings and hence drama earlier than needed verbalized too much on your view of relationships you even talked about nexting should have verbalized less and fired back with your own questions arguing it takes two to dance wtf if a chick starts arguing i pass her shit tests a couple times then give her up to 20 seconds of drama hostility if it longer than that i ask her do you want to go home or i am going home and quietly get up and leave quick soft next for at least 3 5 days,6,TheRedPill
Mangoinhand,lol i commend your perseverance that an awful lot of shit experiences welcome ,2,TheRedPill
Mangoinhand,next time you know exactly what to do though i even told a woman i am going to bite her finger off if she brings it up again anywhere near me moment anyone gets in my face and feel the personal violation is the moment i am prepared to calmly get up and walk away to never see them again with any words uttered i am doing her a small favour by grabbing her hand and then caressing her cheek as if she was a small child or a pet showing affection and dominance if she does not melt and instead resists in the slightest walk the most liberating feeling to not have to take anyone shit warning do not grab a woman hair or cheek if you just met her you will be tried for assault if she not into you,2,TheRedPill
Mangoinhand,that would be even lamer i gave him the benefit of the doubt,1,TheRedPill
Mangoinhand,she a solid 5 if she lost some weight then 7,0,TheRedPill
Mangoinhand,she touched your face i hope you grabbed her hand gently and moved it away and then grabbed her neck and hair gently while looking into her eyes,3,TheRedPill
Mangoinhand,you got oneitis stop it you should easily be openinh dozens of girls a week and going on dates with girls at least a couple times a week get more plates not her because you do not eat where you shit ,2,TheRedPill
Mangoinhand,2 minutes before the date i text her that im almost there then i join her 3 5 mins late it shows i am not waiting at the bar like a chump as if i have nothing better to do than be early you should know whether she flakes or not before then if you dis the anti flake stuff,2,TheRedPill
Mangoinhand,im the same way with limp dick when im nervous the first time happened with all 5 plates my go to fb always makea me rocked hard after 2nd time sex there some things i do to mitigate consequences cutting out porn was the biggest ,1,TheRedPill
Mangoinhand,there a way to start a family without handing your balls over and allowing the government to have a shotgun to your head dm me,1,marriedredpill
Mangoinhand,you automatically become common law married in canada after living together for a while she is in effect pushing for marriage i cannot believe you have other plates maybe they are ugly and you made mistake of having your main plate being the most attractive of the bunch oneitis,0,marriedredpill
Mangoinhand, you will be miserable living with her this is a disaster in the making look at your own words you know what to do,0,marriedredpill
Mangoinhand,do not let a plate upgrade herself to a status relationship whether she was an ons fb mltr low or high end or whatever you choose to upgrade downgrade her when you want she deserves a soft next for this kind of pushy behaviour and you are being a pussy for having weak boundaries ,0,marriedredpill
Mangoinhand,every week i simply schedule about 6 first dates 2 some days i schedule 4 back to back 2 hours apart then we then day comes inevitable a couple flake out at least and for the remaining i end up flaking out on them because i am not excited by their conversation or i am busy with work doing my stuff i have consistently cancelled on about 3 girls a week for about a year straight and go on 2 higher quality dates as a result per week it a numbers game and this helps me become non emotionally invested,5,TheRedPill
Mangoinhand,you know what it called when i have 2 girls back to back monday tuesday wednesday thursday or sunday get used to it you should go for f close on 2nd date tho do not k close on first date,2,TheRedPill
Mangoinhand,it a good sign that she blew up and got mad at you it good self control to not talk to her after that either should have probably waited a week if not longer to contact her tho,2,TheRedPill
Mangoinhand,i did that to a beautiful desi girl in canada 7 years together she fucked me right up until the wedding night to her arranged marriage husband then she fucked me again before they had their first kid now hoping to fuck her again soon ,2,TheRedPill
Mangoinhand,what the fuck are you doing at such a shitty bar where the best entertainment you have is watching a fat man child getting made gun of by tattooed hags clearly it was the highlight of your night because you a filmed it and b you posted it and c you wrote about it what the fuck dude now we are laughing at you lol ,-5,TheRedPill
Mangoinhand,less eye glare looks like your tormented soul is escaping your sexy demonic corpse,5,TheRedPill
Mangoinhand,your eyes look like spawn of satan fix the eyes at least also start doing chest press exercises for 2 months 3 times a week then take picture again my first thought was holy fuck what a good looking dude no homo i also get a ton of matches but only like 1 5 leads to meet up and then only get the lay 1 5 times or worse if you get the lay 1 10 times that a good starting point the best you can do i heard is about a 40 lay ratio for first date,12,TheRedPill
Mangoinhand,semi chad here once i put up my abs pic i now have women open me my response one word responses and want to hangout in a few i cannot believe i never put my topless photo up before also helps that i ve been fucking lifting and dieting for a year it fucking surreal how a good looking beard and a topless photo of my lean and ripped body works for this shit guys read the sidebar but lift as if your life depends on it when pumping iron just think of this comment and how you will slay pussy with very little effort ,50,TheRedPill
Mangoinhand,anecdotal data please plus you missed the forest for the trees ie missing correct focus on what actually matters lays preferably in the form matches openers replies phone numbers first dates lays this is a sales funnel and understanding where the drop off happens provides you with actionable insight on how to improve your conversion ratio would be lays matches you did not say anything about your conversions you may be good at getting a reply but horrendous at getting them out let alone the lay however time is not free either and you will want to understand your return on investment roi take the total time spent for all phases and divide it by the number of conversions lays that number gives you the total cost per lay the major problem with your approach is that it is time consuming to think of something to say and type it out i get somewhere around 3 10 matches per day each of which i spend about 12 seconds max copy pasting it takes few seconds to open app close app etc i found a form of the opener that is not clever applies almost to all women is personal fun non needy and non gimmicky took me close to 2000 openers to refine it dm if you are interested it too valuable to share publically ,-2,TheRedPill
Mangoinhand,it sure will tell you volumes about her except the women i want to get with almost always will not accept i will be able to tell that she may have been a woman i wanted to be with but she declined or never responded this technique you propose is a filter for high n count women ugly women or extremely young and naive women a friend recently convinced a 23 year old hottie to come over on first date at his place he fucked her too she was actually innocent and cried for 2 weeks after he ghosted her after the first lay i have round about knowledge of this so perhaps i can use your filter for that however i fear the high signal to noise ratio,2,TheRedPill
Mangoinhand,actually her house then becomes the matrimonial home and you can take half of her place in event of divorce see the beauty of this plan is that worst case you do not lose anything she would be losing rent money from you if she is renting and you decided to move in best case is you get half her house event of divorce etc which is still bad to get married anyways so may not be the actual best case but you get my point there is a way to structure things at least from my vantage point in canada to be able to have all the experiences of marriage kids with almost none of the downsides if you think this through and start planning now i wo not reveal the clincher that took me a while to wrap my head around even blackdragon did not explain and share this piece himself either he does not know care or just keeps it to himself likely the former hint it takes a clever use of your funds to buy a specific type of property in your area honestly if you make a decent amount of money and start planning now you can have it all no joke and i am living it now if you are interested then dm me i will not share this info here publically since it is so deadly that i do not want any women and a bunch of men to know about it ,3,TheRedPill
Mangoinhand,if a woman lives with you in the case of a lease you will be in for a lot of drama and huge disruption to your life when your relationship ends all relationships end if a woman lives with you in your house then under marriage and common law that becomes the matrimonial home in canada she has every right to force you to sell and take half of it ,2,TheRedPill
Mangoinhand,pay her directly not pay her rent i know it can be read both ways i used to pay my ex half of the marketable rent of her house when i lived with her i am in real estate so it not too hard to compute what that is the beauty of this is that if she dumps you you dump her then she stops receiving payments immediately since you move out asap bonus points if you have a bedroom another house that you keep vacant and can move in a 2 minute notice she can fuck chad act up but then loses 600 month immediately lol the arrangement i have now set up is so air tight and well crafted that i think an ebook is in order on the topic of attract and love women while living free and secure ,3,TheRedPill
Mangoinhand,bingo this i like to meet the girl in public nice place for tea coffee for less than an hour if she passes that then 2nd date is at my place reasons first date is very cheap first date is fast filter out catfish and sluts ,21,TheRedPill
Mangoinhand,the problem with this is that it will bring in all the ho too quickly ,5,TheRedPill
Mangoinhand,you dodged a fucking bullet do not second guess yourself,50,TheRedPill
Mangoinhand,do not ever let her move into your house if you have one before meeting her do not ever buy a house together pay rent to her directly to live with her in her house do not put yourself on the lease ever do not ever share bank accounts loans credit cards or any assets sign a co habitation agreement never get legally married have a wonderful wedding ceremony if you must but do not sign any papers ,17,TheRedPill
Mangoinhand,i have 5 plates all hb7 8 they range from cute to very cute each banged and swallowed my load in the past 10 days see them each once a week or every second week for a few hours bang drinks food chill bang again plus they pay their fair share alternate who pays for outings if we do go out and get this 4 of them are about 100km away and drive in to see me they are in fields of accounting corporate sales engineering and biology it would be a breeze to add another but having 14 fucking boggles my mind and not sure how to do that yet maybe i will stick to 5 but gradually up convert them all to hb9 and all under the age of 24 must lift more and make shit ton of money how do i have the time for starters i invested wisely in real estate and work from home for my career ,3,TheRedPill
Mangoinhand,the fact that you have oneitis and posting here tells me that you are a beta next spin more plates,3,TheRedPill
Mangoinhand,be unrelentless in upping your standards for yourself and for all the women in your life my goal is 14 plates with all of them being hb9 10 and cooking for me ,4,TheRedPill
Mangoinhand,beat me to it except i was going to go further and say she already did and hence why quiet ,2,TheRedPill
Mangoinhand,wouldnt mind getting married why ,1,TheRedPill
Mangoinhand,move,1,TheRedPill
Mangoinhand,them those cannot be red pill woman if they are low class over 25 years old etc ,1,TheRedPill
Mangoinhand,where can i find the official definition woman also have disney societal programming and a beta woman gets screwed too in my mind a red pill woman would play flawlessly ,1,TheRedPill
Mangoinhand,she would get settled by 21 23 years old and raise a beautiful family until the kids are 5 years old or so pair bonding intact ,0,TheRedPill
Mangoinhand,but why not live in a cheaper apartment and rent out the other one at higher rent ,2,TheRedPill
Mangoinhand,you look the girl in her eye like a delicious peice of meat and start kissing her immediately run your hand on her shoulders and move to the ass quick keep kissing and start pulling her shirt off and keep undressing her then you fuck her or get a blowjob or whatever jesus christ man i almost think you are trolling us here,1,TheRedPill
Mangoinhand,im white and only date indian desi girls am i fucking racist abso fucking lutely love brown girls like chocolate cream pie you know what pisses me off brown girls who want brown guys those fucking racist bitches ,1,TheRedPill
Mangoinhand,dude you do not have confidence or abundance until approaching girls feels like a job clock in tons of time and you are no longer feeling pain of rejection then you will be awkward and not very confident you are faking it a confident man would have thought nothing of it after a few minutes let alone hours later and then write a post about it ,1,TheRedPill
Mangoinhand,you are shameful your approach with a group of woman is awful and 99 of even white guys here would have been laughed out read day bang by roosh and then come back in a few months after implementing it and tell us how it worked you may have other victomhood issues you need to deal with i have tons of indian desi friends that slay like mad ,1,TheRedPill
Mangoinhand,monk mode just fucking tighten up your physique and approach girls everywhere im 6 feet tall and used to be 60 pounds overweight what i would give to be 6 foot 4 and overweight and your age i would slay pussy like a god for decades stop being a bitch and enjoy your godlike genes you lucky bastard,1,TheRedPill
Mangoinhand,i got goosebumps when she said fried chicken creepy and awkward ,2,TheRedPill
Mangoinhand,why cannot you spend time with her regardless of payout what does some labels such as blue pill have to do with mooching free rent ,2,TheRedPill
Mangoinhand,thanks for this visiting budapest in the summer,2,TheRedPill
Mangoinhand,nailed it,1,TheRedPill
Mangoinhand,well i have 20 years of development experience myself and a comp sci degree it would cost you 50 bucks and a lot of your time time is the most precious asset so i doubt it is wise to charge yourself 1 cent per hour the effective cost is higher it would take me between 10 to 25 hours to build a robust bot more likely a week with test cases so between 500 to a few thousand in our earning power so for the other guys watching expect to pay a few thousand dollars for a simple tinder bot,2,TheRedPill
Mangoinhand,there are bots for both sexes meanwhile i am crushing it on my tinder game and do take it seriously about as easy to get an attractive young girl as ordering a pizza and you are planning tech startup ideas on a service you do not use with your dick on hand ,1,TheRedPill
Mangoinhand,i will take the bait i will pay you 100 for it since i am looking for a contractor to do it when can you start ill pay via paypal whatever convenient for you i will post the results for everyone to see within a week to back up your claim ,2,TheRedPill
Mangoinhand,tinder already has a shit tonne of these bots that do exactly that and more clearly you have not been on tinder long each week i get about 6 12 matches that are bots trying to dup me out of money or scam me i am also an it guy and would rather lift weights and make more money to continue being the top 20 get out there and improve yourself instead of this childish intellectual masturbation disgusting,1,TheRedPill
Mangoinhand,dear sweet baby kittens you must be a troll she is fucking other guys at the same time or at least seeing more get that into your head take her off the pedestal you are the prize let her earn you not the other way around,1,TheRedPill
Mangoinhand,you are going to crash and fucking burn with that plan guaranteed you have it so backwards first thing date 1 should be less than an hour long coffee tea drinks fucking end it early on a high note do not fucking compliment her at all and lean back ask her questions and let her talk date 2 invite her to your place to watch a movie at home or drinks or board games anything go for the kiss when sitting next to her she resists let her go home and focus on other girls this isnt going to end well you would be best served with hitting on about 5 other girls asap and pretending she does not exist ,1,TheRedPill
Mangoinhand,find yourself a 21 23 year old virgin foreigner at university bus stops near university coffee shops near university lock her down asap with getting her pregnant do not share bank accounts do not buy a house together do not pay her way simply have the couple kids you want over the course of a few years then eject have your gorgeous kids a few great years with the mother focus on your health and career be a great father and bang as many 18 27 year olds for the rest of your life ,5,TheRedPill
Mangoinhand,all woman lie about their sexual partners occassionally you find a virgin but they are exceptions to the rule real question is why you even cared in the first place anytime a woman tries to tell me she has been with x guys i respond with laughter and cockiness oh yeah i believe you i do not really care if you were with 10 times as many does not phase me serves to show her she can open up but i really do not care about her number of it is greater than 0 0 or many if she is 0 there will be strong evidences proving that fact 0 is the only number i care about the rest is simply many ,6,TheRedPill
Mangoinhand,awesome makes sense,1,TheRedPill
Mangoinhand,anyone else have a hard time reading what the fuck this is about ,1,TheRedPill
Mangoinhand,maybe should also let your nose hairs grow as they should too perhaps while at it grow hair down to ass length and braid it too ,2,TheRedPill
Mangoinhand,does not seem very lone perhaps the dictionary needs to be updated ,1,TheRedPill
