name,body,score,sub
Mangoinhand,moved in like it just happened to him op had to actively decide to allow a co tenant do not let him off for his bad decision you are speaking like a woman as if it just happened to him jesus christ,1,TheRedPill
Mangoinhand,the only question that matters here is why did you allow another tenant to move in without your consent this is all on you do you own the house if so then you decide are you renting if so then all existing tenants have to sign off on an occupancy change stop blaming others for the situation that you got yourself in if i were you then i would make it clear that you were not consulted with a tenancy lease change and that you do not a accept it if you must accept then demand 1 3rd of rent and bills then move out a red pill man does not allow a stranger to move into his house without his consent who more blue pill here the irony is funny,1,TheRedPill
Mangoinhand,i never said solid career aspirations just a womanly degree that still useful accounting for instance or would you prefer a women that has no education or a fine arts degree a woman with an accounting degree can work from home and help my business grow ,1,TheRedPill
Mangoinhand,graba your face dominance play right there the only time a woman can touch my face is when my dick is inside her ,5,TheRedPill
Mangoinhand,best outcome here my alpha fantasy she at least 10 years my junior i am 34 she a virgin or had at most 1 sex partner before she foreign but has gotten her own residency citizenship has good parents loves her dad healthy family life has a real degree accounting wants children does not want legal marriage common law will suffice loves cooking beautiful body does not gossip loves investing and has ambitious plans pays for half of everything loves blowjobs and swallowing high sex drive cannot keep her hands off me,3,TheRedPill
Mangoinhand,how would i get unlimited easy sex if i stopped using these apps ,9,TheRedPill
Mangoinhand,which type of marriage are you referring to there are a couple types legal marriage common law marriage what is wrong with having a wedding with no marriage contract and living in a woman house while your own properties are rented out i got this shit down pat i can have children and happy to pay child support if i must since ya know kids gotta eat some people lack the creativity and imagination to pass on their genes without getting financially and psychologically fucked,4,TheRedPill
Mangoinhand,it is his fault he signed the marriage contract he was aware of the risks it entailed heck i take responsibility for my own birth i chose to be born and all that entails fault implies that causality exists it does not there is not clear line of responsibility in a quantum existence it is all you oh you say it is not then what measure test can you apply if situation x or consequence y is some z in your control too many people too eagerly proclaim poor me it was out of my control and not my fault fuck it own it all and die by the consequences without shedding a tear pr uttering a whimper ,3,TheRedPill
Mangoinhand,use paragraphs very hard to read,4,TheRedPill
Mangoinhand,wtf is master of none get off the damn couch ,0,TheRedPill
Mangoinhand,your height some men would give their entire life savings for it you have it all now just need back to back regimens of p90x for 6 9 months and you are golden i lost 55 pounds in 10 months ans changed my life at age 28 i am 34 now and thank my past self for taking that step,3,TheRedPill
Mangoinhand,who cares you get to go and she loses her money not sure what the issue is you can even get her ticket for free and take another plate you do have another plate do not you edit actually do not take another plate bad move go by yourself and scalp the ticket to cover your costs,5,TheRedPill
Mangoinhand,i cannot do ons either due to ed but i get a raging hardon after the 2nd date with a plate i am more comfortable with her then and know she has properly submitted to me,3,TheRedPill
Mangoinhand,in a previous post of yours you admited i am middle eastern and i fucked more girls than you your dad and your grandpa combined maybe your parents tried to arrange dates with stank ass pussy for you and got a bad taste in your mouth enjoy your sorority girls,3,TheRedPill
Mangoinhand,women with hairy arms have high testosterone and very high sex drives ,3,TheRedPill
Mangoinhand,too old what are you talking about the cure for oneitis is spinning more plates,5,TheRedPill
Mangoinhand,i only date guyanese carribean latin bengali afghan and indian women i am white it is a numbers game out of a 120 first dates in the past year only 1 was not one of the above i am also near toronto which is the most culturally diverse place in the world ,11,TheRedPill
Mangoinhand,jesus man these things are all liabilities liabilities takes money out of your pocket assets put money into your pocket you know what makes women horny when i tell them i fucking dug a hole to plant a tree in my own backyard or did some gardening at my house but i say none of that until i know she down or already gave me the bang ,2,TheRedPill
Mangoinhand,this is not wealth this is conspicuous consumption ,1,TheRedPill
Mangoinhand,too much drama all for what to pretend that mother and father can what telling someone to do something ie shut her mouth is guy drama cringe i am sorry you all had to experience something that was easily avoidable ,11,TheRedPill
Mangoinhand,polygamy is the natural sexual strategy for men women could be perfect but he needs to spread his seed no need to invoke blaming women here although it can be a contributing factor,0,TheRedPill
Mangoinhand,you are so far off the mark that it hilarious in all of what you said all wrong i am 34 and faster stronger and slay women aged 20 25 like nothing 2 3 dates max to sex with the good innocent sexy ones and sluts too but careful with those i can literally smell their pussies getting wet as they are talking to me on the first date they grope me and pay for the dates not always the first date but 100 of time on 2nd date it fucking surreal do you know what i call getting 1 hours worth of anal from one girl and getting sucked off and fucked by 2 others within 24 hours while having 3 other women messaging me in that time span i call it saturday or sunday i literally cannot get excited if she is over 25 30 is the best fucking thing to happen to me ,3,TheRedPill
Mangoinhand,how cringeworthy that someone would brag about a tinder match i would get out of earshot of that conversation or the hairs on my arm would raise in embarrassment of this buffoon online dating matches mean nothing i have gone on over 120 first dates in one year and have probably matched with a 1000 women it to the point where i will get matches and they do not register i even forget to reply to half of them or respond a few days later i could have an amazing first and 2nd date and assume i will never hear from her again even if i got the kiss and the feel up that means shit these days the beauty of this is that half the time i do not even realize i have been ghosted on the contrary i am doing the ghosting due to absent mindedness got 4 plates at one point had 6 but that was fucking intense ,1,TheRedPill
Mangoinhand,yes rp is like finding out santa does not exist but the presents keep getting bigger and more plentiful that the joy of spinning multiple foreign women south asian my type that are younger than 24 way better than believing in true love i am as carefree as a single man with the benefits of having multiple ltrs that love me just had my 34th birthday best rp present ever thank you all ,2,TheRedPill
Mangoinhand,the result would have been same if she cheated the proximate cause of the pain is cheating but the ultimate cause is marriage contract rights ,4,TheRedPill
Mangoinhand,talk about the blind leading the blind the poor buy liabilities first and then whatever is left is barely anything and do not end up investing much at all ,2,TheRedPill
Mangoinhand,i had a similar goal as you but after reading rich dad poor dad i bought a small apartment building 4 units with a downpayment equal to my classic dream car it generated 1000 month in profit then i waited about 3 years and bought my car with the profits the poor as so because they focus on buying liabilities aka depreciating assets rusting hunks of metal the wealthy focus on buying appreciating assets that put money in their pockets every month ,2,TheRedPill
Mangoinhand,being pedantic here your greatest asset is your health your greatest resource is time ,2,TheRedPill
Mangoinhand,only the poor and unfortunate say money cannot buy happiness money is a form of captured reciprocal altruism it a way of tracking the value happiness you brought to others ,1,TheRedPill
Mangoinhand,the poor say money is the root of all evil the wealthy say the lack of money is the root of all evil ,1,TheRedPill
Mangoinhand,my name is chad and i got a stem degree they are throwing around 120k year jobs like it nothing oh and i broker mortgages on the side since it laugably easy money my guess is you do not have a stem degree with abundance of offers ,7,TheRedPill
Mangoinhand,why did you delete the post i was in middle of reading it last night then fell asleep started reading rest of it today and accidentally clicked another link came back to your post and now it is gone to my horror can you please send me a dm of your post ,3,TheRedPill
Mangoinhand,check the definition of alcoholic 2 drinks a week and you are one getting her and you wasted on date 1 is a huge red flag for all,-2,TheRedPill
Mangoinhand,yes being an alcoholic can get shit serious fast that is op problem in the field report ,1,TheRedPill
Mangoinhand,what the hell are you doing getting yourself and a woman drunk on the first date sounds more like a confession of an alcoholic than anything else you would not have had to make the blue pill move of asking if she wanted to have sex if you and her had the liquor in check i hope by mgtow you mean quitting your drinking problem no other lessons can be gleaned from this and a woman asking you to hit her first off grab her by the neck tiny force and then playfully slap her and grab her mouth and kiss her furiously that would have sufficed instead you verbalized and got all social justice y on her wtf man if i asked any of my plates for any reason do you want me to go to jail they would all laugh since the comment is out from left field shut your mouth next time i have learned a few things from dates do not make talker jokes do not make rape jokes do not make jail jokes shut up,3,TheRedPill
Mangoinhand,too much drama she made you react you lost your cool here let me get you a broom no problem seems like you are busy maybe we can get together another time would you like to go home or be dropped off near your place i do not have much time to go out of my way since i realized i have some work to do but can drop you off near your place ,26,TheRedPill
Mangoinhand,this should get more upvotes except the part about verbalizing your intentions of other women instead do it and let your actions speak if a woman is choosing to leave you because of x then she did not care enough ,1,TheRedPill
Mangoinhand,is not thinking that it awkward to examine vagina operating in the feminine frame do not see what is awkward about it,1,TheRedPill
Mangoinhand,this x1000 a woman like this is the pinnacle and makes it all worth it never settle for less from her,5,TheRedPill
Mangoinhand,first date she pays always i shit you not i get about 2 3 new women to pay for first dates coffee drinks a week next one on me she ghosts me least i did not buy her a drink she likes me great my turn to pay alternate there after ,1,TheRedPill
Mangoinhand,3 seconds of dominance is a lifetime for many he has come far and some may say it be impossible to have that many moments,22,TheRedPill
Mangoinhand,yep i am getting paid through my corporation too love the write offs right figure i will save a few 100k and let it slowly leak out as retained earnings over a few years through my corporation another rule i have is that the client cannot be within a 2 hour driving distance since then i never have to see them in person waste of gas and time ,2,TheRedPill
Mangoinhand,one of my girls also paid for dinner at a traditional restaurant with her sweet brown massive ddd tits hanging out she from the same culture as the south asian cuisine family restaurant that i took her to told her i am never getting married but she already knew that there no point for a man took it great and paid while being shy that she dressed like a slut and took her to her cultures dining place i told her to dress like that she a great sexy women if you are high value to her she will continue to see you and look past all so called violations of social norms getting her to pay to drive to see you groping her in public ,8,TheRedPill
Mangoinhand,i got fired from one contract job last week does not matter since i had another full time one at same time 80 hour weeks and signed another last night for full time as well they all pay over 150k year each i treat my jobs customers like woman interchangeable ,2,TheRedPill
Mangoinhand,message her in 2 months,1,TheRedPill
Mangoinhand,fail she was never yours it only your turn clearly she wants tobget railed by you why do not you give it to her it not your place to decide how a women spends her time or what she does put into her body abmalt all beta men are like that getting yourself into a drama ridden sulking and angry boy is lame you knew she would be fucking seeing some other guy in no time after all you claim you are naturally red pilled hint no you are not anymore than there are natural leaders ,1,TheRedPill
Mangoinhand,why does your ltr have a say in your mission and goals i am a real estate investor and a softward entrepreneur barely making any money on paper yet i can support 2 children and everything on my own pay who needs a woman to tell you how to do that get to work,1,TheRedPill
Mangoinhand,if she pushing you away even once then you lost that soft nextable behaviour,0,TheRedPill
Mangoinhand,what std for fucksake i can tell you whether it matters or not which one damnit,10,TheRedPill
Mangoinhand,shit does hit the fan all the time watch what happens when a disaster strikes and there no electricity or running water for a week or two it a good plan to have a bug out bag and know how to survive away from your coddled existence ,5,TheRedPill
Mangoinhand,awesome post apt favorite quotes of mine build your own dreams or someone will hire you to build theirs mind your own business not job ,4,TheRedPill
Mangoinhand,a plague more like a constant stream of sweet pussy coming my way while just swiping right on the can,1,TheRedPill
Mangoinhand,corporate route gives money but you lose your time your greatest and most valuable resource only a business or real estate provides you with wealth health time ,4,TheRedPill
Mangoinhand,actually just decided to scale back to 40 hour weeks only for the next 3 months then planning 60 hours week in late summer too bad guess i will only make 13k month for a couple months how do you like that ,1,TheRedPill
Mangoinhand, the problem is you think you have time buddha,24,TheRedPill
Mangoinhand,white women turn me off i am european caucasian and strongly prefer non white i did not read hot white girls as fetish juat read it as hot girls that happen to be white which is a major turn off for me ,5,TheRedPill
Mangoinhand,i used to get that feeling not anymore i think the reason is that i used to act too much like a boyfriend and offered them the world the guilt would come from the cognitive dissonance of having spent so much mental and physical energy coupled with being fully spent on someone that i over extended myself for now i do not act like a boyfriend do not over extend myself and get no strings attached sex from my plates no guilt because i only spent max 1 2 hours on first date and only 1 3 hours on the lay no guilt because i did not trick them it a beautiful thing because right after i nut we have a good chat enjoying talking about stuff she wants to repeat ,1,TheRedPill
Mangoinhand,whoa there someone has to share that there a less expensive time and money way to get what you want did not realize you had experience in online community building care to share links to the communities you have built i love it when someone rips me a new one your enemies and those that disagree are the best for personal improvement and feedback do not be so soft i appreciated your post and learned something from it it what makes this place great having men that share their thoughts and do not puss out because someone points out a weakness in your post stay motherfucker and keep on rocking ,1,TheRedPill
Mangoinhand,too bad i only bought 20 worth of eth during the crowdsale,2,ethtrader
Mangoinhand,the girls i am sleeping with also do that for me not seeing the connection here ,1,TheRedPill
Mangoinhand,what is the cost per lay count ,1,TheRedPill
Mangoinhand,she not a plate until you achieve lock in having sex at least twice ,2,TheRedPill
Mangoinhand,giving up life to build wealth what are you talking about life is great and loving every minute of it i will be going to bali for 2 months once again i am a remote software development consultant and work wherever next month and then mexico resort for 2 months plus i am super efficient so can get away some days doing only 7 hours and no one is the wiser materialism more like the experiences of a lifetime and retire by 34 keep dreaming,1,TheRedPill
Mangoinhand,ok how do you plan on not working to 70 years old while having the best time of your life in your late 20 and well into your 30 open to hearing suggestions,1,TheRedPill
Mangoinhand,if monk mode is not self improvement and going for it then what is it bank 250k this year and buy another rental multiplex then wind down to only 14k month working regular 40 hours a week retired for life since i now own a few apartment buildings done at age of 33 let me know how your savings and retirement plan goes for you ,1,TheRedPill
Mangoinhand,i meant net income 20k net and see how you burn out what about 50k net per month a million the point is that at some point you would happily work a lot and treat it as your life work ghandi didnt bitch,1,TheRedPill
Mangoinhand,since math is maybe not a strong suit for some people i will list the hours here sleep 8 hours getting ready to go out 1 hour eating 30 minutes errands 30 minutes work 11 hours reading study 30 minutes workout 1 hour that 22 5 hours per day left with 1 5 hours per day left with about 10 hours per week residual each plate takes about 3 hours per week which averages to 9 hours a week another 1 hour left for calling for family some weeks are more or less instensive on certain things but balances out the point of the crown comment was not to say i could not afford the crown it to show that i have a certain frame where women are chasing me not the other way around hence can protect my time but you knew that ,1,TheRedPill
Mangoinhand,and you got paid 20k month try getting paid 40k month and then try again,1,TheRedPill
Mangoinhand,software but i get up to do 3 sun salutations every 25 minutes 3 plates one bought me a bottle of crown laat week and just got back from a first date with a woman that paid for our drinks 80 hours a week is only about 11 hours of work a day,1,TheRedPill
Mangoinhand,wat,1,TheRedPill
Mangoinhand,working 80 hours now and earning 24k month actually love building software and counting my money a busy man with vision does not burn out used to work 80 hours for an employer earning only 9k month and burned out ,1,TheRedPill
Mangoinhand,burnout is a psychological state it almost impossible to burn out working 70 hour weeks for doing something you love and getting paid 20k month,2,TheRedPill
Mangoinhand,there is a cookie cutter solution to legal marriage do not do it you should not put yourself your family at risk by being forced to pay alimony it as simple and cookie cutter as you get ,1,TheRedPill
Mangoinhand,i have already won enough bread to feed myself my unborn children for years what if she already won enough bread as well and has mad savings should i still pay for her then if you get married and expect a stay at home mom not to eventually divorce you and claim alimony then you deserve what you get ,1,TheRedPill
Mangoinhand,i am 33 and regularly get with girls that young 28 you are still a baby jeez,1,TheRedPill
Mangoinhand,i would rather go out with the women on the left,3,TheRedPill
Mangoinhand,just jerk off 4 times a day and chill and play video games after you get home from your sub 100k job ,1,TheRedPill
Mangoinhand,there that should word so if i am the stay at home dad and take care of my kids dogs and the house and i will be since i do only remote software consulting then you are saying she should pay for my house and put food on the table i am misunderstanding your logic perhaps i can raise my own kids and will not depend on a woman having to be there why hould anyone else expect otherwise ,1,TheRedPill
Mangoinhand,needy outcome dependent why does it bother you what she does with her time body and phone did you sign a contract with her blows my mind that there nothing better to do than check a woman phone have you that much time on your hands ,1,TheRedPill
Mangoinhand,you have been triggered now get the fuck out if you take offense to what some stupid shit here said i love mixed people and have a hard on brown girl fetish i come from mixed background and poverty and shit from my home country i am too busy crushing it at life to get offended by some asshole on the other side of the continent if i withdrew anytime someone offended me i would be living in the mountains alone ,2,TheRedPill
Mangoinhand,do not want to ee anything related to her except seeing posts and replies on reddit fixed that for you,2,TheRedPill
Mangoinhand,i have to say i give you a 4 10 what could be been done differently to have morr dignity and better chance of getting her as a plate bad over verbalized how she would isrespected you gave her guy drama blocking someone is childish burn bridges having to tell yourself you need no closure is closure best to be so busy that you forget in first place never agree to anything like a break wtf is that texted too much talked too much good stood your ground have strong resolve just poor execution ,5,TheRedPill
Mangoinhand,this is great needed to hear it,4,TheRedPill
Mangoinhand,doctors get paid as corporations in canada he a radiologist after tax is 600k turned down a 1 mil year job in bum fuck nowhere to be in a mega city,0,TheRedPill
Mangoinhand,says the man giving advice reddit ,3,TheRedPill
Mangoinhand,the real question is why op is wasting his time with losers shouting at from his balcony ghetto,1,TheRedPill
Mangoinhand,this who the fuck has that much time to eavesdrop and then write about it jesus,2,TheRedPill
Mangoinhand,tell her you have a kid only on the first date do not put it into your online dating profile,0,TheRedPill
Mangoinhand,20k that great now invest it instead of letting inflation eat away at it on your checking account find a way to make 20k in a month and every month after that my friend took us out for drinks and blew 15k on bottle service in a single night but it no big deal because his monthly paychecks are 50k he a doctor age 32 extremely high value is north of that range for at least the money portion of smv women do not care that you make low 6 figures ,-1,TheRedPill
Mangoinhand,yes pay interest which is tax deductible there is always risk key is to manage it example buy investment property with small downpayment use banks money for mortgage use tenants money to pay down mortgage,1,TheRedPill
Mangoinhand,i like to use other people cash and money for my investments ,1,TheRedPill
Mangoinhand,cuckholdry is where a man makes his wife have sex with another man oltr is not official marriage you are not making her do anything ,1,TheRedPill
Mangoinhand,too many guys have defeatist attitude about mltr and oltr so they just stick to ltr there are alpha 1 0 alpha 2 0 and beta behaviours not such thing as alpha and beta ideas or sounds ,1,TheRedPill
Mangoinhand,are getting braces less alpha too ,2,TheRedPill
Mangoinhand,nice work ,1,TheRedPill
Mangoinhand,i wear a tshirt that says brown girl fetish ,2,TheRedPill
Mangoinhand,loan for tv bad loan for investment good,0,TheRedPill
Mangoinhand,i like chocolate sue me ,1,TheRedPill
Mangoinhand,it is relevant to your situation trust me just ignore it all act like nothing happened and do not make same mistake twice,1,TheRedPill
Mangoinhand,certainly not relevant anymore now that op has removed the post,1,TheRedPill
Mangoinhand,you disrespected her in public she soft nexted you you deserve that then you laid down how she must respect you how she not allowed to use her phone a certain way ie not allowed to hit the block button you are acting like a needy and aggressive bitch you can downgrade her to perma fb if she was your ltr or you can keep her as an ltr and continue to be the bitch in the relationship or you can make her an mltr and keep her and your balls want to know how to have a chance to save this relationship here you go do not talk about the incident just go on like nothing happened do not give her guy drama telling her what to do insulting her in public do not talk about your feelings do not beg for respect or any shit fuck her awesome and give her a great orgasm see her at most once a week twice if you must lift more weights spin more plates,2,TheRedPill
Mangoinhand,awesome thank you ,1,TheRedPill
Mangoinhand,do not do shit because women like it jesus do it because you love it ,3,TheRedPill
