name,body,score,sub
Mangoinhand,your mistakes not focusing on many woman at the same time you should have went for the kiss by the 2nd meet up no later your logistics suck ie what is your end game do not meetup where you cannot have her come to your place her place hotel texting with her too frequently for other reasons than to setup next date have not been lifting enough care too much your status is lower than hers because she is not asking her girlfriends on how to get you to make a move it is you asking for advice from guys which clearly signals in your thoughts behaviour that your smv is lower next her and do not look back or do what other posters suggested and run dread fade away let her work for you ,1,TheRedPill
Mangoinhand,oneitis how can a woman that banged your friend be ltr material ,1,TheRedPill
Mangoinhand,lone wolf to me actually means being alone with the woman only online dating provides that should be called pack wolf since there is a pack of guys competing there with you ,-5,TheRedPill
Mangoinhand,dude no texting is only for logistics she is wasting your time honestly please believe me when i say that it is killing your chances what are you up to this week want to grab drinks in a bit that your ticket if she rejects next ,2,TheRedPill
Mangoinhand,my typical number of messages to get the phone number is 4 6 my opener her reply another message and her reply sometimes it takes another to segue into the ask for a total of 6 i have a handy trick i use to guage which variation and how to move along the conversation to the ask dm me if you want to know i feel like i hit jackpot,4,TheRedPill
Mangoinhand,it means she is at least into you not fucking you is a clear signal she is not ,4,TheRedPill
Mangoinhand,i like where this is going can you elaborate s bit more ,1,TheRedPill
Mangoinhand,exactly ,1,TheRedPill
Mangoinhand,this exemplifies precisely the irony and awful attitude read my comment above there is no such thing as free rent i should know since i own properties and apartment buildings if the marketable rent for a place i own is 3000 month and i choose to move into it say instead of me renting a cheaper place or moving into another place i own that rents for 1800 month then i am wastimg an opportunity to save and invest why the fuck did you not buy a small apartment building with your 16 years of savings and grew your investment while living free shame leave the woman alone and stop being so needy and meddling in her affairs ,2,TheRedPill
Mangoinhand,dude that called dependance i expect nothing from my parents sure it is likely i will get a payout but i expected none of it and encourage them to live a long and healthy life and spend on what they please jesus christ this woman is responsible for giving you the most precious asset being born time health and you are judging her for living it up for fucks sake you moved into prime real estate that would have easily earned thousands of dollars in rent per month a penny saved is a penny earned you could have easily moved into mote affordable housing and use the rent money to pay for your nest egg the irony is massive and i am ashamed to to hear that a 50 year old man thinks like this i am 34 ,2,TheRedPill
Mangoinhand,she was your date lead like a fucking man he is bigger than you tell him you guys are busy he does not leave treat him like a violent vagrant that wo not leave grab her hand walk somewhere else she does not come with you then she had no intention of being with you anymore at the point and you walk away this is why i schedule 2 4 tinder dates back to back in a single day each are less than 1 hour long the 2nd date is where i escalate at my place if a woman gives me a nuclear shit test like that and does not try to show me how she handles situations like that then she does not get the prize,1,TheRedPill
Mangoinhand,hilarious why the downvotes,1,TheRedPill
Mangoinhand,and those are the things you discovered what else is she stealing besides your dignity you know what to do ,6,TheRedPill
Mangoinhand,uhmmm covert communication,5,TheRedPill
Mangoinhand,lol spread her legs and send you a notarized letter allowing you entry ,3,TheRedPill
Mangoinhand,here are your screw ups you are welcome you go for the kiss on 2nd or 3rd date in the middle never at the end ask her to come close and go for it if she rejects you then you get up and leave tell her nicely it was nice meeting you pay your own tab and let her pay for what she consumed ordered seriously i have done this and i get the kiss 9 10 times you dont ask her to dance unless you are a hip hop star if you must then you grab her hand and lead her there if she rejects or resists you leave never ask a girl to be your girlfriend let her ask if you make sure to see her only once a week then she will not ask about it for at least 2 4 months do not initiate texting with her only to setup dates once a week if she replies you can reply quick do not ask her to spend the night no no no you do not want a girl you barely know to sleep over when girl gives me a physical attribute compliment i say nice flattery or make a quick joke and change the subject you need to spin more plates and it will make you less needy you will get there and laugh a hearty laugh in less than a years time over this ridiculousness this shit happens to me all the time but i am always focusing on a new group of girls and easily walk away literally i am ready to walk with the slighest barb or disrespect since there no need to put up with any crap when i have have a dozen girls in the queue they can sense this and shit tests are a breeze due to this fact ,32,TheRedPill
Mangoinhand,going out to bars and hitting on them is a waste of time online game is so easy that almost everyday i am blown away at knowing i will have a deluge of beautiful pussy enter my life for as long as i live or at least for another 20 years i had shitty levels of success at first and decided to optimize certainly never crossed my mind to get with fatties or beasts ,1,TheRedPill
Mangoinhand,yes read that shit for hours and days if there are a 1000 people here that read your post in 1 minute the you just wasted over 15 hours of peoples total collective time shame ,1,TheRedPill
Mangoinhand,trim your goddamn neckline and get some mustache wax already studies show that men with beards are sexier to women once i grew out my beard my online dating game in street game doubled in results she is simply trying to make you less sexy,6,TheRedPill
Mangoinhand,digusting puked a little in my mouth as i read that,2,TheRedPill
Mangoinhand,you can tell the first timers from the rest because their text game is overly open and they message frequently love them,8,TheRedPill
Mangoinhand,well true you need a great profile and to be on point with your copy paste text game however hb8 come knocking down my online profiles and it has never been so easy to get passive stream of women coming my way and i am 33 years old decent shape and a beard to die for about 20 matches per week about 5 10 first dates per week and another couple plates added to the roster i will be up to 14 plates by may at this rate hold on fellas it going to be a wild summer if anyone wants to know how i do it so easily then message me thinking about doing an ebook or course on this shit i am almost disgusted with how easy it is and regularly have to turn down half a dozen per week since ive become very picky ,-33,TheRedPill
Mangoinhand,come back and share after you banged her dont count your chickens before they hatch ,3,TheRedPill
Mangoinhand,oh god dude i know exactly what you are feeling i had the same situation with a gorgeous brown girl at age 2w i was her first for everything and had a great thing going understatement we were together for 7 fucking years yes it was a big waste of time for me i wrote letters and similar crap guess it fed my own soul next time i wo not be a pussy but now i am addicted to having 5 plates on rotation fuck me ,0,TheRedPill
Mangoinhand,do not sign birth certificate if you want to go ahead but not before getting dna test ,378,TheRedPill
Mangoinhand,i was sad for another reason reading the post she is 2 points below his smv and has no other plates while granting exclusivity or perceived exclusivity to her,6,TheRedPill
Mangoinhand,of course there are exceptions to the rule 15 mins quickie etc half of marriages involve the woman cheating in secret best to know what you are dealing with at least ,1,TheRedPill
Mangoinhand,how is that at her expense you did not ask what the man can do but what a woman can here is my end of the deal make her orgasm everytime at least 1 hour long sex always workout and be attractive and stylish earn serious money and wealth building clean toilets plumbing carpentry etc zero drama targetted at her she can also have fwb she does not have to cook but then she can clean the toilets and fix things when they break seems perfectly equal and reasonable to me ,1,TheRedPill
Mangoinhand,it amazing how a coin toss level of confidence is the best we can do ,1,TheRedPill
Mangoinhand,how is his frame impeccable frame is options does the following sound like a man with options i considered it but knowing the repercussions i held my ground and never went over there those words stuck with me and it affected my relationship with my girlfriend if a woman sends some puffs of air over your way and you cannot stop thinking about it then you are clearly not spinning enough plates ,6,TheRedPill
Mangoinhand,this it is loving snd supportive and non needy on your part ,1,TheRedPill
Mangoinhand,because she is not for you she replaceable right around the corner is a woman that is younger more attractive and totally into you that does not give you half the shit she does you will enjoy blackdragon free podcast titled she replaceable no im not a shill but that shit is gold and im a huge fan ,1,TheRedPill
Mangoinhand,no but 85 of marriages end in divorce in north america 80 of the time it is the woman initiating it half the time in successful monogamous relationships the man or woman or both will cheat covertly nuclear family is a myth a fairy tale disney you can have an oltr with children in a common law marriage go ahead have your wedding party and cake but skip signing the fucking contract with the government not hard people ps there are ltrs mltrs and oltrs these terms add sharpness and clarity to your judgement ,1,TheRedPill
Mangoinhand,let this be a lesson to you to never promise exclusivity monogamy to a women had you kept frame you would be free to do as you wish and not worry that someone has dominion over you and your balls ,4,TheRedPill
Mangoinhand,perfect redpill wife does not exist signing a one sided agreement with the government does not make sense for strong men as the laws are currently written perhaps you mean common law married for starters excellent and voracious deep throating skills no drama perhaps 20 seconds of drama is acceptable once a year loves to cook and feed a man be attractive and fit accept that he will bang fwb on the side and give him no drama over it give him the kids he desires if any that would be a great start ,4,TheRedPill
Mangoinhand,not convinced that writing imaginary love hate letters or a list is a good solution at best it is a stop gap for beta behaviour in transition dangerous territory of the mind here love and hate come from the same place emotional attachment the fact that you are spending time writing and thinking about her is emotional attachment writing pseudo love hate letters to someone that wants nothing to do with you is still oneitis the best way i get over oneitis is to be so busy with my mission goals and to approach new woman constantly once you get a plate or few then you just go and fuck someone that actually gives you the time of day ,1,TheRedPill
Mangoinhand,2 girls is great happy for you my journey took me 10 months of online dating game got my first bang 4 months in have 5 plates now and meet about 1 3 new girls per week and literally cancel 2 4 other new dates per week since they are lower ranking and im very busy with work and the better prospects the rush of dopamine to my brain and self worth is tremendous when every goddamn week each girl comes by and gets serviced with 1 2 hour long sex where the orgasm 1 4 times each and all of them have been trained to swallow i even have a sex slave that i just tell her im coming over and we just go at it you know what it feels like when a girl ghosts me or disrespects me beats me im too swamped with work to notice or really care my goal is to see if i can truly get 14 plates this year why because when girls ask me so how many other woman do you have you seen my reply is usually about 14 2 for everyday of the week it will be an honest and accurate statement at that point ,2,TheRedPill
Mangoinhand,im going to keep replying to your comments since you are still not getting what the other commenters are saying please devour the sidebar and start pounding the weights it only took me 180 days to become lean and fit and lose 60 pounds and get serious definition p90x back to back twice baby you will understand and feel amazed you get there in a few short months ,1,TheRedPill
Mangoinhand,he right it is a shit test but she still could be planning on fucking him or already did either way your attitude should be cool have fun internally and externally there is no punishment or ghosting to be given since she did not disrespect you or give you drama she is free to do what she wants with her time and body as she pleases carry on and follow the texting advice in my earlier comment here and lift and spin more plates ,1,TheRedPill
Mangoinhand,do not fucking message her with any of that shit you will put the final nail in the coffin aloof light hearted short but funny replies dont try hard tho only text her if it is to get her on your calendar otherwise the only time you text her is to reply to the texts that she initiated ,3,TheRedPill
Mangoinhand,lock her down what the hell is that you mean with rope or a marriage certificate it like trying to tighten your fists around water does not even make sense ,2,TheRedPill
Mangoinhand,you are the prize motherfucker she probably is fucking him if that bothers you then she loses the prize if it does not bother you then she can have the prize temporarily while you are satisfied in her other performances lift motherfucker you would not care if you were so fit that you had a harem where each fucks and sucks you off every week ive got 5 girls it does hurt a bit when one drops off or i get micro oneitis over a new potential plate for about 5 minutes trying to get this down to 1 second or nothing yes you have something special and she a sex freak and you want to keep that i get it 2 of my woman are like that and that is precisely how i am going to keep them by taking my own advice,1,TheRedPill
Mangoinhand,tell her that you are at a stage in your life where this is not acceptable she can choose to do what she wishes however drive these points home firmly and with good frame and do not argue or elaborate you will not sign any birth certificate you will have no contact with her forever you will have no contact with any potential child ever you can tell her that you will help her pay for the abortion medicine transportation etc be firm but respectful in control of yourself and logistics do not argue or spend any time with her except to plan the abortion asap you would only pay child support if forced by a paternity test and court order she can receive the checks in the mail and will never hear from you ever again hopefully you so not make too much money right now and can get off easy with only a few hundred bucks a month no one needs to know that your sperm was used in the creation of a child it is no ones business just have those cheques automatic payments made out so you do not have to think about it beyond once every year or few also now might be a good time to start a business entity incorporate yourself for a few hundred bucks and start thinking about how you can earn money through contracting consulting whatever and take advantage of tax breaks you can pay yourself minimum wage eventually through it and keep your earnings low and paying less child support while still living a good life godspeed ,6,TheRedPill
Mangoinhand,the feeling of being in demand by having sex with a participant that ia genuinely attracted to you is very different from paying for sex with a prostitute you may fulfil your carnal desires but you wo not feel like you got it ,1,TheRedPill
Mangoinhand,did anyone else crack up when they read we moved into a trailer i was the man o that house and i was running a damn good ship i was drinkin smokin my weed and maintaining a 3 0gpa makes me almost think the whole story is made up,2,TheRedPill
Mangoinhand,sure that easier than taking a few minutes each day to copy paste messages and follow up maybe you will find a hot tranny boy there ,1,TheRedPill
Mangoinhand,being a caring person is deciding and doing the right thing just like deciding not to fart at the dinner table because you care about the people you are with it is an act of consideration messaging a girl after sex is something guys dont do because they may feel they come off needy even though they want to message her giving good rational reason to express these feelings is perfectly genuine ,2,TheRedPill
Mangoinhand,next sexual attraction is never negotiated lift more weights,7,TheRedPill
Mangoinhand,get fucking viagara as if your life deoends on it also make sure to give her an orgasm with your tongue finger even if it takes an hour before intercourse that what i do since i also go limp the first one or two times of attempting to have sex with a woman godspeed,1,TheRedPill
Mangoinhand,fully agreed with tteabag91 i will add my thoughts however her behaviour sounds like a woman i was with for years somehow things were always my fault and she truly convinced me she beta ized you and now you are feeling what most people feel sometime around the 2 5 year relationship mark you apologize too much never apologize unless you ran over the dog by accident etc you are too available to her and have little interests outside your relationshit start lifting weights and eating better get at least 8 hours of sleep do not let her get away with taking your sleep allow her 20 seconds of verbal abuse directed towards you not a second longer if she continues get up and leave and say nothing do not answer her text or calls for a few hours come back like nothing happened and do not discuss why you left she knows if she demands answers just say i am not discussing this and find your disrespect unacceptable then go lift weights do work focus on your life mission hint your life mission is not her do not accept marriage counselling you will lose more respect and money along the way she is going to cheat on you or already has start talking to a divorce lawyer and finding out how you can slowly structure your life in a way to limit financial and health impact on your life whatever you do do not abandon your house when she gets upset do not engage her and be calm in any manner you can be you may be in for a real storm prepare your mind and life for this you will do great and now have a wonderful child this is a blessing with or without her poisonous behavior ,7,TheRedPill
Mangoinhand,this is a tremendous share deep in theory and has clarifies many things for me ,4,TheRedPill
Mangoinhand,good man now do yourself a favour and get gardasil 9 hpv vaccine,7,TheRedPill
Mangoinhand,you will always get distracted if you are focusing you are doing it wrong and limiting how deep you can go the key is to not focus on focusing on not focusing the middle way do not follow the thoughts simply acknowledge them as if you are seeing something while floating along a river,1,TheRedPill
Mangoinhand,i know what you mean but overtly she still crossed a line ,2,TheRedPill
Mangoinhand,then you might be gay,1,TheRedPill
Mangoinhand,the part about emotional investment is gold saved to my evernote and will be reviewing all this for a while thanks ,1,TheRedPill
Mangoinhand,false rape accusations are very real this is an insurance policy against that would you say that proper dinner table etiquette is treating the other diners as objects ,45,TheRedPill
Mangoinhand,and have her think it is a ons or you are a boyfriend so fast no thank you first date shouls be for comfort building and attraction,2,TheRedPill
Mangoinhand,you are a slave to pussy and still pedestalizing woman create a mission in life that will be your grand work your big goals woman are the byproduct and side fun for you working on your mission,5,TheRedPill
Mangoinhand,no ltr is easy why not an mltr or oltr ,1,TheRedPill
Mangoinhand,you spent 10 bucks on a child for valentines day wtf girls spend money on me for valentines day and i reward them with orgasms wtf is wrong with you,1,TheRedPill
Mangoinhand,my girls let me fuck their mouths for 30 to 60 minutes every fucking time we had sex yes i made her cum a 1 to 4 times at the beginning intercourse so i feel no guilt none of them did this before none of them would take down a load for anyone before now they gargle and i get to tell them how sexy they look with tears in their eyes ,1,TheRedPill
Mangoinhand,posting on reddit dating sites etc is the real world whether i am autistic or not i am not does not change the fact that i have constant stream gorgeous pussy coming into my life i picked up 2 girls via day game this past year as well but it easier to copy paste the same message and swipe ,3,TheRedPill
Mangoinhand,have a relationship with both and offer exclusivity to no one make sure to only spend time with each of them once a week and make sure you give them orgasms everytime you have sex do not act like a boyfriend and start texting or calling either with lovey dovey messages or they will kick you to the curb ,2,TheRedPill
Mangoinhand,that like saying tv is being spammed youtube is merely a marketing channel he not saying get on youtube he saying find your niche and use an appropriate marketing channel to reach your audience ,1,TheRedPill
Mangoinhand,he got his own content marketing business now and an entrepreneural spirit he is the kind of person that will employ people like you in the future ,8,TheRedPill
Mangoinhand,read roosh day bang he calls it the elderly chat dear god do not talk about your med school shit when opening up do a fucking elderly opener and you will be fine ,2,TheRedPill
Mangoinhand,this it is a numbers game my game is online game and send out about 100 openers per week across 6 dating apps tinder eharmony pof bumble happn blendr guess how many respond per week with anything at all about 20 of those 20 about half do not agree to meet up the remaining 10 agree to meet and about half of them flake out the remaining 5 have first dates less than 1 hour coffee chat about things as described in blackdragons first date podcast of those 5 2 of them will ghost me after and 1 or 2 of them i will disqualify they were 30 pounds heavier or smelled bad leaves 1 remaining that agrees to the second date i close that second date to lay about 20 30 percent of the time therefore i average about 1 new lay per month and add them to my roster after about 6 months you will have a small harem i have 5 now and working on 6 and 7 as we speak it took me close to 4 months to make my first close i know i am awful and kept getting tripped up now i enjoy the passive stream of women coming into my life with very little effort you think you are busy i am running 2 companies and have a dozen tenants to deal with as well do not play the sour grapes card ,9,TheRedPill
Mangoinhand,that a great story and i am happy you found a better path your conclusion of women are honestly pathetic emotional creatures is more of an ironic projection of your perceived past self you blew your load on yourself because that what you really wanted back then behaviour not words women are not the enemy nor is it healthy for a man to emote such scorn and bitterness towards his past relationship but i can understand it is part of the healing process and wish you success and happiness to you and those in your life ,425,TheRedPill
Mangoinhand,i think there a serious problem already,0,funny
