name,body,score,sub
SFtechgirl,someone tried they got chelsea to sign a book dna from pen and they fished hubble empty starbucks out of a trash can dna from straw the results were inconclusive aka dna samples probably were not good enough ,2,The_Donald
SFtechgirl,it easy to find online while you are at it michelle is actually a man in drag i shit you not look it up now we know why obama loves 65 000 hot dogs so much ,1,The_Donald
SFtechgirl,this is pure speculation but what if most of the terrorist attacks are being orchestrated by deep state since they lost control of the white house it would be impossible for them to pull off an attack and coverup while trump is in office they still control uk and france though is not it interesting how the manchester bombing happened just as seth rich and kim dotcom were trending in the news ,1,redacted
SFtechgirl,you can automate it with a service like ifttt or netvibes potions example every time djt tweets automatically like it and send me an email text pushbullet whatev ,2,The_Donald
SFtechgirl,still says 1 signature wtf i guess i will sign and be 2,4,The_Donald
SFtechgirl,haha if we can meme ice cream into a racist hate symbol that might start waking people up ,2,The_Donald
SFtechgirl,sorry dude that sucks i have had 2 apartments burglarized in san francisco property crime capital of the usa thanks sanctuary city,6,The_Donald
SFtechgirl, getting out of the opinion business just reporting news wow what a novel concept good luck i will be reading,1,promos
SFtechgirl,he not really calling the shots he just writes algorithms to censor what the higherups tell him too he did not even recognize the name seth rich until i told him who it was most of the people who actually work at twitter are not evil they just do not realize what is going on but if we can educate them maybe we can stop the censorship from within ,2,The_Donald
SFtechgirl,puppet of the globalists destroyer of germany of course she upset trump foiled their plans to transfer us billions to corrupt third world governments this has nothing to do with fixing the environment ,-7,worldnews
SFtechgirl,i met a twitter ai engineer at a party this week who helps control the censorship i launched into him about how evil twitter is he was surprised said they only censor threats porn isis etc what about sethrich i asked he says i thought that was debunked anyway if anyone has examples of twitter censorship or a message they want to send this dude let me know i promised to educate him ,18,The_Donald
SFtechgirl,i love how the fake news meme totally backfired on the globalists they invented it to try to take down pizzagate and alternative news ,7,The_Donald
SFtechgirl,the investigation has been happening for nearly a year but it seems the d c police dropped it last fall and have been trying to cover it up since even the parents are now requesting dcpd release the evidence they have ,1,The_Donald
SFtechgirl,where is kektown sf 84 of cucked san francisco voted for hillary only 10 trump,6,The_Donald
SFtechgirl,to this day the nytimes has still not run a single story or mention of the awan brothers unbelievable ,7,The_Donald
SFtechgirl,you have no idea how evil hillary really is unimaginably horrific shit yes they drink babies blood because for its anti aging restorative properties you have some more red pilling to do my friend pizzagate is real ,1,The_Donald
SFtechgirl,chaffetz was getting death threats and is bowing out gowdy is being majorly threatened too but he has protection for himself and family and he wants to see this through gowdy is a badass ,8,The_Donald
SFtechgirl,agree it taken this long because you have to take down the fake news media and the pedophiles at the same time the pieces in nearly into place 12d check and mate ,24,The_Donald
SFtechgirl,many suspicious facts in this case but here a big one seth rich was still awake and talking when the cops found him and took him to the hospital all of these cops were wearing bodycams but where the footage anyway seth arrives at the hospital still conscious statistically 95 of gunshot victims who arrive at the hospital awake will survive so what happened to seth ,1,politics
SFtechgirl,i read the article several times and could not figure wtf they are trying to say either something to do with it was russia fault ,2,The_Donald
SFtechgirl,it as if these morons have never heard of the streisand effect keep fighting pedes we have got them on the ropes ,18,The_Donald
SFtechgirl,the office of the presidency is hard on anyone health president trump has sacrificed so much to save us and our country god bless trump ,40,The_Donald
SFtechgirl,come on we wish people acted like that like moral compassionate humans how do people really act remember the dude who got pushed onto the nyc subway tracks and everyone started filming with their cell phone as he got crushed instead of helping him i rest my case ,2,The_Donald
SFtechgirl,i am pretty sure graham is a pizzagate character with skeletons in his closet although maybe he worked out an immunity deal to help us bring down the ring ,2,The_Donald
SFtechgirl,thanks anything else it weird how seriously impossible it is to find anything about what it is in these leaks exactly f ing censorship these evil globalists are going down hard ,39,The_Donald
SFtechgirl,interesting how you think the russians are all powerful with puppets everywhere but the rich banking elites who run the world totally innocent sarcasm ,-3,worldnews
